,Name,Affilation,H-index,Citations 2020,Total_citation,H-index_since_2016,Citation_since_2016,HomePage,Area of Research,Google_Scholar
0,"U Rajendra Acharya (SCI Highly Cited Researcher 2016-2021)  PhD, DEng, DSc","Ngee Ann,  Singapore University of Social Science,  Kuamamoto University, Japan",113,11714,51135,99,38637,https://scholar.google.co.th/citations?user=8FjY99sAAAAJ&hl=ja,Artificial Intelligence/Medical Informatics,https://scholar.google.com.sg/citations?user=8FjY99sAAAAJ&hl=en
1,IAN  F.  AKYILDIZ,"Truva Inc. , USA",131,6602,133870,80,38496,https://ianakyildiz.com/,Wireless Communication/5G/6G Wireless Systems/Intelligent Surfaces for Wireless Communication/Nano-scale and Molecular Commun,https://scholar.google.com/citations?user=rAGwv14AAAAJ&hl=en
2,Ibrahim Aljarah,"Associate Professor, University of Jordan",44,3337,8222,43,8046,http://evo-ml.com/ibrahim/index.html,Artificial  intelligence/Swarm Intelligence/Data Science/Machine Learning/Evolutionary Computation,https://scholar.google.com/citations?user=moOTIYEAAAAJ&hl=en
3,Jeffrey Andrews,"Cockrell Family Endowed Chair in Engineering, University of Texas at Austin",105,3795,65380,71,28982,https://scholar.google.com/citations?user=Hr9Gey0AAAAJ&hl=en,Wireless Communications/Communication Theory/Machine Learning for Communications/Stochastic Geometry/Information Theory,https://scholar.google.com/citations?user=Hr9Gey0AAAAJ&hl=en
4,Bennis Mehdi,"Full Professor, IEEE Fellow, Head of ICON, University of Oulu",68,7029,24898,64,22314,https://twitter.com/phantombenn,B5G/6G/machine learning/semantic communication,https://scholar.google.com/citations?user=RW4sJu8AAAAJ&hl=en
5,Emil Björnson,"Professor of Wireless Communication, KTH Royal Institute of Technology",61,4554,17946,59,15092,https://ma-mimo.ellintech.se/author/eb/,Massive MIMO/Cell-free Massive MIMO/RIS/Signal processing/Wireless communication,https://scholar.google.se/citations?user=Maij4akAAAAJ&hl=en
6,Rajkumar Buyya,"CLOUDS Lab, School of Computing and Information Systems, The University of Melbourne, Australia",153,11257,123407,104,60077,https://scholar.google.com/scholar_url?url=https://davidabramson.org/wp-content/uploads/2021/08/buyya05economy.pdf&hl=en&sa=X&ei=aPhEYqHyDeHDywSZlqmICg&scisig=AAGBfm1S0sFhYE8_HtmTDM1zQsv7xrfWJw&oi=scholarr,Computer Systems/Cloud Computing/Distributed Systems/Edge Computing/Internet of Things,https://scholar.google.com/citations?user=7xN6JqYAAAAJ&hl=en
7,Xing Cai,"Senior Research Scientist at Simula Research Laboratory, Professor at University of Oslo",19,137,2030,13,745,https://www.simula.no/people/xingca,Parallel programming/High-performance computing/numerical methods for PDEs,https://scholar.google.com/citations?user=IWQbrcK5CEwC&hl=en
8,Giuseppe Caire,"Professor, Technical University of Berlin, Germany, and Professor of Electrical Engineering (on",82,2868,39207,55,15810,https://www.5gitaly.eu/2019/team-member/caire-giuseppe/,Information Theory/Communications/Signal Processing/Statistics,https://scholar.google.com/citations?user=g66ErTcAAAAJ&hl=en
9,Jinde Cao,"Academician, RAE/AE/RAEN/LAS/AAS/EASA/PAS/IASCYS  & FIEEE/FAAIA/DFIETI; Southeast University",130,9054,69422,89,39711,https://loop.frontiersin.org/people/134501/overview,Complex networks/neural networks/multi-agent systems - engineering stability - dynamics and control - time-delay systems,https://scholar.google.com/citations?user=8_ffELYAAAAJ&hl=en
10,C. L. Philip Chen,"Chair Professor, South China University of Technology, Philip.Chen@ieee.org",94,7450,37171,82,27675,https://scholar.google.com/scholar_url?url=https://drive.google.com/file/d/1DPnhWd_Y8wqgh8Tj0AOxn1YzS0RDHSgR/view&hl=en&sa=X&ei=a_hEYoD4H8OP6rQPsJSA6Ak&scisig=AAGBfm1F3dkaVreFpG78GtpelNEFhL7p8w&oi=scholarr,Computational Intelligence/Intelligent Control/Cybernetics/Intelligent Transportation Systems/Data Science/Engineering,https://scholar.google.com/citations?user=Q5248zwAAAAJ&hl=en
11,Jinjun Chen,"Professor and Deputy Institute Director, Swinburne University of Technology",68,2326,12912,49,8675,https://dblp.org/pid/06/2379.html,Cloud Computing/Scalable Architecture/Scalable Data Storage/Scalable Data Processing (Privacy),https://scholar.google.com/citations?user=mQ9vJ24AAAAJ&hl=en
12,Min Chen,"Professor, IEEE Fellow, Highly Cited Researcher, Huazhong University of Science and Technology",88,5972,33502,70,24448,https://cmse.msu.edu/directory/faculty/min-chen/remembering-our-colleague-min-chen/,Cognitive Computing and Big Data Analytics/IoT Sensing/5G Networks/Robotics/Edge Computing,https://scholar.google.com/citations?user=_HyHTrsAAAAJ&hl=en
13,Xiaofeng Chen,"Professor, Xidian University, China",57,1721,13075,48,9624,https://www.beg.utexas.edu/people/xiaofeng-chen,Security/Cryptography/Cloud computing,https://scholar.google.com/citations?user=-3WhJecAAAAJ&hl=en
14,Francisco Chiclana,"Professor of Computational Intelligence and Decision Making, De Montfort University, UK",68,2486,19531,58,11178,https://loop.frontiersin.org/people/601367/bio,Decision making/computational intelligence/information fusion/consensus/sentiment analysis,https://scholar.google.com/citations?user=qDOxZIIAAAAJ&hl=en
15,zhihua cui,"Taiyuan University of Science and Technology, Taiyuan, Shanxi, China, 030024",44,1720,7926,33,5808,https://www.researchgate.net/profile/Zhihua-Cui-6,evolutionary computation,https://scholar.google.com/citations?user=BpDrULIAAAAJ&hl=en
16,Linglong Dai,"Associate Professor, Tsinghua University; IEEE Fellow",65,3339,15931,59,14296,https://www.ee.tsinghua.edu.cn/en/info/1059/1261.htm,Wireless Communications/RIS/Massive MIMO/Millimeter-Wave/Teraherz Communications/Non-Orthogonal Mutiple Access,https://scholar.google.com/citations?user=OTFnifoAAAAJ&hl=en
17,Merouane Debbah,"Centralesupelec, Technology Innovation Institute, MBZUAI, Lagrange Mathematics Center",98,9039,46632,82,32694,https://scholar.google.com/scholar_url?url=https://www.academia.edu/download/63978273/35_5Jan18_12Oct17_9307-14182-1-ED20200721-28399-w3b6tv.pdf&hl=en&sa=X&ei=cfhEYvQviPDIBNbgvKgK&scisig=AAGBfm1l9hWewlJ7gXu2yiGN6TlYyKcTtw&oi=scholarr,5G/6G/Machine Learning/Random Matrix Theory/Game Theory,https://scholar.google.com/citations?user=HU5I0X4AAAAJ&hl=en
18,Zhiguo Ding,"University of Manchester, Fellow of IEEE, Web of Science Highly Cited Researcher",91,8220,36798,85,32562,https://dl.acm.org/profile/81447594874,Wireless communications/signal processing/and cross-layer optimization,https://scholar.google.co.uk/citations?user=V-nB8scAAAAJ&hl=en
19,"Mianxiong Dong, Foreign Fellow of EAJ","Vice President and Professor, Muroran Institute of Technology, Japan",53,2182,10692,49,9311,http://mail.ibr.cs.tu-bs.de/pipermail/cfp/2021-April/009623.html,Cyber-Physical Systems/Internet of Things/Artificial Intelligence,https://scholar.google.co.jp/citations?user=TqyApAUAAAAJ&hl=en
20,Yucheng Dong,"Professor of Management and Systems Sciences, Sichuan University",58,2276,11415,54,9133,https://www.journals.elsevier.com/computers-and-industrial-engineering/editorial-board/yucheng-dong,Decision Analysis/Human Dynamics/Social Network/Data Science,https://scholar.google.com/citations?user=tFVYDw4AAAAJ&hl=en
21,Maged Elkashlan,"Associate Professor, Queen Mary University of London",60,2725,14878,53,12439,https://ieeexplore.ieee.org/author/37269057400,IRS/URLLC/UAV/PLS/NOMA,https://scholar.google.com/citations?user=mncnnOAAAAAJ&hl=en
22,Zubair Md. Fadlullah,"Associate Professor, Research Chair, Department of Computer Science, Lakehead University, TBRHRI",39,1313,7356,38,5632,https://www.lakeheadu.ca/users/F/zfadlull/node/50708,Beyond 5G/Smart Health/UAV & Energy efficient Networks/QoS & Security/Deep Learning applications,https://scholar.google.com/citations?user=dZyfKpYAAAAJ&hl=en
23,Hossam Faris,"Professor, The University of Jordan",47,4411,10891,46,10662,https://scholar.google.com/citations?user=UEYd--YAAAAJ&hl=en,Data Science/Knowledge Systems/Data Mining/Evolutionary computation,https://scholar.google.com/citations?user=UEYd--YAAAAJ&hl=en
24,Giancarlo Fortino,"Full Prof. of Computer Engineering, University of Calabria, IEEE Fellow, Highly Cited Researcher",65,3688,15601,57,12524,https://research.com/u/giancarlo-fortino,Human-Machine Systems/Agent-based Computing/Internet of Things/Wearable Computing/Wireless/Body Area Networks,https://scholar.google.com/citations?user=ecImn1MAAAAJ&hl=it
25,Hamido Fujita,Iwate Prefectural University,65,4636,16256,65,15054,https://www.journals.elsevier.com/array/editorial-board/dr-hamido-fujita-phd,Machine Learning,https://scholar.google.com/citations?user=MxzV1nQAAAAJ&hl=en
26,Erik G. Larsson,"Professor, Dept. of Electrical Engineering (ISY), Linköping University, Sweden",85,6309,43898,67,27967,http://scholar.google.se/citations?user=79Lry6oAAAAJ&hl=en,Wireless communications/statistical signal processing/localization/massive MIMO/networks,https://scholar.google.se/citations?user=79Lry6oAAAAJ&hl=en
27,Amir H. Gandomi,"Professor, University of Technology Sydney",75,6923,27684,63,21089,https://ieeexplore.ieee.org/author/37681044500,Data Analytics/Genetic Programming/Engineering Optimization/Evolutionary Computation/Smart Cities,https://scholar.google.com/citations?user=VMf3wfMAAAAJ&hl=en
28,Xiaohua Ge,"Swinburne University of Technology, Melbourne, Australia",35,2051,6801,35,6601,https://publons.com/a/1375878/,Networked control systems/Cyber-physical systems/Multi-agent systems/Intelligent vehicles/Connected automated vehicles,https://scholar.google.com.au/citations?user=B37CYFoAAAAJ&hl=en
29,"Mohsen Guizani, FIEEE",Mohamed Bin Zayed University of Artificial Intelligence (MBZUAI),91,10688,42775,79,35403,https://research.com/u/mohsen-guizani,Internet of Things/Applied AI/ML and Cybersecurity,https://scholar.google.com/citations?user=RigrYkcAAAAJ&hl=en
30,Song Guo,"FCAE, FIEEE, The Hong Kong Polytechnic University",71,4299,20783,65,16800,https://openreview.net/profile?id=~Song_Guo5,Edge AI/Wireless Networking/Big Data Computing/Distributed System,https://scholar.google.com/citations?user=Ib-sizwAAAAJ&hl=en
31,Harald Haas,The University of Edinburgh,94,5536,44677,75,28652,https://www.comsoc.org/harald-haas,Optical Wireless Communications/Interference Managment in Wireless Networks/Spatial Modulation,https://scholar.google.com/citations?user=XxIwRJQAAAAJ&hl=ja
32,Yuki Hagiwara,Fraunhofer IKS,29,1966,6327,29,6305,https://muckrack.com/yuki-hagiwara/articles,Artificial Intelligence,https://scholar.google.com.sg/citations?user=P6WI2DQAAAAJ&hl=en
33,"Qing-Long Han, Pro Vice-Chancellor and Distinguished Professor, MAE, IEEE Fellow",Swinburne University of Technology,108,6381,37644,90,25439,https://studylib.net/doc/18098221/mae-prospectus---department-of-mechanical-and-automation,Networked control systems/time-delay systems/multi-agent systems/smart grids/unmanned surface vehicles,https://scholar.google.com.au/citations?user=j0pyptAAAAAJ&hl=en
34,Zhu Han,University of Houston,118,8442,56164,89,36800,https://en.wikipedia.org/wiki/Zhu_Han,Game Theory/Wireless Networking/Security/Data Science/Smart Grid,https://scholar.google.com/citations?user=ty7wIXoAAAAJ&hl=en
35,L Hanzo,"Chair of Telecommunications, University of Southampton",108,8283,65915,81,33163,https://www.ecs.soton.ac.uk/people/hanzo,telecommunications/wireless communication/quantum_information_science/video_coding/video_networking,https://scholar.google.co.uk/citations?user=p0jnEW0AAAAJ&hl=en
36,L Hanzo,"Chair of Telecommunications, University of Southampton",108,8283,65915,81,33163,https://www.ecs.soton.ac.uk/people/hanzo,telecommunications/wireless communication/quantum_information_science/video_coding/video_networking,https://scholar.google.co.uk/citations?user=p0jnEW0AAAAJ&hl=en
37,Robert Heath,"Lampe Distinguished Professor, North Carolina State University",134,7665,79346,89,40810,http://www.profheath.org/home/,wireless/MIMO/communications/signal processing/information theory,https://scholar.google.com/citations?user=17Ko8Q0AAAAJ&hl=en
38,Francisco Herrera,"Professor Computer Science and AI, Granada University, Spain",161,14725,110828,120,58681,https://comicarttracker.com/francisco-herrera-original-art-for-sale,Artificial Intelligence/Computational Intelligence/Data mining/Evolutionary Algorithms/Big Data Analytics,https://scholar.google.com/citations?user=HULIk-QAAAAJ&hl=en
39,Enrique Herrera-Viedma,"Professor of Computer Science and Artificial Intelligence, Spain, University of Granada",108,6052,46613,89,25444,https://research.com/u/enrique-herrera-vied,Fuzzy sets/fuzzy decision making/computing with words/multiple criteria decision making/consensus,https://scholar.google.com/citations?user=g8ZXTuYAAAAJ&hl=en
40,Ekram Hossain,"Professor, University of Manitoba, Canada, IEEE Fellow",96,3191,35926,70,18238,https://scholar.google.com/scholar_url?url=https://books.google.com/books%3Fhl%3Den%26lr%3D%26id%3DFgce1ge4gtwC%26oi%3Dfnd%26pg%3DPA3%26dq%3DEkram%2BHossain%2Bhomepage%26ots%3Dhamiglo2Wo%26sig%3DSCGzVQAwHzKYBNWNaBhp6fJplgU&hl=en&sa=X&ei=hvhEYp3MMIz0yAS6oYyoCg&scisig=AAGBfm0VJC6JjSds5Ka3rWaCDTAtEp1p2Q&oi=scholarr,Wireless communication networks/radio resource allocation/cognitive radio/multi-tier cellular networks,https://scholar.google.com/citations?user=Lb617EMAAAAJ&hl=en
41,Guang-Bin Huang,"Full Professor, Nanyang Technological University, Singapore",71,5567,53641,61,31651,https://scholar.google.com/scholar_url?url=https://www.researchgate.net/profile/Narasimhan-Sundararajan/publication/7281816_Classification_of_Mental_Tasks_from_EEG_Signals_Using_Extreme_Learning_Machines/links/00b7d5190fb196fe3e000000/Classification-of-Mental-Tasks-from-EEG-Signals-Using-Extreme-Learning-Machines.pdf&hl=en&sa=X&ei=h_hEYs_xJs3uygTdnqKwBg&scisig=AAGBfm2C1jkiPMDUoN2_KiL7H43tHbSfaA&oi=scholarr,Machine Learning/Neural Networks/Neuroscience,https://scholar.google.com.sg/citations?user=LhSqQCIAAAAJ&hl=en
42,Kaibin Huang,"Professor, Dept. of EEE, The University of Hong Kong; IEEE Fellow; ISI Highly Cited Researcher",51,2894,14295,40,10952,https://dl.acm.org/profile/99659822022,Machine Learning/Mobile Edge Computing/Wireless Communications/Wireless Power Transfer/Stochastic Geometry,https://scholar.google.com/citations?user=HfuA3uIAAAAJ&hl=en
43,Thomas JR Hughes,"Peter O'Donnell Jr. Chair in Computational and Applied Mathematics, University of Texas at Austin",150,7065,126288,90,38814,https://en.wikipedia.org/wiki/Thomas_J.R._Hughes,Finite Element Methods/Solid Mechanics/Computational Fluid Dynamics/Partial Differential Equations/Isogeometric Analysis,https://scholar.google.com/citations?user=6tPdlYAAAAAJ&hl=en
44,Yaochu Jin,"A. v. Humboldt Professor for AI, Bielefeld University and Distinguished Chair, University of Surrey",85,5675,30676,71,18823,http://www.soft-computing.de/,Evolutionary Computation/Multiobjective Optimization/Multiobjective Learning/Federated Learning/Artificial Intelligence,https://scholar.google.com/citations?user=B5WAkz4AAAAJ&hl=en
45,"Nei Kato(IEEE Fellow, IEICE Fellow)","Professor, Graduate School of Information Sciences, Tohoku University, Japan",73,3160,21283,57,13694,https://orcid.org/0000-0001-8769-302X,Wireless networking,https://scholar.google.com/citations?user=LfLfZXEAAAAJ&hl=en
46,"Dr. Neeraj Kumar, SMIEEE (Web of Science Highly Cited Researcher 2019, 2020,2021)","Professor, CSED, Thapar Institute of Engineering and Technology, India",88,9979,27141,85,25144,https://scholar.google.co.in/citations?user=gL9gR-4AAAAJ&hl=en,IoT and Machine Learning/Deep Learning/Blockchain Technology,https://scholar.google.co.in/citations?user=gL9gR-4AAAAJ&hl=en
47,"Dr. Arun Kumar Sangaiah, (Web of Science Highly Cited Researcher)","Professor, VIT University, Vellore, India",69,4690,14318,69,14125,http://www.publicnow.com/view/383E0E62A62E07E12FC5362085B1CF8B27F7CFF0,Software Engineering/Computational Intelligence/Internet of Things,https://scholar.google.co.in/citations?user=8yF6Xc4AAAAJ&hl=en
48,Victor C. M. Leung,Shenzhen University / The University of British Columbia,101,6362,47045,82,29585,https://scholar.google.ca/citations?user=ajvCoo4AAAAJ&hl=en,communication systems/wireless networks/mobile systems,https://scholar.google.ca/citations?user=ajvCoo4AAAAJ&hl=en
49,Geoffrey Ye Li (李烨),"Chair Professor in Wireless Systems, Dept EEE, Imperial College London",107,5781,52088,78,23756,http://www.scia.com.cn/bd_editor/php/upload/file/20220222/1645506858497297.pdf,Signal Processing/and/Machine Learning/for/Wireless Communications,https://scholar.google.com/citations?user=d0FzG8YAAAAJ&hl=en
50,Hongyi Li,"Assistant Professor, University of Houston",32,920,3530,28,2941,https://www.researchgate.net/profile/Hongyi-Li-13,watershed hydrology/earth system modeling/coupled human-nature system,https://scholar.google.com/citations?user=yWy-5icAAAAJ&hl=en
51,Jin Li  李进,Professor @Guangzhou University,58,1946,18579,52,12164,https://idealliancechina.org/2021/07/09/mr-jin-li-%E6%9D%8E%E8%BF%9B/,Trust and Security in Artificial Intelligence/Computating and Storage in Cloud Computing/Blockchain,https://scholar.google.com/citations?user=7GDV2vUAAAAJ&hl=en
52,Xuelong Li (Executive Councilor of AAAI),"Professor, Northwestern Polytechnical University, China",117,8361,53135,95,36526,https://aaai.org/Organization/officers.php,artificial intelligence/optics and electronics,https://scholar.google.com/citations?user=ahUibskAAAAJ&hl=en
53,yongming li,"college of computer science, shaanxi normal university",37,417,4875,24,2341,https://loop.frontiersin.org/people/774056/overview,fuzzy systems/quantume logic and quantum information/lattice/topology/model checking,https://scholar.google.com/citations?user=P3VERZ0AAAAJ&hl=en
54,Huchang Liao (廖虎昌),"IET Fellow, BCS Fellow; Business School, Sichuan University",61,3717,12405,58,11328,https://www.adscientificindex.com/scientist.php?id=728035,Decision analysis/Fuzzy Systems/Multiple criteria decision making/Preference learning,https://scholar.google.co.uk/citations?user=KlWnnbIAAAAJ&hl=en
55,Chong Lin,Qingdao University,70,1985,16091,51,8805,https://www.linkedin.com/in/chonglin,systems and control theory,https://scholar.google.com/citations?user=AQbRErEAAAAJ&hl=en
56,Yan-Jun Liu,Liaoning University of Technology,61,2380,13853,57,10434,https://sites.google.com/site/johnianliu/,Adaptive control/fuzzy control/neural networks,https://scholar.google.com/citations?user=x_Wk1jAAAAAJ&hl=en
57,Yuanwei Liu,"Associate Professor in Queen Mary University of London, Web of Science Highly Cited Researcher",48,3548,11285,47,11006,https://kclpure.kcl.ac.uk/portal/en/persons/yuanwei-liu(2b436c4e-ff5b-46ee-a6a7-eff58f0a7f72).html,NOMA/RIS/AI/6G/Integrated Sensing and Communications,https://scholar.google.com/citations?user=FxLf7ZAAAAAJ&hl=en
58,Wenjing Lou,"W. C. English Endowed Professor, IEEE Fellow, Virginia Tech, USA",82,2726,39019,58,18574,https://www.linkedin.com/in/wenjing-lou-a605237,Cyber Security/Wireless Networks/Wireless Security/Network Security/Cloud Computing,https://scholar.google.com/citations?user=hM8uAwoAAAAJ&hl=en
59,Majdi Mafarja,"Associate Professor of Computer Science, Birzeit University",33,2703,6157,32,6105,https://scholar.google.com/citations?user=ftkD0MgAAAAJ&hl=en,Feature Selection/Machine Learning/Artificial Intelligence/Bio-inspired Algorithms/Metaheuristics,https://scholar.google.com/citations?user=ftkD0MgAAAAJ&hl=en
60,Luis Martínez,"Professor of Computer Science, University of Jaén",61,2777,22271,51,12271,https://scholar.google.com/citations?user=PG3D8UMAAAAJ&hl=en,Fuzzy decision making/Computing with words/Recommender Systems,https://scholar.google.com/citations?user=PG3D8UMAAAAJ&hl=en
61,Thomas Marzetta,"Distinguished Industry Professor, Department of Electrical and Computer Engineering, New York",58,4671,46527,45,27326,https://ieeexplore.ieee.org/author/37282754500,Beyond Massive MIMO,https://scholar.google.com/citations?user=tBLWIBoAAAAJ&hl=en
62,Seyedali Mirjalili,"Professor, Torrens University Australia, Adjunct Griffith University",73,17203,47358,71,45190,https://ieeexplore.ieee.org/author/37887965300,Metaheuristics/Robust Optimization/Engineering Optimization/Evolutionary Algorithm/Swarm Intelligence,https://scholar.google.com/citations?user=TJHmrREAAAAJ&hl=en
63,Andreas F. Molisch,"Professor of Electrical Engineering, University of Southern California",101,5202,58457,71,27142,https://scholar.google.com/scholar_url?url=https://merl.com/publications/docs/TR2008-072.pdf&hl=en&sa=X&ei=mvhEYuy8AZLeyQSQoL7oCQ&scisig=AAGBfm0YMVoBGcBSFij6oNowME7WgCoT9g&oi=scholarr,wireless propagation channels/multi-antenna systems/ultrawideband communications and positioning/cooperative communications,https://scholar.google.com/citations?user=W0wwrucAAAAJ&hl=en
64,Derrick Wing Kwan Ng,"Scientia  Assoicate Professor,  University of New South Wales",65,3973,18567,61,15900,http://www2.ee.unsw.edu.au/~derrick/,Wireless Communications,https://scholar.google.com/citations?user=NUJSHxoAAAAJ&hl=en
65,H. Nguyen-Xuan,"CIRTech Institute, HUTECH University, Vietnam",68,2520,15329,57,10678,https://scholar.google.co.uk/citations?user=3iK9h-gAAAAJ&hl=en,Computational Engineering/Large-scale data/3D Printing/Renewable Energy,https://scholar.google.co.uk/citations?user=3iK9h-gAAAAJ&hl=en
66,Dusit (Tao) Niyato,Nanyang Technological University (NTU),102,8729,46380,82,31490,https://www.adscientificindex.com/university/Nanyang+Technological+University/,ดุสิต นิยะโต - เต๋า,https://scholar.google.com/citations?user=T8sVhLMAAAAJ&hl=en
67,Kaoru Ota (太田　香),"MEXT Excellent Young Researcher (文部科学省　卓越研究員), Muroran Institute of Technology",50,2072,9519,47,8644,https://researchmap.jp/k-ota/?lang=english,,https://scholar.google.com/citations?user=8JVn8RsAAAAJ&hl=ja
68,Mugen Peng,"Beijing University of Posts & Telecommun., IEEE Fellow, Web of Science Highly Cited Researcher",53,2312,15208,45,10581,https://dl.acm.org/profile/81339521539,Fog Computing/Cloud Radio Access Networks/Integrated Satellite-Terrestrial Networks/6G,https://scholar.google.com/citations?user=85mAZVcAAAAJ&hl=en
69,HV Poor,"Michael Henry Strater University Professor, Princeton University",154,14328,119706,104,58230,https://en.wikipedia.org/wiki/Vincent_Poor#Awards,Communication Systems/Wireless Communications/Communications/Statistical Signal Processing/Information Theory,https://scholar.google.com/citations?user=Dq93mOUAAAAJ&hl=en
70,Lianyong Qi(齐连永),"Professor, Qufu Normal University",42,1865,5412,40,5163,https://sites.google.com/view/lianyongqi/research/publications,service computing/big data/recommender system,https://scholar.google.com/citations?user=pxNRRsAAAAAJ&hl=en
71,Timon Rabczuk,Bauhaus University Weimar,107,7443,40769,90,30228,https://scholar.google.com/citations?user=3CBuGosAAAAJ&hl=it,Computational Mechanics/Solid Mechanics,https://scholar.google.ca/citations?user=3CBuGosAAAAJ&hl=en
72,Kim-Kwang Raymond Choo,"Cloud Tech Endowed Professor, University of Texas at San Antonio; Highly Cited Researcher 2020, 2021",91,6496,24027,84,21595,https://globalyoungacademy.net/kim-kwang-raymond-choo/,Cloud Forensics/Cyber Forensics/Cyber Security/IoT Security/Blockchain,https://scholar.google.com/citations?user=rRBNI6AAAAAJ&hl=en
73,Kui Ren,"Professor, Zhejiang University, ACM Fellow, IEEE Fellow",83,3647,39405,68,21597,https://scholar.google.com/scholar?q=Kui+Ren+homepage&hl=en&as_sdt=0&as_vis=1&oi=scholart,Data Security & Privacy/IoT Security/AI Security,https://scholar.google.com/citations?user=uuQA_rcAAAAJ&hl=en
74,Walid Saad,"Professor, Electrical and Computer Engineering",82,7425,30999,73,25953,https://www.netsciwis.com/,6G/machine learning/semantic communications/security and cyber-physical systems/unmanned aerial vehicles,https://scholar.google.com/citations?user=kYDNA0UAAAAJ&hl=en
75,Robert Schober,Friedrich-Alexander-University Erlangen-Nuremberg,92,5445,41883,74,26916,https://scholar.google.com/scholar_url?url=http://publications.lib.chalmers.se/records/fulltext/182416/182416.pdf&hl=en&sa=X&ei=o_hEYs-YOZLeyQSQoL7oCQ&scisig=AAGBfm0LrAxTXp4HRE94r1AO0BIQqslBuQ&oi=scholarr,,https://scholar.google.com/citations?user=Uu0BpX8AAAAJ&hl=en
76,"Ling Shao, Fellow of IEEE/IAPR","CTO and Chief Scientist, National Center for Artificial Intelligence (NCAI), SDAIA, KSA",82,8271,30435,78,25377,https://ieeexplore.ieee.org/author/38265369400,Computer Vision/Deep Learning/Artificial Intelligence/Medical Imaging/Vision and Language,https://scholar.google.com/citations?user=z84rLjoAAAAJ&hl=en
77,Xuemin (Sherman) Shen,"University Professor, University of Waterloo",130,9011,72280,100,40995,https://scholar.google.ca/citations?user=Bjl3GwoAAAAJ&hl=en,Wireless networking/MAC/Network security/VANET,https://scholar.google.com/citations?user=Bjl3GwoAAAAJ&hl=cs
78,Peng Shi,"Professor, School of Electrical and Electronic Engineering, The University of Adelaide",149,8320,76416,112,44339,https://scholar.google.com/scholar?q=Peng+Shi+homepage&hl=en&as_sdt=0&as_vis=1&oi=scholart,Systems and Control/Electrical and Electronic Engineering/Cybernetics/Human-Computer Interaction,https://scholar.google.com.hk/citations?user=EGx1iH0AAAAJ&hl=en
79,"Dr. P. N. Suganthan (SCI Highly Cited Researcher 2015-2021), FIEEE'2015","Some Codes available at GitHub, (Hon. Doctorate, U. of Maribor, 2020 ; BA & MA, U. of Cambridge, UK)",104,7071,56018,86,31899,https://www.timeshighereducation.com/hub/macau-university-science-and-technology/p/highly-cited-researchers-must,Machine Learning(ML)/Swarm-Evolutionary Computation(SEC)/Neural Networks(ANN)/Applications of ML SEC ANN.,https://scholar.google.com/citations?user=yZNzBU0AAAAJ&hl=en
80,Xingming Sun,Nanjing University of Information Science and Technology,57,1669,15273,51,12044,https://ieeexplore.ieee.org/author/37290262300,Digital Watermarking/Information Security,http://scholar.google.com/citations?user=epqnljMAAAAJ&hl=en
