,Name,Affilation,H-index,Citations 2020,Total_citation,H-index_since_2016,Citation_since_2016,HomePage,Area of Research,Google_Scholar
0,"U Rajendra Acharya (SCI Highly Cited Researcher 2016-2022)  PhD, DEng, DSc",Unknown affiliation,122,11883,60228,109,47668,https://rajendraacharya.com/,Artificial Intelligence,https://scholar.google.com.sg/citations?user=8FjY99sAAAAJ&hl=en
1,IAN  F.  AKYILDIZ,"Truva Inc. , USA",134,6644,137988,86,42494,https://ianakyildiz.com/projects/,Wireless Communication/5G/6G Wireless Systems/Intelligent Surfaces for Wireless Communication/Nano-scale and Molecular Commun,https://scholar.google.com/citations?user=rAGwv14AAAAJ&hl=en
2,Ibrahim Aljarah,"Professor of Big Data Mining and Computational Intelligence, The University of Jordan",48,3253,10823,47,10621,https://scholar.google.com/citations?user=moOTIYEAAAAJ&hl=en,Artificial  intelligence/Swarm Intelligence/Data Science/Machine Learning/Evolutionary Computation,https://scholar.google.com/citations?user=moOTIYEAAAAJ&hl=en
3,Jeffrey Andrews,"Truchard Family Chair and Director of 6G@UT, University of Texas at Austin",107,3888,67630,74,31171,https://sites.utexas.edu/jandrews/,Wireless Communications/Communication Theory/Machine Learning for Communications/Stochastic Geometry/Information Theory,https://scholar.google.com/citations?user=Hr9Gey0AAAAJ&hl=en
4,Bennis Mehdi,"Full Professor, IEEE Fellow, Head of ICON, University of Oulu",75,7200,30566,71,27979,https://sites.google.com/view/dr-mehdi-bennis/group,B5G/6G/machine learning/semantic communication/protocol learning,https://scholar.google.com/citations?user=RW4sJu8AAAAJ&hl=en
5,Emil Björnson,"Professor of Wireless Communication, KTH Royal Institute of Technology",68,4490,21372,66,18522,https://ieeexplore.ieee.org/author/37322949300,Massive MIMO/Cell-free Massive MIMO/RIS/Signal processing/Wireless communication,https://scholar.google.se/citations?user=Maij4akAAAAJ&hl=en
6,Rajkumar Buyya,"School of Computing and Information Systems, The Uni of Melbourne; Fellow of IEEE & Academia Europea",158,11461,130626,111,67130,https://scholar.google.com/scholar_url?url=https://arxiv.org/pdf/1512.08187&hl=en&sa=X&ei=GMB-Y9GPEJCXywTpjZ64Bw&scisig=AAGBfm02lvO1qQRXw3fwYs1XC31m_SoBlg&oi=scholarr,Cloud Computing/Distributed Systems/Edge Computing/Internet of Things/Sustainable Computing,https://scholar.google.com/citations?user=7xN6JqYAAAAJ&hl=en
7,Xing Cai,"Senior Research Scientist at Simula Research Laboratory, Professor at University of Oslo",19,138,2117,14,822,https://koei.fandom.com/wiki/Xingcai#Warriors_Orochi,Parallel programming/High-performance computing/numerical methods for PDEs,https://scholar.google.com/citations?user=IWQbrcK5CEwC&hl=en
8,Giuseppe Caire,"Professor, Technical University of Berlin, Germany, and Professor of Electrical Engineering (on",85,2903,40990,59,17647,https://www.humboldt-foundation.de/en/entdecken/newsroom/dossier-alexander-von-humboldt-professur/giuseppe-caire,Information Theory/Communications/Signal Processing/Statistics,https://scholar.google.com/citations?user=g66ErTcAAAAJ&hl=en
9,Jinde Cao,"Academician, RAS/AE/LAS/PAS/AAS/RAE/EASA/IASCYS  & FIEEE/FAAIA/DFIETI; Southeast University",133,8714,75779,97,45986,https://www.ae-info.org/ae/User/Cao_Jinde,Complex networks/neural networks/multi-agent systems - engineering stability - dynamics and control - time-delay systems,https://scholar.google.com/citations?user=8_ffELYAAAAJ&hl=en
10,C. L. Philip Chen,"Chair Professor, South China University of Technology, Philip.Chen@ieee.org",99,7325,42696,88,33098,https://engineering.purdue.edu/ECE/Alums/OECE/2016/chen.html,Computational Intelligence/Intelligent Control/Cybernetics/Intelligent Transportation Systems/Data Science/Engineering,https://scholar.google.com/citations?user=Q5248zwAAAAJ&hl=en
11,Jinjun Chen,"MAE (Academia Europea), IEEE Fellow (Computer Society), AAIA Fellow, HiCi; Professor and Deputy",72,2331,14723,54,10473,https://dl.acm.org/profile/81452604018,Cloud Computing/Scalable Architecture/Scalable Data Storage/Scalable Data Processing (Privacy),https://scholar.google.com/citations?user=mQ9vJ24AAAAJ&hl=en
12,Min Chen,"Professor, IEEE Fellow, Highly Cited Researcher, Huazhong University of Science and Technology",92,6198,37289,73,28180,https://sites.google.com/site/drminchen/home,Cognitive Computing and Big Data Analytics/IoT Sensing/5G Networks/Robotics/Edge Computing,https://scholar.google.com/citations?user=_HyHTrsAAAAJ&hl=en
13,Xiaofeng Chen,"Professor, Xidian University, China",60,1830,14595,52,11118,https://scholar.google.com/scholar?q=Xiaofeng+Chen+homepage&hl=en&as_sdt=0&as_vis=1&oi=scholart,Security/Cryptography/Cloud computing,https://scholar.google.com/citations?user=-3WhJecAAAAJ&hl=en
14,Francisco Chiclana,"Professor of Computational Intelligence and Decision Making, De Montfort University, UK",71,2382,21494,63,13089,https://scholar.google.com/citations?user=qDOxZIIAAAAJ&hl=en,Decision making/computational intelligence/information fusion/consensus/sentiment analysis,https://scholar.google.com/citations?user=qDOxZIIAAAAJ&hl=en
15,zhihua cui,"Taiyuan University of Science and Technology, Taiyuan, Shanxi, China, 030024",46,1683,9241,37,7120,https://www.zhihuacui.com/contact,evolutionary computation,https://scholar.google.com/citations?user=BpDrULIAAAAJ&hl=en
16,Linglong Dai,"Associate Professor, Tsinghua University; IEEE Fellow",67,3348,18362,63,16738,https://arxiv.org/abs/2203.16318,Wireless Communications/RIS/Massive MIMO/Millimeter-Wave/Teraherz Communications/Non-Orthogonal Mutiple Access,https://scholar.google.com/citations?user=OTFnifoAAAAJ&hl=en
17,Merouane Debbah,"Centralesupelec, Technology Innovation Institute, MBZUAI, Lagrange Mathematics Center",104,9086,53102,89,39164,https://ctw2021.ieee-ctw.org/speaker-biography-merouane-debbah/,5G/6G/Machine Learning/Random Matrix Theory/Game Theory,https://scholar.google.com/citations?user=HU5I0X4AAAAJ&hl=en
18,Zhiguo Ding,"University of Manchester, Fellow of IEEE, Web of Science Highly Cited Researcher",98,8234,42855,92,38662,https://www.research.lancs.ac.uk/portal/en/people/zhiguo-ding(6f420ab8-4825-4195-a3d8-07e5c5b7716e).html,Wireless communications/signal processing/and cross-layer optimization,https://scholar.google.co.uk/citations?user=V-nB8scAAAAJ&hl=en
19,"Mianxiong Dong, Foreign Fellow of EAJ","Vice President and Professor, Muroran Institute of Technology, Japan",57,2258,12271,51,10892,http://www2.egr.uh.edu/~zhan2/index_files/cv.pdf,Cyber-Physical Systems/Internet of Things/Artificial Intelligence,https://scholar.google.co.jp/citations?user=TqyApAUAAAAJ&hl=en
20,Yucheng Dong,"Professor of Management and Systems Sciences, Sichuan University",65,2210,13253,62,10951,https://ieeexplore.ieee.org/author/37536522700,Decision Analysis/Human Dynamics/Social Network/Data Science,https://scholar.google.com/citations?user=tFVYDw4AAAAJ&hl=en
21,Maged Elkashlan,"Associate Professor, Queen Mary University of London",63,2723,16843,55,14412,https://dl.acm.org/profile/81461660943,IRS/URLLC/UAV/PLS/NOMA,https://scholar.google.com/citations?user=mncnnOAAAAAJ&hl=en
22,Zubair Md. Fadlullah,"Associate Professor, Research Chair, Department of Computer Science, Lakehead University, TBRHRI",41,1365,8225,39,6509,http://www.it.is.tohoku.ac.jp/~zubair/Contact.htm,Beyond 5G/Smart Health/UAV & Energy efficient Networks/QoS & Security/Deep Learning applications,https://scholar.google.com/citations?user=dZyfKpYAAAAJ&hl=en
23,Hossam Faris,"Professor, The University of Jordan",52,4287,14265,50,14014,http://eacademic.ju.edu.jo/Hossam.faris,Data Science/Knowledge Systems/Data Mining/Evolutionary computation,https://scholar.google.com/citations?user=UEYd--YAAAAJ&hl=en
24,Giancarlo Fortino,"Full Prof. of Computer Engineering, University of Calabria, FIEEE, FAAIA, Highly Cited Researcher",70,3740,18223,64,15118,https://en.wikipedia.org/wiki/Giancarlo_Fortino,Human-Machine Systems/Agent-based Computing/Internet of Things/Wearable Computing/Wireless/Body Area Networks,https://scholar.google.com/citations?user=ecImn1MAAAAJ&hl=it
25,Hamido Fujita,Iwate Prefectural University,74,4434,19864,74,18567,https://scholar.google.com/scholar_url?url=https://link.springer.com/article/10.1007/s10489-018-1278-z&hl=en&sa=X&ei=KsB-Y4maLeqK6rQP7ZGx8A4&scisig=AAGBfm3a883HHXF5fCk7ogGNjAC7a287cw&oi=scholarr,Machine Learning,https://scholar.google.com/citations?user=MxzV1nQAAAAJ&hl=en
26,Erik G. Larsson,"Professor, Dept. of Electrical Engineering (ISY), Linköping University, Sweden",91,6335,48264,72,32288,https://scholar.google.com/scholar_url?url=http://download.garuda.kemdikbud.go.id/article.php%3Farticle%3D1306855%26val%3D146%26title%3DPerformance%2520Analysis%2520of%2520Adaptive%2520Filter%2520Channel%2520Estimated%2520MIMO%2520OFDM%2520Communication%2520System&hl=en&sa=X&ei=K8B-Y8zOIOeR6rQPj_qo2Ao&scisig=AAGBfm1IJ50CwidsVreyPtM355Q3oUw1XQ&oi=scholarr,Wireless communications/statistical signal processing/localization/massive MIMO/networks,https://scholar.google.se/citations?user=79Lry6oAAAAJ&hl=en
27,Amir H. Gandomi,"Professor of Data Science, University of Technology Sydney",85,6880,35041,74,28308,https://scholar.google.com/scholar_url?url=https://www.tandfonline.com/doi/abs/10.1080/10298436.2021.1969019&hl=en&sa=X&ei=LMB-Y5PgFpD-yQStgp1w&scisig=AAGBfm3ILy9_ZioDeMB_XjZm0Fn2lTszmw&oi=scholarr,Data Analytics/Genetic Programming/Engineering Optimization/Evolutionary Computation/Smart Cities,https://scholar.google.com/citations?user=VMf3wfMAAAAJ&hl=en
28,Xiaohua Ge,"Swinburne University of Technology, Melbourne, Australia",40,2023,8435,39,8234,https://dblp.org/pid/118/3514,Networked control systems/Cyber-physical systems/Multi-agent systems/Intelligent vehicles/Connected automated vehicles,https://scholar.google.com.au/citations?user=B37CYFoAAAAJ&hl=en
29,"Mohsen Guizani, FIEEE",Mohamed Bin Zayed University of Artificial Intelligence (MBZUAI),97,11118,51399,87,43954,https://www.comsoc.org/mohsen-guizani,Internet of Things/Applied AI/ML and Cybersecurity,https://scholar.google.com/citations?user=RigrYkcAAAAJ&hl=en
30,Song Guo,"FCAE, FIEEE, The Hong Kong Polytechnic University",75,4448,23941,68,19934,https://forestgeo.si.edu/song-guo-zhang-michael,Edge Intelligence/Federated Learning/Edge Computing/Distributed System/Wireless Networking,https://scholar.google.com/citations?user=Ib-sizwAAAAJ&hl=en
31,Harald Haas,The University of Edinburgh,97,5656,48513,80,32449,https://lifi.co/harald-haas/,Optical Wireless Communications/Interference Managment in Wireless Networks/Spatial Modulation,https://scholar.google.com/citations?user=XxIwRJQAAAAJ&hl=ja
32,Yuki Hagiwara,Fraunhofer IKS,30,1984,7662,30,7636,https://tumsatdb.kaiyodai.ac.jp/html/100000513_en.html,Artificial Intelligence,https://scholar.google.com.sg/citations?user=P6WI2DQAAAAJ&hl=en
33,"Qing-Long Han, Pro Vice-Chancellor and Distinguished Professor, MAE, IEEE Fellow, IFAC Fellow",Swinburne University of Technology,113,6137,41739,97,29510,https://www.swinburne.edu.au/about/our-structure/leadership-governance/executive-team/professor-qing-long-han/,Networked control systems/time-delay systems/multi-agent systems/smart grids/unmanned surface vehicles,https://scholar.google.com.au/citations?user=j0pyptAAAAAJ&hl=en
34,Zhu Han,University of Houston,123,8613,63102,95,43711,https://scholar.google.com/scholar_url?url=https://www.ncbi.nlm.nih.gov/pmc/articles/PMC5569675/&hl=en&sa=X&ei=M8B-Y9eLPL-D6rQPotOMKA&scisig=AAGBfm3v8SagCDZvriICz3BIMGlNiVuZVA&oi=scholarr,Game Theory/Wireless Networking/Security/Data Science/Smart Grid,https://scholar.google.com/citations?user=ty7wIXoAAAAJ&hl=en
35,L Hanzo,"Chair of Telecommunications, University of Southampton",114,8327,74041,90,40883,https://www.researchgate.net/profile/L-Hanzo,telecommunications/wireless communication/quantum_information_science/video_coding/video_networking,https://scholar.google.co.uk/citations?user=p0jnEW0AAAAJ&hl=en
36,L Hanzo,"Chair of Telecommunications, University of Southampton",114,8327,74041,90,40883,https://www.researchgate.net/profile/L-Hanzo,telecommunications/wireless communication/quantum_information_science/video_coding/video_networking,https://scholar.google.co.uk/citations?user=p0jnEW0AAAAJ&hl=en
37,Robert Heath,"Lampe Distinguished Professor, North Carolina State University",139,7757,84101,94,45576,https://en.wikipedia.org/wiki/Robert_W._Heath_Jr.,wireless/MIMO/communications/signal processing/information theory,https://scholar.google.com/citations?user=17Ko8Q0AAAAJ&hl=en
38,Francisco Herrera,"Professor Computer Science and AI, Granada University, Spain",167,14517,121758,128,69189,https://www.facebook.com/FranciscoHerreraforsupervisor/,Artificial Intelligence/Computational Intelligence/Data mining/Evolutionary Algorithms/Big Data Analytics,https://scholar.google.com/citations?user=HULIk-QAAAAJ&hl=en
39,Enrique Herrera-Viedma,"Professor of Computer Science and Artificial Intelligence, Spain, University of Granada",111,5995,51658,92,30179,https://www.journals.elsevier.com/applied-soft-computing/editorial-board/enrique-herrera-viedma,Fuzzy sets/fuzzy decision making/computing with words/multiple criteria decision making/consensus,https://scholar.google.com/citations?user=g8ZXTuYAAAAJ&hl=en
40,Ekram Hossain,"Professor, University of Manitoba, Canada, IEEE Fellow",99,3278,38150,73,20536,https://scholar.google.com/citations?user=Lb617EMAAAAJ&hl=en,Wireless communication networks/radio resource allocation/cognitive radio/multi-tier cellular networks,https://scholar.google.com/citations?user=Lb617EMAAAAJ&hl=en
41,Guang-Bin Huang,"Full Professor, Nanyang Technological University, Singapore",73,5593,56828,62,35049,https://scholar.google.com/scholar?q=Guang-Bin+Huang+homepage&hl=en&as_sdt=0&as_vis=1&oi=scholart,Machine Learning/Neural Networks/Neuroscience,https://scholar.google.com.sg/citations?user=LhSqQCIAAAAJ&hl=en
42,Kaibin Huang,"Professor, Dept. of EEE, The University of Hong Kong; IEEE Fellow; ISI Highly Cited Researcher",54,2891,16457,45,13105,https://www.researchgate.net/profile/Kaibin-Huang-2,Machine Learning/Mobile Edge Computing/Wireless Communications/Wireless Power Transfer/Stochastic Geometry,https://scholar.google.com/citations?user=HfuA3uIAAAAJ&hl=en
43,Thomas JR Hughes,"Peter O'Donnell Jr. Chair in Computational and Applied Mathematics, University of Texas at Austin",152,7071,132045,96,43963,https://oden.utexas.edu/people/directory/Thomas-J.R.-Hughes/,Finite Element Methods/Solid Mechanics/Computational Fluid Dynamics/Partial Differential Equations/Isogeometric Analysis,https://scholar.google.com/citations?user=6tPdlYAAAAAJ&hl=en
44,Yaochu Jin,"A. v. Humboldt Professor for AI, Bielefeld University, Germany; University of Surrey, UK",92,5581,35663,76,23710,https://scholar.google.com/scholar_url?url=https://books.google.com/books%3Fhl%3Den%26lr%3D%26id%3DyhkvL3gArwsC%26oi%3Dfnd%26pg%3DPA2%26dq%3DYaochu%2BJin%2Bhomepage%26ots%3Dj7wXA-4RCs%26sig%3DZPjz92RSpjcdgB0_vKyd02csKw8&hl=en&sa=X&ei=PcB-Y_KCCoz5yATA7rmYCQ&scisig=AAGBfm2roaa2pe4orAt6XEFp_F8qyfrdtA&oi=scholarr,Data-Driven optimization/Multiobjective optimization/Multiobjective learning/Trustworthy AI/Developmental AI,https://scholar.google.com/citations?user=B5WAkz4AAAAJ&hl=en
45,"Nei Kato(IEEE Fellow, IEICE Fellow)","Professor and Dean, Graduate School of Information Sciences, Tohoku University, Japan",77,3303,23722,62,16154,https://vtsociety.org/contact/nei-kato,Wireless networking,https://scholar.google.com/citations?user=LfLfZXEAAAAJ&hl=en
46,"Dr. Neeraj Kumar, SMIEEE","Professor, CSED, Thapar Institute of Engineering and Technology, India",103,10008,34417,99,32439,https://www.amazon.com/Blockchain-Big-Data-Machine-Learning/dp/0367371685,IoT and Machine Learning/Deep Learning/Blockchain Technology,https://scholar.google.co.in/citations?user=gL9gR-4AAAAJ&hl=en
47,"Dr.Arun Kumar Sangaiah 桑亞倫, SM'IEEE (WoS-Highly Cited Researcher, Yushan Young Scholar)","玉山學者, National Yunlin University of Science & Technology, Taiwan & VIT University, India",75,4835,17685,75,17502,https://scholar.google.dk/citations?user=8yF6Xc4AAAAJ&hl=ja,Computational Intelligence/Internet of Things/Cognitive Computing,https://scholar.google.co.in/citations?user=8yF6Xc4AAAAJ&hl=en
48,Victor C. M. Leung,Shenzhen University / The University of British Columbia,106,6605,51911,89,34333,https://dl.acm.org/profile/81100299209,communication systems/wireless networks/mobile systems,https://scholar.google.ca/citations?user=ajvCoo4AAAAJ&hl=en
49,Geoffrey Ye Li (李烨),"Chair Professor in Wireless Systems, Dept EEE, Imperial College London",112,5866,56791,81,28432,https://www.aminer.cn/ai2000,Signal Processing/and/Machine Learning/for/Wireless Communications,https://scholar.google.com/citations?user=d0FzG8YAAAAJ&hl=en
50,Hongyi Li,"Assistant Professor, University of Houston",35,914,4193,31,3592,https://scholar.google.com/scholar?q=Hongyi+Li+homepage&hl=en&as_sdt=0&as_vis=1&oi=scholart,watershed hydrology/earth system modeling/coupled human-nature system,https://scholar.google.com/citations?user=yWy-5icAAAAJ&hl=en
51,Jin Li  李进,Professor @Guangzhou University,61,2021,19940,56,13541,https://www.scholat.com/jinli71.cn,Trust and Security in Artificial Intelligence/Computating and Storage in Cloud Computing/Blockchain,https://scholar.google.com/citations?user=7GDV2vUAAAAJ&hl=en
52,"Xuelong Li (Executive Councilor of AAAI, 21-24)","Professor, Northwestern Polytechnical University, China",124,8513,59553,103,42978,https://scholar.google.com/citations?user=ahUibskAAAAJ&hl=zh-TW,artificial intelligence/applied mathematics/physics,https://scholar.google.com/citations?user=ahUibskAAAAJ&hl=en
53,yongming li,"college of computer science, shaanxi normal university",37,402,5115,24,2600,https://www.eastwestcenter.org/about/staff/ming-li.yong,fuzzy systems/quantume logic and quantum information/lattice/topology/model checking,https://scholar.google.com/citations?user=P3VERZ0AAAAJ&hl=en
54,Huchang Liao (廖虎昌),"IET Fellow, BCS Fellow; Business School, Sichuan University",67,3579,14792,64,13717,https://www.sysengi.com/CN/10.12011/1000-6788(2017)01-0035-14,Decision analysis/Fuzzy Systems/Multiple criteria decision making/Preference learning,https://scholar.google.co.uk/citations?user=KlWnnbIAAAAJ&hl=en
55,Chong Lin,Qingdao University,73,1908,17417,54,10090,https://en.wikipedia.org/wiki/Lin_Chong,systems and control theory,https://scholar.google.com/citations?user=AQbRErEAAAAJ&hl=en
56,Yan-Jun Liu,Liaoning University of Technology,65,2282,15568,60,12127,https://scholar.google.com/scholar?q=Yan-Jun+Liu+homepage&hl=en&as_sdt=0&as_vis=1&oi=scholart,Adaptive control/fuzzy control/neural networks,https://scholar.google.com/citations?user=x_Wk1jAAAAAJ&hl=en
57,Yuanwei Liu,"Associate Professor in Queen Mary University of London, Web of Science Highly Cited Researcher",58,3435,14705,57,14438,https://scholar.google.com/scholar_url?url=https://www.sciencedirect.com/science/article/pii/S0959652621014591&hl=en&sa=X&ei=SMB-Y4-_Gs6vywTM0p3IDQ&scisig=AAGBfm3kYybdAtLZ4fsaaaw0NlHm4hS7lw&oi=scholarr,NOMA/RIS/AI/6G/Integrated Sensing and Communications,https://scholar.google.com/citations?user=FxLf7ZAAAAAJ&hl=en
58,Wenjing Lou,"W. C. English Endowed Professor, IEEE Fellow, Virginia Tech, USA",84,2865,40954,61,20461,https://cyberinitiative.org/research/researcher-directory/lou-wenjing.html,Cyber Security/Wireless Networks/Wireless Security/Network Security/Cloud Computing,https://scholar.google.com/citations?user=hM8uAwoAAAAJ&hl=en
59,Majdi Mafarja,"Associate Professor of Computer Science, Birzeit University",37,2613,8388,37,8343,https://dblp.org/pid/202/6216.html,Feature Selection/Machine Learning/Artificial Intelligence/Bio-inspired Algorithms/Metaheuristics,https://scholar.google.com/citations?user=ftkD0MgAAAAJ&hl=en
60,Luis Martínez,"Professor of Computer Science, University of Jaén",67,2687,24376,54,14281,https://www.luismartinezphotography.com/homepage,Fuzzy decision making/Computing with words/Recommender Systems,https://scholar.google.com/citations?user=PG3D8UMAAAAJ&hl=en
61,Thomas Marzetta,"Distinguished Industry Professor, Department of Electrical and Computer Engineering, New York",62,4642,49305,46,30035,https://wirelessfuture.podbean.com/e/19-future-of-multi-antenna-technology-and-spectrum-with-thomas-marzetta/,Beyond Massive MIMO,https://scholar.google.com/citations?user=tBLWIBoAAAAJ&hl=en
62,Seyedali Mirjalili,"Professor, Torrens University Australia, Adjunct Griffith University",83,16684,63197,83,60759,https://www.udemy.com/user/seyedali-mirjalili/,Metaheuristics/Robust Optimization/Engineering Optimization/Evolutionary Algorithm/Swarm Intelligence,https://scholar.google.com/citations?user=TJHmrREAAAAJ&hl=en
63,Andreas F. Molisch,"Professor of Electrical Engineering, University of Southern California",104,5279,62169,73,30790,https://wides.usc.edu/founder.html,wireless propagation channels/multi-antenna systems/ultrawideband communications and positioning/cooperative communications,https://scholar.google.com/citations?user=W0wwrucAAAAJ&hl=en
64,Derrick Wing Kwan Ng,"Scientia  Associate Professor,  University of New South Wales",72,3931,22045,67,19379,https://scholar.google.com/scholar_url?url=https://arxiv.org/pdf/1808.00101&hl=en&sa=X&ei=TsB-Y_PSIJD-yQStgp1w&scisig=AAGBfm0Hhn45GzU6q5kfFHGxEx0ejML8yQ&oi=scholarr,Wireless Communications,https://scholar.google.com/citations?user=NUJSHxoAAAAJ&hl=en
65,H. Nguyen-Xuan,"CIRTech Institute, HUTECH University, Vietnam",71,2433,17000,62,12290,https://sites.google.com/site/nguyenxuanhungsite/,Computational Engineering/Large-scale Data/3D Printing/Renewable Energy,https://scholar.google.co.uk/citations?user=3iK9h-gAAAAJ&hl=en
66,Dusit (Tao) Niyato,Nanyang Technological University (NTU),110,8980,54064,94,39255,https://www.vistec.ac.th/academic/faculty_detail.php?school=IST&id=146,ดุสิต นิยะโต - เต๋า,https://scholar.google.com/citations?user=T8sVhLMAAAAJ&hl=en
67,Kaoru Ota (太田　香),"MEXT Excellent Young Researcher (文部科学省　卓越研究員), Muroran Institute of Technology",52,2146,10895,50,10015,https://jglobal.jst.go.jp/en/detail?JGLOBAL_ID=201801018750503459,,https://scholar.google.com/citations?user=8JVn8RsAAAAJ&hl=ja
68,Mugen Peng,"Beijing University of Posts & Telecommun., IEEE Fellow, Web of Science Highly Cited Researcher",56,2404,16882,49,12274,https://sites.google.com/site/pengmg78/curriculum-vitae,Fog Computing/Cloud Radio Access Networks/Integrated Satellite-Terrestrial Networks/6G,https://scholar.google.com/citations?user=85mAZVcAAAAJ&hl=en
69,HV Poor,"Michael Henry Strater University Professor, Princeton University",162,14361,131329,112,69813,https://engineering.princeton.edu/faculty/h-vincent-poor,Communication Systems/Wireless Communications/Communications/Statistical Signal Processing/Information Theory,https://scholar.google.com/citations?user=Dq93mOUAAAAJ&hl=en
70,Lianyong Qi(齐连永),"Professor, China University of Petroleum (East China)",48,1827,7107,47,6852,https://scholar.google.com/citations?user=pxNRRsAAAAAJ&hl=en,service computing/big data/recommender system,https://scholar.google.com/citations?user=pxNRRsAAAAAJ&hl=en
71,Timon Rabczuk,Bauhaus University Weimar,112,7347,46070,97,35523,https://scholar.google.com/scholar_url?url=https://www.tandfonline.com/doi/full/10.1080/17415977.2015.1017485&hl=en&sa=X&ei=VMB-Y5aqJpD-yQStgp1w&scisig=AAGBfm3tUQJu1nYSY67hIj0XrUY4NGZsjQ&oi=scholarr,Computational Mechanics/Solid Mechanics,https://scholar.google.ca/citations?user=3CBuGosAAAAJ&hl=en
72,Kim-Kwang Raymond Choo,"Cloud Tech Endowed Professor, University of Texas at San Antonio",100,6707,28937,94,26439,https://www.youtube.com/watch?v=0AlIJB7fsds,Cloud Forensics/Cyber Forensics/Cyber Security/IoT Security/Blockchain,https://scholar.google.com/citations?user=rRBNI6AAAAAJ&hl=en
73,Kui Ren,"Professor, Zhejiang University, ACM Fellow, IEEE Fellow",87,3820,42116,71,24288,https://ieeexplore.ieee.org/author/37288795500,Data Security & Privacy/IoT Security/AI Security,https://scholar.google.com/citations?user=uuQA_rcAAAAJ&hl=en
74,Walid Saad,"Professor, Electrical and Computer Engineering",87,7528,36553,80,31523,http://resume.walid-saad.com/,6G/machine learning/semantic communications/security and cyber-physical systems/unmanned aerial vehicles,https://scholar.google.com/citations?user=kYDNA0UAAAAJ&hl=en
75,Robert Schober,Friedrich-Alexander-University Erlangen-Nuremberg,97,5367,45966,82,30967,https://scholar.google.com/scholar?q=Robert+Schober+homepage&hl=en&as_sdt=0&as_vis=1&oi=scholart,,https://scholar.google.com/citations?user=Uu0BpX8AAAAJ&hl=en
76,"Ling Shao, Fellow of IEEE/IAPR",Terminus Group,97,8256,38746,94,33669,https://scholar.google.com/citations?user=z84rLjoAAAAJ&hl=en,Computer Vision/Deep Learning/Artificial Intelligence/Medical Imaging/Vision and Language,https://scholar.google.com/citations?user=z84rLjoAAAAJ&hl=en
77,Xuemin (Sherman) Shen,"University Professor, University of Waterloo",136,9365,79547,109,48008,https://uwaterloo.ca/electrical-computer-engineering/profile/sshen,Wireless networking/MAC/Network security/VANET,https://scholar.google.com/citations?user=Bjl3GwoAAAAJ&hl=cs
78,Peng Shi,"Professor, School of Electrical and Electronic Engineering, The University of Adelaide",154,8186,82118,117,49891,https://scholars.cityu.edu.hk/en/persons/peng-shi(0e151646-b642-4a53-98e0-b312de44ae71).html,Systems and Control/Electrical and Electronic Engineering/Cybernetics/Human-Computer Interaction,https://scholar.google.com.hk/citations?user=EGx1iH0AAAAJ&hl=en
79,"R. Prof. P. N. Suganthan, FIEEE'2015, SCI Highly Cited Researcher 2015-2022, (Codes from my GitHub)","KINDI Center for Computing Research, Qatar University (Hon Doc: U of Maribor; BA/MA: Cambridge U, UK",110,7000,61320,93,37155,https://github.com/Reyhanehne/CVF-SID_PyTorch,Machine Learning(ML)/Swarm-Evolutionary Computation(SEC)/Neural Networks(ANN)/Applications of ML SEC ANN.,https://scholar.google.com/citations?user=yZNzBU0AAAAJ&hl=en
