,Name,Affilation,H-index,Citations 2020,Total_citation,H-index_since_2016,Citation_since_2016,HomePage,Area of Research,Google_Scholar
0,"U Rajendra Acharya (SCI Highly Cited Researcher 2016-2021)  PhD, DEng, DSc","Ngee Ann,  Singapore University of Social Science,  University of Malaya, Malaysia",112,11335,48743,96,36177,https://www.researchgate.net/profile/U-Rajendra-Acharya,Artificial Intelligence/Medical Informatics,https://scholar.google.com.sg/citations?user=8FjY99sAAAAJ&hl=en
1,IAN  F.  AKYILDIZ,"Truva Inc. , USA",132,6287,132589,78,37371,http://mswimconf.com/2014/keynotes.htm,Wireless Communication/5G/6G Wireless Systems/Intelligent Surfaces for Wireless Communication/Nano-scale and Molecular Commun,https://scholar.google.com/citations?user=rAGwv14AAAAJ&hl=en
2,Ibrahim Aljarah,"Associate Professor, University of Jordan",43,3235,7530,41,7355,http://evo-ml.com/ibrahim/biography.html,Artificial  intelligence/Swarm Intelligence/Data Science/Machine Learning/Evolutionary Computation,https://scholar.google.com/citations?user=moOTIYEAAAAJ&hl=en
3,Jeffrey Andrews,"Cockrell Family Endowed Chair in Engineering, University of Texas at Austin",105,3630,65128,70,28501,https://www.jeffandrewsdesign.com/praise,Wireless Communications/Communication Theory/Machine Learning for Communications/Stochastic Geometry/Information Theory,https://scholar.google.com/citations?user=Hr9Gey0AAAAJ&hl=en
4,Bennis Mehdi,"Full Professor, IEEE Fellow, Head of ICON, University of Oulu",65,6642,23315,62,20704,https://sites.google.com/view/dr-mehdi-bennis/research/v2x,B5G/6G/machine learning/semantic communication,https://scholar.google.com/citations?user=RW4sJu8AAAAJ&hl=en
5,Emil Björnson,"Professor of Wireless Communication, KTH Royal Institute of Technology",61,4324,17085,58,14221,https://dblp.org/pid/67/1658,Massive MIMO/Cell-free Massive MIMO/RIS/Signal processing/Wireless communication,https://scholar.google.se/citations?user=Maij4akAAAAJ&hl=en
6,Rajkumar Buyya,"CLOUDS Lab, School of Computing and Information Systems, The University of Melbourne, Australia",153,10695,121508,102,57997,https://www.abebooks.com/book-search/author/rajkumar-buyya/,Computer Systems/Cloud Computing/Distributed Systems/Edge Computing/Internet of Things,https://scholar.google.com/citations?user=7xN6JqYAAAAJ&hl=en
7,Xing Cai,"Senior Research Scientist at Simula Research Laboratory, Professor at University of Oslo",19,141,2008,13,718,https://www.linkedin.com/in/xingcai,Parallel programming/High-performance computing/numerical methods for PDEs,https://scholar.google.com/citations?user=IWQbrcK5CEwC&hl=en
8,Giuseppe Caire,"Professor, Technical University of Berlin, Germany, and Professor of Electrical Engineering (on",82,2786,38724,54,15270,https://braincity.berlin/en/our-ambassadors/prof-dr-giuseppe-caire,Information Theory/Communications/Signal Processing/Statistics,https://scholar.google.com/citations?user=g66ErTcAAAAJ&hl=en
9,Jinde Cao,"Academician, RAE/AE/RAEN/LAS/AAS/EASA/PAS/IASCYS  & FIEEE/FAAIA/DFIETI; Southeast University",129,9071,67664,88,37899,https://www.ae-info.org/ae/User/Cao_Jinde,Complex networks/neural networks/multi-agent systems - engineering stability - dynamics and control - time-delay systems,https://scholar.google.com/citations?user=8_ffELYAAAAJ&hl=en
10,C. L. Philip Chen,"Chair Professor, South China University of Technology, Philip.Chen@ieee.org",92,7373,35634,81,26004,https://dblp.org/pid/48/4856,Computational Intelligence/Intelligent Control/Cybernetics/Intelligent Transportation Systems/Data Science/Engineering,https://scholar.google.com/citations?user=Q5248zwAAAAJ&hl=en
11,Jinjun Chen,"Professor and Deputy Institute Director, Swinburne University of Technology",67,2350,12470,48,8227,https://dblp.org/pid/06/2379.html,Cloud Computing/Scalable Architecture/Scalable Data Storage/Scalable Data Processing (Privacy),https://scholar.google.com/citations?user=mQ9vJ24AAAAJ&hl=en
12,Min Chen,"Professor, IEEE Fellow, Highly Cited Researcher, Huazhong University of Science and Technology",86,5699,32458,68,23361,https://www.math.purdue.edu/~chen45/,Cognitive Computing and Big Data Analytics/IoT Sensing/5G Networks/Robotics/Edge Computing,https://scholar.google.com/citations?user=_HyHTrsAAAAJ&hl=en
13,Xiaofeng Chen,"Professor, Xidian University, China",56,1641,12690,47,9215,https://scholar.google.com/scholar_url?url=https://www.researchgate.net/profile/Xiaofeng-Chen-7/publication/312248508_Factors_That_Influence_Employees%27_Security_Policy_Compliance_An_Awareness-Motivation-Capability_Perspective/links/5fbb09c1458515b797627588/Factors-That-Influence-Employees-Security-Policy-Compliance-An-Awareness-Motivation-Capability-Perspective.pdf&hl=en&sa=X&ei=p_LtYdyJHpKoywTOyoTACA&scisig=AAGBfm0h7_-Q5jGp55ZZ9OHAyE740P1Qig&oi=scholarr,Security/Cryptography/Cloud computing,https://scholar.google.com/citations?user=-3WhJecAAAAJ&hl=en
14,Francisco Chiclana,"Professor of Computational Intelligence and Decision Making, De Montfort University, UK",67,2519,19256,58,10851,https://www.researchgate.net/profile/Francisco-Chiclana/3,Decision making/computational intelligence/information fusion/consensus/sentiment analysis,https://scholar.google.com/citations?user=qDOxZIIAAAAJ&hl=en
15,zhihua cui,"Taiyuan University of Science and Technology, Taiyuan, Shanxi, China, 030024",43,1723,7665,33,5451,https://www.researchgate.net/profile/Zhihua-Cui-6,evolutionary computation,https://scholar.google.com/citations?user=BpDrULIAAAAJ&hl=en
16,Linglong Dai,"Associate Professor, Tsinghua University; IEEE Fellow",62,3171,15338,57,13689,https://dblp.org/pid/50/7910,Wireless Communications/RIS/Massive MIMO/Millimeter-Wave/Teraherz Communications/Non-Orthogonal Mutiple Access,https://scholar.google.com/citations?user=OTFnifoAAAAJ&hl=en
17,Merouane Debbah,"Centralesupelec, Technology Innovation Institute, MBZUAI, Lagrange Mathematics Center",98,8693,45958,83,31551,https://scholar.google.com/scholar_url?url=https://dl.acm.org/doi/pdf/10.1145/3125719.3125728&hl=en&sa=X&ei=q_LtYYnvEIy5yQSO1oSwAw&scisig=AAGBfm0IaZoa9nRNIZ6FYSAhDAcZqTL0Bw&oi=scholarr,5G/6G/Machine Learning/Random Matrix Theory/Game Theory,https://scholar.google.com/citations?user=HU5I0X4AAAAJ&hl=en
18,Yong Deng,"School of Computer and Information Science, Southwest University",74,3591,19140,64,14417,https://scholar.google.com/scholar_url?url=https://pubs.rsc.org/en/content/articlehtml/2018/qo/c7qo01082f&hl=en&sa=X&ei=rPLtYfHSCYy5yQSO1oSwAw&scisig=AAGBfm21ybTgWGYWbOKs28y8MpC4XMssYA&oi=scholarr,Evidence Theory/Fuzzy Set Theory/Bio-inspired AI/Complex Networks,https://scholar.google.com/citations?user=8voeILsAAAAJ&hl=en
19,Zhiguo Ding,"University of Manchester, Fellow of IEEE, Web of Science Highly Cited Researcher",88,7848,35263,83,30974,https://www.research.manchester.ac.uk/portal/zhiguo.ding.html,Wireless communications/signal processing/and cross-layer optimization,https://scholar.google.co.uk/citations?user=V-nB8scAAAAJ&hl=en
20,"Mianxiong Dong, Foreign Fellow of EAJ","Vice President and Professor, Muroran Institute of Technology, Japan",53,2043,10187,47,8808,https://scholar.google.co.id/citations?user=TqyApAUAAAAJ&hl=fil,Cyber-Physical Systems/Internet of Things/Artificial Intelligence,https://scholar.google.co.jp/citations?user=TqyApAUAAAAJ&hl=en
21,Yucheng Dong,"Professor of Management and Systems Sciences, Sichuan University",57,2371,11083,53,8761,https://publons.com/a/J-1668-2017/,Decision Analysis/Human Dynamics/Social Network/Data Science,https://scholar.google.com/citations?user=tFVYDw4AAAAJ&hl=en
22,Maged Elkashlan,"Associate Professor, Queen Mary University of London",59,2596,14397,52,11936,https://ieeexplore.ieee.org/author/37269057400,IRS/URLLC/UAV/PLS/NOMA,https://scholar.google.com/citations?user=mncnnOAAAAAJ&hl=en
23,Zubair Md. Fadlullah,"Associate Professor, Research Chair, Department of Computer Science, Lakehead University, TBRHRI",38,1216,7046,36,5345,https://www.researchgate.net/profile/Zubair-Fadlullah,Beyond 5G/Smart Health/UAV & Energy efficient Networks/QoS & Security/Deep Learning applications,https://scholar.google.com/citations?user=dZyfKpYAAAAJ&hl=en
24,Hossam Faris,"Professor, The University of Jordan, Al Hussein Technical University",45,4286,9968,44,9741,http://evo-ml.com/team_member/dr-hossam-faris/,Data Science/Knowledge Systems/Data Mining/Evolutionary computation,https://scholar.google.com/citations?user=UEYd--YAAAAJ&hl=en
25,Giancarlo Fortino,"Full Prof. of Computer Engineering, University of Calabria, IEEE Fellow, Highly Cited Researcher",64,3544,14862,56,11827,https://ieeexplore.ieee.org/author/37273318600,Human-Machine Systems/Agent-based Computing/Internet of Things/Wearable Computing/Wireless/Body Area Networks,https://scholar.google.com/citations?user=ecImn1MAAAAJ&hl=it
26,Hamido Fujita,Iwate Prefectural University,64,4769,15258,63,14158,http://www.fujita.soft.iwate-pu.ac.jp/,Machine Learning,https://scholar.google.com/citations?user=MxzV1nQAAAAJ&hl=en
27,Erik G. Larsson,"Professor, Dept. of Electrical Engineering (ISY), Linköping University, Sweden",84,5991,42839,64,26855,https://scholar.google.com/scholar?q=Erik+G.+Larsson+homepage&hl=en&as_sdt=0&as_vis=1&oi=scholart,Wireless communications/statistical signal processing/localization/massive MIMO/networks,https://scholar.google.se/citations?user=79Lry6oAAAAJ&hl=en
28,Amir H. Gandomi,"Professor, University of Technology Sydney",74,6729,25996,61,19369,https://www.linkedin.com/in/amir-h-gandomi-4225023b,Data Analytics/Genetic Programming/Engineering Optimization/Evolutionary Computation/Smart Cities,https://scholar.google.com/citations?user=VMf3wfMAAAAJ&hl=en
29,Xiaohua Ge,"Swinburne University of Technology, Melbourne, Australia",33,2029,6200,33,6011,https://sites.google.com/site/jamiexiaohuage/Home,Multi-agent systems/Networked control systems/Cyber-physical systems,https://scholar.google.com.au/citations?user=B37CYFoAAAAJ&hl=en
30,"Mohsen Guizani, FIEEE",Mohamed Bin Zayed University of Artificial Intelligence (MBZUAI),89,10085,41263,74,33181,https://www.comsoc.org/mohsen-guizani,Internet of Things/Applied AI/ML and Cybersecurity,https://scholar.google.com/citations?user=RigrYkcAAAAJ&hl=en
31,Song Guo,"FCAE, FIEEE, The Hong Kong Polytechnic University",69,4083,19805,63,15830,https://orcid.org/0000-0001-9831-2202,Big Data Computing/Edge AI/Mobile Computing/Distributed System,https://scholar.google.com/citations?user=Ib-sizwAAAAJ&hl=en
32,Harald Haas,The University of Edinburgh,93,5342,44122,75,27758,https://www.ted.com/speakers/harald_haas,Optical Wireless Communications/Interference Managment in Wireless Networks/Spatial Modulation,https://scholar.google.com/citations?user=XxIwRJQAAAAJ&hl=ja
33,Yuki Hagiwara,Fraunhofer IKS,29,1905,5951,29,5929,https://scholar.google.com/scholar_url?url=https://nyaspubs.onlinelibrary.wiley.com/doi/abs/10.1111/j.1749-6632.1987.tb48733.x&hl=en&sa=X&ei=u_LtYfn8GcvFywTR35zADA&scisig=AAGBfm1T9uoyx0IzyxZO7ZKM4sNfF9NS7Q&oi=scholarr,Artificial Intelligence,https://scholar.google.com.sg/citations?user=P6WI2DQAAAAJ&hl=en
34,"Qing-Long Han, Pro Vice-Chancellor and Distinguished Professor, MAE, IEEE Fellow",Swinburne University of Technology,104,6350,35890,85,23751,https://au.linkedin.com/in/qing-long-han-22992227,Networked control systems/time-delay systems/multi-agent systems/smart grids/unmanned surface vehicles,https://scholar.google.com.au/citations?user=j0pyptAAAAAJ&hl=en
35,Zhu Han,University of Houston,116,7848,54280,86,34813,https://ieeexplore-ieee-org.ezproxy.u-pec.fr/author/37087193640,Game Theory/Wireless Networking/Security/Data Science/Smart Grid,https://scholar.google.com/citations?user=ty7wIXoAAAAJ&hl=en
36,L Hanzo,"Chair of Telecommunications, University of Southampton",106,7875,64780,81,31518,https://www.cpp.edu/~wtsi/wts/Previous%20Conferences/WTS2016/Speakers/LajosHanzo.html,telecommunications/wireless communication/quantum_information_science/video_coding/video_networking,https://scholar.google.co.uk/citations?user=p0jnEW0AAAAJ&hl=en
37,L Hanzo,"Chair of Telecommunications, University of Southampton",106,7875,64780,81,31518,https://scholar.google.com/scholar_url?url=https://arxiv.org/pdf/1907.10102&hl=en&sa=X&ei=v_LtYZOFBPCR6rQPqKOe0Ag&scisig=AAGBfm0yFw1vJvZ6yeAYDs0Jt6qY7Ks-AQ&oi=scholarr,telecommunications/wireless communication/quantum_information_science/video_coding/video_networking,https://scholar.google.co.uk/citations?user=p0jnEW0AAAAJ&hl=en
38,Robert Heath,"Lampe Distinguished Professor, North Carolina State University",135,7631,79435,88,40614,https://en.wikipedia.org/wiki/Robert_W._Heath_Jr.,wireless/MIMO/communications/signal processing/information theory,https://scholar.google.com/citations?user=17Ko8Q0AAAAJ&hl=en
39,Francisco Herrera,"Professor Computer Science and AI, Granada University, Senior Research Advisor in DL&ML at Sherpa.ai",158,14500,108094,117,55810,http://www.herrerabox.com/#contact,Artificial Intelligence/Computational Intelligence/Data mining/Evolutionary Algorithms/Big Data Analytics,https://scholar.google.com/citations?user=HULIk-QAAAAJ&hl=en
40,Enrique Herrera-Viedma,"Professor of Computer Science and Artificial Intelligence, Spain, University of Granada",106,6002,45224,86,24235,https://orcid.org/0000-0002-7922-4984,Fuzzy sets/fuzzy decision making/computing with words/multiple criteria decision making/consensus,https://scholar.google.com/citations?user=g8ZXTuYAAAAJ&hl=en
41,Ekram Hossain,"Professor, University of Manitoba, Canada, IEEE Fellow",98,3091,36257,68,17936,https://www.cs.rochester.edu/u/ehossai2/,Wireless communication networks/radio resource allocation/cognitive radio/multi-tier cellular networks,https://scholar.google.com/citations?user=Lb617EMAAAAJ&hl=en
42,Guang-Bin Huang,"Full Professor, Nanyang Technological University, Singapore",69,5348,52686,60,30672,https://en.wikipedia.org/wiki/Extreme_learning_machine,Machine Learning/Neural Networks/Neuroscience,https://scholar.google.com.sg/citations?user=LhSqQCIAAAAJ&hl=en
43,Kaibin Huang,"Associate Professor, Dept. of EEE, The University of Hong Kong; IEEE Fellow",51,2770,13745,40,10390,https://dblp.org/pid/21/506,Machine Learning/Mobile Edge Computing/Wireless Communications/Wireless Power Transfer/Stochastic Geometry,https://scholar.google.com/citations?user=HfuA3uIAAAAJ&hl=en
44,Thomas JR Hughes,"Peter O'Donnell Jr. Chair in Computational and Applied Mathematics, University of Texas at Austin",159,7362,130006,93,39219,https://en.wikipedia.org/wiki/Thomas_J.R._Hughes#Career,Finite Element Methods/Solid Mechanics/Computational Fluid Dynamics/Partial Differential Equations/Isogeometric Analysis,https://scholar.google.com/citations?user=6tPdlYAAAAAJ&hl=en
45,Yaochu Jin,"A. v. Humboldt Professor for AI, Bielefeld University and Distinguished Chair, University of Surrey",83,5555,29579,70,17664,https://scholar.google.com/citations?user=B5WAkz4AAAAJ&hl=en,Artificial Intelligence/Evolutionary Computation/Multiobjective Optimization/Federated Learning/Developmental AI,https://scholar.google.com/citations?user=B5WAkz4AAAAJ&hl=en
46,"Nei Kato(IEEE Fellow, IEICE Fellow)","Professor, Graduate School of Information Sciences, Tohoku University, Japan",72,2963,20747,56,13077,http://www.ic-wcsp.org/2013/show.asp?id=36,Wireless networking,https://scholar.google.com/citations?user=LfLfZXEAAAAJ&hl=en
47,"Dr. Neeraj Kumar, SMIEEE (Web of Science Highly Cited Researcher 2019, 2020,2021)","Professor, CSED, Thapar Institute of Engineering and Technology, India",87,9473,25246,81,23188,https://scholar.google.com/citations?user=gL9gR-4AAAAJ&hl=ko,IoT and Machine Learning/Deep Learning/Blockchain Technology,https://scholar.google.co.in/citations?user=gL9gR-4AAAAJ&hl=en
48,"Dr. Arun Kumar Sangaiah., Ph.D (SM'IEEE)","Professor, School of Computing Science and Engineering, VIT University, Vellore, India",66,4479,13406,66,13234,https://glose.com/author/arun-kumar-sangaiah,Software Engineering/Computational Intelligence/Internet of Things,https://scholar.google.co.in/citations?user=8yF6Xc4AAAAJ&hl=en
49,Victor C. M. Leung,Shenzhen University / The University of British Columbia,100,6003,45879,80,28279,https://scholar.google.com/scholar?q=Victor+C.+M.+Leung+homepage&hl=en&as_sdt=0&as_vis=1&oi=scholart,communication systems/wireless networks/mobile systems,https://scholar.google.ca/citations?user=ajvCoo4AAAAJ&hl=en
50,Geoffrey Ye Li (李烨),"Chair Professor in Wireless Systems, Dept EEE, Imperial College London",104,5432,50976,77,22623,https://scholar.google.co.in/citations?user=-JNQawgAAAAJ&hl=en,Signal Processing/and/Machine Learning/for/Wireless Communications,https://scholar.google.com/citations?user=d0FzG8YAAAAJ&hl=en
51,Hongyi Li,"Assistant Professor, University of Houston",32,925,3325,28,2734,https://speech.ee.ntu.edu.tw/~tlkagk/,watershed hydrology/earth system modeling/coupled human-nature system,https://scholar.google.com/citations?user=yWy-5icAAAAJ&hl=en
52,Jin Li  李进,Professor @Guangzhou University,56,1837,18185,51,11755,http://seea.tju.edu.cn/info/1012/1504.htm,Trust and Security in Artificial Intelligence/Computating and Storage in Cloud Computing/Blockchain,https://scholar.google.com/citations?user=7GDV2vUAAAAJ&hl=en
53,Xuelong Li (Executive Councilor of AAAI),"Professor, Northwestern Polytechnical University, China",116,8114,51387,93,34759,https://studylib.net/doc/13643651/thirtieth-aaai-conference-on-artificial-intelligence-twen...,artificial intelligence/optics and electronics,https://scholar.google.com/citations?user=ahUibskAAAAJ&hl=en
54,yongming li,"college of computer science, shaanxi normal university",36,420,4762,23,2245,https://www.healthprofs.com/us/acupuncturists/yong-ming-li-bridgewater-nj/507114,fuzzy systems/quantume logic and quantum information/lattice/topology/model checking,https://scholar.google.com/citations?user=P3VERZ0AAAAJ&hl=en
55,Huchang Liao (廖虎昌),"IET Fellow, BCS Fellow; Business School, Sichuan University",59,3839,11857,56,10790,https://dblp.org/pid/129/4568,Decision analysis/Fuzzy Systems/Multiple criteria decision making/Preference learning,https://scholar.google.co.uk/citations?user=KlWnnbIAAAAJ&hl=en
56,Chong Lin,Qingdao University,68,2070,15613,50,8420,https://ieeexplore.ieee.org/author/37404176900,systems and control theory,https://scholar.google.com/citations?user=AQbRErEAAAAJ&hl=en
57,Yan-Jun Liu,Liaoning University of Technology,58,2441,13385,55,9962,https://scholar.google.com/scholar_url?url=https://www.sciencedirect.com/science/article/pii/S1534580719308561&hl=en&sa=X&ei=0vLtYce4Co74yASX442gDg&scisig=AAGBfm3jpcFyWa45-Eu8j6QENVeWn4y6-w&oi=scholarr,Adaptive control/fuzzy control/neural networks,https://scholar.google.com/citations?user=x_Wk1jAAAAAJ&hl=en
58,Yuanwei Liu,"Associate Professor in Queen Mary University of London, Web of Science Highly Cited Researcher",47,3423,10510,46,10203,https://scholar.google.com/scholar?q=Yuanwei+Liu+homepage&hl=en&as_sdt=0&as_vis=1&oi=scholart,NOMA/RIS/UAV Communications/Artifical Intelligence/6G,https://scholar.google.com/citations?user=FxLf7ZAAAAAJ&hl=en
59,Wenjing Lou,"W. C. English Endowed Professor, IEEE Fellow, Virginia Tech, USA",80,2564,38556,57,18086,https://developer.nvidia.com/blog/author/wenjinglou/,Cyber Security/Wireless Networks/Wireless Security/Network Security/Cloud Computing,https://scholar.google.com/citations?user=hM8uAwoAAAAJ&hl=en
60,Majdi Mafarja,"Associate Professor of Computer Science, Birzeit University",33,2660,5569,31,5518,http://evo-ml.com/team_member/majdi-mafarja/,Feature Selection/Machine Learning/Artificial Intelligence/Bio-inspired Algorithms/Metaheuristics,https://scholar.google.com/citations?user=ftkD0MgAAAAJ&hl=en
61,Luis Martínez,"Professor of Computer Science, University of Jaén",61,2824,21866,50,11788,https://sites.google.com/site/lrmartineza,Fuzzy decision making/Computing with words/Recommender Systems,https://scholar.google.com/citations?user=PG3D8UMAAAAJ&hl=en
62,Thomas Marzetta,"Distinguished Industry Professor, Department of Electrical and Computer Engineering, New York",58,4409,45875,44,26604,https://www.researchgate.net/profile/Thomas-Marzetta,Beyond Massive MIMO,https://scholar.google.com/citations?user=tBLWIBoAAAAJ&hl=en
63,Seyedali Mirjalili,"Professor, Torrens University Australia, Adjunct Griffith University",70,16781,42984,69,40833,https://www.mathworks.com/matlabcentral/profile/authors/2943818-seyedali-mirjalili?s_tid=mlc_lp_contributor,Metaheuristics/Robust Optimization/Engineering Optimization/Evolutionary Algorithm/Swarm Intelligence,https://scholar.google.com/citations?user=TJHmrREAAAAJ&hl=en
64,Andreas F. Molisch,"Professor of Electrical Engineering, University of Southern California",101,5063,57982,70,26323,https://viterbi.usc.edu/directory/faculty/Molisch/Andreas,wireless propagation channels/multi-antenna systems/ultrawideband communications and positioning/cooperative communications,https://scholar.google.com/citations?user=W0wwrucAAAAJ&hl=en
65,Derrick Wing Kwan Ng,"Scientia  Assoicate Professor,  University of New South Wales",64,3742,17626,61,14965,https://www.aminer.org/profile/53f467dedabfaee4dc854000,Wireless Communications,https://scholar.google.com/citations?user=NUJSHxoAAAAJ&hl=en
66,H. Nguyen-Xuan,"CIRTech Institute, Ho Chi Minh City University of Technology (HUTECH), Vietnam",67,2553,14933,56,10307,https://www.earnosethroatdoctor.com/,Computational Engineering/Large-scale data/3D Printing/Renewable Energy,https://scholar.google.co.uk/citations?user=3iK9h-gAAAAJ&hl=en
67,Dusit (Tao) Niyato,Nanyang Technological University (NTU),99,8152,44312,80,29352,https://faculty.sustech.edu.cn/asheralievaa/,ดุสิต นิยะโต - เต๋า,https://scholar.google.com/citations?user=T8sVhLMAAAAJ&hl=en
68,Kaoru Ota (太田　香),"MEXT Excellent Young Researcher (文部科学省　卓越研究員), Muroran Institute of Technology",49,1938,9037,47,8192,https://www.aminer.cn/profile/kaoru-ota/53f43e73dabfaeb22f4aa4b0,,https://scholar.google.com/citations?user=8JVn8RsAAAAJ&hl=ja
69,Mugen Peng,"Beijing University of Posts & Telecommun., IEEE Fellow, Web of Science Highly Cited Researcher",52,2194,14965,43,10071,https://dl.acm.org/profile/81339521539,Fog Radio Access Network/Heterogeneous Networks/Cloud Radio Access Networks/Network Coding/Radio Resource Allocation and Opt,https://scholar.google.com/citations?user=85mAZVcAAAAJ&hl=en
70,HV Poor,"Michael Henry Strater University Professor, Princeton University",154,13760,118144,102,55858,https://scholar.google.com/citations?user=Dq93mOUAAAAJ&hl=en,Information Theory/Statistical Signal Processing/Stochastic Analysis,https://scholar.google.com/citations?user=Dq93mOUAAAAJ&hl=en
71,Lianyong Qi(齐连永),"Professor, Qufu Normal University(青年教授，博士生导师，曲阜师范大学)",40,1775,4958,38,4709,https://scholar.google.com/citations?user=pxNRRsAAAAAJ&hl=en,service computing/big data/recommender system,https://scholar.google.com/citations?user=pxNRRsAAAAAJ&hl=en
72,Timon Rabczuk,Bauhaus University Weimar,105,7516,39312,89,28878,https://scholar.google.com/scholar?q=Timon+Rabczuk+homepage&hl=en&as_sdt=0&as_vis=1&oi=scholart,Computational Mechanics/Solid Mechanics,https://scholar.google.ca/citations?user=3CBuGosAAAAJ&hl=en
73,Kim-Kwang Raymond Choo,"Cloud Tech Endowed Professor, University of Texas at San Antonio; Highly Cited Researcher 2020, 2021",89,6112,22560,82,20134,https://business.utsa.edu/faculty/kim-kwang-raymond-choo/,Cloud Forensics/Cyber Forensics/Cyber Security/IoT Security/Blockchain,https://scholar.google.com/citations?user=rRBNI6AAAAAJ&hl=en
74,Kui Ren,"Professor, Zhejiang University, ACM Fellow, IEEE Fellow",81,3471,38747,67,20926,https://scholar.google.com/scholar_url?url=https://acmccs.github.io/papers/p425-qinAemb.pdf&hl=en&sa=X&ei=4fLtYcLoBoy5yQSO1oSwAw&scisig=AAGBfm0AfjHr9DisjPShiKwP5VhpuLY-eA&oi=scholarr,Data Security & Privacy/IoT Security/AI Security,https://scholar.google.com/citations?user=uuQA_rcAAAAJ&hl=en
75,Walid Saad,"Professor, Electrical and Computer Engineering",79,7011,29469,69,24375,https://csim.committees.comsoc.org/2021/03/15/csim-online-seminar-prof-walid-saad-on-31-march-2021-at-930-am-est/,6G wireless systems/machine learning/security/cyber-physical systems/Unmanned aerial vehicles (UAVs),https://scholar.google.com/citations?user=kYDNA0UAAAAJ&hl=en
76,Robert Schober,Friedrich-Alexander-University Erlangen-Nuremberg,90,5177,40831,72,25858,https://scholar.google.com/citations?user=Uu0BpX8AAAAJ&hl=en,,https://scholar.google.com/citations?user=Uu0BpX8AAAAJ&hl=en
77,"Ling Shao, Fellow of IEEE/IAPR","CTO and Chief Scientist, National Center for Artificial Intelligence (NCAI), SDAIA, KSA",79,7997,28543,74,23452,https://ieeexplore-ieee-org.ezproxy.u-pec.fr/author/38265369400,Computer Vision/Deep Learning/Artificial Intelligence/Medical Imaging/Vision and Language,https://scholar.google.com/citations?user=z84rLjoAAAAJ&hl=en
78,Xuemin (Sherman) Shen,"University Professor, University of Waterloo",127,8484,70505,97,39181,https://scholar.google.com/scholar?q=Xuemin+(Sherman)+Shen+homepage&hl=en&as_sdt=0&as_vis=1&oi=scholart,Wireless networking/MAC/Network security/VANET,https://scholar.google.com/citations?user=Bjl3GwoAAAAJ&hl=cs
79,Peng Shi,"Professor, School of Electrical and Electronic Engineering, The University of Adelaide",147,8522,74639,109,42610,https://scholar.google.com/scholar_url?url=https://www.tandfonline.com/doi/abs/10.1080/00207179.2012.713515&hl=en&sa=X&ei=5fLtYd7GI_CR6rQPqKOe0Ag&scisig=AAGBfm3bm8-B7MNBxyiKXZCbms-HCrl_zg&oi=scholarr,Systems and Control/Electrical and Electronic Engineering/Cybernetics/Human-Computer Interaction,https://scholar.google.com.hk/citations?user=EGx1iH0AAAAJ&hl=en
