79,"Dr. P. N. Suganthan (SCI Highly Cited Researcher 2015-2021), FIEEE'2015","Some Codes available at GitHub, (Hon. Doctorate, U. of Maribor, 2020 ; BA & MA, U. of Cambridge, UK)",106,7001,58063,90,34052,https://0-scholar-google-com.brum.beds.ac.uk/citations?user=DVtxD5QAAAAJ&hl=ca,Machine Learning(ML)/Swarm-Evolutionary Computation(SEC)/Neural Networks(ANN)/Applications of ML SEC ANN.,https://scholar.google.com/citations?user=yZNzBU0AAAAJ&hl=en
80,Xingming Sun,Nanjing University of Information Science and Technology,58,1702,15838,52,12561,http://scholar.google.com/citations?user=epqnljMAAAAJ&hl=en,Digital Watermarking/Information Security,http://scholar.google.com/citations?user=epqnljMAAAAJ&hl=en
81,Tarik Taleb,University of Oulu,68,3660,19699,59,15292,http://www.mosaic-lab.org/,Network Function Virtualization/Network Softwarization/Software Defined Networking,https://scholar.google.com/citations?user=o1Ap0TEAAAAJ&hl=en
82,"jen hong, tan","Highly Cited Researcher in Computer Science, National University of Singapore",48,2326,10033,44,9146,https://publons.com/researcher/4043557/jen-hong-tan/,image processing/computer vision/deep learning/infrared thermography/fundus image,https://scholar.google.com/citations?user=uJlD-A0AAAAJ&hl=en
83,Dacheng Tao,The University of Sydney,141,14088,80037,119,58762,https://openreview.net/profile?id=~Dacheng_Tao1,artificial intelligence/machine learning/computer vision/image processing/data mining,https://scholar.google.com/citations?user=RwlJNLcAAAAJ&hl=en
84,Athanasios Vasilakos,"PROF OF COMPLEX SYSTEMS, CYBERSECURITY, AI",127,7524,57419,106,40593,https://scholar.google.com/scholar_url?url=https://arxiv.org/pdf/1512.05449&hl=en&sa=X&ei=_7vQYrLSKoyO6rQPv6OeiA8&scisig=AAGBfm3-H9WShnb_Oat9d_uyBPpjhb9Cfw&oi=scholarr,Cybersecurity/IoTs/Mobile Nets/Big Data Analytics/Cloud Computing/Artificial Intelligence/Machine Learning,https://scholar.google.com/citations?user=_yWPQWoAAAAJ&hl=en
85,Huanqing Wang,Michigan Technological University,4,9,38,4,38,https://www.linkedin.com/in/huanqing-wang,Electric vehicle/optimal control/model predictive control,https://scholar.google.com/citations?user=6XxgmPEAAAAJ&hl=en
86,Ping Wang,"York University, IEEE Fellow, York Research Chair, IEEE VTS Distinguished Lecturer",70,3608,22011,57,16460,http://www.wangping.com/,wireless communications/Internet of Things/cloud computing/smart grid,https://scholar.google.com/citations?user=3sIHxrcAAAAJ&hl=en
87,Qingqing Wu (武庆庆),University of Macau,47,5060,13853,47,13742,https://www.aminer.cn/ai2000?domain_ids=5dc122672ebaa6faa962c2e1,6G/IRS/UAV communications/Machine learning/MIMO transceiver design,https://scholar.google.com/citations?user=as1T8CMAAAAJ&hl=en
88,Zheng-Guang Wu,Zhejiang University,74,2556,16502,66,12326,https://scholar.google.com/citations?user=vy6JCNgAAAAJ&hl=en,Markov Jump Systems/Sampled-Data Control Systems/Neural Networks/Fuzzy Systems/Singular Systems,https://scholar.google.com/citations?user=vy6JCNgAAAAJ&hl=en
89,Yang Xiang,"IEEE Fellow, Professfor, Swinburne University of Technology",67,2805,16652,59,13058,https://scholar.google.com/scholar_url?url=https://core.ac.uk/download/pdf/82298185.pdf&hl=en&sa=X&ei=BLzQYpvCDYbUyQSTyo6YCA&scisig=AAGBfm1M2OLAQ91xoi9VRM1ZFDZnD6Ds9g&oi=scholarr,Cybersecurity/Network Security/System Security/Software Vulnerability Detection/Blockchain,https://scholar.google.com/citations?user=7ymTWY4AAAAJ&hl=en
90,Xiaolong Xu (许小龙),"Professor, Highly Cited Researcher 2021, Nanjing University of Information Science and Technology",40,1475,5062,40,5007,https://faculty.nuist.edu.cn/xuxiaolong/zh_CN/index.htm,Edge computing/Cloud computing/Big data/Fog computing/Mobile computing,https://scholar.google.com/citations?user=Tyzef4sAAAAJ&hl=en
91,Zeshui Xu (徐泽水),"Member of AE,EASA,IASCYS; DFIETI,FIEEE,FIFSA,FIET,FRSA,FORS,FBCS,FIAAM,FAAIA... Sichuan University",139,8992,74024,108,43674,https://baike.baidu.com/item/%E5%BE%90%E6%B3%BD%E6%B0%B4/7518284#4,Decision Making/Information Fusion/Fuzzy Sets/Computational Intelligence/Bibliometrics,https://scholar.google.co.uk/citations?user=kd9L_GUAAAAJ&hl=en
92,Xin-She Yang (DPhil),"Computational intelligence, swarm intelligence, optimization, metaheuristics, nature-inspired",91,10488,71287,82,49305,https://scholar.google.com/scholar_url?url=https://jcbansal.scrs.in/uploads/22-Levy_flight_artificial_bee_colony_algorithm.pdf&hl=en&sa=X&ei=CbzQYoDhDpLuygTP-pLADw&scisig=AAGBfm2H-TjLvNhqZm-uUxLSeq8iz8dPJQ&oi=scholarr,swarm intelligence/optimization/metaheuristics/computational intelligence.,https://scholar.google.com/citations?user=fA6aTlAAAAAJ&hl=th
93,Fei Yu,University of Southern Denmark,9,69,278,8,216,https://www.feiyu-tech.com/support.html,Industry 4.0 technology and smart product development,https://scholar.google.com/citations?user=3OHgAmIAAAAJ&hl=en
94,Xiangxiang Zeng,"Deparment of Computer Science, Hunan University",49,1615,6908,40,5728,https://publons.com/a/H-3771-2014/,Computational Intelligence/Bio-inspired Intelligence,https://scholar.google.com/citations?user=B20HBMIAAAAJ&hl=en
95,Yong Zeng (曾勇）,"Southeast University, China; Purple Mountain Laboratories, China",51,4168,16519,50,16046,https://www.aminer.cn/ai2000?domain_ids=5dc122672ebaa6faa962c2e1,UAV communications/Massive MIMO/Extremely-Large MIMO (XL-MIMO)/Integrated Sensing and Communication,https://scholar.google.com/citations?user=ENldmwIAAAAJ&hl=en
96,Jianming Zhan,Hubei University for Nationalities,44,991,7234,37,4702,https://content.iospress.com/articles/journal-of-intelligent-and-fuzzy-systems/ifs707,logical algebras(BL-algebras/R0-algebras and MTL-algebras)/fuzzy algebras(semirings/hemirings and rings) and their hyperstuctures(hyperring/hypergroups,https://scholar.google.com/citations?user=XmJAmNIAAAAJ&hl=en
97,Haijun Zhang,"Professor, University of Science and Technology Beijing",46,1940,10462,44,9250,https://www.anesthesiology.cuimc.columbia.edu/profile/haijun-zhang-md,6G/AI enabled Wireless Communications/Resource Allocation/Mobility Management,https://scholar.google.ca/citations?user=B3oYgSIAAAAJ&hl=en
98,Rui Zhang,"Chair Professor, National University of Singapore",122,12524,64393,104,48815,https://www.ruizhang.info/,Wireless Communications/MIMO/Cognitive Radio/Wireless Power Transfer/UAV,https://scholar.google.com.sg/citations?user=yoJqPIkAAAAJ&hl=en
99,Xian-Ming Zhang,Swinburne University of Technology,47,2220,11658,42,9615,https://scholar.google.com/scholar_url?url=https://www.researchgate.net/profile/Ming-Liang-Tong/publication/227560878_Hydroxylation_of_N-Heterocycle_Ligands_Observed_in_Two_Unusual_Mixed-Valence_CuICuII_Complexes/links/00b7d52c39d137be8d000000/Hydroxylation-of-N-Heterocycle-Ligands-Observed-in-Two-Unusual-Mixed-Valence-CuI-CuII-Complexes.pdf&hl=en&sa=X&ei=D7zQYp6POpLuygTP-pLADw&scisig=AAGBfm0oUKshgbd2oo_fCJpR97FtdJX48g&oi=scholarr,Networked Control Systems/Event-triggered Control/H-infinity Filtering/Time-delay Systems/Neural Networks,https://scholar.google.com/citations?user=aZcLkqgAAAAJ&hl=en
100,Xuyun Zhang,Macquarie University,43,1267,6539,40,5426,https://orcid.org/0000-0001-7353-4159,big data mining/scalable machine learning/big data privacy and cybersecurity/cloud/edge computing/Internet of Things,https://scholar.google.com.au/citations?user=wbF6HL8AAAAJ&hl=en
101,Yan Zhang,"IEEE Fellow, Highly Cited Researcher, University of Oslo, Norway",93,6452,31459,78,23854,https://www.sjsu.edu/people/yan.zhang/,wireless networks/smart grid/edge intelligence/blockchain/digital twin,https://scholar.google.no/citations?user=-gahn9AAAAAJ&hl=no
102,Quan Zou (邹权),University of Electronic Science and Technology of China,70,3208,14959,62,12518,https://www.qzc.edu.cn/2020/1214/c1219a54995/page.htm,Bioinformatics/data mining,https://scholar.google.com/citations?user=RcaUHs4AAAAJ&hl=en
