,Name,Affilation,H-index,Citations 2020,Total_citation,H-index_since_2016,Citation_since_2016,HomePage,Area of Research,Google_Scholar
0,"U Rajendra Acharya (SCI Highly Cited Researcher 2016-2021)  PhD, DEng, DSc","Ngee Ann,  Singapore University of Social Science,  Kuamamoto University, Japan",117,11811,55190,104,42763,https://publons.com/researcher/2836800/rajendra-u-acharya/,Artificial Intelligence/Medical Informatics,https://scholar.google.com.sg/citations?user=8FjY99sAAAAJ&hl=en
1,IAN  F.  AKYILDIZ,"Truva Inc. , USA",132,6580,135561,82,40331,https://en.wikipedia.org/wiki/Ian_F._Akyildiz#Research_Contributions,Wireless Communication/5G/6G Wireless Systems/Intelligent Surfaces for Wireless Communication/Nano-scale and Molecular Commun,https://scholar.google.com/citations?user=rAGwv14AAAAJ&hl=en
2,Ibrahim Aljarah,"Professor of Big Data Mining and Computational Intelligence, The University of Jordan",45,3279,9347,45,9177,https://scholar.google.com/citations?user=moOTIYEAAAAJ&hl=en,Artificial  intelligence/Swarm Intelligence/Data Science/Machine Learning/Evolutionary Computation,https://scholar.google.com/citations?user=moOTIYEAAAAJ&hl=en
3,Jeffrey Andrews,"Cockrell Family Endowed Chair and Director of 6G@UT, University of Texas at Austin",106,3902,66340,73,29971,https://orcid.org/0000-0001-5261-3923,Wireless Communications/Communication Theory/Machine Learning for Communications/Stochastic Geometry/Information Theory,https://scholar.google.com/citations?user=Hr9Gey0AAAAJ&hl=en
4,Bennis Mehdi,"Full Professor, IEEE Fellow, Head of ICON, University of Oulu",71,7147,27253,68,24697,https://sites.google.com/view/dr-mehdi-bennis/group,B5G/6G/machine learning/semantic communication,https://scholar.google.com/citations?user=RW4sJu8AAAAJ&hl=en
5,Emil Björnson,"Professor of Wireless Communication, KTH Royal Institute of Technology",63,4567,19341,61,16503,https://www.youtube.com/watch?v=LyIINgdVQ8Y,Massive MIMO/Cell-free Massive MIMO/RIS/Signal processing/Wireless communication,https://scholar.google.se/citations?user=Maij4akAAAAJ&hl=en
6,Rajkumar Buyya,"CLOUDS Lab, School of Computing and Information Systems, The University of Melbourne, Australia",155,11341,126481,107,63252,https://dl.acm.org/profile/81100342317/publications?Role=author,Computer Systems/Cloud Computing/Distributed Systems/Edge Computing/Internet of Things,https://scholar.google.com/citations?user=7xN6JqYAAAAJ&hl=en
7,Xing Cai,"Senior Research Scientist at Simula Research Laboratory, Professor at University of Oslo",19,136,2073,13,783,https://www.ccee.ncsu.edu/people/xcai9/,Parallel programming/High-performance computing/numerical methods for PDEs,https://scholar.google.com/citations?user=IWQbrcK5CEwC&hl=en
8,Giuseppe Caire,"Professor, Technical University of Berlin, Germany, and Professor of Electrical Engineering (on",82,2909,39841,57,16569,https://viterbi.usc.edu/directory/faculty/Caire/Giuseppe,Information Theory/Communications/Signal Processing/Statistics,https://scholar.google.com/citations?user=g66ErTcAAAAJ&hl=en
9,Jinde Cao,"Academician, RAS/AE/RAE/LAS/AAS/EASA/PAS/IASCYS  & FIEEE/FAAIA/DFIETI; Southeast University",131,8813,72189,93,42442,https://research.com/u/jinde-cao,Complex networks/neural networks/multi-agent systems - engineering stability - dynamics and control - time-delay systems,https://scholar.google.com/citations?user=8_ffELYAAAAJ&hl=en
10,C. L. Philip Chen,"Chair Professor, South China University of Technology, Philip.Chen@ieee.org",95,7362,39611,85,30087,https://repository.um.edu.mo/profile/philipchen,Computational Intelligence/Intelligent Control/Cybernetics/Intelligent Transportation Systems/Data Science/Engineering,https://scholar.google.com/citations?user=Q5248zwAAAAJ&hl=en
11,Jinjun Chen,"MAE (Academia Europea), IEEE Fellow (Computer Society), AAIA Fellow, HiCi; Professor and Deputy",69,2330,13695,51,9460,https://www.sciencedirect.com/author/16506246700/jinjun-chen,Cloud Computing/Scalable Architecture/Scalable Data Storage/Scalable Data Processing (Privacy),https://scholar.google.com/citations?user=mQ9vJ24AAAAJ&hl=en
12,Min Chen,"Professor, IEEE Fellow, Highly Cited Researcher, Huazhong University of Science and Technology",90,6110,35188,72,26152,https://sites.google.com/site/drminchen/home,Cognitive Computing and Big Data Analytics/IoT Sensing/5G Networks/Robotics/Edge Computing,https://scholar.google.com/citations?user=_HyHTrsAAAAJ&hl=en
13,Xiaofeng Chen,"Professor, Xidian University, China",57,1778,13717,50,10260,https://scholar.google.com/scholar_url?url=https://www.ncbi.nlm.nih.gov/pmc/articles/PMC5934575/&hl=en&sa=X&ei=u7vQYv2EEJCWyQSa2aL4CQ&scisig=AAGBfm1JGHd3738y-99jQsFLXmvWq_DEzQ&oi=scholarr,Security/Cryptography/Cloud computing,https://scholar.google.com/citations?user=-3WhJecAAAAJ&hl=en
14,Francisco Chiclana,"Professor of Computational Intelligence and Decision Making, De Montfort University, UK",69,2396,20346,60,11991,https://www.mdpi.com/about/announcements/3570,Decision making/computational intelligence/information fusion/consensus/sentiment analysis,https://scholar.google.com/citations?user=qDOxZIIAAAAJ&hl=en
15,zhihua cui,"Taiyuan University of Science and Technology, Taiyuan, Shanxi, China, 030024",45,1693,8469,35,6356,https://www.zhihuacui.com/about,evolutionary computation,https://scholar.google.com/citations?user=BpDrULIAAAAJ&hl=en
16,Linglong Dai,"Associate Professor, Tsinghua University; IEEE Fellow",65,3371,16975,60,15374,https://publons.com/researcher/2298084/linglong-dai/,Wireless Communications/RIS/Massive MIMO/Millimeter-Wave/Teraherz Communications/Non-Orthogonal Mutiple Access,https://scholar.google.com/citations?user=OTFnifoAAAAJ&hl=en
17,Merouane Debbah,"Centralesupelec, Technology Innovation Institute, MBZUAI, Lagrange Mathematics Center",100,9112,49309,84,35466,https://www.flexible-radio.com/,5G/6G/Machine Learning/Random Matrix Theory/Game Theory,https://scholar.google.com/citations?user=HU5I0X4AAAAJ&hl=en
18,Zhiguo Ding,"University of Manchester, Fellow of IEEE, Web of Science Highly Cited Researcher",93,8293,39476,87,35318,https://ieeexplore.ieee.org/author/37278653500,Wireless communications/signal processing/and cross-layer optimization,https://scholar.google.co.uk/citations?user=V-nB8scAAAAJ&hl=en
19,"Mianxiong Dong, Foreign Fellow of EAJ","Vice President and Professor, Muroran Institute of Technology, Japan",54,2215,11349,50,9979,https://u.muroran-it.ac.jp/enes/~mxdong/,Cyber-Physical Systems/Internet of Things/Artificial Intelligence,https://scholar.google.co.jp/citations?user=TqyApAUAAAAJ&hl=en
20,Yucheng Dong,"Professor of Management and Systems Sciences, Sichuan University",62,2197,12052,58,9782,https://orcid.org/0000-0002-0028-6796,Decision Analysis/Human Dynamics/Social Network/Data Science,https://scholar.google.com/citations?user=tFVYDw4AAAAJ&hl=en
21,Maged Elkashlan,"Associate Professor, Queen Mary University of London",61,2742,15725,54,13299,https://www.aminer.org/profile/maged-elkashlan/54853682dabfae9b4013348c,IRS/URLLC/UAV/PLS/NOMA,https://scholar.google.com/citations?user=mncnnOAAAAAJ&hl=en
22,Zubair Md. Fadlullah,"Associate Professor, Research Chair, Department of Computer Science, Lakehead University, TBRHRI",40,1367,7756,38,6047,https://www.zfadlullah.org/experience,Beyond 5G/Smart Health/UAV & Energy efficient Networks/QoS & Security/Deep Learning applications,https://scholar.google.com/citations?user=dZyfKpYAAAAJ&hl=en
23,Hossam Faris,"Professor, The University of Jordan",50,4341,12431,49,12208,http://eacademic.ju.edu.jo/Hossam.faris,Data Science/Knowledge Systems/Data Mining/Evolutionary computation,https://scholar.google.com/citations?user=UEYd--YAAAAJ&hl=en
24,Giancarlo Fortino,"Full Prof. of Computer Engineering, University of Calabria, FIEEE, FAAIA, Highly Cited Researcher",68,3729,16803,61,13712,https://orcid.org/0000-0002-4039-891X,Human-Machine Systems/Agent-based Computing/Internet of Things/Wearable Computing/Wireless/Body Area Networks,https://scholar.google.com/citations?user=ecImn1MAAAAJ&hl=it
25,Hamido Fujita,Iwate Prefectural University,70,4425,17867,70,16609,https://dl.acm.org/profile/99659089215,Machine Learning,https://scholar.google.com/citations?user=MxzV1nQAAAAJ&hl=en
26,Erik G. Larsson,"Professor, Dept. of Electrical Engineering (ISY), Linköping University, Sweden",89,6351,45722,68,29824,https://scholar.google.com/scholar_url?url=http://download.garuda.kemdikbud.go.id/article.php%3Farticle%3D1306855%26val%3D146%26title%3DPerformance%2520Analysis%2520of%2520Adaptive%2520Filter%2520Channel%2520Estimated%2520MIMO%2520OFDM%2520Communication%2520System&hl=en&sa=X&ei=ybvQYtfBD4r2yATGyJHgBw&scisig=AAGBfm1IJ50CwidsVreyPtM355Q3oUw1XQ&oi=scholarr,Wireless communications/statistical signal processing/localization/massive MIMO/networks,https://scholar.google.se/citations?user=79Lry6oAAAAJ&hl=en
27,Amir H. Gandomi,"Professor of Data Science, University of Technology Sydney",81,6911,30850,71,24225,https://spie.org/profile/Amir-H.Gandomi-4316950,Data Analytics/Genetic Programming/Engineering Optimization/Evolutionary Computation/Smart Cities,https://scholar.google.com/citations?user=VMf3wfMAAAAJ&hl=en
28,Xiaohua Ge,"Swinburne University of Technology, Melbourne, Australia",37,2054,7505,37,7306,https://www.researchgate.net/profile/Xiaohua-Ge,Networked control systems/Cyber-physical systems/Multi-agent systems/Intelligent vehicles/Connected automated vehicles,https://scholar.google.com.au/citations?user=B37CYFoAAAAJ&hl=en
29,"Mohsen Guizani, FIEEE",Mohamed Bin Zayed University of Artificial Intelligence (MBZUAI),93,10983,46612,82,39233,https://orcid.org/0000-0002-8972-8094,Internet of Things/Applied AI/ML and Cybersecurity,https://scholar.google.com/citations?user=RigrYkcAAAAJ&hl=en
30,Song Guo,"FCAE, FIEEE, The Hong Kong Polytechnic University",72,4421,22097,66,18111,https://scholar.google.com/citations?user=Ib-sizwAAAAJ&hl=en,Edge Intelligence/Federated Learning/Edge Computing/Distributed System/Wireless Networking,https://scholar.google.com/citations?user=Ib-sizwAAAAJ&hl=en
31,Harald Haas,The University of Edinburgh,96,5596,46371,79,30374,https://www.lifi.eng.ed.ac.uk/about,Optical Wireless Communications/Interference Managment in Wireless Networks/Spatial Modulation,https://scholar.google.com/citations?user=XxIwRJQAAAAJ&hl=ja
32,Yuki Hagiwara,Fraunhofer IKS,30,1973,6942,30,6917,https://scholar.google.com/scholar?q=Yuki+Hagiwara+homepage&hl=en&as_sdt=0&as_vis=1&oi=scholart,Artificial Intelligence,https://scholar.google.com.sg/citations?user=P6WI2DQAAAAJ&hl=en
33,"Qing-Long Han, Pro Vice-Chancellor and Distinguished Professor, MAE, IEEE Fellow",Swinburne University of Technology,110,6354,39689,91,27512,https://www.researchgate.net/profile/Qing-Long-Han/7,Networked control systems/time-delay systems/multi-agent systems/smart grids/unmanned surface vehicles,https://scholar.google.com.au/citations?user=j0pyptAAAAAJ&hl=en
34,Zhu Han,University of Houston,119,8617,59139,92,39848,https://scholar.google.com/scholar_url?url=https://www.ncbi.nlm.nih.gov/pmc/articles/PMC4621922/&hl=en&sa=X&ei=0LvQYsOzB5uM6rQP57KDuAY&scisig=AAGBfm3h3QiNUYxhPGcqt-p8SeBbN6pOow&oi=scholarr,Game Theory/Wireless Networking/Security/Data Science/Smart Grid,https://scholar.google.com/citations?user=ty7wIXoAAAAJ&hl=en
35,L Hanzo,"Chair of Telecommunications, University of Southampton",111,8337,69885,85,36913,https://scholar.google.com/scholar_url?url=https://arxiv.org/pdf/1907.10102&hl=en&sa=X&ei=0LvQYsWSOYbUyQSTyo6YCA&scisig=AAGBfm0yFw1vJvZ6yeAYDs0Jt6qY7Ks-AQ&oi=scholarr,telecommunications/wireless communication/quantum_information_science/video_coding/video_networking,https://scholar.google.co.uk/citations?user=p0jnEW0AAAAJ&hl=en
36,L Hanzo,"Chair of Telecommunications, University of Southampton",111,8337,69885,85,36913,https://scholar.google.com/scholar_url?url=https://arxiv.org/pdf/1907.10102&hl=en&sa=X&ei=0bvQYvzGNpuM6rQP57KDuAY&scisig=AAGBfm0yFw1vJvZ6yeAYDs0Jt6qY7Ks-AQ&oi=scholarr,telecommunications/wireless communication/quantum_information_science/video_coding/video_networking,https://scholar.google.co.uk/citations?user=p0jnEW0AAAAJ&hl=en
37,Robert Heath,"Lampe Distinguished Professor, North Carolina State University",138,7723,81203,91,42779,https://scholar.google.com/citations?user=17Ko8Q0AAAAJ&hl=en,wireless/MIMO/communications/signal processing/information theory,https://scholar.google.com/citations?user=17Ko8Q0AAAAJ&hl=en
38,Francisco Herrera,"Professor Computer Science and AI, Granada University, Spain",163,14507,115276,122,63109,https://ignatiansolidarity.net/iftj/speakers/francisco-herrera/,Artificial Intelligence/Computational Intelligence/Data mining/Evolutionary Algorithms/Big Data Analytics,https://scholar.google.com/citations?user=HULIk-QAAAAJ&hl=en
39,Enrique Herrera-Viedma,"Professor of Computer Science and Artificial Intelligence, Spain, University of Granada",108,5964,48697,92,27419,https://dasci.es/about-dasci/resources/human-resources/enrique-herrera-viedma/,Fuzzy sets/fuzzy decision making/computing with words/multiple criteria decision making/consensus,https://scholar.google.com/citations?user=g8ZXTuYAAAAJ&hl=en
40,Ekram Hossain,"Professor, University of Manitoba, Canada, IEEE Fellow",98,3262,36793,70,19223,https://vtsociety.org/contact/ekram-hossain,Wireless communication networks/radio resource allocation/cognitive radio/multi-tier cellular networks,https://scholar.google.com/citations?user=Lb617EMAAAAJ&hl=en
41,Guang-Bin Huang,"Full Professor, Nanyang Technological University, Singapore",72,5613,54902,61,33253,https://ieeexplore.ieee.org/author/37086211328,Machine Learning/Neural Networks/Neuroscience,https://scholar.google.com.sg/citations?user=LhSqQCIAAAAJ&hl=en
42,Kaibin Huang,"Professor, Dept. of EEE, The University of Hong Kong; IEEE Fellow; ISI Highly Cited Researcher",53,2924,15243,43,11905,https://scholar.google.com/scholar_url?url=https://www.researchgate.net/profile/Changsheng-You/publication/312061424_Mobile_Edge_Computing_Survey_and_Research_Outlook/links/5c22f648a6fdccfc70690a30/Mobile-Edge-Computing-Survey-and-Research-Outlook.pdf&hl=en&sa=X&ei=17vQYvacEor2yATGyJHgBw&scisig=AAGBfm1lts3IxFGEDPZ2ne9gv_Ydd6FOdw&oi=scholarr,Machine Learning/Mobile Edge Computing/Wireless Communications/Wireless Power Transfer/Stochastic Geometry,https://scholar.google.com/citations?user=HfuA3uIAAAAJ&hl=en
43,Thomas JR Hughes,"Peter O'Donnell Jr. Chair in Computational and Applied Mathematics, University of Texas at Austin",151,7051,128780,93,41261,https://dl.acm.org/profile/81100164422,Finite Element Methods/Solid Mechanics/Computational Fluid Dynamics/Partial Differential Equations/Isogeometric Analysis,https://scholar.google.com/citations?user=6tPdlYAAAAAJ&hl=en
44,Yaochu Jin,"A. v. Humboldt Professor for AI, Bielefeld University and Distinguished Chair, University of Surrey",88,5603,32761,74,20920,https://publons.com/researcher/2754298/yaochu-jin/,Evolutionary computation/Multiobjective optimization/Multiobjective learning/Trustworthy AI/Developmental AI,https://scholar.google.com/citations?user=B5WAkz4AAAAJ&hl=en
45,"Nei Kato(IEEE Fellow, IEICE Fellow)","Professor and Dean, Graduate School of Information Sciences, Tohoku University, Japan",76,3292,22338,60,14790,http://www.iccns.org/kyg.html,Wireless networking,https://scholar.google.com/citations?user=LfLfZXEAAAAJ&hl=en
46,"Dr. Neeraj Kumar, SMIEEE (Web of Science Highly Cited Researcher 2019, 2020,2021)","Professor, CSED, Thapar Institute of Engineering and Technology, India",95,9998,30127,90,28190,https://www.amazon.com/Learning-Security-Preservation-Communication-Technology/dp/9811661855,IoT and Machine Learning/Deep Learning/Blockchain Technology,https://scholar.google.co.in/citations?user=gL9gR-4AAAAJ&hl=en
47,"Dr. Arun Kumar Sangaiah, (Web of Science Highly Cited Researcher, SM'IEEE)","Professor, VIT University, Vellore, India",71,4762,16063,71,15880,https://research.vit.ac.in/researcher/arun-kumar-s-2,Software Engineering/Computational Intelligence/Internet of Things,https://scholar.google.co.in/citations?user=8yF6Xc4AAAAJ&hl=en
48,Victor C. M. Leung,Shenzhen University / The University of British Columbia,103,6525,49190,86,31699,https://scholar.google.com/scholar_url?url=https://www.academia.edu/download/41278290/Location_management_for_next-generation_20160116-11059-1j4rbux.pdf&hl=en&sa=X&ei=3bvQYriyEu2O6rQPoLq--As&scisig=AAGBfm0bku7YVVwXwnk6Nl61Ag3BIJWA1A&oi=scholarr,communication systems/wireless networks/mobile systems,https://scholar.google.ca/citations?user=ajvCoo4AAAAJ&hl=en
49,Geoffrey Ye Li (李烨),"Chair Professor in Wireless Systems, Dept EEE, Imperial College London",109,5874,54116,79,25877,https://www.aminer.org/profile/geoffrey-ye-li/542a1abedabfae61d4954592,Signal Processing/and/Machine Learning/for/Wireless Communications,https://scholar.google.com/citations?user=d0FzG8YAAAAJ&hl=en
50,Hongyi Li,"Assistant Professor, University of Houston",34,920,3806,31,3213,https://ece.illinois.edu/about/directory/grad-students/hli106,watershed hydrology/earth system modeling/coupled human-nature system,https://scholar.google.com/citations?user=yWy-5icAAAAJ&hl=en
51,Jin Li  李进,Professor @Guangzhou University,60,1994,19124,54,12738,http://seea.tju.edu.cn/info/1012/1504.htm,Trust and Security in Artificial Intelligence/Computating and Storage in Cloud Computing/Blockchain,https://scholar.google.com/citations?user=7GDV2vUAAAAJ&hl=en
52,Xuelong Li (Executive Councilor of AAAI),"Professor, Northwestern Polytechnical University, China",120,8552,55971,99,39474,https://aaai.org/Organization/officers.php,artificial intelligence/optics and electronics,https://scholar.google.com/citations?user=ahUibskAAAAJ&hl=en
53,yongming li,"college of computer science, shaanxi normal university",36,393,4980,24,2467,https://dblp.org/pid/225/2500.html,fuzzy systems/quantume logic and quantum information/lattice/topology/model checking,https://scholar.google.com/citations?user=P3VERZ0AAAAJ&hl=en
54,Huchang Liao (廖虎昌),"IET Fellow, BCS Fellow; Business School, Sichuan University",64,3572,13438,61,12373,https://www.pubtexto.com/uploads/editorialboard/editor_cv/pubtexto_cv_90_23092019123728.pdf,Decision analysis/Fuzzy Systems/Multiple criteria decision making/Preference learning,https://scholar.google.co.uk/citations?user=KlWnnbIAAAAJ&hl=en
55,Chong Lin,Qingdao University,71,1936,16664,53,9362,https://www.linkedin.com/in/chonglin,systems and control theory,https://scholar.google.com/citations?user=AQbRErEAAAAJ&hl=en
56,Yan-Jun Liu,Liaoning University of Technology,62,2308,14624,58,11195,https://scholar.google.com/scholar_url?url=https://www.researchgate.net/profile/Yan-Jun-Liu/publication/318371880_Ultrasensitive_Wearable_Soft_Strain_Sensors_of_Conductive_Self-healing_and_Elastic_Hydrogels_with_Synergistic_Soft_and_Hard_Hybrid_Networks/links/5d2fdcb5a6fdcc2462e87993/Ultrasensitive-Wearable-Soft-Strain-Sensors-of-Conductive-Self-healing-and-Elastic-Hydrogels-with-Synergistic-Soft-and-Hard-Hybrid-Networks.pdf&hl=en&sa=X&ei=5bvQYtT5GIr2yATGyJHgBw&scisig=AAGBfm3jHF0WzGKPMpNElwkryUOX4wtd4w&oi=scholarr,Adaptive control/fuzzy control/neural networks,https://scholar.google.com/citations?user=x_Wk1jAAAAAJ&hl=en
57,Yuanwei Liu,"Associate Professor in Queen Mary University of London, Web of Science Highly Cited Researcher",53,3536,12781,52,12520,https://dblp.org/pid/93/8541,NOMA/RIS/AI/6G/Integrated Sensing and Communications,https://scholar.google.com/citations?user=FxLf7ZAAAAAJ&hl=en
58,Wenjing Lou,"W. C. English Endowed Professor, IEEE Fellow, Virginia Tech, USA",83,2807,39734,59,19321,https://en.wikipedia.org/wiki/Wenjing_Lou,Cyber Security/Wireless Networks/Wireless Security/Network Security/Cloud Computing,https://scholar.google.com/citations?user=hM8uAwoAAAAJ&hl=en
59,Majdi Mafarja,"Associate Professor of Computer Science, Birzeit University",35,2636,7104,34,7059,https://www.researchgate.net/profile/Majdi-Mafarja,Feature Selection/Machine Learning/Artificial Intelligence/Bio-inspired Algorithms/Metaheuristics,https://scholar.google.com/citations?user=ftkD0MgAAAAJ&hl=en
60,Luis Martínez,"Professor of Computer Science, University of Jaén",64,2692,23083,52,13061,https://sites.google.com/site/lrmartineza,Fuzzy decision making/Computing with words/Recommender Systems,https://scholar.google.com/citations?user=PG3D8UMAAAAJ&hl=en
61,Thomas Marzetta,"Distinguished Industry Professor, Department of Electrical and Computer Engineering, New York",59,4650,47736,46,28540,https://ieeexplore.ieee.org/author/37282754500,Beyond Massive MIMO,https://scholar.google.com/citations?user=tBLWIBoAAAAJ&hl=en
62,Seyedali Mirjalili,"Professor, Torrens University Australia, Adjunct Griffith University",77,16795,53921,76,51786,https://au.linkedin.com/in/alimirjalili,Metaheuristics/Robust Optimization/Engineering Optimization/Evolutionary Algorithm/Swarm Intelligence,https://scholar.google.com/citations?user=TJHmrREAAAAJ&hl=en
63,Andreas F. Molisch,"Professor of Electrical Engineering, University of Southern California",102,5234,59988,71,28707,https://research.com/u/andreas-f-molisch,wireless propagation channels/multi-antenna systems/ultrawideband communications and positioning/cooperative communications,https://scholar.google.com/citations?user=W0wwrucAAAAJ&hl=en
64,Derrick Wing Kwan Ng,"Scientia  Associate Professor,  University of New South Wales",68,3986,19886,64,17237,https://ieeexplore.ieee.org/author/37536288000,Wireless Communications,https://scholar.google.com/citations?user=NUJSHxoAAAAJ&hl=en
65,H. Nguyen-Xuan,"CIRTech Institute, HUTECH University, Vietnam",68,2493,16176,60,11523,https://orcid.org/0000-0002-2216-8598,Computational Engineering/Large-scale data/3D Printing/Renewable Energy,https://scholar.google.co.uk/citations?user=3iK9h-gAAAAJ&hl=en
66,Dusit (Tao) Niyato,Nanyang Technological University (NTU),104,8952,49541,87,34790,https://scholar.google.com/scholar?q=Dusit+(Tao)+Niyato+homepage&hl=en&as_sdt=0&as_vis=1&oi=scholart,ดุสิต นิยะโต - เต๋า,https://scholar.google.com/citations?user=T8sVhLMAAAAJ&hl=en
67,Kaoru Ota (太田　香),"MEXT Excellent Young Researcher (文部科学省　卓越研究員), Muroran Institute of Technology",50,2105,10116,48,9242,https://www.instagram.com/mitchlangerak/,,https://scholar.google.com/citations?user=8JVn8RsAAAAJ&hl=ja
68,Mugen Peng,"Beijing University of Posts & Telecommun., IEEE Fellow, Web of Science Highly Cited Researcher",53,2376,15896,47,11316,https://glose.com/author/mugen-peng,Fog Computing/Cloud Radio Access Networks/Integrated Satellite-Terrestrial Networks/6G,https://scholar.google.com/citations?user=85mAZVcAAAAJ&hl=en
69,HV Poor,"Michael Henry Strater University Professor, Princeton University",158,14477,124688,108,63356,https://scholar.google.com/scholar_url?url=https://ieeexplore.ieee.org/ielaam/10206/8114524/8016368-aam.pdf&hl=en&sa=X&ei=8rvQYpTLBs-wywSNrpLADQ&scisig=AAGBfm34gqR0GRX1WRq8a4Nw5l6SZC-6-Q&oi=scholarr,Communication Systems/Wireless Communications/Communications/Statistical Signal Processing/Information Theory,https://scholar.google.com/citations?user=Dq93mOUAAAAJ&hl=en
70,Lianyong Qi(齐连永),"Professor, Qufu Normal University",46,1880,6267,45,6013,https://scholar.google.com/citations?user=pxNRRsAAAAAJ&hl=en,service computing/big data/recommender system,https://scholar.google.com/citations?user=pxNRRsAAAAAJ&hl=en
71,Timon Rabczuk,Bauhaus University Weimar,108,7425,43260,93,32809,https://scholar.google.com/scholar_url?url=https://www.researchgate.net/profile/Chien-Thai-Hoang/publication/235903027_Isogeometric_Analysis_of_Laminated_Composite_Plates_Using_the_Higher-Order_Shear_Deformation_Theory/links/02e7e516360ecb9a35000000/Isogeometric-Analysis-of-Laminated-Composite-Plates-Using-the-Higher-Order-Shear-Deformation-Theory.pdf&hl=en&sa=X&ei=87vQYs_QLor2yATGyJHgBw&scisig=AAGBfm38XDBZptm8Gbek_l19jeXxFXPZrg&oi=scholarr,Computational Mechanics/Solid Mechanics,https://scholar.google.ca/citations?user=3CBuGosAAAAJ&hl=en
72,Kim-Kwang Raymond Choo,"Cloud Tech Endowed Professor, University of Texas at San Antonio; Highly Cited Researcher 2020, 2021",96,6692,26280,88,23803,https://people.unisa.edu.au/raymond.choo,Cloud Forensics/Cyber Forensics/Cyber Security/IoT Security/Blockchain,https://scholar.google.com/citations?user=rRBNI6AAAAAJ&hl=en
73,Kui Ren,"Professor, Zhejiang University, ACM Fellow, IEEE Fellow",84,3754,40540,70,22775,https://scholar.google.com/citations?user=uuQA_rcAAAAJ&hl=en,Data Security & Privacy/IoT Security/AI Security,https://scholar.google.com/citations?user=uuQA_rcAAAAJ&hl=en
74,Walid Saad,"Professor, Electrical and Computer Engineering",82,7548,33368,75,28379,https://www.linkedin.com/in/walid-saad-089640a,6G/machine learning/semantic communications/security and cyber-physical systems/unmanned aerial vehicles,https://scholar.google.com/citations?user=kYDNA0UAAAAJ&hl=en
75,Robert Schober,Friedrich-Alexander-University Erlangen-Nuremberg,94,5444,43640,78,28701,https://scholar.google.com/scholar?q=Robert+Schober+homepage&hl=en&as_sdt=0&as_vis=1&oi=scholart,,https://scholar.google.com/citations?user=Uu0BpX8AAAAJ&hl=en
76,"Ling Shao, Fellow of IEEE/IAPR",Terminus Group,91,8245,33690,85,28635,https://cszhengzhang.cn/,Computer Vision/Deep Learning/Artificial Intelligence/Medical Imaging/Vision and Language,https://scholar.google.com/citations?user=z84rLjoAAAAJ&hl=en
77,Xuemin (Sherman) Shen,"University Professor, University of Waterloo",133,9318,75377,105,43946,https://ieeexplore-ieee-org.ezproxy.u-pec.fr/author/37065811100,Wireless networking/MAC/Network security/VANET,https://scholar.google.com/citations?user=Bjl3GwoAAAAJ&hl=cs
78,Peng Shi,"Professor, School of Electrical and Electronic Engineering, The University of Adelaide",151,8194,78962,114,46861,https://www.pengshi.com/,Systems and Control/Electrical and Electronic Engineering/Cybernetics/Human-Computer Interaction,https://scholar.google.com.hk/citations?user=EGx1iH0AAAAJ&hl=en
