,Name,Affilation,H-index,Citations 2020,Total_citation,H-index_since_2016,Citation_since_2016,HomePage,Area of Research,Google_Scholar
0,"U Rajendra Acharya (SCI Highly Cited Researcher 2016-2021)  PhD, DEng, DSc","Ngee Ann,  Singapore University of Social Science,  University of Malaya, Malaysia",109,8749,46790,98,37009,https://scholar.google.com.sg/citations?user=8FjY99sAAAAJ&hl=en,Artificial Intelligence/Medical Informatics,https://scholar.google.com.sg/citations?user=8FjY99sAAAAJ&hl=en
1,IAN  F.  AKYILDIZ,"Truva Inc. , USA",131,6701,131335,86,45237,https://en.wikipedia.org/wiki/Ian_F._Akyildiz#1990s,Wireless Communication/5G/6G Wireless Systems/Intelligent Surfaces for Wireless Communication/Nano-scale and Molecular Commun,https://scholar.google.com/citations?user=rAGwv14AAAAJ&hl=en
2,Ibrahim Aljarah,"Associate Professor, University of Jordan",43,2270,7080,43,6973,http://www.ibrahimaljarah.com/,Artificial  intelligence/Data Security/Data Science/Machine Learning/Evolutionary Computation,https://scholar.google.com/citations?user=moOTIYEAAAAJ&hl=en
3,Jeffrey Andrews,"Cockrell Family Endowed Chair in Engineering, University of Texas at Austin",104,4652,64356,79,34807,https://ieeexplore.ieee.org/author/37271209100,Wireless Communications/Communication Theory/Machine Learning for Communications/Stochastic Geometry/Information Theory,https://scholar.google.com/citations?user=Hr9Gey0AAAAJ&hl=en
4,Bennis Mehdi,"Full Professor, IEEE Fellow, Head of ICON, University of Oulu",64,5557,22226,62,20647,https://sites.google.com/view/dr-mehdi-bennis/research/v2x,B5G/6G/machine learning/semantic communication,https://scholar.google.com/citations?user=RW4sJu8AAAAJ&hl=en
5,Emil Björnson,KTH Royal Institute of Technology / Linköping University,60,3378,16432,57,14659,https://scholar.google.se/citations?user=Maij4akAAAAJ&hl=en,Massive MIMO/Cell-free Massive MIMO/RIS/Signal processing/convex optimization,https://scholar.google.se/citations?user=Maij4akAAAAJ&hl=en
6,Rajkumar Buyya,"CLOUDS Lab, School of Computing and Information Systems, The University of Melbourne, Australia",151,11167,119603,109,66129,https://scholar.google.com/scholar?q=Rajkumar+Buyya+homepage&hl=en&as_sdt=0&as_vis=1&oi=scholart,Computer Systems/Cloud Computing/Distributed Systems/Edge Computing/Internet of Things,https://scholar.google.com/citations?user=7xN6JqYAAAAJ&hl=en
7,Xing Cai,"Senior Research Scientist at Simula Research Laboratory, Professor at University of Oslo",19,122,1973,14,856,https://www.cosas2018.fau.de/index.html%3Fp=367.html,Parallel programming/High-performance computing/numerical methods for PDEs,https://scholar.google.com/citations?user=IWQbrcK5CEwC&hl=en
8,Giuseppe Caire,"Professor, Technical University of Berlin, Germany, and Professor of Electrical Engineering (on",82,2927,38211,59,17470,https://www.5gitaly.eu/2019/team-member/caire-giuseppe/,Information Theory/Communications/Signal Processing/Statistics,https://scholar.google.com/citations?user=g66ErTcAAAAJ&hl=en
9,Jinde Cao,"Academician, RAE/AE/RAEN/LAS/AAS/EASA/PAS/IASCYS  & FIEEE/FAAIA/DFIETI; Southeast University",128,8758,66301,90,40524,https://scholar.google.com/citations?user=8_ffELYAAAAJ&hl=en,Complex networks/neural networks/multi-agent systems - engineering stability - dynamics and control - time-delay systems,https://scholar.google.com/citations?user=8_ffELYAAAAJ&hl=en
10,C. L. Philip Chen,"Chair Professor, South China University of Technology, Philip.Chen@ieee.org",91,5841,34327,83,27069,https://scholar.google.com/citations?user=Q5248zwAAAAJ&hl=en,Computational Intelligence/Intelligent Control/Cybernetics/Intelligent Transportation Systems/Data Science/Engineering,https://scholar.google.com/citations?user=Q5248zwAAAAJ&hl=en
11,Jinjun Chen,"Professor and Deputy Institute Director, Swinburne University of Technology",65,2153,12105,48,8817,https://dblp.org/pid/06/2379.html,Cloud Computing/Scalable Architecture/Scalable Data Storage/Scalable Data Processing (Privacy),https://scholar.google.com/citations?user=mQ9vJ24AAAAJ&hl=en
12,Min Chen,"Professor, IEEE Fellow, Highly Cited Researcher, Huazhong University of Science and Technology",85,5731,31599,71,25148,https://www.uwb.edu/css/faculty/bios/mchen,Cognitive Computing and Big Data Analytics/IoT Sensing/5G Networks/Robotics/Edge Computing,https://scholar.google.com/citations?user=_HyHTrsAAAAJ&hl=en
13,Xiaofeng Chen,"Professor, Xidian University, China",55,1932,13250,51,10476,https://scholar.google.com/scholar_url?url=https://www.researchgate.net/profile/Xiaofeng-Chen-7/publication/312248508_Factors_That_Influence_Employees%27_Security_Policy_Compliance_An_Awareness-Motivation-Capability_Perspective/links/5fbb09c1458515b797627588/Factors-That-Influence-Employees-Security-Policy-Compliance-An-Awareness-Motivation-Capability-Perspective.pdf&hl=en&sa=X&ei=DhOoYY7fOIj4yATL6oXwCw&scisig=AAGBfm0h7_-Q5jGp55ZZ9OHAyE740P1Qig&oi=scholarr,Security/Cryptography/Cloud computing,https://scholar.google.com/citations?user=-3WhJecAAAAJ&hl=en
14,Francisco Chiclana,"Professor of Computational Intelligence and Decision Making, De Montfort University, UK",68,2297,18938,60,11955,https://dasci.es/about-dasci/resources/human-resources/francisco-chiclana/,Decision making/computational intelligence/information fusion/consensus/sentiment analysis,https://scholar.google.com/citations?user=qDOxZIIAAAAJ&hl=en
15,zhihua cui,"Taiyuan University of Science and Technology, Taiyuan, Shanxi, China, 030024",44,1628,7857,33,5743,https://dblp.org/pid/10/423.html?view=joint&param=104,evolutionary computation,https://scholar.google.com/citations?user=BpDrULIAAAAJ&hl=en
16,Linglong Dai,"Associate Professor, Department of Electronics Engineering, Tsinghua University, Beijing, China",61,3183,14763,57,13833,https://scholar.google.com/scholar?q=Linglong+Dai+homepage&hl=en&as_sdt=0&as_vis=1&oi=scholart,Wireless Communications/RIS/Massive MIMO/Millimeter-Wave/Teraherz Communications/Non-Orthogonal Mutiple Access,https://scholar.google.com/citations?user=OTFnifoAAAAJ&hl=en
17,Merouane Debbah,"Centralesupelec, Technology Innovation Institute, MBZUAI, Lagrange Mathematics Center",98,7540,44618,84,33764,https://www.tii.ae/team/prof-merouane-debbah,5G/6G/Machine Learning/Random Matrix Theory/Game Theory,https://scholar.google.com/citations?user=HU5I0X4AAAAJ&hl=en
18,Yong Deng,"School of Computer and Information Science, Southwest University",72,3155,18584,66,15121,https://dblp.org/pid/66/3604-1.html,Evidence Theory/Fuzzy Set Theory/Bio-inspired AI/Complex Networks,https://scholar.google.com/citations?user=8voeILsAAAAJ&hl=en
19,Zhiguo Ding,"University of Manchester, Fellow of IEEE, Web of Science Highly Cited Researcher",87,7804,34123,82,31356,https://www.comsoc.org/zhiguo-ding,Wireless communications/signal processing/and cross-layer optimization,https://scholar.google.co.uk/citations?user=V-nB8scAAAAJ&hl=en
20,"Mianxiong Dong, Foreign Fellow of EAJ","Vice President and Professor, Muroran Institute of Technology, Japan",51,2174,9969,50,9220,http://www.wikicfp.com/cfp/servlet/event.showcfp?eventid=94233&copyownerid=110304,Cyber-Physical Systems/Internet of Things/Artificial Intelligence,https://scholar.google.co.jp/citations?user=TqyApAUAAAAJ&hl=en
21,Yucheng Dong,"Professor of Management and Systems Sciences, Sichuan University",56,1836,10712,52,9051,https://dblp.org/pid/08/3009,Decision Analysis/Human Dynamics/Social Network/Data Science,https://scholar.google.com/citations?user=tFVYDw4AAAAJ&hl=en
22,Maged Elkashlan,"Associate Professor, Queen Mary University of London",57,2604,13966,54,12639,https://scholar.google.com/citations?user=mncnnOAAAAAJ&hl=en,IRS/URLLC/UAV/PLS/NOMA,https://scholar.google.com/citations?user=mncnnOAAAAAJ&hl=en
23,Zubair Md. Fadlullah,"Associate Professor, Research Chair, Department of Computer Science, Lakehead University, TBRHRI",38,1477,6804,36,5569,https://dblp.org/pid/64/3988,Beyond 5G/Smart Health/UAV & Energy efficient Networks/QoS & Security/Deep Learning applications,https://scholar.google.com/citations?user=dZyfKpYAAAAJ&hl=en
24,Hossam Faris,"Professor, The University of Jordan, Al Hussein Technical University",43,2907,9347,43,9217,http://eacademic.ju.edu.jo/Hossam.faris,Data Science/Knowledge Systems/Data Mining/Evolutionary computation,https://scholar.google.com/citations?user=UEYd--YAAAAJ&hl=en
25,Giancarlo Fortino,"Full Prof. of Computer Engineering, Univ. of Calabria, IEEE Fellow, Highly Cited Researcher",62,2815,14304,57,11986,https://dl.acm.org/profile/81339499344,Human-Machine Systems/Agent-based Computing/Internet of Things/Wearable Computing/Wireless/Body Area Networks,https://scholar.google.com/citations?user=ecImn1MAAAAJ&hl=it
26,Hamido Fujita,Iwate Prefectural University,62,3955,14519,62,13763,http://www.fujita.soft.iwate-pu.ac.jp/,Machine Learning,https://scholar.google.com/citations?user=MxzV1nQAAAAJ&hl=en
27,Erik G. Larsson,"Professor, Dept. of Electrical Engineering (ISY), Linköping University, Sweden",83,5590,41752,63,29496,https://ieeexplore.ieee.org/author/37085356008,Wireless communications/statistical signal processing/localization/massive MIMO/networks,https://scholar.google.se/citations?user=79Lry6oAAAAJ&hl=en
28,Amir H. Gandomi,"Professor, University of Technology Sydney",72,4099,24811,64,20027,https://scholar.google.com/scholar?q=Amir+H.+Gandomi+homepage&hl=en&as_sdt=0&as_vis=1&oi=scholart,Data Analytics/Genetic Programming/Engineering Optimization/Evolutionary Computation/Smart Cities,https://scholar.google.com/citations?user=VMf3wfMAAAAJ&hl=en
29,Xiaohua Ge,"Swinburne University of Technology, Melbourne, Australia",32,1712,5884,32,5826,https://scholar.google.com.au/citations?user=B37CYFoAAAAJ&hl=en,Multi-Agent Systems/Networked Control Systems/Cyber-Physical Systems/Sensor Networks,https://scholar.google.com.au/citations?user=B37CYFoAAAAJ&hl=en
30,"Mohsen Guizani, FIEEE","Qatar University, Doha, Qatar",88,8228,39455,75,33317,http://nljrc.njau.edu.cn/index.php/lecture-prof-mohsen-guizani-qatar-university/,Internet of Things/Applied AI/ML and Cybersecurity,https://scholar.google.com/citations?user=RigrYkcAAAAJ&hl=en
31,Song Guo,"FCAE, FIEEE, The Hong Kong Polytechnic University",68,3805,19138,66,16362,https://dblp.org/pid/01/267,Big Data Computing/Edge AI/Mobile Computing/Distributed System,https://scholar.google.com/citations?user=Ib-sizwAAAAJ&hl=en
32,Harald Haas,The University of Edinburgh,92,5612,43202,78,30825,https://uk.linkedin.com/in/hhaas,Optical Wireless Communications/Interference Managment in Wireless Networks/Spatial Modulation,https://scholar.google.com/citations?user=XxIwRJQAAAAJ&hl=ja
33,Yuki Hagiwara,Fraunhofer IKS,29,1751,5650,29,5641,https://scholar.google.com/scholar?q=Yuki+Hagiwara+homepage&hl=en&as_sdt=0&as_vis=1&oi=scholart,Artificial Intelligence,https://scholar.google.com.sg/citations?user=P6WI2DQAAAAJ&hl=en
34,"Qing-Long Han, Pro Vice-Chancellor and Distinguished Professor, MAE, IEEE Fellow",Swinburne University of Technology,104,5697,34975,86,24564,https://0-scholar-google-com.brum.beds.ac.uk/citations?user=6VM9EHcAAAAJ&hl=ru,Networked control systems/time-delay systems/multi-agent systems/smart grids/unmanned surface vehicles,https://scholar.google.com.au/citations?user=j0pyptAAAAAJ&hl=en
35,Zhu Han,University of Houston,114,7579,52964,91,37950,https://zyy123jy.github.io/My-Web-Sites//,Game Theory/Wireless Networking/Security/Data Science/Smart Grid,https://scholar.google.com/citations?user=ty7wIXoAAAAJ&hl=en
36,L Hanzo,"Chair of Telecommunications, University of Southampton",104,7081,63284,82,33672,https://scholar.google.com/citations?user=p0jnEW0AAAAJ&hl=fr,telecommunications/wireless communication/quantum_information_science/video_coding/video_networking,https://scholar.google.co.uk/citations?user=p0jnEW0AAAAJ&hl=en
37,L Hanzo,"Chair of Telecommunications, University of Southampton",104,7081,63284,82,33672,https://scholar.google.com/citations?user=p0jnEW0AAAAJ&hl=fr,telecommunications/wireless communication/quantum_information_science/video_coding/video_networking,https://scholar.google.co.uk/citations?user=p0jnEW0AAAAJ&hl=en
38,Robert Heath,"Lampe Distinguished Professor, North Carolina State University",132,7937,77739,93,44734,http://www.profheath.org/home/,wireless/MIMO/communications/signal processing/information theory,https://scholar.google.com/citations?user=17Ko8Q0AAAAJ&hl=en
39,Francisco Herrera,"Professor Computer Science and AI, Granada University, Senior Research Advisor in DL&ML at Sherpa.ai",157,11525,105746,123,60909,https://www.britannica.com/biography/Francisco-Herrera-the-Elder,Artificial Intelligence/Computational Intelligence/Data mining/Evolutionary Algorithms/Big Data Analytics,https://scholar.google.com/citations?user=HULIk-QAAAAJ&hl=en
40,Enrique Herrera-Viedma,"Professor of Computer Science and Artificial Intelligence, Spain, University of Granada",105,5105,44331,88,26321,https://scholar.google.com/citations?user=g8ZXTuYAAAAJ&hl=en,Fuzzy sets/fuzzy decision making/computing with words/multiple criteria decision making/consensus,https://scholar.google.com/citations?user=g8ZXTuYAAAAJ&hl=en
41,Ekram Hossain,"Professor, University of Manitoba, Canada, IEEE Fellow",97,3318,35624,74,20818,https://scholar.google.com/citations?user=Lb617EMAAAAJ&hl=en,Wireless communication networks/radio resource allocation/cognitive radio/multi-tier cellular networks,https://scholar.google.com/citations?user=Lb617EMAAAAJ&hl=en
42,Guang-Bin Huang,"Full Professor, Nanyang Technological University, Singapore",70,6031,52414,62,35894,https://www.researchgate.net/profile/Guang-Bin-Huang,Machine Learning/Neural Networks/Neuroscience,https://scholar.google.com.sg/citations?user=LhSqQCIAAAAJ&hl=en
43,Kaibin Huang,"Associate Professor, Dept. of EEE, The University of Hong Kong; IEEE Fellow",50,2660,13769,43,11152,https://www.researchgate.net/profile/Kaibin-Huang-2,Machine Learning/Mobile Edge Computing/Wireless Communications/Wireless Power Transfer/Stochastic Geometry,https://scholar.google.com/citations?user=HfuA3uIAAAAJ&hl=en
44,Thomas JR Hughes,"Peter O'Donnell Jr. Chair in Computational and Applied Mathematics, University of Texas at Austin",157,7600,128731,100,45201,http://users.oden.utexas.edu/~hughes/,Finite Element Methods/Solid Mechanics/Computational Fluid Dynamics/Partial Differential Equations/Isogeometric Analysis,https://scholar.google.com/citations?user=6tPdlYAAAAAJ&hl=en
45,Yaochu Jin,"Humboldt Professor for AI, Bielefeld University and Distinguished Chair, University of Surrey",81,3937,28675,68,18422,https://en.wikipedia.org/wiki/Yaochu_Jin,Artificial Intelligence/Evolutionary Computation/Multiobjective Optimization/Federated Learning/Developmental AI,https://scholar.google.com/citations?user=B5WAkz4AAAAJ&hl=en
46,"Nei Kato(IEEE Fellow, IEICE Fellow)","Professor, Graduate School of Information Sciences, Tohoku University, Japan",72,3427,20191,58,14073,https://www.aminer.org/profile/nei-kato/54483485dabfae87b7de6863,Wireless networking,https://scholar.google.com/citations?user=LfLfZXEAAAAJ&hl=en
47,"Dr. Neeraj Kumar, SMIEEE (Web of Science Highly Cited Researcher 2019, 2020,2021)","Professor, CSED, Thapar Institute of Engineering and Technology, India",85,6302,23604,79,22429,https://www.routledge.com/Internet-of-Energy-for-Smart-Cities-Machine-Learning-Models-and-Techniques/Jindal-Kumar-Aujla/p/book/9780367497750,IoT and Machine Learning/Deep Learning/Blockchain Technology,https://scholar.google.co.in/citations?user=gL9gR-4AAAAJ&hl=en
48,"Dr. Arun Kumar Sangaiah., Ph.D (SM'IEEE)","Professor, School of Computing Science and Engineering, VIT University, Vellore, India",64,4025,12748,64,12634,http://yurakugurui48.inoxdvr.com/58.html,Software Engineering/Computational Intelligence/Internet of Things,https://scholar.google.co.in/citations?user=8yF6Xc4AAAAJ&hl=en
49,Victor C. M. Leung,Shenzhen University / The University of British Columbia,100,6397,45298,85,31014,https://scholar.google.com/scholar_url?url=https://citeseerx.ist.psu.edu/viewdoc/download%3Fdoi%3D10.1.1.941.5437%26rep%3Drep1%26type%3Dpdf&hl=en&sa=X&ei=NxOoYaHuDYbmyQSw5K_oDA&scisig=AAGBfm0zezW4rAHdNplD7CDKOE_DZiQqZw&oi=scholarr,communication systems/wireless networks/mobile systems,https://scholar.google.ca/citations?user=ajvCoo4AAAAJ&hl=en
50,Geoffrey Ye Li (李烨),"Chair Professor in Wireless Systems, Dept EEE, Imperial College London",102,5458,49979,79,25147,https://www.jstor.org/stable/26895776,Signal Processing/and/Machine Learning/for/Wireless Communications,https://scholar.google.com/citations?user=d0FzG8YAAAAJ&hl=en
51,Hongyi Li,"Assistant Professor, University of Houston",32,712,3193,29,2819,https://scholar.google.com/scholar_url?url=https://ntrs.nasa.gov/api/citations/20150007907/downloads/20150007907.pdf%3Fattachment%3Dtrue&hl=en&sa=X&ei=OROoYbOcHJD2yAT97YOQBw&scisig=AAGBfm3U4J0qd9J_vSMWfXvhHveZeGeXGA&oi=scholarr,watershed hydrology/earth system modeling/coupled human-nature system,https://scholar.google.com/citations?user=yWy-5icAAAAJ&hl=en
52,Jin Li  李进,Professor @Guangzhou University,56,2256,17952,52,13405,http://www.jin-li.org/,Trust and Security in Artificial Intelligence/Computating and Storage in Cloud Computing/Blockchain,https://scholar.google.com/citations?user=7GDV2vUAAAAJ&hl=en
53,Xuelong Li (Executive Councilor of AAAI),"Professor, Northwestern Polytechnical University, China",114,7696,50397,101,38177,https://aaai.org/Organization/officers.php,artificial intelligence/feature extraction/higher-order data analytics,https://scholar.google.com/citations?user=ahUibskAAAAJ&hl=en
54,yongming li,"college of computer science, shaanxi normal university",36,421,4730,25,2608,https://publons.com/researcher/2368368/yongming-li/,fuzzy systems/quantume logic and quantum information/lattice/topology/model checking,https://scholar.google.com/citations?user=P3VERZ0AAAAJ&hl=en
55,Huchang Liao (廖虎昌),"Fellow of BCS, Business School, Sichuan University",58,2503,11348,56,10793,https://scholar.google.co.uk/citations?user=kd9L_GUAAAAJ&hl=en,Decision analysis/Fuzzy Systems/Multiple criteria decision making/Preference learning,https://scholar.google.co.uk/citations?user=KlWnnbIAAAAJ&hl=en
56,Chong Lin,Qingdao University,67,1851,15343,52,9185,https://en.wikipedia.org/wiki/Lin_Chong,systems and control theory,https://scholar.google.com/citations?user=AQbRErEAAAAJ&hl=en
57,Yan-Jun Liu,Liaoning University of Technology,57,2181,12987,54,10898,https://scholar.google.com/citations?user=x_Wk1jAAAAAJ&hl=en,Adaptive control/fuzzy control/neural networks,https://scholar.google.com/citations?user=x_Wk1jAAAAAJ&hl=en
58,Yuanwei Liu,"Associate Professor in Queen Mary University of London, Web of Science Highly Cited Researcher",46,2588,9982,46,9888,https://scholar.google.com/citations?user=FxLf7ZAAAAAJ&hl=en,NOMA/RIS/UAV Communications/Artifical Intelligence/6G,https://scholar.google.com/citations?user=FxLf7ZAAAAAJ&hl=en
59,Wenjing Lou,"W. C. English Endowed Professor, IEEE Fellow, Virginia Tech, USA",80,3011,38195,62,22387,https://orcid.org/0000-0002-2421-4623,Cyber Security/Wireless Networks/Wireless Security/Network Security/Cloud Computing,https://scholar.google.com/citations?user=hM8uAwoAAAAJ&hl=en
60,Majdi Mafarja,"Associate Professor of Computer Science, Birzeit University",32,1672,5203,30,5164,https://ps.linkedin.com/in/majdi-mafarja-phd-b2848711,Feature Selection/Machine Learning/Artificial Intelligence/Bio-inspired Algorithms/Metaheuristics,https://scholar.google.com/citations?user=ftkD0MgAAAAJ&hl=en
61,Luis Martínez,"Professor of Computer Science, University of Jaén",61,2305,21428,53,12907,https://scholar.google.com/citations?user=PG3D8UMAAAAJ&hl=en,Fuzzy decision making/Computing with words/Recommender Systems,https://scholar.google.com/citations?user=PG3D8UMAAAAJ&hl=en
62,Thomas Marzetta,"Distinguished Industry Professor, Department of Electrical and Computer Engineering, New York",58,4839,45074,45,30521,https://wireless.engineering.nyu.edu/thomas-marzetta/,Beyond Massive MIMO,https://scholar.google.com/citations?user=tBLWIBoAAAAJ&hl=en
63,Seyedali Mirjalili,"Professor, Torrens University Australia, Adjunct Griffith University",68,10602,40119,67,38997,https://au.linkedin.com/in/alimirjalili,Metaheuristics/Robust Optimization/Engineering Optimization/Evolutionary Algorithm/Swarm Intelligence,https://scholar.google.com/citations?user=TJHmrREAAAAJ&hl=en
64,Andreas F. Molisch,"Professor of Electrical Engineering, University of Southern California",100,5154,56988,75,29268,https://scholar.google.com/scholar_url?url=https://ieeexplore.ieee.org/abstract/document/4734219/&hl=en&sa=X&ei=RhOoYeTzNMqxywSNvpSoCA&scisig=AAGBfm3I3-HiK77Jk_1-1EobTKHn84Aq3g&oi=scholarr,wireless propagation channels/multi-antenna systems/ultrawideband communications and positioning/cooperative communications,https://scholar.google.com/citations?user=W0wwrucAAAAJ&hl=en
65,Derrick Wing Kwan Ng,"Scientia Senior Lecturer,  University of New South Wales",63,3492,16956,62,15471,https://ieeexplore.ieee.org/author/37536288000,Wireless Communications,https://scholar.google.com/citations?user=NUJSHxoAAAAJ&hl=en
66,H. Nguyen-Xuan,"CIRTech Institute, Ho Chi Minh City University of Technology (HUTECH), Vietnam",66,2199,14614,58,10905,https://www.researchgate.net/profile/H-Nguyen-Xuan,Computational Engineering/Large-scale data/3D Printing/Renewable Energy,https://scholar.google.co.uk/citations?user=3iK9h-gAAAAJ&hl=en
67,Dusit (Tao) Niyato,Nanyang Technological University (NTU),95,6822,42975,81,31268,https://ieeexplore-ieee-org.ezproxy.u-pec.fr/author/37296968900,ดุสิต นิยะโต - เต๋า,https://scholar.google.com/citations?user=T8sVhLMAAAAJ&hl=en
68,Kaoru Ota (太田　香),"MEXT Excellent Young Researcher (文部科学省　卓越研究員), Muroran Institute of Technology",49,2096,8747,47,8392,https://beta.aminer.cn/pub/5c757007f56def97986b569c/customized-network-security-for-cloud-service,,https://scholar.google.com/citations?user=8JVn8RsAAAAJ&hl=ja
69,Mugen Peng,"Beijing University of Posts & Telecommun., IEEE Fellow, Web of Science Highly Cited Researcher",51,2230,14601,45,10874,https://dl.acm.org/profile/99659737361,Fog Radio Access Network/Heterogeneous Networks/Cloud Radio Access Networks/Network Coding/Radio Resource Allocation and Opt,https://scholar.google.com/citations?user=85mAZVcAAAAJ&hl=en
70,HV Poor,"Michael Henry Strater University Professor, Princeton University",151,12005,115784,108,61322,https://scholar.google.com/scholar_url?url=https://arxiv.org/pdf/1703.08390&hl=en&sa=X&ei=TROoYdbKDp30yATnuoawAw&scisig=AAGBfm3TSw2KF4NCnC9YJA2UNB6tQRvBmw&oi=scholarr,Information Theory/Statistical Signal Processing/Stochastic Analysis,https://scholar.google.com/citations?user=Dq93mOUAAAAJ&hl=en
71,Lianyong Qi(齐连永),"Professor, Qufu Normal University(青年教授，博士生导师，曲阜师范大学)",38,1889,4675,37,4473,https://scholar.google.com/citations?user=pxNRRsAAAAAJ&hl=en,service computing/big data/recommender system,https://scholar.google.com/citations?user=pxNRRsAAAAAJ&hl=en
72,Timon Rabczuk,Bauhaus University Weimar,102,6234,38145,91,30028,https://scholar.google.com/scholar_url?url=https://www.tandfonline.com/doi/pdf/10.1080/19942060.2018.1502688&hl=en&sa=X&ei=TxOoYePDHoSaygSEoZSoDw&scisig=AAGBfm2VzYapJfrkj5wFVRzPIDw8uDYC_w&oi=scholarr,Computational Mechanics/Solid Mechanics,https://scholar.google.ca/citations?user=3CBuGosAAAAJ&hl=en
73,Kim-Kwang Raymond Choo,"Cloud Tech Endowed Professor, University of Texas at San Antonio; Highly Cited Researcher 2020, 2021",88,5099,21354,84,19751,https://people.unisa.edu.au/raymond.choo,Cloud Forensics/Cyber Forensics/Cyber Security/IoT Security/Blockchain,https://scholar.google.com/citations?user=rRBNI6AAAAAJ&hl=en
74,Kui Ren,"Professor, Zhejiang University, ACM Fellow, IEEE Fellow",80,3811,38260,71,24971,https://ieeexplore.ieee.org/author/37288795500,Data Security & Privacy/IoT Security/AI Security,https://scholar.google.com/citations?user=uuQA_rcAAAAJ&hl=en
75,Walid Saad,"Professor, Electrical and Computer Engineering",78,6315,28270,71,24889,https://ieeexplore.ieee.org/author/37392237900,6G wireless systems/machine learning/security/cyber-physical systems/Unmanned aerial vehicles (UAVs),https://scholar.google.com/citations?user=kYDNA0UAAAAJ&hl=en
76,Robert Schober,Friedrich-Alexander-University Erlangen-Nuremberg,90,5378,39955,76,28579,https://www.tf.fau.eu/person/robert-schober/,,https://scholar.google.com/citations?user=Uu0BpX8AAAAJ&hl=en
77,"Ling Shao, Fellow of IEEE/IAPR","CEO & Chief Scientist, Inception Institute of Artificial Intelligence (IIAI)",77,5471,27196,74,23974,https://ieeexplore.ieee.org/author/38265369400,Computer Vision/Deep Learning/Artificial Intelligence/Medical Imaging/Vision and Language,https://scholar.google.com/citations?user=z84rLjoAAAAJ&hl=en
78,Xuemin (Sherman) Shen,"University Professor, University of Waterloo",127,8663,69178,99,43388,https://scholar.google.com/scholar_url?url=https://nsec.sjtu.edu.cn/publications/2018/Securing%2520consumer%2520IoT.pdf&hl=en&sa=X&ei=VROoYbSyLMqxywSNvpSoCA&scisig=AAGBfm2vbwKCUdpVOr8fHbbvawatDnCmWw&oi=scholarr,Wireless networking/MAC/Network security/VANET,https://scholar.google.com/citations?user=Bjl3GwoAAAAJ&hl=cs
79,Peng Shi,"Professor, School of Electrical and Electronic Engineering, The University of Adelaide",145,8374,73497,117,48100,https://scholars.cityu.edu.hk/en/persons/peng-shi(0e151646-b642-4a53-98e0-b312de44ae71).html,Systems and Control/Electrical and Electronic Engineering/Cybernetics/Human-Computer Interaction,https://scholar.google.com.hk/citations?user=EGx1iH0AAAAJ&hl=en
