,Name,Affilation,H-index,Citations 2020,Total_citation,H-index_since_2016,Citation_since_2016,HomePage,Area of Research,Google_Scholar
0,"U Rajendra Acharya (SCI Highly Cited Researcher 2016-2021)  PhD, DEng, DSc","Ngee Ann,  Singapore University of Social Science,  University of Malaya, Malaysia",112,11673,50474,99,37985,https://www.journals.elsevier.com/computers-in-biology-and-medicine/editorial-board/rajendra-acharya-mtech-phd-deng-dsc,Artificial Intelligence/Medical Informatics,https://scholar.google.com.sg/citations?user=8FjY99sAAAAJ&hl=en
1,IAN  F.  AKYILDIZ,"Truva Inc. , USA",131,6568,133570,79,38200,https://www.itu.int/en/ITU-T/academia/kaleidoscope/2020/Pages/Ian-Akyildiz.aspx,Wireless Communication/5G/6G Wireless Systems/Intelligent Surfaces for Wireless Communication/Nano-scale and Molecular Commun,https://scholar.google.com/citations?user=rAGwv14AAAAJ&hl=en
2,Ibrahim Aljarah,"Associate Professor, University of Jordan",44,3333,8040,43,7865,https://publons.com/researcher/1658122/ibrahim-aljarah/,Artificial  intelligence/Swarm Intelligence/Data Science/Machine Learning/Evolutionary Computation,https://scholar.google.com/citations?user=moOTIYEAAAAJ&hl=en
3,Jeffrey Andrews,"Cockrell Family Endowed Chair in Engineering, University of Texas at Austin",105,3785,65252,71,28858,https://ieeexplore.ieee.org/author/37271209100,Wireless Communications/Communication Theory/Machine Learning for Communications/Stochastic Geometry/Information Theory,https://scholar.google.com/citations?user=Hr9Gey0AAAAJ&hl=en
4,Bennis Mehdi,"Full Professor, IEEE Fellow, Head of ICON, University of Oulu",68,6997,24497,64,21911,https://sites.google.com/view/dr-mehdi-bennis/publications,B5G/6G/machine learning/semantic communication,https://scholar.google.com/citations?user=RW4sJu8AAAAJ&hl=en
5,Emil Björnson,"Professor of Wireless Communication, KTH Royal Institute of Technology",61,4541,17770,59,14916,https://ebjornson.com/research/reproducibility/,Massive MIMO/Cell-free Massive MIMO/RIS/Signal processing/Wireless communication,https://scholar.google.se/citations?user=Maij4akAAAAJ&hl=en
6,Rajkumar Buyya,"CLOUDS Lab, School of Computing and Information Systems, The University of Melbourne, Australia",153,11180,122744,102,59429,https://dblp.org/pid/b/RajkumarBuyya,Computer Systems/Cloud Computing/Distributed Systems/Edge Computing/Internet of Things,https://scholar.google.com/citations?user=7xN6JqYAAAAJ&hl=en
7,Xing Cai,"Senior Research Scientist at Simula Research Laboratory, Professor at University of Oslo",19,136,2019,13,737,https://koei.fandom.com/wiki/Xingcai#Dynasty_Warriors,Parallel programming/High-performance computing/numerical methods for PDEs,https://scholar.google.com/citations?user=IWQbrcK5CEwC&hl=en
8,Giuseppe Caire,"Professor, Technical University of Berlin, Germany, and Professor of Electrical Engineering (on",82,2860,39114,55,15720,https://scholar.google.com/citations?user=g66ErTcAAAAJ&hl=en,Information Theory/Communications/Signal Processing/Statistics,https://scholar.google.com/citations?user=g66ErTcAAAAJ&hl=en
9,Jinde Cao,"Academician, RAE/AE/RAEN/LAS/AAS/EASA/PAS/IASCYS  & FIEEE/FAAIA/DFIETI; Southeast University",130,9063,69021,89,39321,https://research.com/u/jinde-cao,Complex networks/neural networks/multi-agent systems - engineering stability - dynamics and control - time-delay systems,https://scholar.google.com/citations?user=8_ffELYAAAAJ&hl=en
10,C. L. Philip Chen,"Chair Professor, South China University of Technology, Philip.Chen@ieee.org",93,7439,36704,82,27212,https://www.ae-info.org/ae/User/Chen_Philip,Computational Intelligence/Intelligent Control/Cybernetics/Intelligent Transportation Systems/Data Science/Engineering,https://scholar.google.com/citations?user=Q5248zwAAAAJ&hl=en
11,Jinjun Chen,"Professor and Deputy Institute Director, Swinburne University of Technology",68,2319,12781,49,8545,https://research.com/u/jinjun-chen,Cloud Computing/Scalable Architecture/Scalable Data Storage/Scalable Data Processing (Privacy),https://scholar.google.com/citations?user=mQ9vJ24AAAAJ&hl=en
12,Min Chen,"Professor, IEEE Fellow, Highly Cited Researcher, Huazhong University of Science and Technology",87,5932,33191,69,24133,https://www.uwb.edu/css/faculty/bios/mchen,Cognitive Computing and Big Data Analytics/IoT Sensing/5G Networks/Robotics/Edge Computing,https://scholar.google.com/citations?user=_HyHTrsAAAAJ&hl=en
13,Xiaofeng Chen,"Professor, Xidian University, China",56,1717,12916,48,9484,http://schools.njnu.edu.cn/chem/person/xiaofeng-chen,Security/Cryptography/Cloud computing,https://scholar.google.com/citations?user=-3WhJecAAAAJ&hl=en
14,Francisco Chiclana,"Professor of Computational Intelligence and Decision Making, De Montfort University, UK",68,2512,19385,57,11033,https://dblp.org/pid/51/6914,Decision making/computational intelligence/information fusion/consensus/sentiment analysis,https://scholar.google.com/citations?user=qDOxZIIAAAAJ&hl=en
15,zhihua cui,"Taiyuan University of Science and Technology, Taiyuan, Shanxi, China, 030024",44,1707,7826,33,5708,https://scholar.google.com/citations?user=BpDrULIAAAAJ&hl=en,evolutionary computation,https://scholar.google.com/citations?user=BpDrULIAAAAJ&hl=en
16,Linglong Dai,"Associate Professor, Tsinghua University; IEEE Fellow",64,3326,15781,58,14146,https://gaozhen16.eu.org/,Wireless Communications/RIS/Massive MIMO/Millimeter-Wave/Teraherz Communications/Non-Orthogonal Mutiple Access,https://scholar.google.com/citations?user=OTFnifoAAAAJ&hl=en
17,Merouane Debbah,"Centralesupelec, Technology Innovation Institute, MBZUAI, Lagrange Mathematics Center",98,9006,46201,81,32274,https://www.youtube.com/watch?v=XRu6uzmAJHU,5G/6G/Machine Learning/Random Matrix Theory/Game Theory,https://scholar.google.com/citations?user=HU5I0X4AAAAJ&hl=en
18,Yong Deng,"School of Computer and Information Science, Southwest University",75,3533,19548,66,14885,https://business.wisc.edu/directory/profile/yongheng-deng/,Evidence Theory/Fuzzy Set Theory/Bio-inspired AI/Complex Networks,https://scholar.google.com/citations?user=8voeILsAAAAJ&hl=en
19,Zhiguo Ding,"University of Manchester, Fellow of IEEE, Web of Science Highly Cited Researcher",91,8173,36359,84,32126,https://scholar.google.co.uk/citations?user=V-nB8scAAAAJ&hl=en,Wireless communications/signal processing/and cross-layer optimization,https://scholar.google.co.uk/citations?user=V-nB8scAAAAJ&hl=en
20,"Mianxiong Dong, Foreign Fellow of EAJ","Vice President and Professor, Muroran Institute of Technology, Japan",53,2161,10543,49,9164,https://u.muroran-it.ac.jp/enes/~mxdong/,Cyber-Physical Systems/Internet of Things/Artificial Intelligence,https://scholar.google.co.jp/citations?user=TqyApAUAAAAJ&hl=en
21,Yucheng Dong,"Professor of Management and Systems Sciences, Sichuan University",58,2322,11267,54,8987,https://dblp.org/pid/08/3009,Decision Analysis/Human Dynamics/Social Network/Data Science,https://scholar.google.com/citations?user=tFVYDw4AAAAJ&hl=en
22,Maged Elkashlan,"Associate Professor, Queen Mary University of London",60,2721,14759,53,12320,http://eecs.qmul.ac.uk/profiles/elkashlanmaged.html,IRS/URLLC/UAV/PLS/NOMA,https://scholar.google.com/citations?user=mncnnOAAAAAJ&hl=en
23,Zubair Md. Fadlullah,"Associate Professor, Research Chair, Department of Computer Science, Lakehead University, TBRHRI",39,1307,7308,37,5584,http://www.it.is.tohoku.ac.jp/~zubair/Contact.htm,Beyond 5G/Smart Health/UAV & Energy efficient Networks/QoS & Security/Deep Learning applications,https://scholar.google.com/citations?user=dZyfKpYAAAAJ&hl=en
24,Hossam Faris,"Professor, The University of Jordan",46,4404,10632,44,10404,https://scholar.google.com/citations?user=UEYd--YAAAAJ&hl=en,Data Science/Knowledge Systems/Data Mining/Evolutionary computation,https://scholar.google.com/citations?user=UEYd--YAAAAJ&hl=en
25,Giancarlo Fortino,"Full Prof. of Computer Engineering, University of Calabria, IEEE Fellow, Highly Cited Researcher",65,3660,15379,55,12304,https://dblp.org/pid/f/GiancarloFortino,Human-Machine Systems/Agent-based Computing/Internet of Things/Wearable Computing/Wireless/Body Area Networks,https://scholar.google.com/citations?user=ecImn1MAAAAJ&hl=it
26,Hamido Fujita,Iwate Prefectural University,64,4633,15970,64,14769,https://www.journals.elsevier.com/array/editorial-board/dr-hamido-fujita-phd,Machine Learning,https://scholar.google.com/citations?user=MxzV1nQAAAAJ&hl=en
27,Erik G. Larsson,"Professor, Dept. of Electrical Engineering (ISY), Linköping University, Sweden",84,6275,43632,67,27691,https://www.larssonsweden.com/,Wireless communications/statistical signal processing/localization/massive MIMO/networks,https://scholar.google.se/citations?user=79Lry6oAAAAJ&hl=en
28,Amir H. Gandomi,"Professor, University of Technology Sydney",74,6935,27115,63,20517,http://www.postdocjournal.com/Profile/Dr.-AMIR-H-GANDOMI.htm,Data Analytics/Genetic Programming/Engineering Optimization/Evolutionary Computation/Smart Cities,https://scholar.google.com/citations?user=VMf3wfMAAAAJ&hl=en
29,Xiaohua Ge,"Swinburne University of Technology, Melbourne, Australia",35,2046,6654,35,6454,https://www.swinburne.edu.au/research/our-research/access-our-research/find-a-researcher-or-supervisor/researcher-profile/?id=xge,Networked control systems/Cyber-physical systems/Multi-agent systems/Intelligent vehicles/Connected automated vehicles,https://scholar.google.com.au/citations?user=B37CYFoAAAAJ&hl=en
30,"Mohsen Guizani, FIEEE",Mohamed Bin Zayed University of Artificial Intelligence (MBZUAI),90,10630,42178,78,34814,https://5gwn.eai-conferences.org/2020/keynotes/,Internet of Things/Applied AI/ML and Cybersecurity,https://scholar.google.com/citations?user=RigrYkcAAAAJ&hl=en
31,Song Guo,"FCAE, FIEEE, The Hong Kong Polytechnic University",71,4293,20549,65,16568,https://scholar.google.com/citations?user=Ib-sizwAAAAJ&hl=en,Big Data Computing/Edge AI/Mobile Computing/Distributed System,https://scholar.google.com/citations?user=Ib-sizwAAAAJ&hl=en
32,Harald Haas,The University of Edinburgh,93,5510,44407,75,28387,https://uk.linkedin.com/in/hhaas,Optical Wireless Communications/Interference Managment in Wireless Networks/Spatial Modulation,https://scholar.google.com/citations?user=XxIwRJQAAAAJ&hl=ja
33,Yuki Hagiwara,Fraunhofer IKS,29,1956,6215,29,6194,https://muckrack.com/yuki-hagiwara,Artificial Intelligence,https://scholar.google.com.sg/citations?user=P6WI2DQAAAAJ&hl=en
34,"Qing-Long Han, Pro Vice-Chancellor and Distinguished Professor, MAE, IEEE Fellow",Swinburne University of Technology,108,6357,37188,88,24991,https://www.ae-info.org/ae/User/Han_Qing-Long,Networked control systems/time-delay systems/multi-agent systems/smart grids/unmanned surface vehicles,https://scholar.google.com.au/citations?user=j0pyptAAAAAJ&hl=en
35,Zhu Han,University of Houston,118,8410,55717,89,36355,https://zyy123jy.github.io/My-Web-Sites//,Game Theory/Wireless Networking/Security/Data Science/Smart Grid,https://scholar.google.com/citations?user=ty7wIXoAAAAJ&hl=en
36,L Hanzo,"Chair of Telecommunications, University of Southampton",108,8276,65485,81,32736,https://scholar.google.co.uk/citations?user=p0jnEW0AAAAJ&hl=en,telecommunications/wireless communication/quantum_information_science/video_coding/video_networking,https://scholar.google.co.uk/citations?user=p0jnEW0AAAAJ&hl=en
37,L Hanzo,"Chair of Telecommunications, University of Southampton",108,8276,65485,81,32736,https://scholar.google.co.uk/citations?user=p0jnEW0AAAAJ&hl=en,telecommunications/wireless communication/quantum_information_science/video_coding/video_networking,https://scholar.google.co.uk/citations?user=p0jnEW0AAAAJ&hl=en
38,Robert Heath,"Lampe Distinguished Professor, North Carolina State University",134,7686,79090,89,40573,http://www.profheath.org/,wireless/MIMO/communications/signal processing/information theory,https://scholar.google.com/citations?user=17Ko8Q0AAAAJ&hl=en
39,Francisco Herrera,"Professor Computer Science and AI, Granada University, Spain",160,14758,109983,119,57878,https://ccia.ugr.es/~herrera/index.html,Artificial Intelligence/Computational Intelligence/Data mining/Evolutionary Algorithms/Big Data Analytics,https://scholar.google.com/citations?user=HULIk-QAAAAJ&hl=en
40,Enrique Herrera-Viedma,"Professor of Computer Science and Artificial Intelligence, Spain, University of Granada",108,6080,46231,87,25071,https://dasci.es/about-dasci/resources/human-resources/enrique-herrera-viedma/,Fuzzy sets/fuzzy decision making/computing with words/multiple criteria decision making/consensus,https://scholar.google.com/citations?user=g8ZXTuYAAAAJ&hl=en
41,Ekram Hossain,"Professor, University of Manitoba, Canada, IEEE Fellow",96,3181,35764,70,18074,https://www.comsoc.org/ekram-hossain-0,Wireless communication networks/radio resource allocation/cognitive radio/multi-tier cellular networks,https://scholar.google.com/citations?user=Lb617EMAAAAJ&hl=en
42,Guang-Bin Huang,"Full Professor, Nanyang Technological University, Singapore",70,5539,53348,60,31368,https://www.ntu.edu.sg/research/research-capabilities/faculty-directory,Machine Learning/Neural Networks/Neuroscience,https://scholar.google.com.sg/citations?user=LhSqQCIAAAAJ&hl=en
43,Kaibin Huang,"Associate Professor, Dept. of EEE, The University of Hong Kong; IEEE Fellow",51,2885,14162,40,10821,https://dblp.org/pid/21/506,Machine Learning/Mobile Edge Computing/Wireless Communications/Wireless Power Transfer/Stochastic Geometry,https://scholar.google.com/citations?user=HfuA3uIAAAAJ&hl=en
44,Thomas JR Hughes,"Peter O'Donnell Jr. Chair in Computational and Applied Mathematics, University of Texas at Austin",149,7076,125811,90,38384,http://users.oden.utexas.edu/~hughes/,Finite Element Methods/Solid Mechanics/Computational Fluid Dynamics/Partial Differential Equations/Isogeometric Analysis,https://scholar.google.com/citations?user=6tPdlYAAAAAJ&hl=en
45,Yaochu Jin,"A. v. Humboldt Professor for AI, Bielefeld University and Distinguished Chair, University of Surrey",85,5648,30335,70,18481,https://www.surrey.ac.uk/people/yaochu-jin,Artificial Intelligence/Evolutionary Computation/Multiobjective Optimization/Federated Learning/Developmental AI,https://scholar.google.com/citations?user=B5WAkz4AAAAJ&hl=en
46,"Nei Kato(IEEE Fellow, IEICE Fellow)","Professor, Graduate School of Information Sciences, Tohoku University, Japan",73,3138,21133,57,13544,https://orcid.org/0000-0001-8769-302X,Wireless networking,https://scholar.google.com/citations?user=LfLfZXEAAAAJ&hl=en
47,"Dr. Neeraj Kumar, SMIEEE (Web of Science Highly Cited Researcher 2019, 2020,2021)","Professor, CSED, Thapar Institute of Engineering and Technology, India",88,9930,26623,83,24627,https://scholar.google.com/citations?user=gL9gR-4AAAAJ&hl=ko,IoT and Machine Learning/Deep Learning/Blockchain Technology,https://scholar.google.co.in/citations?user=gL9gR-4AAAAJ&hl=en
48,"Dr. Arun Kumar Sangaiah., Ph.D (SM'IEEE)","Professor, School of Computing Science and Engineering, VIT University, Vellore, India",68,4662,14090,68,13896,https://0-scholar-google-com.brum.beds.ac.uk/citations?user=8yF6Xc4AAAAJ&hl=ja,Software Engineering/Computational Intelligence/Internet of Things,https://scholar.google.co.in/citations?user=8yF6Xc4AAAAJ&hl=en
49,Victor C. M. Leung,Shenzhen University / The University of British Columbia,101,6315,46693,81,29230,https://www.researchgate.net/scientific-contributions/Victor-C-M-Leung-2169125644,communication systems/wireless networks/mobile systems,https://scholar.google.ca/citations?user=ajvCoo4AAAAJ&hl=en
50,Geoffrey Ye Li (李烨),"Chair Professor in Wireless Systems, Dept EEE, Imperial College London",106,5764,51794,78,23469,https://scholar.google.com/citations?user=d0FzG8YAAAAJ&hl=vi,Signal Processing/and/Machine Learning/for/Wireless Communications,https://scholar.google.com/citations?user=d0FzG8YAAAAJ&hl=en
51,Hongyi Li,"Assistant Professor, University of Houston",32,918,3478,28,2890,https://dl.acm.org/profile/99659030098,watershed hydrology/earth system modeling/coupled human-nature system,https://scholar.google.com/citations?user=yWy-5icAAAAJ&hl=en
52,Jin Li  李进,Professor @Guangzhou University,58,1943,18434,51,12018,http://scholar.google.com/citations?user=7GDV2vUAAAAJ&hl=zh-CN,Trust and Security in Artificial Intelligence/Computating and Storage in Cloud Computing/Blockchain,https://scholar.google.com/citations?user=7GDV2vUAAAAJ&hl=en
53,Xuelong Li (Executive Councilor of AAAI),"Professor, Northwestern Polytechnical University, China",117,8322,52589,95,35987,http://acaciacoatings.com/tuwys/aaai-2013.html,artificial intelligence/optics and electronics,https://scholar.google.com/citations?user=ahUibskAAAAJ&hl=en
54,yongming li,"college of computer science, shaanxi normal university",37,419,4850,24,2318,https://scholar.google.com/citations?user=P3VERZ0AAAAJ&hl=zh-CN,fuzzy systems/quantume logic and quantum information/lattice/topology/model checking,https://scholar.google.com/citations?user=P3VERZ0AAAAJ&hl=en
55,Huchang Liao (廖虎昌),"IET Fellow, BCS Fellow; Business School, Sichuan University",61,3732,12203,57,11135,https://scholar.google.co.uk/citations?user=KlWnnbIAAAAJ&hl=en,Decision analysis/Fuzzy Systems/Multiple criteria decision making/Preference learning,https://scholar.google.co.uk/citations?user=KlWnnbIAAAAJ&hl=en
56,Chong Lin,Qingdao University,69,1996,15997,51,8713,https://www.facebook.com/public/Chong-Lin,systems and control theory,https://scholar.google.com/citations?user=AQbRErEAAAAJ&hl=en
57,Yan-Jun Liu,Liaoning University of Technology,61,2401,13744,57,10325,https://pku.academia.edu/YanjunLiu,Adaptive control/fuzzy control/neural networks,https://scholar.google.com/citations?user=x_Wk1jAAAAAJ&hl=en
58,Yuanwei Liu,"Associate Professor in Queen Mary University of London, Web of Science Highly Cited Researcher",48,3551,11093,47,10813,http://www.eecs.qmul.ac.uk/~yuanwei/,NOMA/RIS/AI/6G/Integrated Sensing and Communications,https://scholar.google.com/citations?user=FxLf7ZAAAAAJ&hl=en
59,Wenjing Lou,"W. C. English Endowed Professor, IEEE Fellow, Virginia Tech, USA",81,2718,38824,57,18380,https://ieeexplore.ieee.org/author/37275345500,Cyber Security/Wireless Networks/Wireless Security/Network Security/Cloud Computing,https://scholar.google.com/citations?user=hM8uAwoAAAAJ&hl=en
60,Majdi Mafarja,"Associate Professor of Computer Science, Birzeit University",33,2701,6011,32,5959,https://scholar.google.com/citations?user=ftkD0MgAAAAJ&hl=en,Feature Selection/Machine Learning/Artificial Intelligence/Bio-inspired Algorithms/Metaheuristics,https://scholar.google.com/citations?user=ftkD0MgAAAAJ&hl=en
61,Luis Martínez,"Professor of Computer Science, University of Jaén",61,2807,22109,50,12121,https://lmartinezphotos.com/home,Fuzzy decision making/Computing with words/Recommender Systems,https://scholar.google.com/citations?user=PG3D8UMAAAAJ&hl=en
62,Thomas Marzetta,"Distinguished Industry Professor, Department of Electrical and Computer Engineering, New York",58,4637,46350,44,27145,https://ieeexplore.ieee.org/author/37282754500,Beyond Massive MIMO,https://scholar.google.com/citations?user=tBLWIBoAAAAJ&hl=en
63,Seyedali Mirjalili,"Professor, Torrens University Australia, Adjunct Griffith University",73,17231,46199,71,44035,https://research.torrens.edu.au/en/persons/seyedali-mirjalili,Metaheuristics/Robust Optimization/Engineering Optimization/Evolutionary Algorithm/Swarm Intelligence,https://scholar.google.com/citations?user=TJHmrREAAAAJ&hl=en
64,Andreas F. Molisch,"Professor of Electrical Engineering, University of Southern California",101,5192,58243,70,26924,https://dl.acm.org/profile/81501670725,wireless propagation channels/multi-antenna systems/ultrawideband communications and positioning/cooperative communications,https://scholar.google.com/citations?user=W0wwrucAAAAJ&hl=en
65,Derrick Wing Kwan Ng,"Scientia  Assoicate Professor,  University of New South Wales",64,3959,18334,60,15668,https://www.researchgate.net/profile/Derrick-Wing-Kwan-Ng,Wireless Communications,https://scholar.google.com/citations?user=NUJSHxoAAAAJ&hl=en
66,H. Nguyen-Xuan,"CIRTech Institute, HUTECH University, Vietnam",67,2534,15229,57,10579,http://tdt.academia.edu/TrVilo/CurriculumVitae,Computational Engineering/Large-scale data/3D Printing/Renewable Energy,https://scholar.google.co.uk/citations?user=3iK9h-gAAAAJ&hl=en
67,Dusit (Tao) Niyato,Nanyang Technological University (NTU),101,8660,45817,82,30927,https://dl.acm.org/profile/81313481268,ดุสิต นิยะโต - เต๋า,https://scholar.google.com/citations?user=T8sVhLMAAAAJ&hl=en
68,Kaoru Ota (太田　香),"MEXT Excellent Young Researcher (文部科学省　卓越研究員), Muroran Institute of Technology",49,2054,9391,47,8517,https://www.adscientificindex.com/university/Muroran+Institute+of+Technology/,,https://scholar.google.com/citations?user=8JVn8RsAAAAJ&hl=ja
69,Mugen Peng,"Beijing University of Posts & Telecommun., IEEE Fellow, Web of Science Highly Cited Researcher",53,2302,15071,44,10448,https://dl.acm.org/profile/81456639314,Fog Computing/Cloud Radio Access Networks/Integrated Satellite-Terrestrial Networks/6G,https://scholar.google.com/citations?user=85mAZVcAAAAJ&hl=en
70,HV Poor,"Michael Henry Strater University Professor, Princeton University",154,14277,118992,103,57535,https://en.wikipedia.org/wiki/Vincent_Poor#Education,Communication Systems/Wireless Communications/Communications/Statistical Signal Processing/Information Theory,https://scholar.google.com/citations?user=Dq93mOUAAAAJ&hl=en
71,Lianyong Qi(齐连永),"Professor, Qufu Normal University",41,1819,5267,40,5019,https://scholar.google.ca/citations?user=aTZFM3EAAAAJ&hl=en,service computing/big data/recommender system,https://scholar.google.com/citations?user=pxNRRsAAAAAJ&hl=en
72,Timon Rabczuk,Bauhaus University Weimar,106,7448,40411,89,29870,https://www.uni-weimar.de/en/civil-engineering/chairs/computational-mechanics/home/,Computational Mechanics/Solid Mechanics,https://scholar.google.ca/citations?user=3CBuGosAAAAJ&hl=en
73,Kim-Kwang Raymond Choo,"Cloud Tech Endowed Professor, University of Texas at San Antonio; Highly Cited Researcher 2020, 2021",91,6433,23633,83,21199,https://www.acm.org/articles/people-of-acm/2021/raymond-choo,Cloud Forensics/Cyber Forensics/Cyber Security/IoT Security/Blockchain,https://scholar.google.com/citations?user=rRBNI6AAAAAJ&hl=en
74,Kui Ren,"Professor, Zhejiang University, ACM Fellow, IEEE Fellow",83,3636,39147,67,21343,https://www.buffalo.edu/~kuiren,Data Security & Privacy/IoT Security/AI Security,https://scholar.google.com/citations?user=uuQA_rcAAAAJ&hl=en
75,Walid Saad,"Professor, Electrical and Computer Engineering",80,7383,30616,73,25574,http://resume.walid-saad.com/,6G/machine learning/semantic communications/security and cyber-physical systems/unmanned aerial vehicles,https://scholar.google.com/citations?user=kYDNA0UAAAAJ&hl=en
76,Robert Schober,Friedrich-Alexander-University Erlangen-Nuremberg,92,5425,41578,74,26614,https://dblp.org/pid/95/2265,,https://scholar.google.com/citations?user=Uu0BpX8AAAAJ&hl=en
77,"Ling Shao, Fellow of IEEE/IAPR","CTO and Chief Scientist, National Center for Artificial Intelligence (NCAI), SDAIA, KSA",81,8267,29869,78,24814,https://www.aaia-ai.org/fellows?page=14,Computer Vision/Deep Learning/Artificial Intelligence/Medical Imaging/Vision and Language,https://scholar.google.com/citations?user=z84rLjoAAAAJ&hl=en
78,Xuemin (Sherman) Shen,"University Professor, University of Waterloo",130,8953,71806,100,40516,http://bbcr.uwaterloo.ca/~xshen/,Wireless networking/MAC/Network security/VANET,https://scholar.google.com/citations?user=Bjl3GwoAAAAJ&hl=cs
79,Peng Shi,"Professor, School of Electrical and Electronic Engineering, The University of Adelaide",149,8316,75895,111,43833,https://www.pengshi.com/,Systems and Control/Electrical and Electronic Engineering/Cybernetics/Human-Computer Interaction,https://scholar.google.com.hk/citations?user=EGx1iH0AAAAJ&hl=en
80,"Dr. P. N. Suganthan (SCI Highly Cited Researcher 2015-2021), FIEEE'2015","Some Codes available at GitHub, (Hon. Doctorate, U. of Maribor, 2020 ; BA & MA, U. of Cambridge, UK)",103,7054,55551,86,31456,https://www.timeshighereducation.com/hub/macau-university-science-and-technology/p/highly-cited-researchers-must,Machine Learning(ML)/Swarm-Evolutionary Computation(SEC)/Neural Networks(ANN)/Applications of ML SEC ANN.,https://scholar.google.com/citations?user=yZNzBU0AAAAJ&hl=en
81,Xingming Sun,Nanjing University of Information Science and Technology,57,1668,15157,50,11928,https://www.aminer.cn/profile/xingming-sun/56cb1892c35f4f3c65651e67,Digital Watermarking/Information Security,http://scholar.google.com/citations?user=epqnljMAAAAJ&hl=en
82,Tarik Taleb,University of Oulu,66,3509,18450,58,14028,https://scholar.google.com/citations?user=o1Ap0TEAAAAJ&hl=en,Network Function Virtualization/Network Softwarization/Software Defined Networking,https://scholar.google.com/citations?user=o1Ap0TEAAAAJ&hl=en
83,"jen hong, tan","Highly Cited Researcher in Computer Science, National University of Singapore",47,2304,9182,43,8294,https://sg.linkedin.com/in/jen-hong-tan-804b282b?trk=people-guest_people_search-card,image processing/computer vision/deep learning/infrared thermography/fundus image,https://scholar.google.com/citations?user=uJlD-A0AAAAJ&hl=en
84,Dacheng Tao,The University of Sydney,138,13867,73874,112,52607,https://www.computer.org/profiles/dacheng-tao/,artificial intelligence/machine learning/computer vision/image processing/data mining,https://scholar.google.com/citations?user=RwlJNLcAAAAJ&hl=en
85,Athanasios Vasilakos,"PROF OF COMPLEX SYSTEMS, CYBERSECURITY, AI",123,7326,54998,104,38132,http://www.athanasiosvasilakos.gr/,Cybersecurity/IoTs/Mobile Nets/Big Data Analytics/Cloud Computing/Artificial Intelligence/Machine Learning,https://scholar.google.com/citations?user=_yWPQWoAAAAJ&hl=en
