79,"Dr. P. N. Suganthan (SCI Highly Cited Researcher 2015-2021), FIEEE'2015","Some Codes available at GitHub, (Hon. Doctorate, U. of Maribor, 2020 ; BA & MA, U. of Cambridge, UK)",106,7067,57258,89,33102,https://scholar.google.com.co/citations?user=bCJAc_8AAAAJ&hl=vi,Machine Learning(ML)/Swarm-Evolutionary Computation(SEC)/Neural Networks(ANN)/Applications of ML SEC ANN.,https://scholar.google.com/citations?user=yZNzBU0AAAAJ&hl=en
80,Xingming Sun,Nanjing University of Information Science and Technology,57,1668,15527,51,12299,http://scholar.google.com/citations?user=epqnljMAAAAJ&hl=en,Digital Watermarking/Information Security,http://scholar.google.com/citations?user=epqnljMAAAAJ&hl=en
81,Tarik Taleb,University of Oulu,67,3609,19207,59,14777,https://ieeexplore.ieee.org/author/37265763700,Network Function Virtualization/Network Softwarization/Software Defined Networking,https://scholar.google.com/citations?user=o1Ap0TEAAAAJ&hl=en
82,"jen hong, tan","Highly Cited Researcher in Computer Science, National University of Singapore",48,2301,9691,44,8797,https://ieeexplore.ieee.org/author/37087208409,image processing/computer vision/deep learning/infrared thermography/fundus image,https://scholar.google.com/citations?user=uJlD-A0AAAAJ&hl=en
83,Dacheng Tao,The University of Sydney,139,13914,77036,116,55744,https://www.science.org.au/profile/dacheng-tao,artificial intelligence/machine learning/computer vision/image processing/data mining,https://scholar.google.com/citations?user=RwlJNLcAAAAJ&hl=en
84,Athanasios Vasilakos,"PROF OF COMPLEX SYSTEMS, CYBERSECURITY, AI",126,7428,56605,105,39704,https://scholar.google.com/scholar?q=Athanasios+Vasilakos+homepage&hl=en&as_sdt=0&as_vis=1&oi=scholart,Cybersecurity/IoTs/Mobile Nets/Big Data Analytics/Cloud Computing/Artificial Intelligence/Machine Learning,https://scholar.google.com/citations?user=_yWPQWoAAAAJ&hl=en
85,Huanqing Wang,Michigan Technological University,4,9,36,4,36,https://www.linkedin.com/in/huanqing-wang,Electric vehicle/optimal control/model predictive control,https://scholar.google.com/citations?user=6XxgmPEAAAAJ&hl=en
86,Ping Wang,"York University, IEEE Fellow, York Research Chair, IEEE VTS Distinguished Lecturer",70,3536,21570,56,15970,https://economics.wustl.edu/people/ping-wang,wireless communications/Internet of Things/cloud computing/smart grid,https://scholar.google.com/citations?user=3sIHxrcAAAAJ&hl=en
87,Qingqing Wu (武庆庆),"Assistant Professor, University of Macau",46,5065,12934,45,12810,https://www.fst.um.edu.mo/people/qingqingwu/,6G/IRS/UAV communications/Machine learning/MIMO transceiver design,https://scholar.google.com/citations?user=as1T8CMAAAAJ&hl=en
88,Zheng-Guang Wu,Zhejiang University,72,2548,16036,65,11866,https://scholar.google.com/scholar_url?url=https://onlinelibrary.wiley.com/doi/abs/10.1002/ange.201806323&hl=en&sa=X&ei=tx-QYumjLoqaygSozpTQCQ&scisig=AAGBfm1j7YrDvMGrzDqussk03n-vsjAOuw&oi=scholarr,Markov Jump Systems/Sampled-Data Control Systems/Neural Networks/Fuzzy Systems/Singular Systems,https://scholar.google.com/citations?user=vy6JCNgAAAAJ&hl=en
89,Yang Xiang,"IEEE Fellow, Professfor, Swinburne University of Technology",66,2751,16257,58,12635,https://psychology.fas.harvard.edu/people/yang-xiang,Cybersecurity/Network Security/System Security/Software Vulnerability Detection/Blockchain,https://scholar.google.com/citations?user=7ymTWY4AAAAJ&hl=en
90,Xiaolong Xu (许小龙),"Professor, Highly Cited Researcher 2021, Nanjing University of Information Science and Technology",38,1458,4687,38,4632,https://scholar.google.ca/citations?user=Tyzef4sAAAAJ&hl=th,Edge computing/Cloud computing/Big data/Fog computing/Mobile computing,https://scholar.google.com/citations?user=Tyzef4sAAAAJ&hl=en
91,Zeshui Xu (徐泽水),"Academician of EASA,IASCYS; DFIETI,FIEEE,FIFSA,FIET,FRSA,FORS,FBCS,FIAAM,FAAIA... Sichuan University",138,9231,72887,106,42513,https://www.adscientificindex.com/university/Sichuan+University/,Decision Making/Information Fusion/Fuzzy Sets/Computational Intelligence/Bibliometrics,https://scholar.google.co.uk/citations?user=kd9L_GUAAAAJ&hl=en
92,Xin-She Yang (DPhil),"Computational intelligence, swarm intelligence, optimization, metaheuristics, nature-inspired",91,10482,69927,82,47859,https://scholar.google.com/scholar_url?url=https://arxiv.org/pdf/1403.7793&hl=en&sa=X&ei=vB-QYo3wIqCM6rQPru2DMA&scisig=AAGBfm27thJw0a5S4uk3Q77JHPjmq4NQAQ&oi=scholarr,swarm intelligence/optimization/metaheuristics/computational intelligence.,https://scholar.google.com/citations?user=fA6aTlAAAAAJ&hl=th
93,Fei Yu,University of Southern Denmark,9,71,258,8,196,https://www.biostat.ucla.edu/people/yu,Industry 4.0 technology and smart product development,https://scholar.google.com/citations?user=3OHgAmIAAAAJ&hl=en
94,Xiangxiang Zeng,"Deparment of Computer Science, Hunan University",49,1598,6623,40,5440,https://ieeexplore.ieee.org/author/37087074633,Computational Intelligence/Bio-inspired Intelligence,https://scholar.google.com/citations?user=B20HBMIAAAAJ&hl=en
95,Yong Zeng (曾勇）,"Southeast University, China; Purple Mountain Laboratories, China",47,3809,15326,47,14837,http://www.gkcccc.org/openchurch/multimedia/podcasts/%E7%B4%84%E6%8B%BF%E5%88%B0%E5%9B%9E%E8%BD%89?page=19,UAV communications/Massive MIMO/Extremely-Large MIMO (XL-MIMO)/Integrated Sensing and Communication,https://scholar.google.com/citations?user=ENldmwIAAAAJ&hl=en
96,Jianming Zhan,Hubei University for Nationalities,43,1034,7037,36,4490,https://ieeexplore.ieee.org/author/37666269500,logical algebras(BL-algebras/R0-algebras and MTL-algebras)/fuzzy algebras(semirings/hemirings and rings) and their hyperstuctures(hyperring/hypergroups,https://scholar.google.com/citations?user=XmJAmNIAAAAJ&hl=en
97,Haijun Zhang,"Professor, University of Science and Technology Beijing",45,1888,10155,43,8954,https://scholar.google.ca/citations?user=XEiWEDAAAAAJ&hl=en,6G/AI enabled Wireless Communications/Resource Allocation/Mobility Management,https://scholar.google.ca/citations?user=B3oYgSIAAAAJ&hl=en
98,Rui Zhang,"Chair Professor, National University of Singapore",120,12409,62677,103,46966,https://www.pharmacy.umn.edu/bio/institute-of-personalized-medi/rui-zhang,Wireless Communications/MIMO/Cognitive Radio/Wireless Power Transfer/UAV,https://scholar.google.com.sg/citations?user=yoJqPIkAAAAJ&hl=en
99,Xian-Ming Zhang,Swinburne University of Technology,47,2215,11324,41,9272,https://orcid.org/0000-0003-0691-5386,Networked Control Systems/Event-triggered Control/H-infinity Filtering/Time-delay Systems/Neural Networks,https://scholar.google.com/citations?user=aZcLkqgAAAAJ&hl=en
100,Xuyun Zhang,Macquarie University,42,1197,6132,39,5023,https://researchers.mq.edu.au/en/persons/xuyun-zhang,big data mining/scalable machine learning/big data privacy and cybersecurity/cloud/edge computing/Internet of Things,https://scholar.google.com.au/citations?user=wbF6HL8AAAAJ&hl=en
101,Yan Zhang,"IEEE Fellow, Highly Cited Researcher, University of Oslo, Norway",93,6292,30464,78,22838,https://www.bakerbotts.com/people/z/zhang-yan,wireless networks/smart grid/edge intelligence/blockchain/digital twin,https://scholar.google.no/citations?user=-gahn9AAAAAJ&hl=no
102,Quan Zou (邹权),University of Electronic Science and Technology of China,69,3192,14459,62,12016,http://school.freekaoyan.com/tj/tju/daoshi/2016/02-03/1454482346483790.shtml,Bioinformatics/data mining,https://scholar.google.com/citations?user=RcaUHs4AAAAJ&hl=en
