,Name,Affilation,H-index,Citations 2020,Total_citation,H-index_since_2016,Citation_since_2016,HomePage,Area of Research,Google_Scholar
0,"U Rajendra Acharya (SCI Highly Cited Researcher 2016-2021)  PhD, DEng, DSc","Ngee Ann,  Singapore University of Social Science,  University of Malaya, Malaysia",112,11136,48415,96,35855,https://scholar.google.com/citations?user=8FjY99sAAAAJ&hl=en,Artificial Intelligence/Medical Informatics,https://scholar.google.com.sg/citations?user=8FjY99sAAAAJ&hl=en
1,IAN  F.  AKYILDIZ,"Truva Inc. , USA",132,6232,132437,78,37232,https://ieeexplore.ieee.org/author/37272190700,Wireless Communication/5G/6G Wireless Systems/Intelligent Surfaces for Wireless Communication/Nano-scale and Molecular Commun,https://scholar.google.com/citations?user=rAGwv14AAAAJ&hl=en
2,Ibrahim Aljarah,"Associate Professor, University of Jordan",43,3206,7436,41,7261,https://jo.linkedin.com/in/ibrahim-aljarah-phd-620a8735,Artificial  intelligence/Swarm Intelligence/Data Science/Machine Learning/Evolutionary Computation,https://scholar.google.com/citations?user=moOTIYEAAAAJ&hl=en
3,Jeffrey Andrews,"Cockrell Family Endowed Chair in Engineering, University of Texas at Austin",105,3607,65059,70,28445,https://www.comsoc.org/jeffrey-andrews,Wireless Communications/Communication Theory/Machine Learning for Communications/Stochastic Geometry/Information Theory,https://scholar.google.com/citations?user=Hr9Gey0AAAAJ&hl=en
4,Bennis Mehdi,"Full Professor, IEEE Fellow, Head of ICON, University of Oulu",65,6586,23172,61,20562,https://www.oulu.fi/university/researcher/mehdi-bennis,B5G/6G/machine learning/semantic communication,https://scholar.google.com/citations?user=RW4sJu8AAAAJ&hl=en
5,Emil Björnson,"Professor of Wireless Communication, KTH Royal Institute of Technology",61,4327,16993,58,14129,https://massivemimobook.com/wp/,Massive MIMO/Cell-free Massive MIMO/RIS/Signal processing/Wireless communication,https://scholar.google.se/citations?user=Maij4akAAAAJ&hl=en
6,Rajkumar Buyya,"CLOUDS Lab, School of Computing and Information Systems, The University of Melbourne, Australia",153,10572,121210,102,57704,https://fedcsis.org/2021/keynotes/buyya,Computer Systems/Cloud Computing/Distributed Systems/Edge Computing/Internet of Things,https://scholar.google.com/citations?user=7xN6JqYAAAAJ&hl=en
7,Xing Cai,"Senior Research Scientist at Simula Research Laboratory, Professor at University of Oslo",19,138,1997,13,708,https://koei.fandom.com/wiki/Xingcai,Parallel programming/High-performance computing/numerical methods for PDEs,https://scholar.google.com/citations?user=IWQbrcK5CEwC&hl=en
8,Giuseppe Caire,"Professor, Technical University of Berlin, Germany, and Professor of Electrical Engineering (on",82,2768,38613,53,15161,https://dl.acm.org/profile/81100014135,Information Theory/Communications/Signal Processing/Statistics,https://scholar.google.com/citations?user=g66ErTcAAAAJ&hl=en
9,Jinde Cao,"Academician, RAE/AE/RAEN/LAS/AAS/EASA/PAS/IASCYS  & FIEEE/FAAIA/DFIETI; Southeast University",129,9050,67483,87,37719,https://scholar.google.com/scholar_url?url=https://onlinelibrary.wiley.com/doi/abs/10.1002/asjc.492&hl=en&sa=X&ei=lmfjYYT-BIqKmgGLjK2IAQ&scisig=AAGBfm2fx2uYWmczjvG7X9fymKxM_uWzgg&oi=scholarr,Complex networks/neural networks/multi-agent systems - engineering stability - dynamics and control - time-delay systems,https://scholar.google.com/citations?user=8_ffELYAAAAJ&hl=en
10,C. L. Philip Chen,"Chair Professor, South China University of Technology, Philip.Chen@ieee.org",92,7336,35458,81,25830,https://scholar.google.com/scholar?q=C.+L.+Philip+Chen+homepage&hl=en&as_sdt=0&as_vis=1&oi=scholart,Computational Intelligence/Intelligent Control/Cybernetics/Intelligent Transportation Systems/Data Science/Engineering,https://scholar.google.com/citations?user=Q5248zwAAAAJ&hl=en
11,Jinjun Chen,"Professor and Deputy Institute Director, Swinburne University of Technology",67,2357,12422,48,8180,https://scholar.google.com/citations?user=mQ9vJ24AAAAJ&hl=en,Cloud Computing/Scalable Architecture/Scalable Data Storage/Scalable Data Processing (Privacy),https://scholar.google.com/citations?user=mQ9vJ24AAAAJ&hl=en
12,Min Chen,"Professor, IEEE Fellow, Highly Cited Researcher, Huazhong University of Science and Technology",86,5623,32321,68,23231,https://sites.google.com/view/minchen/home,Cognitive Computing and Big Data Analytics/IoT Sensing/5G Networks/Robotics/Edge Computing,https://scholar.google.com/citations?user=_HyHTrsAAAAJ&hl=en
13,Xiaofeng Chen,"Professor, Xidian University, China",56,1625,12659,47,9182,https://sites.google.com/site/xiaofengchenstruct,Security/Cryptography/Cloud computing,https://scholar.google.com/citations?user=-3WhJecAAAAJ&hl=en
14,Francisco Chiclana,"Professor of Computational Intelligence and Decision Making, De Montfort University, UK",67,2508,19176,58,10775,https://www.tech.dmu.ac.uk/~chiclana/,Decision making/computational intelligence/information fusion/consensus/sentiment analysis,https://scholar.google.com/citations?user=qDOxZIIAAAAJ&hl=en
15,zhihua cui,"Taiyuan University of Science and Technology, Taiyuan, Shanxi, China, 030024",42,1721,7629,33,5415,https://www.zhihuacui.com/works,evolutionary computation,https://scholar.google.com/citations?user=BpDrULIAAAAJ&hl=en
16,Linglong Dai,"Associate Professor, Tsinghua University; IEEE Fellow",62,3169,15275,56,13626,https://www.aminer.org/profile/linglong-dai/53f38c14dabfae4b34a36d83,Wireless Communications/RIS/Massive MIMO/Millimeter-Wave/Teraherz Communications/Non-Orthogonal Mutiple Access,https://scholar.google.com/citations?user=OTFnifoAAAAJ&hl=en
17,Merouane Debbah,"Centralesupelec, Technology Innovation Institute, MBZUAI, Lagrange Mathematics Center",98,8653,45810,82,31410,https://www.youtube.com/watch?v=XRu6uzmAJHU&t=1416,5G/6G/Machine Learning/Random Matrix Theory/Game Theory,https://scholar.google.com/citations?user=HU5I0X4AAAAJ&hl=en
18,Yong Deng,"School of Computer and Information Science, Southwest University",73,3546,19047,64,14323,https://dblp.org/pid/66/3604,Evidence Theory/Fuzzy Set Theory/Bio-inspired AI/Complex Networks,https://scholar.google.com/citations?user=8voeILsAAAAJ&hl=en
19,Zhiguo Ding,"University of Manchester, Fellow of IEEE, Web of Science Highly Cited Researcher",88,7790,35066,83,30778,https://ieeexplore.ieee.org/author/37278653500,Wireless communications/signal processing/and cross-layer optimization,https://scholar.google.co.uk/citations?user=V-nB8scAAAAJ&hl=en
20,"Mianxiong Dong, Foreign Fellow of EAJ","Vice President and Professor, Muroran Institute of Technology, Japan",53,2019,10136,47,8757,https://u.muroran-it.ac.jp/enes/~mxdong/,Cyber-Physical Systems/Internet of Things/Artificial Intelligence,https://scholar.google.co.jp/citations?user=TqyApAUAAAAJ&hl=en
21,Yucheng Dong,"Professor of Management and Systems Sciences, Sichuan University",57,2305,10969,52,8645,https://www.journals.elsevier.com/computers-and-industrial-engineering/editorial-board/yucheng-dong,Decision Analysis/Human Dynamics/Social Network/Data Science,https://scholar.google.com/citations?user=tFVYDw4AAAAJ&hl=en
22,Maged Elkashlan,"Associate Professor, Queen Mary University of London",58,2579,14331,52,11869,https://dblp.org/pid/98/6377,IRS/URLLC/UAV/PLS/NOMA,https://scholar.google.com/citations?user=mncnnOAAAAAJ&hl=en
23,Zubair Md. Fadlullah,"Associate Professor, Research Chair, Department of Computer Science, Lakehead University, TBRHRI",38,1194,7010,35,5309,http://www.it.is.tohoku.ac.jp/~zubair/Contact.htm,Beyond 5G/Smart Health/UAV & Energy efficient Networks/QoS & Security/Deep Learning applications,https://scholar.google.com/citations?user=dZyfKpYAAAAJ&hl=en
24,Hossam Faris,"Professor, The University of Jordan, Al Hussein Technical University",44,4257,9845,44,9618,https://www.researchgate.net/profile/Hossam-Faris,Data Science/Knowledge Systems/Data Mining/Evolutionary computation,https://scholar.google.com/citations?user=UEYd--YAAAAJ&hl=en
25,Giancarlo Fortino,"Full Prof. of Computer Engineering, University of Calabria, IEEE Fellow, Highly Cited Researcher",63,3474,14779,56,11745,https://labs.dimes.unical.it/speme/people/giancarlo-fortino/,Human-Machine Systems/Agent-based Computing/Internet of Things/Wearable Computing/Wireless/Body Area Networks,https://scholar.google.com/citations?user=ecImn1MAAAAJ&hl=it
26,Hamido Fujita,Iwate Prefectural University,63,4667,15064,63,13964,https://www.youtube.com/watch?v=2TIxd5UW_JM&t=2141,Machine Learning,https://scholar.google.com/citations?user=MxzV1nQAAAAJ&hl=en
27,Erik G. Larsson,"Professor, Dept. of Electrical Engineering (ISY), Linköping University, Sweden",84,5949,42714,63,26728,https://ma-mimo.ellintech.se/author/egl/,Wireless communications/statistical signal processing/localization/massive MIMO/networks,https://scholar.google.se/citations?user=79Lry6oAAAAJ&hl=en
28,Amir H. Gandomi,"Professor, University of Technology Sydney",73,6677,25774,61,19150,https://scholar.google.com/citations?user=VMf3wfMAAAAJ&hl=en,Data Analytics/Genetic Programming/Engineering Optimization/Evolutionary Computation/Smart Cities,https://scholar.google.com/citations?user=VMf3wfMAAAAJ&hl=en
29,Xiaohua Ge,"Swinburne University of Technology, Melbourne, Australia",33,2029,6177,33,5988,https://www.aminer.org/profile/xiaohua-ge/53f43373dabfaeecd69418fc,Multi-agent systems/Networked control systems/Cyber-physical systems,https://scholar.google.com.au/citations?user=B37CYFoAAAAJ&hl=en
30,"Mohsen Guizani, FIEEE",Mohamed Bin Zayed University of Artificial Intelligence (MBZUAI),89,9920,40975,74,32892,https://www.aminer.cn/profile/mohsen-guizani/5489f0acdabfaed7b5fa3e39,Internet of Things/Applied AI/ML and Cybersecurity,https://scholar.google.com/citations?user=RigrYkcAAAAJ&hl=en
31,Song Guo,"FCAE, FIEEE, The Hong Kong Polytechnic University",69,4058,19712,63,15739,https://dblp.org/pid/01/267-1,Big Data Computing/Edge AI/Mobile Computing/Distributed System,https://scholar.google.com/citations?user=Ib-sizwAAAAJ&hl=en
32,Harald Haas,The University of Edinburgh,92,5263,43976,75,27625,https://www.youtube.com/watch?v=iHWIZsIBj3Q,Optical Wireless Communications/Interference Managment in Wireless Networks/Spatial Modulation,https://scholar.google.com/citations?user=XxIwRJQAAAAJ&hl=ja
33,Yuki Hagiwara,Fraunhofer IKS,29,1861,5884,29,5862,https://www.seattletimes.com/author/cap-yuki-hagiwara/,Artificial Intelligence,https://scholar.google.com.sg/citations?user=P6WI2DQAAAAJ&hl=en
34,"Qing-Long Han, Pro Vice-Chancellor and Distinguished Professor, MAE, IEEE Fellow",Swinburne University of Technology,104,6321,35786,85,23647,https://au.linkedin.com/in/qing-long-han-22992227,Networked control systems/time-delay systems/multi-agent systems/smart grids/unmanned surface vehicles,https://scholar.google.com.au/citations?user=j0pyptAAAAAJ&hl=en
35,Zhu Han,University of Houston,116,7764,54084,86,34627,https://www.ee.uh.edu/faculty/han-zhu,Game Theory/Wireless Networking/Security/Data Science/Smart Grid,https://scholar.google.com/citations?user=ty7wIXoAAAAJ&hl=en
36,L Hanzo,"Chair of Telecommunications, University of Southampton",106,7802,64520,80,31264,https://www-mobile.ecs.soton.ac.uk/people/lh,telecommunications/wireless communication/quantum_information_science/video_coding/video_networking,https://scholar.google.co.uk/citations?user=p0jnEW0AAAAJ&hl=en
37,L Hanzo,"Chair of Telecommunications, University of Southampton",106,7802,64520,80,31264,https://www-mobile.ecs.soton.ac.uk/people/lh,telecommunications/wireless communication/quantum_information_science/video_coding/video_networking,https://scholar.google.co.uk/citations?user=p0jnEW0AAAAJ&hl=en
38,Robert Heath,"Lampe Distinguished Professor, North Carolina State University",134,7619,79275,88,40455,https://www.ece.utexas.edu/people/faculty/robert-heath,wireless/MIMO/communications/signal processing/information theory,https://scholar.google.com/citations?user=17Ko8Q0AAAAJ&hl=en
39,Francisco Herrera,"Professor Computer Science and AI, Granada University, Senior Research Advisor in DL&ML at Sherpa.ai",158,14297,107660,117,55398,http://www.herrerabox.com/#section-3,Artificial Intelligence/Computational Intelligence/Data mining/Evolutionary Algorithms/Big Data Analytics,https://scholar.google.com/citations?user=HULIk-QAAAAJ&hl=en
40,Enrique Herrera-Viedma,"Professor of Computer Science and Artificial Intelligence, Spain, University of Granada",106,5921,45039,86,24054,https://publons.com/researcher/2882286/enrique-herrera-viedma/,Fuzzy sets/fuzzy decision making/computing with words/multiple criteria decision making/consensus,https://scholar.google.com/citations?user=g8ZXTuYAAAAJ&hl=en
41,Ekram Hossain,"Professor, University of Manitoba, Canada, IEEE Fellow",98,3072,36196,68,17875,https://scholar.google.com/scholar_url?url=https://books.google.com/books%3Fhl%3Den%26lr%3D%26id%3DFgce1ge4gtwC%26oi%3Dfnd%26pg%3DPA3%26dq%3DEkram%2BHossain%2Bhomepage%26ots%3Dhamcclu1Zn%26sig%3DTstDkxe0yu-i2cpcsRdbt3vPvI8&hl=en&sa=X&ei=r2fjYfKDG43ymgGoi4SYBg&scisig=AAGBfm1gGxNDEe4Kj417ulpBXDGE2kJGIg&oi=scholarr,Wireless communication networks/radio resource allocation/cognitive radio/multi-tier cellular networks,https://scholar.google.com/citations?user=Lb617EMAAAAJ&hl=en
42,Guang-Bin Huang,"Full Professor, Nanyang Technological University, Singapore",69,5300,52561,60,30548,https://scholar.google.com/scholar_url?url=https://citeseerx.ist.psu.edu/viewdoc/download%3Fdoi%3D10.1.1.102.4371%26rep%3Drep1%26type%3Dpdf&hl=en&sa=X&ei=sGfjYZvNBcCVy9YPgta4-AM&scisig=AAGBfm0Bv70Y872ENc88B0feHvpYHtyHLw&oi=scholarr,Machine Learning/Neural Networks/Neuroscience,https://scholar.google.com.sg/citations?user=LhSqQCIAAAAJ&hl=en
43,Kaibin Huang,"Associate Professor, Dept. of EEE, The University of Hong Kong; IEEE Fellow",51,2733,13676,40,10321,https://www.eee.hku.hk/~huangkb/,Machine Learning/Mobile Edge Computing/Wireless Communications/Wireless Power Transfer/Stochastic Geometry,https://scholar.google.com/citations?user=HfuA3uIAAAAJ&hl=en
44,Thomas JR Hughes,"Peter O'Donnell Jr. Chair in Computational and Applied Mathematics, University of Texas at Austin",159,7336,129766,93,39004,https://oden.utexas.edu/people/directory/Thomas-J.R.-Hughes/,Finite Element Methods/Solid Mechanics/Computational Fluid Dynamics/Partial Differential Equations/Isogeometric Analysis,https://scholar.google.com/citations?user=6tPdlYAAAAAJ&hl=en
45,Yaochu Jin,"A. v. Humboldt Professor for AI, Bielefeld University and Distinguished Chair, University of Surrey",83,5475,29411,70,17499,https://scholar.google.com/citations?user=B5WAkz4AAAAJ&hl=en,Artificial Intelligence/Evolutionary Computation/Multiobjective Optimization/Federated Learning/Developmental AI,https://scholar.google.com/citations?user=B5WAkz4AAAAJ&hl=en
46,"Nei Kato(IEEE Fellow, IEICE Fellow)","Professor, Graduate School of Information Sciences, Tohoku University, Japan",72,2934,20675,56,13004,https://ieeexplore.ieee.org/author/37265717700,Wireless networking,https://scholar.google.com/citations?user=LfLfZXEAAAAJ&hl=en
47,"Dr. Neeraj Kumar, SMIEEE (Web of Science Highly Cited Researcher 2019, 2020,2021)","Professor, CSED, Thapar Institute of Engineering and Technology, India",86,9330,24902,80,22845,https://scholar.google.com/citations?user=gL9gR-4AAAAJ&hl=ko,IoT and Machine Learning/Deep Learning/Blockchain Technology,https://scholar.google.co.in/citations?user=gL9gR-4AAAAJ&hl=en
48,"Dr. Arun Kumar Sangaiah., Ph.D (SM'IEEE)","Professor, School of Computing Science and Engineering, VIT University, Vellore, India",65,4401,13276,65,13107,https://glose.com/author/arun-kumar-sangaiah,Software Engineering/Computational Intelligence/Internet of Things,https://scholar.google.co.in/citations?user=8yF6Xc4AAAAJ&hl=en
49,Victor C. M. Leung,Shenzhen University / The University of British Columbia,100,5931,45733,80,28138,https://scholar.google.com/scholar_url?url=https://www.academia.edu/download/41278290/Location_management_for_next-generation_20160116-11059-1j4rbux.pdf&hl=en&sa=X&ei=tWfjYfnQKof0mgGtoqPICA&scisig=AAGBfm0bku7YVVwXwnk6Nl61Ag3BIJWA1A&oi=scholarr,communication systems/wireless networks/mobile systems,https://scholar.google.ca/citations?user=ajvCoo4AAAAJ&hl=en
50,Geoffrey Ye Li (李烨),"Chair Professor in Wireless Systems, Dept EEE, Imperial College London",104,5412,50866,77,22512,https://wuzhuchun.club/lectures/?p=115,Signal Processing/and/Machine Learning/for/Wireless Communications,https://scholar.google.com/citations?user=d0FzG8YAAAAJ&hl=en
51,Hongyi Li,"Assistant Professor, University of Houston",32,914,3289,28,2701,https://scholar.google.com/scholar?q=Hongyi+Li+homepage&hl=en&as_sdt=0&as_vis=1&oi=scholart,watershed hydrology/earth system modeling/coupled human-nature system,https://scholar.google.com/citations?user=yWy-5icAAAAJ&hl=en
52,Jin Li  李进,Professor @Guangzhou University,56,1822,18159,51,11724,https://www.jinli.design/,Trust and Security in Artificial Intelligence/Computating and Storage in Cloud Computing/Blockchain,https://scholar.google.com/citations?user=7GDV2vUAAAAJ&hl=en
53,Xuelong Li (Executive Councilor of AAAI),"Professor, Northwestern Polytechnical University, China",115,8022,51158,92,34535,https://www.aaia-ai.org/,artificial intelligence/feature extraction/higher-order data analytics,https://scholar.google.com/citations?user=ahUibskAAAAJ&hl=en
54,yongming li,"college of computer science, shaanxi normal university",36,390,4758,23,2239,https://www.math.tamu.edu/~liyo0008/,fuzzy systems/quantume logic and quantum information/lattice/topology/model checking,https://scholar.google.com/citations?user=P3VERZ0AAAAJ&hl=en
55,Huchang Liao (廖虎昌),"IET Fellow, BCS Fellow; Business School, Sichuan University",59,3821,11776,55,10709,https://www.adscientificindex.com/top-100-scientist/?tit=Business+%26+Management&con=Asia&country_code=&subject=,Decision analysis/Fuzzy Systems/Multiple criteria decision making/Preference learning,https://scholar.google.co.uk/citations?user=KlWnnbIAAAAJ&hl=en
56,Chong Lin,Qingdao University,68,2066,15566,50,8373,https://www.linkedin.com/in/chonglin,systems and control theory,https://scholar.google.com/citations?user=AQbRErEAAAAJ&hl=en
57,Yan-Jun Liu,Liaoning University of Technology,58,2439,13341,55,9917,https://www.mech.sdu.edu.cn/info/1552/128831.htm,Adaptive control/fuzzy control/neural networks,https://scholar.google.com/citations?user=x_Wk1jAAAAAJ&hl=en
58,Yuanwei Liu,"Associate Professor in Queen Mary University of London, Web of Science Highly Cited Researcher",47,3415,10426,46,10119,https://scholar.google.com/scholar?q=Yuanwei+Liu+homepage&hl=en&as_sdt=0&as_vis=1&oi=scholart,NOMA/RIS/UAV Communications/Artifical Intelligence/6G,https://scholar.google.com/citations?user=FxLf7ZAAAAAJ&hl=en
59,Wenjing Lou,"W. C. English Endowed Professor, IEEE Fellow, Virginia Tech, USA",80,2535,38524,57,18047,https://developer.nvidia.com/blog/author/wenjinglou/,Cyber Security/Wireless Networks/Wireless Security/Network Security/Cloud Computing,https://scholar.google.com/citations?user=hM8uAwoAAAAJ&hl=en
60,Majdi Mafarja,"Associate Professor of Computer Science, Birzeit University",32,2643,5496,30,5445,https://www.researchgate.net/profile/Majdi-Mafarja,Feature Selection/Machine Learning/Artificial Intelligence/Bio-inspired Algorithms/Metaheuristics,https://scholar.google.com/citations?user=ftkD0MgAAAAJ&hl=en
61,Luis Martínez,"Professor of Computer Science, University of Jaén",61,2777,21755,50,11688,https://internet3.trincoll.edu/facProfiles/Default.aspx?fid=1480287,Fuzzy decision making/Computing with words/Recommender Systems,https://scholar.google.com/citations?user=PG3D8UMAAAAJ&hl=en
62,Thomas Marzetta,"Distinguished Industry Professor, Department of Electrical and Computer Engineering, New York",58,4372,45796,44,26527,https://scholar.google.com/citations?user=tBLWIBoAAAAJ&hl=en,Beyond Massive MIMO,https://scholar.google.com/citations?user=tBLWIBoAAAAJ&hl=en
63,Seyedali Mirjalili,"Professor, Torrens University Australia, Adjunct Griffith University",70,16678,42521,69,40371,https://scholar.google.com/scholar?q=Seyedali+Mirjalili+homepage&hl=en&as_sdt=0&as_vis=1&oi=scholart,Metaheuristics/Robust Optimization/Engineering Optimization/Evolutionary Algorithm/Swarm Intelligence,https://scholar.google.com/citations?user=TJHmrREAAAAJ&hl=en
64,Andreas F. Molisch,"Professor of Electrical Engineering, University of Southern California",100,5027,57873,70,26220,https://scholar.google.com/scholar_url?url=https://merl.com/publications/docs/TR2008-072.pdf&hl=en&sa=X&ei=wmfjYYj6IduSy9YPxcKGuAc&scisig=AAGBfm0YMVoBGcBSFij6oNowME7WgCoT9g&oi=scholarr,wireless propagation channels/multi-antenna systems/ultrawideband communications and positioning/cooperative communications,https://scholar.google.com/citations?user=W0wwrucAAAAJ&hl=en
65,Derrick Wing Kwan Ng,"Scientia  Assoicate Professor,  University of New South Wales",64,3725,17540,61,14879,https://scholar.google.com/citations?user=NUJSHxoAAAAJ&hl=en,Wireless Communications,https://scholar.google.com/citations?user=NUJSHxoAAAAJ&hl=en
66,H. Nguyen-Xuan,"CIRTech Institute, Ho Chi Minh City University of Technology (HUTECH), Vietnam",67,2518,14836,56,10212,https://vn.linkedin.com/in/hung-nguyen-xuan-7b6ba61,Computational Engineering/Large-scale data/3D Printing/Renewable Energy,https://scholar.google.co.uk/citations?user=3iK9h-gAAAAJ&hl=en
67,Dusit (Tao) Niyato,Nanyang Technological University (NTU),99,8067,44120,79,29159,https://dblp.org/pid/76/440,ดุสิต นิยะโต - เต๋า,https://scholar.google.com/citations?user=T8sVhLMAAAAJ&hl=en
68,Kaoru Ota (太田　香),"MEXT Excellent Young Researcher (文部科学省　卓越研究員), Muroran Institute of Technology",49,1915,8990,47,8145,https://nrid.nii.ac.jp/nrid/1000050713971/,,https://scholar.google.com/citations?user=8JVn8RsAAAAJ&hl=ja
69,Mugen Peng,"Beijing University of Posts & Telecommun., IEEE Fellow, Web of Science Highly Cited Researcher",52,2162,14910,43,10018,https://www.goldenlabbookshop.com/book/9781107142664,Fog Radio Access Network/Heterogeneous Networks/Cloud Radio Access Networks/Network Coding/Radio Resource Allocation and Opt,https://scholar.google.com/citations?user=85mAZVcAAAAJ&hl=en
70,HV Poor,"Michael Henry Strater University Professor, Princeton University",153,13634,117825,101,55541,https://dl.acm.org/profile/81100081201,Information Theory/Statistical Signal Processing/Stochastic Analysis,https://scholar.google.com/citations?user=Dq93mOUAAAAJ&hl=en
71,Lianyong Qi(齐连永),"Professor, Qufu Normal University(青年教授，博士生导师，曲阜师范大学)",40,1772,4917,38,4668,http://150.138.141.24/kcms/detail/search.aspx?dbcode=CMFD&sfield=au&skey=%E6%9D%8E%E5%BD%A4&code=,service computing/big data/recommender system,https://scholar.google.com/citations?user=pxNRRsAAAAAJ&hl=en
72,Timon Rabczuk,Bauhaus University Weimar,104,7464,39053,88,28623,https://scholar.google.com/scholar_url?url=https://www.tandfonline.com/doi/abs/10.1080/17415977.2015.1017485&hl=en&sa=X&ei=yGfjYefVKsOUy9YP1MGf4AE&scisig=AAGBfm0A8C56CJqnqjuDc4_Rzser-reSZg&oi=scholarr,Computational Mechanics/Solid Mechanics,https://scholar.google.ca/citations?user=3CBuGosAAAAJ&hl=en
73,Kim-Kwang Raymond Choo,"Cloud Tech Endowed Professor, University of Texas at San Antonio; Highly Cited Researcher 2020, 2021",89,6010,22384,81,19958,https://www.linkedin.com/in/raymondchoo?trk=ugc-post-bar__share-text,Cloud Forensics/Cyber Forensics/Cyber Security/IoT Security/Blockchain,https://scholar.google.com/citations?user=rRBNI6AAAAAJ&hl=en
74,Kui Ren,"Professor, Zhejiang University, ACM Fellow, IEEE Fellow",81,3425,38682,66,20852,https://scholar.google.com/scholar?q=Kui+Ren+homepage&hl=en&as_sdt=0&as_vis=1&oi=scholart,Data Security & Privacy/IoT Security/AI Security,https://scholar.google.com/citations?user=uuQA_rcAAAAJ&hl=en
75,Walid Saad,"Professor, Electrical and Computer Engineering",79,6936,29289,69,24202,https://engineering.virginia.edu/events/ece-seminar-walid-saad,6G wireless systems/machine learning/security/cyber-physical systems/Unmanned aerial vehicles (UAVs),https://scholar.google.com/citations?user=kYDNA0UAAAAJ&hl=en
76,Robert Schober,Friedrich-Alexander-University Erlangen-Nuremberg,90,5139,40706,72,25732,https://www.comsoc.org/robert-schober,,https://scholar.google.com/citations?user=Uu0BpX8AAAAJ&hl=en
77,"Ling Shao, Fellow of IEEE/IAPR","CTO and Chief Scientist, National Center for Artificial Intelligence (NCAI), KSA",78,7966,28399,74,23309,https://ae.linkedin.com/in/lingshao,Computer Vision/Deep Learning/Artificial Intelligence/Medical Imaging/Vision and Language,https://scholar.google.com/citations?user=z84rLjoAAAAJ&hl=en
78,Xuemin (Sherman) Shen,"University Professor, University of Waterloo",127,8388,70325,97,39006,http://bbcr.uwaterloo.ca/~xshen/,Wireless networking/MAC/Network security/VANET,https://scholar.google.com/citations?user=Bjl3GwoAAAAJ&hl=cs
79,Peng Shi,"Professor, School of Electrical and Electronic Engineering, The University of Adelaide",147,8473,74471,108,42435,https://scholar.google.com/scholar_url?url=https://www.sciencedirect.com/science/article/pii/S1995764513600619/pdf%3Fmd5%3D3f5336bf24528ae5d90dcefe0b8bc2b3%26pid%3D1-s2.0-S1995764513600619-main.pdf%26_valck%3D1&hl=en&sa=X&ei=zmfjYYyNCrvGsQKXlJKICw&scisig=AAGBfm0hU3tO_A7A08zmY8gukf8kyetufg&oi=scholarr,Systems and Control/Electrical and Electronic Engineering/Cybernetics/Human-Computer Interaction,https://scholar.google.com.hk/citations?user=EGx1iH0AAAAJ&hl=en
80,"Dr. P. N. Suganthan (SCI Highly Cited Researcher 2015-2021), FIEEE'2015","Some Codes available at GitHub, (Hon. Doctorate, U. of Maribor, 2020 ; BA & MA, U. of Cambridge, UK)",102,6897,54126,84,30068,https://scholar.google.com.ph/citations?user=bCJAc_8AAAAJ&hl=fil,Machine Learning(ML)/Swarm-Evolutionary Computation(SEC)/Neural Networks(ANN)/Applications of ML SEC ANN.,https://scholar.google.com/citations?user=yZNzBU0AAAAJ&hl=en
