87,Qingqing Wu (武庆庆),"Assistant Professor, University of Macau",45,5124,11889,44,11765,https://www.fst.um.edu.mo/people/qingqingwu/,6G/IRS/UAV communications/Machine learning/MIMO transceiver design,https://scholar.google.com/citations?user=as1T8CMAAAAJ&hl=en
88,Zheng-Guang Wu,Zhejiang University,70,2634,15520,62,11353,https://research.com/u/zheng-guang-wu,Markov Jump Systems/Sampled-Data Control Systems/Neural Networks/Fuzzy Systems/Singular Systems,https://scholar.google.com/citations?user=vy6JCNgAAAAJ&hl=en
89,Yang Xiang,"IEEE Fellow, Professfor, Swinburne University of Technology",65,2767,15692,57,12074,https://ieeexplore.ieee.org/author/37286573400,Cybersecurity/Network Security/System Security/Software Vulnerability Detection/Blockchain,https://scholar.google.com/citations?user=7ymTWY4AAAAJ&hl=en
90,Xiaolong Xu (许小龙),"Professor, Highly Cited Researcher 2021, Nanjing University of Information Science and Technology",36,1467,4303,36,4249,https://www.adscientificindex.com/scientist.php?id=679661,Edge computing/Cloud computing/Big data/Fog computing/Mobile computing,https://scholar.google.com/citations?user=Tyzef4sAAAAJ&hl=en
91,Zeshui Xu (徐泽水),"Academician of EASA,IASCYS; DFIETI,FIEEE,FIFSA,FIET,FRSA,FORS,FBCS,FIAAM,FAAIA... Sichuan University",137,9768,71323,106,41052,http://drdiaasharifclinic.com/d1phzrg/iet-fellow-list.html,Decision Making/Information Fusion/Fuzzy Sets/Computational Intelligence/Bibliometrics,https://scholar.google.co.uk/citations?user=kd9L_GUAAAAJ&hl=en
92,Xin-She Yang (DPhil),"Computational intelligence, swarm intelligence, optimization, metaheuristics, nature-inspired",90,10695,68211,80,46221,https://ieeexplore.ieee.org/author/38104337900,swarm intelligence/optimization/metaheuristics/computational intelligence.,https://scholar.google.com/citations?user=fA6aTlAAAAAJ&hl=th
93,Fei Yu,University of Southern Denmark,9,68,235,7,173,https://www.feiyu-tech.com/service.html,Industry 4.0 technology and smart product development,https://scholar.google.com/citations?user=3OHgAmIAAAAJ&hl=en
94,Xiangxiang Zeng,"Deparment of Computer Science, Hunan University",48,1613,6348,39,5165,https://research.com/u/xiangxiang-zeng,Computational Intelligence/Bio-inspired Intelligence,https://scholar.google.com/citations?user=B20HBMIAAAAJ&hl=en
95,Yong Zeng (曾勇）,"Southeast University, China; Purple Mountain Laboratories, China",45,3826,14699,45,14213,http://gkcccc.org/openchurch/multimedia/podcasts/why-christians-do-not-need-worry-%E5%9F%BA%E7%9D%A3%E5%BE%92%E7%82%BA%E7%94%9A%E9%BA%BC%E4%B8%8D%E5%BF%85%E6%86%82%E6%85%AE?page=18,UAV communications/Massive MIMO/Extremely-Large MIMO (XL-MIMO)/Integrated Sensing and Communication,https://scholar.google.com/citations?user=ENldmwIAAAAJ&hl=en
96,Jianming Zhan,Hubei University for Nationalities,43,1077,6868,35,4321,http://cs-people.bu.edu/jmzhang/,logical algebras(BL-algebras/R0-algebras and MTL-algebras)/fuzzy algebras(semirings/hemirings and rings) and their hyperstuctures(hyperring/hypergroups,https://scholar.google.com/citations?user=XmJAmNIAAAAJ&hl=en
97,Haijun Zhang,"Professor, University of Science and Technology Beijing",44,1897,9824,43,8625,https://vivo.weill.cornell.edu/display/cwid-haz2004,6G/AI enabled Wireless Communications/Resource Allocation/Mobility Management,https://scholar.google.ca/citations?user=B3oYgSIAAAAJ&hl=en
98,Rui Zhang,"Chair Professor, National University of Singapore",120,12510,60486,101,44777,https://ryanzhumich.github.io/group.html,Wireless Communications/MIMO/Cognitive Radio/Wireless Power Transfer/UAV,https://scholar.google.com.sg/citations?user=yoJqPIkAAAAJ&hl=en
99,Xian-Ming Zhang,Swinburne University of Technology,47,2275,10928,40,8870,https://www.concordia.ca/artsci/chemistry/faculty.html?fpid=xianming-zhang,Networked Control Systems/Event-triggered Control/H-infinity Filtering/Time-delay Systems/Neural Networks,https://scholar.google.com/citations?user=aZcLkqgAAAAJ&hl=en
100,Xuyun Zhang,Macquarie University,41,1211,5910,38,4802,https://itseg.org/group.php,big data mining/scalable machine learning/big data privacy and cybersecurity/cloud/edge computing/Internet of Things,https://scholar.google.com.au/citations?user=wbF6HL8AAAAJ&hl=en
101,Yan Zhang,"IEEE Fellow, Highly Cited Researcher, University of Oslo, Norway",91,6295,29384,76,21775,https://medicine.umich.edu/dept/biochem/yan-zhang-phd,wireless networks/smart grid/edge intelligence/blockchain/digital twin,https://scholar.google.no/citations?user=-gahn9AAAAAJ&hl=no
102,Quan Zou (邹权),University of Electronic Science and Technology of China,67,3217,13840,60,11399,https://scholar.google.com/citations?user=RcaUHs4AAAAJ&hl=en,Bioinformatics/data mining,https://scholar.google.com/citations?user=RcaUHs4AAAAJ&hl=en
