,Name,Affilation,H-index,Citations 2020,Total_citation,H-index_since_2016,Citation_since_2016,HomePage,Area of Research,Google_Scholar
0,"U Rajendra Acharya (SCI Highly Cited Researcher 2016-2022)  PhD, DEng, DSc",Unknown affiliation,122,11893,59603,108,47066,https://research.com/u/u-rajendra-acharya,Artificial Intelligence,https://scholar.google.com.sg/citations?user=8FjY99sAAAAJ&hl=en
1,IAN  F.  AKYILDIZ,"Truva Inc. , USA",134,6618,137699,85,42250,https://en.wikipedia.org/wiki/Ian_F._Akyildiz#2000s,Wireless Communication/5G/6G Wireless Systems/Intelligent Surfaces for Wireless Communication/Nano-scale and Molecular Commun,https://scholar.google.com/citations?user=rAGwv14AAAAJ&hl=en
2,Ibrahim Aljarah,"Professor of Big Data Mining and Computational Intelligence, The University of Jordan",48,3235,10628,47,10429,http://eacademic.ju.edu.jo/i.aljarah/,Artificial  intelligence/Swarm Intelligence/Data Science/Machine Learning/Evolutionary Computation,https://scholar.google.com/citations?user=moOTIYEAAAAJ&hl=en
3,Jeffrey Andrews,"Truchard Family Chair and Director of 6G@UT, University of Texas at Austin",107,3887,67500,74,31037,https://www.ece.utexas.edu/people/faculty/jeffrey-andrews,Wireless Communications/Communication Theory/Machine Learning for Communications/Stochastic Geometry/Information Theory,https://scholar.google.com/citations?user=Hr9Gey0AAAAJ&hl=en
4,Bennis Mehdi,"Full Professor, IEEE Fellow, Head of ICON, University of Oulu",74,7131,30060,70,27474,https://sites.google.com/view/dr-mehdi-bennis/group,B5G/6G/machine learning/semantic communication/protocol learning,https://scholar.google.com/citations?user=RW4sJu8AAAAJ&hl=en
5,Emil Björnson,"Professor of Wireless Communication, KTH Royal Institute of Technology",68,4488,21118,66,18275,https://ma-mimo.ellintech.se/author/eb/,Massive MIMO/Cell-free Massive MIMO/RIS/Signal processing/Wireless communication,https://scholar.google.se/citations?user=Maij4akAAAAJ&hl=en
6,Rajkumar Buyya,"School of Computing and Information Systems, The Uni of Melbourne; Fellow of IEEE & Academia Europea",158,11383,130034,110,66597,https://fedcsis.org/2021/keynotes/buyya,Computer Systems/Cloud Computing/Distributed Systems/Edge Computing/Internet of Things,https://scholar.google.com/citations?user=7xN6JqYAAAAJ&hl=en
7,Xing Cai,"Senior Research Scientist at Simula Research Laboratory, Professor at University of Oslo",19,138,2108,13,814,https://koei.fandom.com/wiki/Xingcai#Role_in_Games,Parallel programming/High-performance computing/numerical methods for PDEs,https://scholar.google.com/citations?user=IWQbrcK5CEwC&hl=en
8,Giuseppe Caire,"Professor, Technical University of Berlin, Germany, and Professor of Electrical Engineering (on",85,2894,40863,59,17529,https://en.wikipedia.org/wiki/Giuseppe_Caire,Information Theory/Communications/Signal Processing/Statistics,https://scholar.google.com/citations?user=g66ErTcAAAAJ&hl=en
9,Jinde Cao,"Academician, RAS/AE/RAE/LAS/AAS/EASA/PAS/IASCYS  & FIEEE/FAAIA/DFIETI; Southeast University",132,8728,75246,96,45480,https://orcid.org/0000-0003-3133-7119,Complex networks/neural networks/multi-agent systems - engineering stability - dynamics and control - time-delay systems,https://scholar.google.com/citations?user=8_ffELYAAAAJ&hl=en
10,C. L. Philip Chen,"Chair Professor, South China University of Technology, Philip.Chen@ieee.org",99,7290,42305,88,32716,https://ieeexplore.ieee.org/author/38252718600,Computational Intelligence/Intelligent Control/Cybernetics/Intelligent Transportation Systems/Data Science/Engineering,https://scholar.google.com/citations?user=Q5248zwAAAAJ&hl=en
11,Jinjun Chen,"MAE (Academia Europea), IEEE Fellow (Computer Society), AAIA Fellow, HiCi; Professor and Deputy",70,2317,14544,54,10301,http://www.azxy5kjw.com/research-institutes/data-science/people/jinjun-chen/,Cloud Computing/Scalable Architecture/Scalable Data Storage/Scalable Data Processing (Privacy),https://scholar.google.com/citations?user=mQ9vJ24AAAAJ&hl=en
12,Min Chen,"Professor, IEEE Fellow, Highly Cited Researcher, Huazhong University of Science and Technology",91,6172,37024,73,27923,https://sites.google.com/site/minchenresearch,Cognitive Computing and Big Data Analytics/IoT Sensing/5G Networks/Robotics/Edge Computing,https://scholar.google.com/citations?user=_HyHTrsAAAAJ&hl=en
13,Xiaofeng Chen,"Professor, Xidian University, China",60,1794,14426,52,10952,https://www.beg.utexas.edu/people/xiaofeng-chen,Security/Cryptography/Cloud computing,https://scholar.google.com/citations?user=-3WhJecAAAAJ&hl=en
14,Francisco Chiclana,"Professor of Computational Intelligence and Decision Making, De Montfort University, UK",71,2366,21371,63,12974,https://scholar.google.com/citations?user=qDOxZIIAAAAJ&hl=en,Decision making/computational intelligence/information fusion/consensus/sentiment analysis,https://scholar.google.com/citations?user=qDOxZIIAAAAJ&hl=en
15,zhihua cui,"Taiyuan University of Science and Technology, Taiyuan, Shanxi, China, 030024",46,1680,9093,37,6974,https://www.zhihuacui.com/,evolutionary computation,https://scholar.google.com/citations?user=BpDrULIAAAAJ&hl=en
16,Linglong Dai,"Associate Professor, Tsinghua University; IEEE Fellow",66,3341,18240,63,16618,https://arxiv.org/abs/2203.16318,Wireless Communications/RIS/Massive MIMO/Millimeter-Wave/Teraherz Communications/Non-Orthogonal Mutiple Access,https://scholar.google.com/citations?user=OTFnifoAAAAJ&hl=en
17,Merouane Debbah,"Centralesupelec, Technology Innovation Institute, MBZUAI, Lagrange Mathematics Center",103,9041,52697,89,38775,https://ctw2021.ieee-ctw.org/speaker-biography-merouane-debbah/,5G/6G/Machine Learning/Random Matrix Theory/Game Theory,https://scholar.google.com/citations?user=HU5I0X4AAAAJ&hl=en
18,Zhiguo Ding,"University of Manchester, Fellow of IEEE, Web of Science Highly Cited Researcher",97,8216,42526,91,38342,https://scholar.google.co.uk/citations?user=V-nB8scAAAAJ&hl=en,Wireless communications/signal processing/and cross-layer optimization,https://scholar.google.co.uk/citations?user=V-nB8scAAAAJ&hl=en
19,"Mianxiong Dong, Foreign Fellow of EAJ","Vice President and Professor, Muroran Institute of Technology, Japan",56,2236,12169,51,10793,https://www.computer.org/csdl/journal/sc/2022/02/09540249/1wWC9LGR6aA,Cyber-Physical Systems/Internet of Things/Artificial Intelligence,https://scholar.google.co.jp/citations?user=TqyApAUAAAAJ&hl=en
20,Yucheng Dong,"Professor of Management and Systems Sciences, Sichuan University",65,2183,13123,61,10826,https://www.journals.elsevier.com/computers-and-industrial-engineering/editorial-board/yucheng-dong,Decision Analysis/Human Dynamics/Social Network/Data Science,https://scholar.google.com/citations?user=tFVYDw4AAAAJ&hl=en
21,Maged Elkashlan,"Associate Professor, Queen Mary University of London",63,2718,16744,55,14313,https://scholar.google.com/citations?user=mncnnOAAAAAJ&hl=en,IRS/URLLC/UAV/PLS/NOMA,https://scholar.google.com/citations?user=mncnnOAAAAAJ&hl=en
22,Zubair Md. Fadlullah,"Associate Professor, Research Chair, Department of Computer Science, Lakehead University, TBRHRI",41,1356,8171,39,6456,https://ieeexplore.ieee.org/author/37590642000,Beyond 5G/Smart Health/UAV & Energy efficient Networks/QoS & Security/Deep Learning applications,https://scholar.google.com/citations?user=dZyfKpYAAAAJ&hl=en
23,Hossam Faris,"Professor, The University of Jordan",52,4256,14034,50,13784,http://evo-ml.com/hossam-faris/,Data Science/Knowledge Systems/Data Mining/Evolutionary computation,https://scholar.google.com/citations?user=UEYd--YAAAAJ&hl=en
24,Giancarlo Fortino,"Full Prof. of Computer Engineering, University of Calabria, FIEEE, FAAIA, Highly Cited Researcher",70,3729,18066,64,14954,https://labs.dimes.unical.it/speme/people/giancarlo-fortino/,Human-Machine Systems/Agent-based Computing/Internet of Things/Wearable Computing/Wireless/Body Area Networks,https://scholar.google.com/citations?user=ecImn1MAAAAJ&hl=it
25,Hamido Fujita,Iwate Prefectural University,74,4437,19566,74,18291,https://research.com/u/hamido-fujita,Machine Learning,https://scholar.google.com/citations?user=MxzV1nQAAAAJ&hl=en
26,Erik G. Larsson,"Professor, Dept. of Electrical Engineering (ISY), Linköping University, Sweden",91,6314,47994,72,32030,https://scholar.google.com/citations?user=79Lry6oAAAAJ&hl=sv,Wireless communications/statistical signal processing/localization/massive MIMO/networks,https://scholar.google.se/citations?user=79Lry6oAAAAJ&hl=en
27,Amir H. Gandomi,"Professor of Data Science, University of Technology Sydney",85,6839,34423,74,27731,https://research.com/u/amir-h-gandomi,Data Analytics/Genetic Programming/Engineering Optimization/Evolutionary Computation/Smart Cities,https://scholar.google.com/citations?user=VMf3wfMAAAAJ&hl=en
28,Xiaohua Ge,"Swinburne University of Technology, Melbourne, Australia",39,2005,8312,39,8112,https://dblp.org/pid/118/3514,Networked control systems/Cyber-physical systems/Multi-agent systems/Intelligent vehicles/Connected automated vehicles,https://scholar.google.com.au/citations?user=B37CYFoAAAAJ&hl=en
29,"Mohsen Guizani, FIEEE",Mohamed Bin Zayed University of Artificial Intelligence (MBZUAI),97,11074,50793,86,43354,https://vivo.nkn.uidaho.edu/vivo/display/n62284,Internet of Things/Applied AI/ML and Cybersecurity,https://scholar.google.com/citations?user=RigrYkcAAAAJ&hl=en
30,Song Guo,"FCAE, FIEEE, The Hong Kong Polytechnic University",75,4419,23687,68,19690,https://www4.comp.polyu.edu.hk/~cssongguo/,Edge Intelligence/Federated Learning/Edge Computing/Distributed System/Wireless Networking,https://scholar.google.com/citations?user=Ib-sizwAAAAJ&hl=en
31,Harald Haas,The University of Edinburgh,97,5640,48258,80,32217,https://lifi.co/harald-haas/,Optical Wireless Communications/Interference Managment in Wireless Networks/Spatial Modulation,https://scholar.google.com/citations?user=XxIwRJQAAAAJ&hl=ja
32,Yuki Hagiwara,Fraunhofer IKS,30,1988,7577,30,7553,https://dl.acm.org/profile/99658991446,Artificial Intelligence,https://scholar.google.com.sg/citations?user=P6WI2DQAAAAJ&hl=en
33,"Qing-Long Han, Pro Vice-Chancellor and Distinguished Professor, MAE, IEEE Fellow, IFAC Fellow",Swinburne University of Technology,112,6078,41386,96,29165,https://scholar.google.com/citations?user=nlu3CqUAAAAJ&hl=en,Networked control systems/time-delay systems/multi-agent systems/smart grids/unmanned surface vehicles,https://scholar.google.com.au/citations?user=j0pyptAAAAAJ&hl=en
34,Zhu Han,University of Houston,123,8580,62649,95,43275,https://speakers.acm.org/speakers/han_16169,Game Theory/Wireless Networking/Security/Data Science/Smart Grid,https://scholar.google.com/citations?user=ty7wIXoAAAAJ&hl=en
35,L Hanzo,"Chair of Telecommunications, University of Southampton",114,8307,73599,90,40464,https://dl.acm.org/profile/81100142890,telecommunications/wireless communication/quantum_information_science/video_coding/video_networking,https://scholar.google.co.uk/citations?user=p0jnEW0AAAAJ&hl=en
36,L Hanzo,"Chair of Telecommunications, University of Southampton",114,8307,73599,90,40464,https://www.hanzologistics.com/,telecommunications/wireless communication/quantum_information_science/video_coding/video_networking,https://scholar.google.co.uk/citations?user=p0jnEW0AAAAJ&hl=en
37,Robert Heath,"Lampe Distinguished Professor, North Carolina State University",139,7736,83744,93,45234,https://www.rpxcorp.com/about/team/leadership-team/robert-heath/,wireless/MIMO/communications/signal processing/information theory,https://scholar.google.com/citations?user=17Ko8Q0AAAAJ&hl=en
38,Francisco Herrera,"Professor Computer Science and AI, Granada University, Spain",166,14436,120865,127,68426,https://www.facebook.com/HERRERABOX/,Artificial Intelligence/Computational Intelligence/Data mining/Evolutionary Algorithms/Big Data Analytics,https://scholar.google.com/citations?user=HULIk-QAAAAJ&hl=en
39,Enrique Herrera-Viedma,"Professor of Computer Science and Artificial Intelligence, Spain, University of Granada",111,5928,51278,92,29872,https://ieeexplore.ieee.org/author/38271721400,Fuzzy sets/fuzzy decision making/computing with words/multiple criteria decision making/consensus,https://scholar.google.com/citations?user=g8ZXTuYAAAAJ&hl=en
40,Ekram Hossain,"Professor, University of Manitoba, Canada, IEEE Fellow",99,3259,37985,72,20374,https://vtsociety.org/contact/ekram-hossain,Wireless communication networks/radio resource allocation/cognitive radio/multi-tier cellular networks,https://scholar.google.com/citations?user=Lb617EMAAAAJ&hl=en
41,Guang-Bin Huang,"Full Professor, Nanyang Technological University, Singapore",73,5605,56569,61,34816,https://dblp.org/pid/95/5912,Machine Learning/Neural Networks/Neuroscience,https://scholar.google.com.sg/citations?user=LhSqQCIAAAAJ&hl=en
42,Kaibin Huang,"Professor, Dept. of EEE, The University of Hong Kong; IEEE Fellow; ISI Highly Cited Researcher",54,2878,16314,45,12965,https://dl.acm.org/profile/81447594577,Machine Learning/Mobile Edge Computing/Wireless Communications/Wireless Power Transfer/Stochastic Geometry,https://scholar.google.com/citations?user=HfuA3uIAAAAJ&hl=en
43,Thomas JR Hughes,"Peter O'Donnell Jr. Chair in Computational and Applied Mathematics, University of Texas at Austin",151,7037,131575,96,43652,https://en.wikipedia.org/wiki/Thomas_J.R._Hughes#Awards_and_honors,Finite Element Methods/Solid Mechanics/Computational Fluid Dynamics/Partial Differential Equations/Isogeometric Analysis,https://scholar.google.com/citations?user=6tPdlYAAAAAJ&hl=en
44,Yaochu Jin,"A. v. Humboldt Professor for AI, Bielefeld University and Distinguished Chair, University of Surrey",92,5584,35232,75,23301,https://scholar.google.com/citations?user=B5WAkz4AAAAJ&hl=en,Evolutionary algorithms/Multiobjective optimization/Multiobjective learning/Trustworthy AI/Developmental AI,https://scholar.google.com/citations?user=B5WAkz4AAAAJ&hl=en
45,"Nei Kato(IEEE Fellow, IEICE Fellow)","Professor and Dean, Graduate School of Information Sciences, Tohoku University, Japan",77,3283,23555,62,15991,https://www.comsoc.org/nei-kato,Wireless networking,https://scholar.google.com/citations?user=LfLfZXEAAAAJ&hl=en
46,"Dr. Neeraj Kumar, SMIEEE","Professor, CSED, Thapar Institute of Engineering and Technology, India",102,9999,33841,97,31829,https://orcid.org/0000-0002-3020-3947,IoT and Machine Learning/Deep Learning/Blockchain Technology,https://scholar.google.co.in/citations?user=gL9gR-4AAAAJ&hl=en
47,"Dr.Arun Kumar Sangaiah 桑亞倫, SM'IEEE (WoS-Highly Cited Researcher, Yushan Young Scholar)","玉山學者, National Yunlin University of Science & Technology, Taiwan & VIT University, India",74,4761,17486,74,17301,https://scholar.google.co.in/citations?user=8yF6Xc4AAAAJ&hl=en,Computational Intelligence/Internet of Things/Cognitive Computing,https://scholar.google.co.in/citations?user=8yF6Xc4AAAAJ&hl=en
48,Victor C. M. Leung,Shenzhen University / The University of British Columbia,106,6579,51619,89,34053,https://ece.ubc.ca/victor-leung/,communication systems/wireless networks/mobile systems,https://scholar.google.ca/citations?user=ajvCoo4AAAAJ&hl=en
49,Geoffrey Ye Li (李烨),"Chair Professor in Wireless Systems, Dept EEE, Imperial College London",112,5847,56508,81,28175,https://scholar.google.com/citations?user=d0FzG8YAAAAJ&hl=vi,Signal Processing/and/Machine Learning/for/Wireless Communications,https://scholar.google.com/citations?user=d0FzG8YAAAAJ&hl=en
50,Hongyi Li,"Assistant Professor, University of Houston",35,917,4133,31,3534,https://www.cive.uh.edu/faculty/li-hong-yi,watershed hydrology/earth system modeling/coupled human-nature system,https://scholar.google.com/citations?user=yWy-5icAAAAJ&hl=en
51,Jin Li  李进,Professor @Guangzhou University,61,1989,19819,55,13423,https://sadisticheaven.github.io/,Trust and Security in Artificial Intelligence/Computating and Storage in Cloud Computing/Blockchain,https://scholar.google.com/citations?user=7GDV2vUAAAAJ&hl=en
52,"Xuelong Li (Executive Councilor of AAAI, 21-24)","Professor, Northwestern Polytechnical University, China",123,8506,59145,103,42589,https://0-scholar-google-com.brum.beds.ac.uk/citations?user=8VY7ZDcAAAAJ&hl=en,artificial intelligence/applied mathematics/physics,https://scholar.google.com/citations?user=ahUibskAAAAJ&hl=en
53,yongming li,"college of computer science, shaanxi normal university",37,398,5103,24,2588,https://www.healthprofs.com/us/acupuncturists/yong-ming-li-bridgewater-nj/507114,fuzzy systems/quantume logic and quantum information/lattice/topology/model checking,https://scholar.google.com/citations?user=P3VERZ0AAAAJ&hl=en
54,Huchang Liao (廖虎昌),"IET Fellow, BCS Fellow; Business School, Sichuan University",67,3512,14654,63,13585,https://scholar.google.co.uk/citations?user=KlWnnbIAAAAJ&hl=en,Decision analysis/Fuzzy Systems/Multiple criteria decision making/Preference learning,https://scholar.google.co.uk/citations?user=KlWnnbIAAAAJ&hl=en
55,Chong Lin,Qingdao University,72,1903,17296,54,9979,https://scholar.google.com/citations?user=AQbRErEAAAAJ&hl=zh-CN,systems and control theory,https://scholar.google.com/citations?user=AQbRErEAAAAJ&hl=en
56,Yan-Jun Liu,Liaoning University of Technology,65,2258,15466,60,12025,https://www.mech.sdu.edu.cn/info/1552/128831.htm,Adaptive control/fuzzy control/neural networks,https://scholar.google.com/citations?user=x_Wk1jAAAAAJ&hl=en
57,Yuanwei Liu,"Associate Professor in Queen Mary University of London, Web of Science Highly Cited Researcher",57,3429,14526,57,14259,https://kclpure.kcl.ac.uk/portal/en/persons/yuanwei-liu(2b436c4e-ff5b-46ee-a6a7-eff58f0a7f72).html,NOMA/RIS/AI/6G/Integrated Sensing and Communications,https://scholar.google.com/citations?user=FxLf7ZAAAAAJ&hl=en
58,Wenjing Lou,"W. C. English Endowed Professor, IEEE Fellow, Virginia Tech, USA",83,2826,40792,61,20311,https://ece.engineering.arizona.edu/news-events/ece-seminar-wenjing-lou,Cyber Security/Wireless Networks/Wireless Security/Network Security/Cloud Computing,https://scholar.google.com/citations?user=hM8uAwoAAAAJ&hl=en
59,Majdi Mafarja,"Associate Professor of Computer Science, Birzeit University",36,2600,8233,36,8188,https://dl.acm.org/profile/83058775557,Feature Selection/Machine Learning/Artificial Intelligence/Bio-inspired Algorithms/Metaheuristics,https://scholar.google.com/citations?user=ftkD0MgAAAAJ&hl=en
60,Luis Martínez,"Professor of Computer Science, University of Jaén",67,2667,24176,53,14092,https://www.pleasanthillca.org/directory.aspx?EID=97,Fuzzy decision making/Computing with words/Recommender Systems,https://scholar.google.com/citations?user=PG3D8UMAAAAJ&hl=en
61,Thomas Marzetta,"Distinguished Industry Professor, Department of Electrical and Computer Engineering, New York",62,4623,49116,46,29862,https://dl.acm.org/profile/81100311884,Beyond Massive MIMO,https://scholar.google.com/citations?user=tBLWIBoAAAAJ&hl=en
62,Seyedali Mirjalili,"Professor, Torrens University Australia, Adjunct Griffith University",82,16603,61956,82,59592,https://scholar.google.com/citations?user=TJHmrREAAAAJ&hl=en,Metaheuristics/Robust Optimization/Engineering Optimization/Evolutionary Algorithm/Swarm Intelligence,https://scholar.google.com/citations?user=TJHmrREAAAAJ&hl=en
63,Andreas F. Molisch,"Professor of Electrical Engineering, University of Southern California",104,5261,61924,73,30563,"https://www.wiley.com/en-aw/Wireless+Communications,+2nd+Edition-p-9780470741870",wireless propagation channels/multi-antenna systems/ultrawideband communications and positioning/cooperative communications,https://scholar.google.com/citations?user=W0wwrucAAAAJ&hl=en
64,Derrick Wing Kwan Ng,"Scientia  Associate Professor,  University of New South Wales",72,3930,21838,67,19172,https://research.com/u/derrick-wing-kwan-ng,Wireless Communications,https://scholar.google.com/citations?user=NUJSHxoAAAAJ&hl=en
65,H. Nguyen-Xuan,"CIRTech Institute, HUTECH University, Vietnam",70,2411,16891,62,12189,https://scholar.google.co.uk/citations?user=3iK9h-gAAAAJ&hl=en,Computational Engineering/Large-scale Data/3D Printing/Renewable Energy,https://scholar.google.co.uk/citations?user=3iK9h-gAAAAJ&hl=en
66,Dusit (Tao) Niyato,Nanyang Technological University (NTU),108,8947,53431,93,38633,https://www.vistec.ac.th/academic/faculty_detail.php?school=IST&id=146,ดุสิต นิยะโต - เต๋า,https://scholar.google.com/citations?user=T8sVhLMAAAAJ&hl=en
67,Kaoru Ota (太田　香),"MEXT Excellent Young Researcher (文部科学省　卓越研究員), Muroran Institute of Technology",52,2128,10809,50,9930,https://researchmap.jp/k-ota/published_papers?limit=50,,https://scholar.google.com/citations?user=8JVn8RsAAAAJ&hl=ja
68,Mugen Peng,"Beijing University of Posts & Telecommun., IEEE Fellow, Web of Science Highly Cited Researcher",56,2393,16779,49,12180,https://research.com/u/mugen-peng,Fog Computing/Cloud Radio Access Networks/Integrated Satellite-Terrestrial Networks/6G,https://scholar.google.com/citations?user=85mAZVcAAAAJ&hl=en
69,HV Poor,"Michael Henry Strater University Professor, Princeton University",162,14337,130560,112,69078,http://en.wikipedia.org/wiki/Princeton_University,Communication Systems/Wireless Communications/Communications/Statistical Signal Processing/Information Theory,https://scholar.google.com/citations?user=Dq93mOUAAAAJ&hl=en
70,Lianyong Qi(齐连永),"Professor, China University of Petroleum (East China)",48,1825,7035,47,6781,https://www.scholat.com/qilianyong.en,service computing/big data/recommender system,https://scholar.google.com/citations?user=pxNRRsAAAAAJ&hl=en
71,Timon Rabczuk,Bauhaus University Weimar,111,7336,45724,96,35216,https://scholar.google.ca/citations?user=3CBuGosAAAAJ&hl=en,Computational Mechanics/Solid Mechanics,https://scholar.google.ca/citations?user=3CBuGosAAAAJ&hl=en
72,Kim-Kwang Raymond Choo,"Cloud Tech Endowed Professor, University of Texas at San Antonio",100,6671,28579,94,26086,https://www.adscientificindex.com/scientist/kim-kwang-raymond-choo/1679004,Cloud Forensics/Cyber Forensics/Cyber Security/IoT Security/Blockchain,https://scholar.google.com/citations?user=rRBNI6AAAAAJ&hl=en
73,Kui Ren,"Professor, Zhejiang University, ACM Fellow, IEEE Fellow",87,3771,41907,71,24088,https://scholar.google.com/citations?user=uuQA_rcAAAAJ&hl=en,Data Security & Privacy/IoT Security/AI Security,https://scholar.google.com/citations?user=uuQA_rcAAAAJ&hl=en
74,Walid Saad,"Professor, Electrical and Computer Engineering",87,7494,36193,80,31166,https://www.linkedin.com/in/walid-saad-089640a,6G/machine learning/semantic communications/security and cyber-physical systems/unmanned aerial vehicles,https://scholar.google.com/citations?user=kYDNA0UAAAAJ&hl=en
75,Robert Schober,Friedrich-Alexander-University Erlangen-Nuremberg,96,5361,45705,82,30723,https://dl.acm.org/profile/81343504438,,https://scholar.google.com/citations?user=Uu0BpX8AAAAJ&hl=en
76,"Ling Shao, Fellow of IEEE/IAPR",Terminus Group,97,8269,38186,93,33112,https://ling-shao.github.io/,Computer Vision/Deep Learning/Artificial Intelligence/Medical Imaging/Vision and Language,https://scholar.google.com/citations?user=z84rLjoAAAAJ&hl=en
77,Xuemin (Sherman) Shen,"University Professor, University of Waterloo",136,9308,79074,107,47553,https://dl.acm.org/profile/81350568396,Wireless networking/MAC/Network security/VANET,https://scholar.google.com/citations?user=Bjl3GwoAAAAJ&hl=cs
78,Peng Shi,"Professor, School of Electrical and Electronic Engineering, The University of Adelaide",154,8155,81698,117,49501,https://sites.google.com/wisc.edu/pengshi/home,Systems and Control/Electrical and Electronic Engineering/Cybernetics/Human-Computer Interaction,https://scholar.google.com.hk/citations?user=EGx1iH0AAAAJ&hl=en
79,"R. Prof. P. N. Suganthan, FIEEE'2015, SCI Highly Cited Researcher 2015-2022, (Codes from my GitHub)","KINDI Center for Computing Research, Qatar University (Hon Doc: U of Maribor; BA/MA: Cambridge U, UK",110,7008,60804,93,36686,https://github.com/fcampelo/EC-Bestiary,Machine Learning(ML)/Swarm-Evolutionary Computation(SEC)/Neural Networks(ANN)/Applications of ML SEC ANN.,https://scholar.google.com/citations?user=yZNzBU0AAAAJ&hl=en
80,Xingming Sun,Nanjing University of Information Science and Technology,59,1696,16427,53,13149,http://www.sunlab-usf.com/,Digital Watermarking/Information Security,http://scholar.google.com/citations?user=epqnljMAAAAJ&hl=en
81,Tarik Taleb,University of Oulu,68,3675,20876,61,16452,https://www.6gworld.com/teams/tarik-taleb/,Network Function Virtualization/Network Softwarization/Software Defined Networking,https://scholar.google.com/citations?user=o1Ap0TEAAAAJ&hl=en
82,"jen hong, tan","Highly Cited Researcher in Computer Science, National University of Singapore",49,2337,10775,45,9876,https://research.com/u/jen-hong-tan,image processing/computer vision/deep learning/infrared thermography/fundus image,https://scholar.google.com/citations?user=uJlD-A0AAAAJ&hl=en
83,Dacheng Tao,The University of Sydney,146,14012,85911,123,64572,https://www.igi-global.com/affiliate/dacheng-tao/1669,artificial intelligence/machine learning/computer vision/image processing/data mining,https://scholar.google.com/citations?user=RwlJNLcAAAAJ&hl=en
84,Athanasios Vasilakos,"PROF OF COMPLEX SYSTEMS, CYBERSECURITY, AI",129,7580,59774,107,42873,http://www.athanasiosvasilakos.gr/,Cybersecurity/AI in Cybersecurity/IoTs/Mobile Nets/Big Data Analytics/Artificial Intelligence/Machine Learning,https://scholar.google.com/citations?user=_yWPQWoAAAAJ&hl=en
85,Huanqing Wang,Michigan Technological University,4,9,44,4,44,https://dblp.org/pid/48/10582,Electric vehicle/optimal control/model predictive control,https://scholar.google.com/citations?user=6XxgmPEAAAAJ&hl=en
86,Ping Wang,"York University, IEEE Fellow, York Research Chair, IEEE VTS Distinguished Lecturer",71,3614,23180,60,17614,https://www.med.upenn.edu/pwanglab/,wireless communications/Internet of Things/cloud computing/smart grid,https://scholar.google.com/citations?user=3sIHxrcAAAAJ&hl=en
