83,Dacheng Tao,The University of Sydney,145,14024,83476,123,62164,https://scholar.google.com/scholar?q=Dacheng+Tao+homepage&hl=en&as_sdt=0&as_vis=1&oi=scholart,artificial intelligence/machine learning/computer vision/image processing/data mining,https://scholar.google.com/citations?user=RwlJNLcAAAAJ&hl=en
84,Athanasios Vasilakos,"PROF OF COMPLEX SYSTEMS, CYBERSECURITY, AI",128,7579,58939,107,42079,https://dl.acm.org/profile/81100083052,Cybersecurity/AI in Cybersecurity/IoTs/Mobile Nets/Big Data Analytics/Artificial Intelligence/Machine Learning,https://scholar.google.com/citations?user=_yWPQWoAAAAJ&hl=en
85,Huanqing Wang,Michigan Technological University,4,9,41,4,41,https://stat.uchicago.edu/people/profile/huanqing-wang/,Electric vehicle/optimal control/model predictive control,https://scholar.google.com/citations?user=6XxgmPEAAAAJ&hl=en
86,Ping Wang,"York University, IEEE Fellow, York Research Chair, IEEE VTS Distinguished Lecturer",70,3599,22721,60,17158,https://economics.wustl.edu/people/ping-wang,wireless communications/Internet of Things/cloud computing/smart grid,https://scholar.google.com/citations?user=3sIHxrcAAAAJ&hl=en
87,Qingqing Wu (武庆庆),University of Macau,50,4949,15336,49,15225,https://www.paediatrics.ox.ac.uk/team/qingqing-wu,6G/IRS/Green communication and computing/UAV communications/Machine learning,https://scholar.google.com/citations?user=as1T8CMAAAAJ&hl=en
88,Zheng-Guang Wu,Zhejiang University,75,2560,17080,68,12891,https://dl.acm.org/profile/81438592518,Markov Jump Systems/Sampled-Data Control Systems/Neural Networks/Fuzzy Systems/Singular Systems,https://scholar.google.com/citations?user=vy6JCNgAAAAJ&hl=en
89,Yang Xiang,"IEEE Fellow, Professfor, Swinburne University of Technology",68,2793,17269,59,13663,https://scholar.google.com/scholar?q=Yang+Xiang+homepage&hl=en&as_sdt=0&as_vis=1&oi=scholart,Cybersecurity/Network Security/System Security/Software Vulnerability Detection/Blockchain,https://scholar.google.com/citations?user=7ymTWY4AAAAJ&hl=en
90,Xiaolong Xu (许小龙),"Professor, Highly Cited Researcher 2021, Nanjing University of Information Science and Technology",42,1451,5512,42,5457,https://scholar.google.com/scholar_url?url=http://www.ricesci.cn/EN/Y2004/V18/I2/176&hl=zh-CN&sa=X&ei=NagvY5vvEKWTy9YP8u-t6Ag&scisig=AAGBfm018b4_c2zRALEguvtm1krir4xf-Q&oi=scholarr,Edge computing/Cloud computing/Big data/Fog computing/Mobile computing,https://scholar.google.com/citations?user=Tyzef4sAAAAJ&hl=en
91,Zeshui Xu (徐泽水),"Member of AE,EASA,IASCYS; DFIETI,FIEEE,FIFSA,FIET,FRSA,FORS,FBCS,FIAAM,FAAIA... Sichuan University",140,8913,75970,110,45553,https://scholar.google.co.uk/citations?user=kd9L_GUAAAAJ&hl=zh-CN,Decision Making/Information Fusion/Fuzzy Sets/Computational Intelligence/Bibliometrics,https://scholar.google.co.uk/citations?user=kd9L_GUAAAAJ&hl=en
92,Xin-She Yang (DPhil),"Computational intelligence, swarm intelligence, optimization, metaheuristics, nature-inspired",91,10491,73270,84,51221,https://scholar.google.com/scholar_url?url=https://books.google.com/books%3Fhl%3Den%26lr%3D%26id%3DJ0VcBQxtcwsC%26oi%3Dfnd%26pg%3DPP1%26dq%3DXin-She%2BYang%2B(DPhil)%2Bhomepage%26ots%3Ds8iBi8c_iO%26sig%3Do5hNSGG1uLjUwlUoRa95EsQac3Q&hl=en&sa=X&ei=OKgvY4D_NtaWy9YPxaGk2AU&scisig=AAGBfm1f7qeeUaowgPqml74CfTgYvQ4xwQ&oi=scholarr,swarm intelligence/optimization/metaheuristics/computational intelligence.,https://scholar.google.com/citations?user=fA6aTlAAAAAJ&hl=th
93,Fei Yu,University of Southern Denmark,11,78,368,9,276,https://fy29.abe.msstate.edu/,Industry 4.0 technology and smart product development,https://scholar.google.com/citations?user=3OHgAmIAAAAJ&hl=en
94,Xiangxiang Zeng,"Deparment of Computer Science, Hunan University",50,1614,7339,40,6158,https://xzenglab.github.io/xzeng/,Computational Intelligence/Bio-inspired Intelligence,https://scholar.google.com/citations?user=B20HBMIAAAAJ&hl=en
95,Yong Zeng (曾勇）,"Southeast University, China; Purple Mountain Laboratories, China",53,4103,17558,52,17081,https://www.adscientificindex.com/scientist.php?id=413103,UAV communications/Massive MIMO/Extremely-Large MIMO (XL-MIMO)/Integrated Sensing and Communication,https://scholar.google.com/citations?user=ENldmwIAAAAJ&hl=en
96,Jianming Zhan,Hubei University for Nationalities,44,1006,7479,38,4948,https://content.iospress.com/articles/journal-of-intelligent-and-fuzzy-systems/ifs707,logical algebras(BL-algebras/R0-algebras and MTL-algebras)/fuzzy algebras(semirings/hemirings and rings) and their hyperstuctures(hyperring/hypergroups,https://scholar.google.com/citations?user=XmJAmNIAAAAJ&hl=en
97,Rui Zhang,"Chair Professor, National University of Singapore",123,12336,67467,105,51869,https://www.eecis.udel.edu/~ruizhang/,Wireless Communications/MIMO/Cognitive Radio/Wireless Power Transfer/UAV,https://scholar.google.com.sg/citations?user=yoJqPIkAAAAJ&hl=en
98,Xian-Ming Zhang,Swinburne University of Technology,48,2208,12116,44,10068,https://scholar.google.com/citations?user=0QgZ9lwAAAAJ&hl=en,Networked Control Systems/Event-triggered Control/H-infinity Filtering/Time-delay Systems/Neural Networks,https://scholar.google.com/citations?user=aZcLkqgAAAAJ&hl=en
99,Xuyun Zhang,Macquarie University,43,1243,6868,41,5752,https://ieeexplore.ieee.org/author/37089171155,big data mining/scalable machine learning/big data privacy and cybersecurity/cloud/edge computing/Internet of Things,https://scholar.google.com.au/citations?user=wbF6HL8AAAAJ&hl=en
100,Yan Zhang,"IEEE Fellow, Highly Cited Researcher, University of Oslo, Norway",94,6475,33000,83,25381,http://cse.csusb.edu/yzhang/,wireless networks/smart grid/edge intelligence/blockchain/digital twin,https://scholar.google.no/citations?user=-gahn9AAAAAJ&hl=no
101,Quan Zou (邹权),University of Electronic Science and Technology of China,71,3201,15544,64,13099,https://www.ejournal.org.cn/EN/abstract/abstract4593.shtml,Bioinformatics/data mining,https://scholar.google.com/citations?user=RcaUHs4AAAAJ&hl=en
