,Name,Affilation,H-index,Citations 2020,Total_citation,H-index_since_2016,Citation_since_2016,HomePage,Area of Research,Google_Scholar
0,"U Rajendra Acharya (SCI Highly Cited Researcher 2016-2022)  PhD, DEng, DSc",Unknown affiliation,122,11963,59890,109,47340,https://rajendraacharya.com/,Artificial Intelligence,https://scholar.google.com.sg/citations?user=8FjY99sAAAAJ&hl=en
1,IAN  F.  AKYILDIZ,"Truva Inc. , USA",134,6633,137822,85,42359,https://en.wikipedia.org/wiki/Ian_F._Akyildiz,Wireless Communication/5G/6G Wireless Systems/Intelligent Surfaces for Wireless Communication/Nano-scale and Molecular Commun,https://scholar.google.com/citations?user=rAGwv14AAAAJ&hl=en
2,Ibrahim Aljarah,"Professor of Big Data Mining and Computational Intelligence, The University of Jordan",48,3238,10752,47,10552,http://evo-ml.com/ibrahim/biography.html,Artificial  intelligence/Swarm Intelligence/Data Science/Machine Learning/Evolutionary Computation,https://scholar.google.com/citations?user=moOTIYEAAAAJ&hl=en
3,Jeffrey Andrews,"Truchard Family Chair and Director of 6G@UT, University of Texas at Austin",107,3890,67579,74,31126,https://sites.utexas.edu/jandrews/resume-pdf/,Wireless Communications/Communication Theory/Machine Learning for Communications/Stochastic Geometry/Information Theory,https://scholar.google.com/citations?user=Hr9Gey0AAAAJ&hl=en
4,Bennis Mehdi,"Full Professor, IEEE Fellow, Head of ICON, University of Oulu",75,7186,30321,71,27738,https://www.wikidata.org/wiki/Q102163111,B5G/6G/machine learning/semantic communication/protocol learning,https://scholar.google.com/citations?user=RW4sJu8AAAAJ&hl=en
5,Emil Björnson,"Professor of Wireless Communication, KTH Royal Institute of Technology",68,4492,21235,66,18386,https://ebjornson.com/,Massive MIMO/Cell-free Massive MIMO/RIS/Signal processing/Wireless communication,https://scholar.google.se/citations?user=Maij4akAAAAJ&hl=en
6,Rajkumar Buyya,"School of Computing and Information Systems, The Uni of Melbourne; Fellow of IEEE & Academia Europea",158,11402,130298,110,66836,https://fedcsis.org/2021/keynotes/buyya,Computer Systems/Cloud Computing/Distributed Systems/Edge Computing/Internet of Things,https://scholar.google.com/citations?user=7xN6JqYAAAAJ&hl=en
7,Xing Cai,"Senior Research Scientist at Simula Research Laboratory, Professor at University of Oslo",19,139,2115,14,820,https://koei.fandom.com/wiki/Xingcai#Role_in_Games,Parallel programming/High-performance computing/numerical methods for PDEs,https://scholar.google.com/citations?user=IWQbrcK5CEwC&hl=en
8,Giuseppe Caire,"Professor, Technical University of Berlin, Germany, and Professor of Electrical Engineering (on",85,2902,40952,59,17618,https://www.humboldt-foundation.de/en/entdecken/newsroom/dossier-alexander-von-humboldt-professur/giuseppe-caire,Information Theory/Communications/Signal Processing/Statistics,https://scholar.google.com/citations?user=g66ErTcAAAAJ&hl=en
9,Jinde Cao,"Academician, RAS/AE/LAS/PAS/AAS/RAE/EASA/IASCYS  & FIEEE/FAAIA/DFIETI; Southeast University",132,8710,75540,96,45763,https://www.ae-info.org/ae/User/Cao_Jinde,Complex networks/neural networks/multi-agent systems - engineering stability - dynamics and control - time-delay systems,https://scholar.google.com/citations?user=8_ffELYAAAAJ&hl=en
10,C. L. Philip Chen,"Chair Professor, South China University of Technology, Philip.Chen@ieee.org",99,7314,42474,88,32882,https://dblp.org/pid/48/4856,Computational Intelligence/Intelligent Control/Cybernetics/Intelligent Transportation Systems/Data Science/Engineering,https://scholar.google.com/citations?user=Q5248zwAAAAJ&hl=en
11,Jinjun Chen,"MAE (Academia Europea), IEEE Fellow (Computer Society), AAIA Fellow, HiCi; Professor and Deputy",71,2315,14637,54,10392,https://scholar.google.com/scholar_url?url=https://www.sciencedirect.com/science/article/pii/S0743731518302375&hl=en&sa=X&ei=yeJyY_TMMueR6rQPuLqy-AU&scisig=AAGBfm1OqmxEoV-H6mfH3YpJukNasUpyjQ&oi=scholarr,Cloud Computing/Scalable Architecture/Scalable Data Storage/Scalable Data Processing (Privacy),https://scholar.google.com/citations?user=mQ9vJ24AAAAJ&hl=en
12,Min Chen,"Professor, IEEE Fellow, Highly Cited Researcher, Huazhong University of Science and Technology",91,6182,37132,73,28029,https://feldmanlab.ucsf.edu/people/min-chen-phd,Cognitive Computing and Big Data Analytics/IoT Sensing/5G Networks/Robotics/Edge Computing,https://scholar.google.com/citations?user=_HyHTrsAAAAJ&hl=en
13,Xiaofeng Chen,"Professor, Xidian University, China",60,1808,14489,52,11011,https://scholar.google.com/scholar?q=Xiaofeng+Chen+homepage&hl=en&as_sdt=0&as_vis=1&oi=scholart,Security/Cryptography/Cloud computing,https://scholar.google.com/citations?user=-3WhJecAAAAJ&hl=en
14,Francisco Chiclana,"Professor of Computational Intelligence and Decision Making, De Montfort University, UK",71,2364,21444,63,13044,https://www.mdpi.com/about/announcements/3570,Decision making/computational intelligence/information fusion/consensus/sentiment analysis,https://scholar.google.com/citations?user=qDOxZIIAAAAJ&hl=en
15,zhihua cui,"Taiyuan University of Science and Technology, Taiyuan, Shanxi, China, 030024",46,1677,9180,37,7061,https://www.walshmedicalmedia.com/editor/zhihua-cui-8740,evolutionary computation,https://scholar.google.com/citations?user=BpDrULIAAAAJ&hl=en
16,Linglong Dai,"Associate Professor, Tsinghua University; IEEE Fellow",66,3344,18313,63,16688,https://scholar.google.com/scholar_url?url=http://oa.ee.tsinghua.edu.cn/~dailinglong/publications/paper/Fast%2520channel%2520tracking%2520for%2520terahertz%2520beamspace%2520massive%2520MIMO%2520systems.pdf&hl=en&sa=X&ei=z-JyY93vBc6vywTz2InoCQ&scisig=AAGBfm2R-67vcBg3S7LwSqGGTl8xxFiSXw&oi=scholarr,Wireless Communications/RIS/Massive MIMO/Millimeter-Wave/Teraherz Communications/Non-Orthogonal Mutiple Access,https://scholar.google.com/citations?user=OTFnifoAAAAJ&hl=en
17,Merouane Debbah,"Centralesupelec, Technology Innovation Institute, MBZUAI, Lagrange Mathematics Center",103,9057,52878,89,38956,https://ieeexplore.ieee.org/author/37284195000,5G/6G/Machine Learning/Random Matrix Theory/Game Theory,https://scholar.google.com/citations?user=HU5I0X4AAAAJ&hl=en
18,Zhiguo Ding,"University of Manchester, Fellow of IEEE, Web of Science Highly Cited Researcher",97,8233,42665,92,38478,https://www.research.lancs.ac.uk/portal/en/people/zhiguo-ding(6f420ab8-4825-4195-a3d8-07e5c5b7716e).html,Wireless communications/signal processing/and cross-layer optimization,https://scholar.google.co.uk/citations?user=V-nB8scAAAAJ&hl=en
19,"Mianxiong Dong, Foreign Fellow of EAJ","Vice President and Professor, Muroran Institute of Technology, Japan",57,2236,12220,51,10841,https://ece.princeton.edu/sites/ee/files/people-cv/vincepoor_cv_long_apr21.pdf,Cyber-Physical Systems/Internet of Things/Artificial Intelligence,https://scholar.google.co.jp/citations?user=TqyApAUAAAAJ&hl=en
20,Yucheng Dong,"Professor of Management and Systems Sciences, Sichuan University",65,2202,13167,61,10870,https://www.journals.elsevier.com/computers-and-industrial-engineering/editorial-board/yucheng-dong,Decision Analysis/Human Dynamics/Social Network/Data Science,https://scholar.google.com/citations?user=tFVYDw4AAAAJ&hl=en
21,Maged Elkashlan,"Associate Professor, Queen Mary University of London",63,2718,16801,55,14370,https://vivo.nkn.uidaho.edu/vivo/display/n169367,IRS/URLLC/UAV/PLS/NOMA,https://scholar.google.com/citations?user=mncnnOAAAAAJ&hl=en
22,Zubair Md. Fadlullah,"Associate Professor, Research Chair, Department of Computer Science, Lakehead University, TBRHRI",41,1360,8194,39,6481,https://dblp.org/pid/64/3988,Beyond 5G/Smart Health/UAV & Energy efficient Networks/QoS & Security/Deep Learning applications,https://scholar.google.com/citations?user=dZyfKpYAAAAJ&hl=en
23,Hossam Faris,"Professor, The University of Jordan",52,4262,14176,50,13926,http://evo-ml.com/hossam-faris/,Data Science/Knowledge Systems/Data Mining/Evolutionary computation,https://scholar.google.com/citations?user=UEYd--YAAAAJ&hl=en
24,Giancarlo Fortino,"Full Prof. of Computer Engineering, University of Calabria, FIEEE, FAAIA, Highly Cited Researcher",70,3762,18135,64,15026,https://ieeexplore-ieee-org.ezproxy.u-pec.fr/author/37273318600,Human-Machine Systems/Agent-based Computing/Internet of Things/Wearable Computing/Wireless/Body Area Networks,https://scholar.google.com/citations?user=ecImn1MAAAAJ&hl=it
25,Hamido Fujita,Iwate Prefectural University,74,4473,19679,74,18396,https://portal.insticc.org/KeynotesInterviewsArchive/5fac038fe261a5eed8511c13,Machine Learning,https://scholar.google.com/citations?user=MxzV1nQAAAAJ&hl=en
26,Erik G. Larsson,"Professor, Dept. of Electrical Engineering (ISY), Linköping University, Sweden",91,6323,48149,72,32179,https://www.kva.se/en/contact/erik-g-larsson-2/,Wireless communications/statistical signal processing/localization/massive MIMO/networks,https://scholar.google.se/citations?user=79Lry6oAAAAJ&hl=en
27,Amir H. Gandomi,"Professor of Data Science, University of Technology Sydney",85,6847,34763,74,28043,https://profiles.uts.edu.au/Amirhossein.Gandomi,Data Analytics/Genetic Programming/Engineering Optimization/Evolutionary Computation/Smart Cities,https://scholar.google.com/citations?user=VMf3wfMAAAAJ&hl=en
28,Xiaohua Ge,"Swinburne University of Technology, Melbourne, Australia",39,2009,8368,39,8168,https://dblp.org/pid/118/3514,Networked control systems/Cyber-physical systems/Multi-agent systems/Intelligent vehicles/Connected automated vehicles,https://scholar.google.com.au/citations?user=B37CYFoAAAAJ&hl=en
29,"Mohsen Guizani, FIEEE",Mohamed Bin Zayed University of Artificial Intelligence (MBZUAI),97,11105,51049,86,43608,https://ieeexplore.ieee.org/author/37273043000,Internet of Things/Applied AI/ML and Cybersecurity,https://scholar.google.com/citations?user=RigrYkcAAAAJ&hl=en
30,Song Guo,"FCAE, FIEEE, The Hong Kong Polytechnic University",75,4418,23812,68,19810,https://www.lancaster.ac.uk/arts-and-social-sciences/people/song-guo,Edge Intelligence/Federated Learning/Edge Computing/Distributed System/Wireless Networking,https://scholar.google.com/citations?user=Ib-sizwAAAAJ&hl=en
31,Harald Haas,The University of Edinburgh,97,5648,48368,80,32321,https://en.wikipedia.org/wiki/Harald_Haas_(engineer),Optical Wireless Communications/Interference Managment in Wireless Networks/Spatial Modulation,https://scholar.google.com/citations?user=XxIwRJQAAAAJ&hl=ja
32,Yuki Hagiwara,Fraunhofer IKS,30,2001,7627,30,7602,https://na.finalfantasyxiv.com/lodestone/character/2849881/,Artificial Intelligence,https://scholar.google.com.sg/citations?user=P6WI2DQAAAAJ&hl=en
33,"Qing-Long Han, Pro Vice-Chancellor and Distinguished Professor, MAE, IEEE Fellow, IFAC Fellow",Swinburne University of Technology,112,6092,41521,96,29299,https://au.linkedin.com/in/qing-long-han-22992227,Networked control systems/time-delay systems/multi-agent systems/smart grids/unmanned surface vehicles,https://scholar.google.com.au/citations?user=j0pyptAAAAAJ&hl=en
34,Zhu Han,University of Houston,123,8605,62833,95,43459,https://scholar.google.com/citations?user=ty7wIXoAAAAJ&hl=en,Game Theory/Wireless Networking/Security/Data Science/Smart Grid,https://scholar.google.com/citations?user=ty7wIXoAAAAJ&hl=en
35,L Hanzo,"Chair of Telecommunications, University of Southampton",114,8325,73795,90,40653,https://ieeexplore.ieee.org/author/37276255400,telecommunications/wireless communication/quantum_information_science/video_coding/video_networking,https://scholar.google.co.uk/citations?user=p0jnEW0AAAAJ&hl=en
36,L Hanzo,"Chair of Telecommunications, University of Southampton",114,8325,73795,90,40653,https://ieeexplore.ieee.org/author/37276255400,telecommunications/wireless communication/quantum_information_science/video_coding/video_networking,https://scholar.google.co.uk/citations?user=p0jnEW0AAAAJ&hl=en
37,Robert Heath,"Lampe Distinguished Professor, North Carolina State University",139,7737,84049,94,45528,https://en.wikipedia.org/wiki/Robert_W._Heath_Jr.,wireless/MIMO/communications/signal processing/information theory,https://scholar.google.com/citations?user=17Ko8Q0AAAAJ&hl=en
38,Francisco Herrera,"Professor Computer Science and AI, Granada University, Spain",166,14562,121165,128,68707,https://www.instagram.com/herrerabox/?hl=en,Artificial Intelligence/Computational Intelligence/Data mining/Evolutionary Algorithms/Big Data Analytics,https://scholar.google.com/citations?user=HULIk-QAAAAJ&hl=en
39,Enrique Herrera-Viedma,"Professor of Computer Science and Artificial Intelligence, Spain, University of Granada",111,5985,51410,92,29989,https://scholar.google.com/citations?user=g8ZXTuYAAAAJ&hl=en,Fuzzy sets/fuzzy decision making/computing with words/multiple criteria decision making/consensus,https://scholar.google.com/citations?user=g8ZXTuYAAAAJ&hl=en
40,Ekram Hossain,"Professor, University of Manitoba, Canada, IEEE Fellow",99,3273,38043,72,20432,https://www.comsoc.org/ekram-hossain,Wireless communication networks/radio resource allocation/cognitive radio/multi-tier cellular networks,https://scholar.google.com/citations?user=Lb617EMAAAAJ&hl=en
41,Guang-Bin Huang,"Full Professor, Nanyang Technological University, Singapore",73,5649,56674,61,34915,https://scholar.google.com/scholar_url?url=https://www.researchgate.net/profile/Narasimhan-Sundararajan/publication/3451938_Can_threshold_networks_be_trained_directly_IEEE_Trans_Circuits_Syst_II/links/00b7d5190fb1db3947000000/Can-threshold-networks-be-trained-directly-IEEE-Trans-Circuits-Syst-II.pdf&hl=en&sa=X&ei=7OJyY4TlKrGB6rQP-8iQuAk&scisig=AAGBfm3Y3nArbUDhXoTSN1gYjTlkPmf2IA&oi=scholarr,Machine Learning/Neural Networks/Neuroscience,https://scholar.google.com.sg/citations?user=LhSqQCIAAAAJ&hl=en
42,Kaibin Huang,"Professor, Dept. of EEE, The University of Hong Kong; IEEE Fellow; ISI Highly Cited Researcher",54,2884,16397,45,13048,https://en.wikipedia.org/wiki/Kaibin_Huang,Machine Learning/Mobile Edge Computing/Wireless Communications/Wireless Power Transfer/Stochastic Geometry,https://scholar.google.com/citations?user=HfuA3uIAAAAJ&hl=en
43,Thomas JR Hughes,"Peter O'Donnell Jr. Chair in Computational and Applied Mathematics, University of Texas at Austin",152,7032,131783,96,43796,https://en.wikipedia.org/wiki/Thomas_J.R._Hughes#Books,Finite Element Methods/Solid Mechanics/Computational Fluid Dynamics/Partial Differential Equations/Isogeometric Analysis,https://scholar.google.com/citations?user=6tPdlYAAAAAJ&hl=en
44,Yaochu Jin,"A. v. Humboldt Professor for AI, Bielefeld University, Germany; University of Surrey, UK",92,5651,35439,76,23497,https://ekvv.uni-bielefeld.de/pers_publ/publ/sekretariatListeAct?kontaktId=6164174,Evolutionary algorithms/Multiobjective optimization/Multiobjective learning/Trustworthy AI/Developmental AI,https://scholar.google.com/citations?user=B5WAkz4AAAAJ&hl=en
45,"Nei Kato(IEEE Fellow, IEICE Fellow)","Professor and Dean, Graduate School of Information Sciences, Tohoku University, Japan",78,3295,23630,62,16067,https://vtsociety.org/contact/nei-kato,Wireless networking,https://scholar.google.com/citations?user=LfLfZXEAAAAJ&hl=en
46,"Dr. Neeraj Kumar, SMIEEE","Professor, CSED, Thapar Institute of Engineering and Technology, India",102,9987,34077,97,32101,https://dsc.kau.edu.sa/Pages-Neeraj-Kumar-en.aspx,IoT and Machine Learning/Deep Learning/Blockchain Technology,https://scholar.google.co.in/citations?user=gL9gR-4AAAAJ&hl=en
47,"Dr.Arun Kumar Sangaiah 桑亞倫, SM'IEEE (WoS-Highly Cited Researcher, Yushan Young Scholar)","玉山學者, National Yunlin University of Science & Technology, Taiwan & VIT University, India",74,4800,17553,74,17368,https://scholar.google.co.in/citations?user=8yF6Xc4AAAAJ&hl=en,Computational Intelligence/Internet of Things/Cognitive Computing,https://scholar.google.co.in/citations?user=8yF6Xc4AAAAJ&hl=en
48,Victor C. M. Leung,Shenzhen University / The University of British Columbia,106,6585,51762,89,34191,https://dl.acm.org/profile/81100299209,communication systems/wireless networks/mobile systems,https://scholar.google.ca/citations?user=ajvCoo4AAAAJ&hl=en
49,Geoffrey Ye Li (李烨),"Chair Professor in Wireless Systems, Dept EEE, Imperial College London",112,5872,56642,81,28308,https://scholar.google.fi/citations?user=d0FzG8YAAAAJ&hl=fi,Signal Processing/and/Machine Learning/for/Wireless Communications,https://scholar.google.com/citations?user=d0FzG8YAAAAJ&hl=en
50,Hongyi Li,"Assistant Professor, University of Houston",35,918,4163,31,3563,https://scholar.google.com/scholar_url?url=https://www.researchgate.net/profile/Hongyi-Li-12/publication/248802637_Rayleigh_wave_tomography_of_China_and_adjacent_regions/links/5823603c08ae61258e3ca9ea/Rayleigh-wave-tomography-of-China-and-adjacent-regions.pdf&hl=en&sa=X&ei=9-JyY7_7O7GB6rQP-8iQuAk&scisig=AAGBfm0Y4zCXzSMGdI__PPkoJvo3llMMWw&oi=scholarr,watershed hydrology/earth system modeling/coupled human-nature system,https://scholar.google.com/citations?user=yWy-5icAAAAJ&hl=en
51,Jin Li  李进,Professor @Guangzhou University,61,2008,19871,55,13475,https://www.crunchbase.com/person/jin-li-cad4,Trust and Security in Artificial Intelligence/Computating and Storage in Cloud Computing/Blockchain,https://scholar.google.com/citations?user=7GDV2vUAAAAJ&hl=en
52,"Xuelong Li (Executive Councilor of AAAI, 21-24)","Professor, Northwestern Polytechnical University, China",124,8555,59297,103,42734,https://api.profiles.sydney.edu.au/AcademicProfiles/profile/resource?urlid=dacheng.tao&type=cv,artificial intelligence/applied mathematics/physics,https://scholar.google.com/citations?user=ahUibskAAAAJ&hl=en
53,yongming li,"college of computer science, shaanxi normal university",37,406,5110,24,2595,https://www.eastwestcenter.org/about/staff/ming-li.yong,fuzzy systems/quantume logic and quantum information/lattice/topology/model checking,https://scholar.google.com/citations?user=P3VERZ0AAAAJ&hl=en
54,Huchang Liao (廖虎昌),"IET Fellow, BCS Fellow; Business School, Sichuan University",67,3546,14695,63,13625,http://2020.cibda.org/committee,Decision analysis/Fuzzy Systems/Multiple criteria decision making/Preference learning,https://scholar.google.co.uk/citations?user=KlWnnbIAAAAJ&hl=en
55,Chong Lin,Qingdao University,72,1909,17364,54,10046,https://en.wikipedia.org/wiki/Lin_Chong,systems and control theory,https://scholar.google.com/citations?user=AQbRErEAAAAJ&hl=en
56,Yan-Jun Liu,Liaoning University of Technology,65,2268,15524,60,12084,https://orcid.org/0000-0002-3880-7446,Adaptive control/fuzzy control/neural networks,https://scholar.google.com/citations?user=x_Wk1jAAAAAJ&hl=en
57,Yuanwei Liu,"Associate Professor in Queen Mary University of London, Web of Science Highly Cited Researcher",57,3430,14620,57,14353,https://scholar.google.com/scholar?q=Yuanwei+Liu+homepage&hl=en&as_sdt=0&as_vis=1&oi=scholart,NOMA/RIS/AI/6G/Integrated Sensing and Communications,https://scholar.google.com/citations?user=FxLf7ZAAAAAJ&hl=en
58,Wenjing Lou,"W. C. English Endowed Professor, IEEE Fellow, Virginia Tech, USA",84,2831,40868,61,20382,https://ece.engineering.arizona.edu/news-events/ece-seminar-wenjing-lou,Cyber Security/Wireless Networks/Wireless Security/Network Security/Cloud Computing,https://scholar.google.com/citations?user=hM8uAwoAAAAJ&hl=en
59,Majdi Mafarja,"Associate Professor of Computer Science, Birzeit University",37,2659,8301,36,8256,https://dblp.org/pid/202/6216.html,Feature Selection/Machine Learning/Artificial Intelligence/Bio-inspired Algorithms/Metaheuristics,https://scholar.google.com/citations?user=ftkD0MgAAAAJ&hl=en
60,Luis Martínez,"Professor of Computer Science, University of Jaén",67,2679,24218,54,14134,https://harris.uchicago.edu/directory/luis-martinez,Fuzzy decision making/Computing with words/Recommender Systems,https://scholar.google.com/citations?user=PG3D8UMAAAAJ&hl=en
61,Thomas Marzetta,"Distinguished Industry Professor, Department of Electrical and Computer Engineering, New York",62,4642,49238,46,29976,https://wireless.engineering.nyu.edu/thomas-marzetta/,Beyond Massive MIMO,https://scholar.google.com/citations?user=tBLWIBoAAAAJ&hl=en
62,Seyedali Mirjalili,"Professor, Torrens University Australia, Adjunct Griffith University",83,16968,62447,82,60060,https://www.udemy.com/user/seyedali-mirjalili/,Metaheuristics/Robust Optimization/Engineering Optimization/Evolutionary Algorithm/Swarm Intelligence,https://scholar.google.com/citations?user=TJHmrREAAAAJ&hl=en
63,Andreas F. Molisch,"Professor of Electrical Engineering, University of Southern California",104,5261,62062,73,30694,"https://www.wiley.com/en-aw/Wireless+Communications,+2nd+Edition-p-9780470741870",wireless propagation channels/multi-antenna systems/ultrawideband communications and positioning/cooperative communications,https://scholar.google.com/citations?user=W0wwrucAAAAJ&hl=en
64,Derrick Wing Kwan Ng,"Scientia  Associate Professor,  University of New South Wales",72,3928,21923,67,19258,https://scholar.google.com/scholar_url?url=https://arxiv.org/pdf/2010.09317&hl=en&sa=X&ei=CONyY9-IKZD-yQS3_I_wDA&scisig=AAGBfm22XLgDFg1w1lipIoJdS2Oq1VY2iw&oi=scholarr,Wireless Communications,https://scholar.google.com/citations?user=NUJSHxoAAAAJ&hl=en
65,H. Nguyen-Xuan,"CIRTech Institute, HUTECH University, Vietnam",71,2451,16932,62,12224,https://scholar.google.co.uk/citations?user=3iK9h-gAAAAJ&hl=en,Computational Engineering/Large-scale Data/3D Printing/Renewable Energy,https://scholar.google.co.uk/citations?user=3iK9h-gAAAAJ&hl=en
66,Dusit (Tao) Niyato,Nanyang Technological University (NTU),109,8949,53738,93,38936,https://dblp.org/pid/76/440,ดุสิต นิยะโต - เต๋า,https://scholar.google.com/citations?user=T8sVhLMAAAAJ&hl=en
67,Kaoru Ota (太田　香),"MEXT Excellent Young Researcher (文部科学省　卓越研究員), Muroran Institute of Technology",52,2133,10840,50,9960,https://nrid.nii.ac.jp/en/nrid/1000050713971/,,https://scholar.google.com/citations?user=8JVn8RsAAAAJ&hl=ja
68,Mugen Peng,"Beijing University of Posts & Telecommun., IEEE Fellow, Web of Science Highly Cited Researcher",56,2400,16836,49,12233,https://books.apple.com/au/author/mugen-peng/id1196680226,Fog Computing/Cloud Radio Access Networks/Integrated Satellite-Terrestrial Networks/6G,https://scholar.google.com/citations?user=85mAZVcAAAAJ&hl=en
69,HV Poor,"Michael Henry Strater University Professor, Princeton University",162,14342,130996,112,69500,http://en.wikipedia.org/wiki/Auburn_University,Communication Systems/Wireless Communications/Communications/Statistical Signal Processing/Information Theory,https://scholar.google.com/citations?user=Dq93mOUAAAAJ&hl=en
70,Lianyong Qi(齐连永),"Professor, China University of Petroleum (East China)",48,1826,7083,47,6829,https://scholar.google.com/citations?user=pxNRRsAAAAAJ&hl=en,service computing/big data/recommender system,https://scholar.google.com/citations?user=pxNRRsAAAAAJ&hl=en
71,Timon Rabczuk,Bauhaus University Weimar,111,7379,45841,96,35318,https://scholar.google.com/scholar?q=Timon+Rabczuk+homepage&hl=en&as_sdt=0&as_vis=1&oi=scholart,Computational Mechanics/Solid Mechanics,https://scholar.google.ca/citations?user=3CBuGosAAAAJ&hl=en
72,Kim-Kwang Raymond Choo,"Cloud Tech Endowed Professor, University of Texas at San Antonio",100,6708,28714,94,26221,https://business.utsa.edu/faculty/kim-kwang-raymond-choo/,Cloud Forensics/Cyber Forensics/Cyber Security/IoT Security/Blockchain,https://scholar.google.com/citations?user=rRBNI6AAAAAJ&hl=en
73,Kui Ren,"Professor, Zhejiang University, ACM Fellow, IEEE Fellow",87,3792,41992,71,24166,https://engineering.buffalo.edu/computer-science-engineering/people/faculty-directory.host.html/content/shared/engineering/computer-science-engineering/profiles/faculty/ren-kui.detail.research.html,Data Security & Privacy/IoT Security/AI Security,https://scholar.google.com/citations?user=uuQA_rcAAAAJ&hl=en
74,Walid Saad,"Professor, Electrical and Computer Engineering",87,7520,36356,80,31333,https://www.linkedin.com/in/walid-saad-089640a,6G/machine learning/semantic communications/security and cyber-physical systems/unmanned aerial vehicles,https://scholar.google.com/citations?user=kYDNA0UAAAAJ&hl=en
75,Robert Schober,Friedrich-Alexander-University Erlangen-Nuremberg,96,5364,45813,82,30830,https://dblp.org/pid/95/2265,,https://scholar.google.com/citations?user=Uu0BpX8AAAAJ&hl=en
76,"Ling Shao, Fellow of IEEE/IAPR",Terminus Group,98,8264,38521,93,33445,https://ieeexplore.ieee.org/author/38265369400,Computer Vision/Deep Learning/Artificial Intelligence/Medical Imaging/Vision and Language,https://scholar.google.com/citations?user=z84rLjoAAAAJ&hl=en
77,Xuemin (Sherman) Shen,"University Professor, University of Waterloo",136,9344,79248,108,47722,https://scholar.google.ca/citations?user=Bjl3GwoAAAAJ&hl=en,Wireless networking/MAC/Network security/VANET,https://scholar.google.com/citations?user=Bjl3GwoAAAAJ&hl=cs
78,Peng Shi,"Professor, School of Electrical and Electronic Engineering, The University of Adelaide",154,8172,81887,117,49681,https://scholar.google.com/citations?user=sRk9x_0AAAAJ&hl=en,Systems and Control/Electrical and Electronic Engineering/Cybernetics/Human-Computer Interaction,https://scholar.google.com.hk/citations?user=EGx1iH0AAAAJ&hl=en
79,"R. Prof. P. N. Suganthan, FIEEE'2015, SCI Highly Cited Researcher 2015-2022, (Codes from my GitHub)","KINDI Center for Computing Research, Qatar University (Hon Doc: U of Maribor; BA/MA: Cambridge U, UK",110,7000,61088,93,36955,https://github.com/fcampelo/EC-Bestiary,Machine Learning(ML)/Swarm-Evolutionary Computation(SEC)/Neural Networks(ANN)/Applications of ML SEC ANN.,https://scholar.google.com/citations?user=yZNzBU0AAAAJ&hl=en
80,Xingming Sun,Nanjing University of Information Science and Technology,59,1718,16461,53,13183,https://webs.nuist.edu.cn/_s58/2018/0823/c3090a111533/page.psp,Digital Watermarking/Information Security,http://scholar.google.com/citations?user=epqnljMAAAAJ&hl=en
