87,Qingqing Wu (武庆庆),"Assistant Professor, University of Macau",45,5100,11599,44,11475,https://qingqingwu.weebly.com/,6G/IRS/UAV communications/Machine learning/MIMO transceiver design,https://scholar.google.com/citations?user=as1T8CMAAAAJ&hl=en
88,Zheng-Guang Wu,Zhejiang University,70,2595,15375,61,11208,https://ieeexplore.ieee.org/author/37404351000,Markov Jump Systems/Sampled-Data Control Systems/Neural Networks/Fuzzy Systems/Singular Systems,https://scholar.google.com/citations?user=vy6JCNgAAAAJ&hl=en
89,Yang Xiang,"IEEE Fellow, Professfor, Swinburne University of Technology",64,2743,15513,57,11893,https://sites.google.com/site/xyangphilip,Cybersecurity/network and system security/deep learning/vulnerability detection/traffic classification,https://scholar.google.com/citations?user=7ymTWY4AAAAJ&hl=en
90,Xiaolong Xu (许小龙),"Professor, Highly Cited Researcher 2021, Nanjing University of Information Science and Technology",36,1406,4128,36,4075,https://scholar.google.ca/citations?user=aTZFM3EAAAAJ&hl=en,Edge computing/Cloud computing/Big data/Fog computing/Mobile computing,https://scholar.google.com/citations?user=Tyzef4sAAAAJ&hl=en
91,Zeshui Xu (徐泽水),"Academician of EASA,IASCYS; Fellow of IEEE,IFSA,IET,RSA,ORS,BCS,VEBLEO,IAAM,AAIA; Sichuan University",136,9469,70933,105,40669,https://scholar.google.com/citations?user=9HgSVSoAAAAJ&hl=zh-CN,Decision Making/Information Fusion/Fuzzy Sets/Computational Intelligence/Bibliometrics,https://scholar.google.co.uk/citations?user=kd9L_GUAAAAJ&hl=en
92,Xin-She Yang (DPhil),"Computational intelligence, swarm intelligence, optimization, metaheuristics, nature-inspired",89,10509,67720,80,45776,https://scholar.google.co.uk/citations?user=fA6aTlAAAAAJ&hl=en,swarm intelligence/optimization/metaheuristics/computational intelligence.,https://scholar.google.com/citations?user=fA6aTlAAAAAJ&hl=th
93,Fei Yu,University of Southern Denmark,9,67,230,7,167,https://designlab.com/yufeihuan/,Industry 4.0 technology and smart product development,https://scholar.google.com/citations?user=3OHgAmIAAAAJ&hl=en
94,Xiangxiang Zeng,"Deparment of Computer Science, Hunan University",48,1618,6221,39,5043,https://xzenglab.github.io/xzeng/,Computational Intelligence/Bio-inspired Intelligence,https://scholar.google.com/citations?user=B20HBMIAAAAJ&hl=en
95,Yong Zeng (曾勇）,"Southeast University, China; Purple Mountain Laboratories, China",45,3790,14448,45,13967,http://www.gkcccc.org/openchurch/multimedia/podcasts/peace?page=18,UAV communications/Massive MIMO/Extremely-Large MIMO (XL-MIMO)/Integrated Sensing and Communication,https://scholar.google.com/citations?user=ENldmwIAAAAJ&hl=en
96,Jianming Zhan,Hubei University for Nationalities,43,1043,6799,35,4253,https://scholar.google.com/citations?user=XmJAmNIAAAAJ&hl=en,logical algebras(BL-algebras/R0-algebras and MTL-algebras)/fuzzy algebras(semirings/hemirings and rings) and their hyperstuctures(hyperring/hypergroups,https://scholar.google.com/citations?user=XmJAmNIAAAAJ&hl=en
97,Haijun Zhang,"Professor, University of Science and Technology Beijing",44,1872,9722,43,8523,https://vivo.weill.cornell.edu/display/cwid-haz2004,Wireless Communications/Resource Allocation/Mobility Management,https://scholar.google.ca/citations?user=B3oYgSIAAAAJ&hl=en
98,Rui Zhang,"Chair Professor, National University of Singapore",120,12439,59846,100,44147,https://sites.google.com/view/rayzhangrui23/home,Wireless Communications/MIMO/Cognitive Radio/Wireless Power Transfer/UAV,https://scholar.google.com.sg/citations?user=yoJqPIkAAAAJ&hl=en
99,Xian-Ming Zhang,Swinburne University of Technology,46,2237,10782,40,8733,https://publons.com/researcher/1291878/xian-ming-zhang/,Networked Control Systems/Event-triggered Control/H-infinity Filtering/Time-delay Systems/Neural Networks,https://scholar.google.com/citations?user=aZcLkqgAAAAJ&hl=en
100,Xuyun Zhang,Macquarie University,41,1187,5829,38,4722,https://unidirectory.auckland.ac.nz/profile/sang-nguyen,big data mining/scalable machine learning/big data privacy and cybersecurity/cloud/edge computing/Internet of Things,https://scholar.google.com.au/citations?user=wbF6HL8AAAAJ&hl=en
101,Yan Zhang,"IEEE Fellow, Highly Cited Researcher, University of Oslo, Norway",91,6214,29065,76,21455,https://www.usf.edu/engineering/cse/people/zhang-yan.aspx,wireless networks/smart grid/edge intelligence/blockchain/digital twin,https://scholar.google.no/citations?user=-gahn9AAAAAJ&hl=no
102,Quan Zou (邹权),University of Electronic Science and Technology of China,67,3223,13717,60,11275,http://lab.malab.cn/,Bioinformatics/data mining,https://scholar.google.com/citations?user=RcaUHs4AAAAJ&hl=en
