,Name,Affilation,H-index,Citations 2020,Total_citation,H-index_since_2016,Citation_since_2016,HomePage,Area of Research,Google_Scholar
0,"U Rajendra Acharya (SCI Highly Cited Researcher 2016-2021)  PhD, DEng, DSc","Ngee Ann,  Singapore University of Social Science,  Kuamamoto University, Japan",115,11875,53192,101,40658,https://www.mdpi.com/journal/methane/announcements,Artificial Intelligence/Medical Informatics,https://scholar.google.com.sg/citations?user=8FjY99sAAAAJ&hl=en
1,IAN  F.  AKYILDIZ,"Truva Inc. , USA",133,6622,134893,81,39400,https://idsc.miami.edu/ian-f-akyildiz/,Wireless Communication/5G/6G Wireless Systems/Intelligent Surfaces for Wireless Communication/Nano-scale and Molecular Commun,https://scholar.google.com/citations?user=rAGwv14AAAAJ&hl=en
2,Ibrahim Aljarah,"Associate Professor, University of Jordan",45,3393,8755,44,8579,https://ieeexplore.ieee.org/author/38232838100,Artificial  intelligence/Swarm Intelligence/Data Science/Machine Learning/Evolutionary Computation,https://scholar.google.com/citations?user=moOTIYEAAAAJ&hl=en
3,Jeffrey Andrews,"Cockrell Family Endowed Chair and Director of 6G@UT, University of Texas at Austin",106,3862,65999,72,29570,https://scholar.google.com/citations?user=Hr9Gey0AAAAJ&hl=en,Wireless Communications/Communication Theory/Machine Learning for Communications/Stochastic Geometry/Information Theory,https://scholar.google.com/citations?user=Hr9Gey0AAAAJ&hl=en
4,Bennis Mehdi,"Full Professor, IEEE Fellow, Head of ICON, University of Oulu",69,7061,26015,66,23431,https://ieeexplore.ieee.org/author/37299803500,B5G/6G/machine learning/semantic communication,https://scholar.google.com/citations?user=RW4sJu8AAAAJ&hl=en
5,Emil Björnson,"Professor of Wireless Communication, KTH Royal Institute of Technology",63,4532,18644,60,15777,https://www.kth.se/profile/emilbjo,Massive MIMO/Cell-free Massive MIMO/RIS/Signal processing/Wireless communication,https://scholar.google.se/citations?user=Maij4akAAAAJ&hl=en
6,Rajkumar Buyya,"CLOUDS Lab, School of Computing and Information Systems, The University of Melbourne, Australia",154,11486,125122,105,61735,https://ieeexplore.ieee.org/author/37267557900,Computer Systems/Cloud Computing/Distributed Systems/Edge Computing/Internet of Things,https://scholar.google.com/citations?user=7xN6JqYAAAAJ&hl=en
7,Xing Cai,"Senior Research Scientist at Simula Research Laboratory, Professor at University of Oslo",19,137,2043,13,760,https://ieeexplore.ieee.org/author/37535572800,Parallel programming/High-performance computing/numerical methods for PDEs,https://scholar.google.com/citations?user=IWQbrcK5CEwC&hl=en
8,Giuseppe Caire,"Professor, Technical University of Berlin, Germany, and Professor of Electrical Engineering (on",83,2866,39694,57,16253,https://viterbi.usc.edu/directory/faculty/Caire/Giuseppe,Information Theory/Communications/Signal Processing/Statistics,https://scholar.google.com/citations?user=g66ErTcAAAAJ&hl=en
9,Jinde Cao,"Academician, RAE/AE/RAEN/LAS/AAS/EASA/PAS/IASCYS  & FIEEE/FAAIA/DFIETI; Southeast University",131,9088,70721,91,40979,https://research.com/u/jinde-cao,Complex networks/neural networks/multi-agent systems - engineering stability - dynamics and control - time-delay systems,https://scholar.google.com/citations?user=8_ffELYAAAAJ&hl=en
10,C. L. Philip Chen,"Chair Professor, South China University of Technology, Philip.Chen@ieee.org",95,7502,38312,83,28799,https://orcid.org/0000-0001-5451-7230,Computational Intelligence/Intelligent Control/Cybernetics/Intelligent Transportation Systems/Data Science/Engineering,https://scholar.google.com/citations?user=Q5248zwAAAAJ&hl=en
11,Jinjun Chen,"Professor and Deputy Institute Director, Swinburne University of Technology",68,2332,13275,51,9037,http://www.azxy5kjw.com/research-institutes/data-science/people/jinjun-chen/,Cloud Computing/Scalable Architecture/Scalable Data Storage/Scalable Data Processing (Privacy),https://scholar.google.com/citations?user=mQ9vJ24AAAAJ&hl=en
12,Min Chen,"Professor, IEEE Fellow, Highly Cited Researcher, Huazhong University of Science and Technology",90,6062,34349,71,25268,https://www.chem.umass.edu/faculty/min-chen,Cognitive Computing and Big Data Analytics/IoT Sensing/5G Networks/Robotics/Edge Computing,https://scholar.google.com/citations?user=_HyHTrsAAAAJ&hl=en
13,Xiaofeng Chen,"Professor, Xidian University, China",58,1752,13353,49,9901,https://scholar.google.com/citations?user=-3WhJecAAAAJ&hl=en,Security/Cryptography/Cloud computing,https://scholar.google.com/citations?user=-3WhJecAAAAJ&hl=en
14,Francisco Chiclana,"Professor of Computational Intelligence and Decision Making, De Montfort University, UK",68,2551,19935,59,11573,https://www.researchgate.net/profile/Francisco-Chiclana,Decision making/computational intelligence/information fusion/consensus/sentiment analysis,https://scholar.google.com/citations?user=qDOxZIIAAAAJ&hl=en
15,zhihua cui,"Taiyuan University of Science and Technology, Taiyuan, Shanxi, China, 030024",44,1749,8199,34,6086,https://www.zhihuacui.com/,evolutionary computation,https://scholar.google.com/citations?user=BpDrULIAAAAJ&hl=en
16,Linglong Dai,"Associate Professor, Tsinghua University; IEEE Fellow",65,3353,16473,59,14835,http://oa.ee.tsinghua.edu.cn/dailinglong/,Wireless Communications/RIS/Massive MIMO/Millimeter-Wave/Teraherz Communications/Non-Orthogonal Mutiple Access,https://scholar.google.com/citations?user=OTFnifoAAAAJ&hl=en
17,Merouane Debbah,"Centralesupelec, Technology Innovation Institute, MBZUAI, Lagrange Mathematics Center",99,9045,47955,82,33999,https://dl.acm.org/profile/81346487984/publications?Role=author,5G/6G/Machine Learning/Random Matrix Theory/Game Theory,https://scholar.google.com/citations?user=HU5I0X4AAAAJ&hl=en
18,Zhiguo Ding,"University of Manchester, Fellow of IEEE, Web of Science Highly Cited Researcher",93,8278,38056,86,33816,http://www.research.lancs.ac.uk/portal/en/people/zhiguo-ding(6f420ab8-4825-4195-a3d8-07e5c5b7716e)/publications.html,Wireless communications/signal processing/and cross-layer optimization,https://scholar.google.co.uk/citations?user=V-nB8scAAAAJ&hl=en
19,"Mianxiong Dong, Foreign Fellow of EAJ","Vice President and Professor, Muroran Institute of Technology, Japan",54,2197,10979,49,9601,https://www.computer.org/csdl/journal/sc/2022/02/09540249/1wWC9LGR6aA,Cyber-Physical Systems/Internet of Things/Artificial Intelligence,https://scholar.google.co.jp/citations?user=TqyApAUAAAAJ&hl=en
20,Yucheng Dong,"Professor of Management and Systems Sciences, Sichuan University",60,2377,11753,56,9468,https://www.adscientificindex.com/scientist.php?id=725210,Decision Analysis/Human Dynamics/Social Network/Data Science,https://scholar.google.com/citations?user=tFVYDw4AAAAJ&hl=en
21,Maged Elkashlan,"Associate Professor, Queen Mary University of London",60,2718,15296,53,12850,https://dblp.org/pid/98/6377,IRS/URLLC/UAV/PLS/NOMA,https://scholar.google.com/citations?user=mncnnOAAAAAJ&hl=en
22,Zubair Md. Fadlullah,"Associate Professor, Research Chair, Department of Computer Science, Lakehead University, TBRHRI",40,1332,7547,38,5821,https://www.lakeheadu.ca/users/F/zfadlull/node/50708,Beyond 5G/Smart Health/UAV & Energy efficient Networks/QoS & Security/Deep Learning applications,https://scholar.google.com/citations?user=dZyfKpYAAAAJ&hl=en
23,Hossam Faris,"Professor, The University of Jordan",48,4480,11611,47,11380,https://www.researchgate.net/profile/Hossam-Faris,Data Science/Knowledge Systems/Data Mining/Evolutionary computation,https://scholar.google.com/citations?user=UEYd--YAAAAJ&hl=en
24,Giancarlo Fortino,"Full Prof. of Computer Engineering, University of Calabria, FIEEE, FAAIA, Highly Cited Researcher",66,3722,16174,58,13092,https://dl.acm.org/profile/81488652675,Human-Machine Systems/Agent-based Computing/Internet of Things/Wearable Computing/Wireless/Body Area Networks,https://scholar.google.com/citations?user=ecImn1MAAAAJ&hl=it
25,Hamido Fujita,Iwate Prefectural University,67,4837,16984,67,15782,https://www.youtube.com/watch?v=2TIxd5UW_JM,Machine Learning,https://scholar.google.com/citations?user=MxzV1nQAAAAJ&hl=en
26,Erik G. Larsson,"Professor, Dept. of Electrical Engineering (ISY), Linköping University, Sweden",88,6304,44893,68,28928,https://ma-mimo.ellintech.se/author/egl/,Wireless communications/statistical signal processing/localization/massive MIMO/networks,https://scholar.google.se/citations?user=79Lry6oAAAAJ&hl=en
27,Amir H. Gandomi,"Professor of Data Science, University of Technology Sydney",76,7074,29134,67,22521,https://orcid.org/0000-0002-2798-0104,Data Analytics/Genetic Programming/Engineering Optimization/Evolutionary Computation/Smart Cities,https://scholar.google.com/citations?user=VMf3wfMAAAAJ&hl=en
28,Xiaohua Ge,"Swinburne University of Technology, Melbourne, Australia",37,2038,7144,36,6943,https://iwct.sjtu.edu.cn/personal/xtian/index_backup.html,Networked control systems/Cyber-physical systems/Multi-agent systems/Intelligent vehicles/Connected automated vehicles,https://scholar.google.com.au/citations?user=B37CYFoAAAAJ&hl=en
29,"Mohsen Guizani, FIEEE",Mohamed Bin Zayed University of Artificial Intelligence (MBZUAI),92,10842,44516,79,37132,https://ietresearch.onlinelibrary.wiley.com/hub/journal/26328925/homepage/editorial-board,Internet of Things/Applied AI/ML and Cybersecurity,https://scholar.google.com/citations?user=RigrYkcAAAAJ&hl=en
30,Song Guo,"FCAE, FIEEE, The Hong Kong Polytechnic University",72,4341,21375,65,17379,https://dblp.org/pid/01/267-1,Edge AI/Wireless Networking/Big Data Computing/Distributed System,https://scholar.google.com/citations?user=Ib-sizwAAAAJ&hl=en
31,Harald Haas,The University of Edinburgh,94,5570,45504,76,29469,https://www.youtube.com/watch?v=Dp34aH5D-RA,Optical Wireless Communications/Interference Managment in Wireless Networks/Spatial Modulation,https://scholar.google.com/citations?user=XxIwRJQAAAAJ&hl=ja
32,Yuki Hagiwara,Fraunhofer IKS,29,1990,6630,29,6606,https://www.bloombergquint.com/author/1530894/yuki-hagiwara-2,Artificial Intelligence,https://scholar.google.com.sg/citations?user=P6WI2DQAAAAJ&hl=en
33,"Qing-Long Han, Pro Vice-Chancellor and Distinguished Professor, MAE, IEEE Fellow",Swinburne University of Technology,110,6353,38630,90,26431,https://www.aminer.org/profile/qing-long-han/53f469b2dabfaee02ada1fc0,Networked control systems/time-delay systems/multi-agent systems/smart grids/unmanned surface vehicles,https://scholar.google.com.au/citations?user=j0pyptAAAAAJ&hl=en
34,Zhu Han,University of Houston,119,8502,57526,90,38140,https://ieeexplore.ieee.org/author/37278605300,Game Theory/Wireless Networking/Security/Data Science/Smart Grid,https://scholar.google.com/citations?user=ty7wIXoAAAAJ&hl=en
35,L Hanzo,"Chair of Telecommunications, University of Southampton",109,8289,68229,83,35446,https://www.encyclopedia.com/arts/educational-magazines/hanzo-lajos-1952,telecommunications/wireless communication/quantum_information_science/video_coding/video_networking,https://scholar.google.co.uk/citations?user=p0jnEW0AAAAJ&hl=en
36,L Hanzo,"Chair of Telecommunications, University of Southampton",109,8289,68229,83,35446,https://www.encyclopedia.com/arts/educational-magazines/hanzo-lajos-1952,telecommunications/wireless communication/quantum_information_science/video_coding/video_networking,https://scholar.google.co.uk/citations?user=p0jnEW0AAAAJ&hl=en
37,Robert Heath,"Lampe Distinguished Professor, North Carolina State University",136,7710,80491,91,41908,https://www.facebook.com/RobertHeathInsuranceAgency/,wireless/MIMO/communications/signal processing/information theory,https://scholar.google.com/citations?user=17Ko8Q0AAAAJ&hl=en
38,Francisco Herrera,"Professor Computer Science and AI, Granada University, Spain",162,15109,113178,121,60949,http://www.herrerabox.com/,Artificial Intelligence/Computational Intelligence/Data mining/Evolutionary Algorithms/Big Data Analytics,https://scholar.google.com/citations?user=HULIk-QAAAAJ&hl=en
39,Enrique Herrera-Viedma,"Professor of Computer Science and Artificial Intelligence, Spain, University of Granada",108,6206,47631,90,26421,https://scholar.google.com/citations?user=g8ZXTuYAAAAJ&hl=en,Fuzzy sets/fuzzy decision making/computing with words/multiple criteria decision making/consensus,https://scholar.google.com/citations?user=g8ZXTuYAAAAJ&hl=en
40,Ekram Hossain,"Professor, University of Manitoba, Canada, IEEE Fellow",97,3241,36437,70,18728,https://www.cs.rochester.edu/u/ehossai2/,Wireless communication networks/radio resource allocation/cognitive radio/multi-tier cellular networks,https://scholar.google.com/citations?user=Lb617EMAAAAJ&hl=en
41,Guang-Bin Huang,"Full Professor, Nanyang Technological University, Singapore",71,5663,54531,61,32539,https://www.aminer.org/profile/guang-bin-huang/53f4a75cdabfaeb22f57430a,Machine Learning/Neural Networks/Neuroscience,https://scholar.google.com.sg/citations?user=LhSqQCIAAAAJ&hl=en
42,Kaibin Huang,"Professor, Dept. of EEE, The University of Hong Kong; IEEE Fellow; ISI Highly Cited Researcher",51,2905,14724,42,11378,https://en.wikipedia.org/wiki/Kaibin_Huang,Machine Learning/Mobile Edge Computing/Wireless Communications/Wireless Power Transfer/Stochastic Geometry,https://scholar.google.com/citations?user=HfuA3uIAAAAJ&hl=en
43,Thomas JR Hughes,"Peter O'Donnell Jr. Chair in Computational and Applied Mathematics, University of Texas at Austin",150,7139,127578,92,39996,http://www.nasonline.org/member-directory/members/54328.html,Finite Element Methods/Solid Mechanics/Computational Fluid Dynamics/Partial Differential Equations/Isogeometric Analysis,https://scholar.google.com/citations?user=6tPdlYAAAAAJ&hl=en
44,Yaochu Jin,"A. v. Humboldt Professor for AI, Bielefeld University and Distinguished Chair, University of Surrey",88,5770,31878,72,19969,https://jaii.eu/,Evolutionary Computation/Multiobjective Optimization/Multiobjective Learning/Federated Learning/Artificial Intelligence,https://scholar.google.com/citations?user=B5WAkz4AAAAJ&hl=en
45,"Nei Kato(IEEE Fellow, IEICE Fellow)","Professor and Dean, Graduate School of Information Sciences, Tohoku University, Japan",74,3201,21728,58,14148,https://orcid.org/0000-0001-8769-302X,Wireless networking,https://scholar.google.com/citations?user=LfLfZXEAAAAJ&hl=en
46,"Dr. Neeraj Kumar, SMIEEE (Web of Science Highly Cited Researcher 2019, 2020,2021)","Professor, CSED, Thapar Institute of Engineering and Technology, India",92,9979,28340,87,26379,https://www.webometrics.info/en/hlargerthan100,IoT and Machine Learning/Deep Learning/Blockchain Technology,https://scholar.google.co.in/citations?user=gL9gR-4AAAAJ&hl=en
47,"Dr. Arun Kumar Sangaiah, (Web of Science Highly Cited Researcher, SM'IEEE)","Professor, VIT University, Vellore, India",70,4769,14956,70,14766,https://scholar.google.se/citations?user=8yF6Xc4AAAAJ&hl=th,Software Engineering/Computational Intelligence/Internet of Things,https://scholar.google.co.in/citations?user=8yF6Xc4AAAAJ&hl=en
48,Victor C. M. Leung,Shenzhen University / The University of British Columbia,102,6440,48062,83,30567,https://wix.academia.edu/VictorLeung/CurriculumVitae,communication systems/wireless networks/mobile systems,https://scholar.google.ca/citations?user=ajvCoo4AAAAJ&hl=en
49,Geoffrey Ye Li (李烨),"Chair Professor in Wireless Systems, Dept EEE, Imperial College London",108,5817,53135,78,24760,https://innerspacebrewing.com/nbp1617/c782f4-geoffrey-ye-li,Signal Processing/and/Machine Learning/for/Wireless Communications,https://scholar.google.com/citations?user=d0FzG8YAAAAJ&hl=en
50,Hongyi Li,"Assistant Professor, University of Houston",33,925,3706,30,3115,https://ieeexplore.ieee.org/author/37600678300,watershed hydrology/earth system modeling/coupled human-nature system,https://scholar.google.com/citations?user=yWy-5icAAAAJ&hl=en
51,Jin Li  李进,Professor @Guangzhou University,59,1989,18922,53,12494,https://www.scholat.com/jinli71.cn,Trust and Security in Artificial Intelligence/Computating and Storage in Cloud Computing/Blockchain,https://scholar.google.com/citations?user=7GDV2vUAAAAJ&hl=en
52,Xuelong Li (Executive Councilor of AAAI),"Professor, Northwestern Polytechnical University, China",118,8513,54384,97,37773,http://iopen.nwpu.edu.cn/info/1329/1171.htm,artificial intelligence/optics and electronics,https://scholar.google.com/citations?user=ahUibskAAAAJ&hl=en
53,yongming li,"college of computer science, shaanxi normal university",37,422,4936,25,2406,https://loop.frontiersin.org/people/774056/overview,fuzzy systems/quantume logic and quantum information/lattice/topology/model checking,https://scholar.google.com/citations?user=P3VERZ0AAAAJ&hl=en
54,Chong Lin,Qingdao University,70,2004,16373,51,9073,https://www.linkedin.com/in/chonglin,systems and control theory,https://scholar.google.com/citations?user=AQbRErEAAAAJ&hl=en
55,Yan-Jun Liu,Liaoning University of Technology,61,2348,14189,58,10768,https://dblp.org/pid/65/3945,Adaptive control/fuzzy control/neural networks,https://scholar.google.com/citations?user=x_Wk1jAAAAAJ&hl=en
56,Yuanwei Liu,"Associate Professor in Queen Mary University of London, Web of Science Highly Cited Researcher",50,3534,11932,50,11653,https://ieeexplore.ieee.org/author/37085363947,NOMA/RIS/AI/6G/Integrated Sensing and Communications,https://scholar.google.com/citations?user=FxLf7ZAAAAAJ&hl=en
57,Wenjing Lou,"W. C. English Endowed Professor, IEEE Fellow, Virginia Tech, USA",83,2776,39521,60,19016,https://ieeexplore.ieee.org/author/37275345500,Cyber Security/Wireless Networks/Wireless Security/Network Security/Cloud Computing,https://scholar.google.com/citations?user=hM8uAwoAAAAJ&hl=en
58,Majdi Mafarja,"Associate Professor of Computer Science, Birzeit University",33,2748,6617,32,6566,https://ps.linkedin.com/in/majdi-mafarja-phd-b2848711,Feature Selection/Machine Learning/Artificial Intelligence/Bio-inspired Algorithms/Metaheuristics,https://scholar.google.com/citations?user=ftkD0MgAAAAJ&hl=en
59,Luis Martínez,"Professor of Computer Science, University of Jaén",63,2880,22656,52,12636,https://www.kean.edu/directory/luis-martinez,Fuzzy decision making/Computing with words/Recommender Systems,https://scholar.google.com/citations?user=PG3D8UMAAAAJ&hl=en
60,Thomas Marzetta,"Distinguished Industry Professor, Department of Electrical and Computer Engineering, New York",59,4680,47258,46,28026,https://scholar.google.com/citations?user=tBLWIBoAAAAJ&hl=en,Beyond Massive MIMO,https://scholar.google.com/citations?user=tBLWIBoAAAAJ&hl=en
61,Seyedali Mirjalili,"Professor, Torrens University Australia, Adjunct Griffith University",75,17574,50516,74,48329,https://twitter.com/s_mirjalili,Metaheuristics/Robust Optimization/Engineering Optimization/Evolutionary Algorithm/Swarm Intelligence,https://scholar.google.com/citations?user=TJHmrREAAAAJ&hl=en
62,Andreas F. Molisch,"Professor of Electrical Engineering, University of Southern California",101,5235,59262,71,27890,https://viterbi.usc.edu/directory/faculty/Molisch/Andreas,wireless propagation channels/multi-antenna systems/ultrawideband communications and positioning/cooperative communications,https://scholar.google.com/citations?user=W0wwrucAAAAJ&hl=en
63,Derrick Wing Kwan Ng,"Scientia  Assoicate Professor,  University of New South Wales",65,3943,19176,62,16510,https://www.aminer.org/profile/derrick-wing-kwan-ng/53f467dedabfaee4dc854000,Wireless Communications,https://scholar.google.com/citations?user=NUJSHxoAAAAJ&hl=en
64,H. Nguyen-Xuan,"CIRTech Institute, HUTECH University, Vietnam",68,2553,15790,59,11133,https://sites.google.com/site/nguyenxuanhungsite/,Computational Engineering/Large-scale data/3D Printing/Renewable Energy,https://scholar.google.co.uk/citations?user=3iK9h-gAAAAJ&hl=en
65,Dusit (Tao) Niyato,Nanyang Technological University (NTU),103,8806,47856,85,32939,https://books.google.com/books?id=IQngLbr97kYC&pg=PR12&lpg=PR12&dq=Dusit+(Tao)+Niyato+homepage&source=bl&ots=vK1Uf_aCSp&sig=ACfU3U1aIDKbz66KSJ5MvH9n4zYVEDj8Hg&hl=en&sa=X&ved=2ahUKEwi_jIPasvT3AhVZQ80KHQKUBwIQ6AF6BAgaEAM,ดุสิต นิยะโต - เต๋า,https://scholar.google.com/citations?user=T8sVhLMAAAAJ&hl=en
66,Kaoru Ota (太田　香),"MEXT Excellent Young Researcher (文部科学省　卓越研究員), Muroran Institute of Technology",50,2084,9768,48,8895,https://scholar.google.com/citations?user=8JVn8RsAAAAJ&hl=ja,,https://scholar.google.com/citations?user=8JVn8RsAAAAJ&hl=ja
67,Mugen Peng,"Beijing University of Posts & Telecommun., IEEE Fellow, Web of Science Highly Cited Researcher",53,2343,15587,46,10954,https://dl.acm.org/profile/81456639314,Fog Computing/Cloud Radio Access Networks/Integrated Satellite-Terrestrial Networks/6G,https://scholar.google.com/citations?user=85mAZVcAAAAJ&hl=en
68,HV Poor,"Michael Henry Strater University Professor, Princeton University",155,14361,122066,106,60527,https://en.wikipedia.org/wiki/Vincent_Poor#Education,Communication Systems/Wireless Communications/Communications/Statistical Signal Processing/Information Theory,https://scholar.google.com/citations?user=Dq93mOUAAAAJ&hl=en
69,Lianyong Qi(齐连永),"Professor, Qufu Normal University",44,1893,5825,43,5574,https://scholar.google.ca/citations?user=aTZFM3EAAAAJ&hl=en,service computing/big data/recommender system,https://scholar.google.com/citations?user=pxNRRsAAAAAJ&hl=en
70,Timon Rabczuk,Bauhaus University Weimar,108,7503,42125,91,31569,https://scholar.google.ca/citations?user=3CBuGosAAAAJ&hl=en,Computational Mechanics/Solid Mechanics,https://scholar.google.ca/citations?user=3CBuGosAAAAJ&hl=en
71,Kim-Kwang Raymond Choo,"Cloud Tech Endowed Professor, University of Texas at San Antonio; Highly Cited Researcher 2020, 2021",93,6596,25042,86,22602,https://www.computer.org/profiles/kim-kwang-raymond-choo,Cloud Forensics/Cyber Forensics/Cyber Security/IoT Security/Blockchain,https://scholar.google.com/citations?user=rRBNI6AAAAAJ&hl=en
72,Kui Ren,"Professor, Zhejiang University, ACM Fellow, IEEE Fellow",84,3719,40073,70,22216,http://www.columbia.edu/~kr2002/,Data Security & Privacy/IoT Security/AI Security,https://scholar.google.com/citations?user=uuQA_rcAAAAJ&hl=en
73,Walid Saad,"Professor, Electrical and Computer Engineering",82,7444,32145,74,27093,https://www.netsciwis.com/,6G/machine learning/semantic communications/security and cyber-physical systems/unmanned aerial vehicles,https://scholar.google.com/citations?user=kYDNA0UAAAAJ&hl=en
74,Robert Schober,Friedrich-Alexander-University Erlangen-Nuremberg,94,5377,42676,75,27696,https://scholar.google.com/citations?user=Uu0BpX8AAAAJ&hl=en,,https://scholar.google.com/citations?user=Uu0BpX8AAAAJ&hl=en
75,"Ling Shao, Fellow of IEEE/IAPR",Terminus Group,86,8381,31932,82,26865,https://research.com/u/ling-shao,Computer Vision/Deep Learning/Artificial Intelligence/Medical Imaging/Vision and Language,https://scholar.google.com/citations?user=z84rLjoAAAAJ&hl=en
76,Xuemin (Sherman) Shen,"University Professor, University of Waterloo",131,9127,73627,102,42278,https://www.adscientificindex.com/scientist.php?id=641112,Wireless networking/MAC/Network security/VANET,https://scholar.google.com/citations?user=Bjl3GwoAAAAJ&hl=cs
77,Peng Shi,"Professor, School of Electrical and Electronic Engineering, The University of Adelaide",149,8297,77639,113,45521,http://faculty.marshall.usc.edu/Peng-Shi/,Systems and Control/Electrical and Electronic Engineering/Cybernetics/Human-Computer Interaction,https://scholar.google.com.hk/citations?user=EGx1iH0AAAAJ&hl=en
78,"Dr. P. N. Suganthan (SCI Highly Cited Researcher 2015-2021), FIEEE'2015","Some Codes available at GitHub, (Hon. Doctorate, U. of Maribor, 2020 ; BA & MA, U. of Cambridge, UK)",106,7246,57167,89,33012,https://www.timeshighereducation.com/hub/macau-university-science-and-technology/p/highly-cited-researchers-must,Machine Learning(ML)/Swarm-Evolutionary Computation(SEC)/Neural Networks(ANN)/Applications of ML SEC ANN.,https://scholar.google.com/citations?user=yZNzBU0AAAAJ&hl=en
79,Xingming Sun,Nanjing University of Information Science and Technology,57,1712,15506,51,12279,https://dblp.org/pid/08/3399,Digital Watermarking/Information Security,http://scholar.google.com/citations?user=epqnljMAAAAJ&hl=en
80,Tarik Taleb,University of Oulu,67,3617,19157,59,14730,https://scholar.google.com/citations?user=o1Ap0TEAAAAJ&hl=en,Network Function Virtualization/Network Softwarization/Software Defined Networking,https://scholar.google.com/citations?user=o1Ap0TEAAAAJ&hl=en
81,"jen hong, tan","Highly Cited Researcher in Computer Science, National University of Singapore",48,2339,9664,44,8770,https://www.researchgate.net/profile/Jen-Hong-Tan,image processing/computer vision/deep learning/infrared thermography/fundus image,https://scholar.google.com/citations?user=uJlD-A0AAAAJ&hl=en
82,Dacheng Tao,The University of Sydney,139,14109,76858,116,55577,https://scholar.google.com/citations?user=RwlJNLcAAAAJ&hl=en,artificial intelligence/machine learning/computer vision/image processing/data mining,https://scholar.google.com/citations?user=RwlJNLcAAAAJ&hl=en
83,Athanasios Vasilakos,"PROF OF COMPLEX SYSTEMS, CYBERSECURITY, AI",126,7492,56488,105,39595,https://www.ltu.se/staff/t/thanos-1.126959?l=en,Cybersecurity/IoTs/Mobile Nets/Big Data Analytics/Cloud Computing/Artificial Intelligence/Machine Learning,https://scholar.google.com/citations?user=_yWPQWoAAAAJ&hl=en
84,Huanqing Wang,Michigan Technological University,4,9,36,4,36,https://www.researchgate.net/profile/Huanqing-Wang,Electric vehicle/optimal control/model predictive control,https://scholar.google.com/citations?user=6XxgmPEAAAAJ&hl=en
85,Ping Wang,"York University, IEEE Fellow, York Research Chair, IEEE VTS Distinguished Lecturer",70,3550,21520,56,15920,https://bbe.umn.edu/people/ping-wang,wireless communications/Internet of Things/cloud computing/smart grid,https://scholar.google.com/citations?user=3sIHxrcAAAAJ&hl=en
