86,Huanqing Wang,Michigan Technological University,3,9,32,3,32,https://dblp.org/pid/48/10582,Electric vehicle/optimal control/model predictive control,https://scholar.google.com/citations?user=6XxgmPEAAAAJ&hl=en
87,Ping Wang,"York University, IEEE Fellow, York Research Chair, IEEE VTS Distinguished Lecturer",69,3476,20683,56,15092,https://sites.wustl.edu/pingwang/,wireless communications/Internet of Things/cloud computing/smart grid,https://scholar.google.com/citations?user=3sIHxrcAAAAJ&hl=en
88,Qingqing Wu (武庆庆),"Assistant Professor, University of Macau",45,5120,11350,44,11226,https://0-scholar-google-com.brum.beds.ac.uk/citations?user=as1T8CMAAAAJ&hl=fi,6G/IRS/UAV communications/Machine learning/MIMO transceiver design,https://scholar.google.com/citations?user=as1T8CMAAAAJ&hl=en
89,Zheng-Guang Wu,Zhejiang University,69,2635,15270,61,11104,https://orcid.org/0000-0003-4460-9785,Markov Jump Systems/Sampled-Data Control Systems/Neural Networks/Fuzzy Systems/Singular Systems,https://scholar.google.com/citations?user=vy6JCNgAAAAJ&hl=en
90,Yang Xiang,"IEEE Fellow, Professfor, Swinburne University of Technology",64,2730,15410,57,11801,https://www.me.psu.edu/department/directory-detail-g.aspx?q=xzy48,Cybersecurity/network and system security/deep learning/vulnerability detection/traffic classification,https://scholar.google.com/citations?user=7ymTWY4AAAAJ&hl=en
91,Xiaolong Xu (许小龙),"Professor, Highly Cited Researcher 2021, Nanjing University of Information Science and Technology",36,1405,4070,36,4017,https://orcid.org/0000-0003-4879-9803,Edge computing/Cloud computing/Big data/Fog computing/Mobile computing,https://scholar.google.com/citations?user=Tyzef4sAAAAJ&hl=en
92,Zeshui Xu (徐泽水),"Academician of EASA,IASCYS; Fellow of IEEE,IFSA,IET,RSA,ORS,BCS,VEBLEO,IAAM,AAIA; Sichuan University",135,9690,70608,105,40348,https://scholar.google.co.uk/citations?user=kd9L_GUAAAAJ&hl=en,Decision Making/Information Fusion/Fuzzy Sets/Computational Intelligence/Bibliometrics,https://scholar.google.co.uk/citations?user=kd9L_GUAAAAJ&hl=en
93,Xin-She Yang (DPhil),"Computational intelligence, swarm intelligence, optimization, metaheuristics, nature-inspired",88,10585,67216,79,45292,https://scholar.google.com/citations?user=fA6aTlAAAAAJ&hl=fil,swarm intelligence/optimization/metaheuristics/computational intelligence.,https://scholar.google.com/citations?user=fA6aTlAAAAAJ&hl=th
94,Fei Yu,University of Southern Denmark,9,66,226,7,163,https://www.feiyu-tech.com/,Industry 4.0 technology and smart product development,https://scholar.google.com/citations?user=3OHgAmIAAAAJ&hl=en
95,Xiangxiang Zeng,"Deparment of Computer Science, Hunan University",48,1594,6139,39,4960,https://loop.frontiersin.org/people/904991/overview,Computational Intelligence/Bio-inspired Intelligence,https://scholar.google.com/citations?user=B20HBMIAAAAJ&hl=en
96,Yong Zeng (曾勇）,"Southeast University, China; Purple Mountain Laboratories, China",45,3779,14263,45,13782,https://scholar.google.com.hk/citations?user=ENldmwIAAAAJ&hl=zh-CN,UAV communications/Massive MIMO/Extremely-Large MIMO (XL-MIMO)/Integrated Sensing and Communication,https://scholar.google.com/citations?user=ENldmwIAAAAJ&hl=en
97,Jianming Zhan,Hubei University for Nationalities,42,1062,6768,34,4226,https://www.aminer.org/profile/jianming-zhan/53f42ed7dabfaec22ba2ad74,logical algebras(BL-algebras/R0-algebras and MTL-algebras)/fuzzy algebras(semirings/hemirings and rings) and their hyperstuctures(hyperring/hypergroups,https://scholar.google.com/citations?user=XmJAmNIAAAAJ&hl=en
98,Haijun Zhang,"Professor, University of Science and Technology Beijing",44,1861,9605,42,8409,https://ieeexplore.ieee.org/author/37406815600,Wireless Communications/Resource Allocation/Mobility Management,https://scholar.google.ca/citations?user=B3oYgSIAAAAJ&hl=en
99,Rui Zhang,"Chair Professor, National University of Singapore",119,12489,59285,99,43586,https://www.pharmacy.umn.edu/bio/institute-of-personalized-medi/rui-zhang,Wireless Communications/MIMO/Cognitive Radio/Wireless Power Transfer/UAV,https://scholar.google.com.sg/citations?user=yoJqPIkAAAAJ&hl=en
100,Xian-Ming Zhang,Swinburne University of Technology,46,2248,10663,40,8620,https://www.concordia.ca/artsci/chemistry/faculty.html?fpid=xianming-zhang,Networked Control Systems/Event-triggered Control/H-infinity Filtering/Time-delay Systems/Neural Networks,https://scholar.google.com/citations?user=aZcLkqgAAAAJ&hl=en
101,Xuyun Zhang,Macquarie University,41,1186,5797,38,4691,https://dl.acm.org/profile/81479659199,big data mining/scalable machine learning/big data privacy and cybersecurity/cloud/edge computing/Internet of Things,https://scholar.google.com.au/citations?user=wbF6HL8AAAAJ&hl=en
102,Yan Zhang,"IEEE Fellow, Highly Cited Researcher, University of Oslo, Norway",90,6166,28739,76,21139,https://www.cyanogenoid.com/,wireless networks/smart grid/edge intelligence/blockchain/digital twin,https://scholar.google.no/citations?user=-gahn9AAAAAJ&hl=no
103,Quan Zou (邹权),University of Electronic Science and Technology of China,66,3198,13585,60,11147,http://lab.malab.cn/,Bioinformatics/data mining,https://scholar.google.com/citations?user=RcaUHs4AAAAJ&hl=en
