80,Xingming Sun,Nanjing University of Information Science and Technology,55,1838,14909,51,13064,https://webs.nuist.edu.cn/_s58/2018/0823/c3090a111533/page.psp,Digital Watermarking/Information Security,http://scholar.google.com/citations?user=epqnljMAAAAJ&hl=en
81,Tarik Taleb,University of Oulu/Aalto University,64,3158,17768,59,14464,https://dblp.org/pid/09/3053.html,Network Function Virtualization/Network Softwarization/Software Defined Networking,https://scholar.google.com/citations?user=o1Ap0TEAAAAJ&hl=en
82,"jen hong, tan","Highly Cited Researcher in Computer Science, National University of Singapore",46,2194,8764,44,8134,https://www.sciencedirect.com/science/article/abs/pii/S1877750317302028,image processing/computer vision/deep learning/infrared thermography/fundus image,https://scholar.google.com/citations?user=uJlD-A0AAAAJ&hl=en
83,Dacheng Tao,The University of Sydney,136,11824,70742,116,54939,https://www.sydney.edu.au/engineering/about/our-people/academic-staff/dacheng-tao.html,artificial intelligence/machine learning/computer vision/image processing/data mining,https://scholar.google.com/citations?user=RwlJNLcAAAAJ&hl=en
84,Athanasios Vasilakos,"PROF OF COMPLEX SYSTEMS, CYBERSECURITY, AI",122,7631,53455,110,42926,https://scholar.google.com/scholar_url?url=https://oatao.univ-toulouse.fr/13283/1/mastelic_13283.pdf&hl=en&sa=X&ei=qPLQYd_PDJOSy9YPqLqpyA0&scisig=AAGBfm0MQAjsDjaBYYRyePCM86JW7lEcqA&oi=scholarr,Cybersecurity/IoTs/Mobile Nets/Big Data Analytics/Cloud Computing/Artificial Intelligence/Machine Learning,https://scholar.google.com/citations?user=_yWPQWoAAAAJ&hl=en
85,Huanqing Wang,Michigan Technological University,2,14,28,2,28,https://www.researchgate.net/profile/Huanqing_Wang2/5,Electric vehicle/optimal control/model predictive control,https://scholar.google.com/citations?user=6XxgmPEAAAAJ&hl=en
86,Ping Wang,York University,68,3525,20097,58,16159,http://www.wangping.com/,wireless communications/Internet of Things/cloud computing/smart grid,https://scholar.google.com/citations?user=3sIHxrcAAAAJ&hl=en
87,Qingqing Wu (武庆庆),"Assistant Professor, University of Macau",43,3208,10418,42,10372,https://qingqingwu.weebly.com/,6G/IRS/UAV communications/Machine learning/MIMO transceiver design,https://scholar.google.com/citations?user=as1T8CMAAAAJ&hl=en
88,Zheng-Guang Wu,Zhejiang University,68,2348,14765,59,11720,https://scholar.google.com/scholar?q=Zheng-Guang+Wu+homepage&hl=en&as_sdt=0&as_vis=1&oi=scholart,Markov Jump Systems/Sampled-Data Control Systems/Neural Networks/Fuzzy Systems/Singular Systems,https://scholar.google.com/citations?user=vy6JCNgAAAAJ&hl=en
89,Yang Xiang,"IEEE Fellow, Professfor, Swinburne University of Technology",63,2539,14898,57,12308,https://sites.google.com/site/xyangphilip,Cybersecurity/network and system security/deep learning/vulnerability detection/traffic classification,https://scholar.google.com/citations?user=7ymTWY4AAAAJ&hl=en
90,Xiaolong Xu (许小龙),"Professor, Nanjing University of Information Science and Technology",36,1484,3859,36,3841,https://www.adscientificindex.com/scientist.php?id=679661,Edge computing/Cloud computing/Big data/Fog computing/Mobile computing,https://scholar.google.com/citations?user=Tyzef4sAAAAJ&hl=en
91,Zeshui Xu (徐泽水),"Academician of EASA,IASCYS; Fellow of IEEE,IFSA,IET,RSA,ORS,BCS,VEBLEO,IAAM,AAIA; Sichuan University",137,7901,70932,108,44551,https://www.adscientificindex.com/?country_code=cn,Decision Making/Information Fusion/Fuzzy Sets/Computational Intelligence/Bibliometrics,https://scholar.google.co.uk/citations?user=kd9L_GUAAAAJ&hl=en
92,Xin-She Yang (DPhil),"Computational intelligence, swarm intelligence, optimization, metaheuristics, nature-inspired",87,9332,65481,80,49929,https://en.wikipedia.org/wiki/Xin-She_Yang,swarm intelligence/optimization/metaheuristics/computational intelligence.,https://scholar.google.com/citations?user=fA6aTlAAAAAJ&hl=th
93,Fei Yu,University of Southern Denmark,9,41,214,8,170,https://scholar.google.com/citations?user=kOHRUWsAAAAJ&hl=en,Industry 4.0 technology and smart product development,https://scholar.google.com/citations?user=3OHgAmIAAAAJ&hl=en
94,Xiangxiang Zeng,"Deparment of Computer Science, Hunan University",45,1159,5806,40,5186,https://scholar.google.com/scholar_url?url=https://www.sciencedirect.com/science/article/pii/S0304397508009092/pdf%3Fmd5%3D0c66b6349deed9761febcbe891f3fd96%26pid%3D1-s2.0-S0304397508009092-main.pdf%26_valck%3D1&hl=en&sa=X&ei=svLQYfrfIo3amAH1m5uwCA&scisig=AAGBfm0vdUrThWboTCfC60QhDev98FoFQw&oi=scholarr,Computational Intelligence/Bio-inspired Intelligence,https://scholar.google.com/citations?user=B20HBMIAAAAJ&hl=en
95,Yong Zeng (曾勇）,"Southeast University, China; Purple Mountain Laboratories, China",43,3673,13589,43,13361,http://shundeyanglao.com/en/events/12060.html,UAV communications/Massive MIMO/Extremely-Large MIMO (XL-MIMO)/Integrated Sensing and Communication,https://scholar.google.com/citations?user=ENldmwIAAAAJ&hl=en
96,Jianming Zhan,Hubei University for Nationalities,42,792,6668,35,4408,https://dl.acm.org/profile/81453639157,logical algebras(BL-algebras/R0-algebras and MTL-algebras)/fuzzy algebras(semirings/hemirings and rings) and their hyperstuctures(hyperring/hypergroups,https://scholar.google.com/citations?user=XmJAmNIAAAAJ&hl=en
97,Haijun Zhang,"Professor, University of Science and Technology Beijing",42,1949,9126,41,8525,http://chemen.lzu.edu.cn/index.php?m=content&c=index&a=show&catid=12&id=184,Wireless Communications/Resource Allocation/Mobility Management,https://scholar.google.ca/citations?user=B3oYgSIAAAAJ&hl=en
98,Rui Zhang,"Chair Professor, National University of Singapore",118,10447,57249,103,45756,https://ryanzhumich.github.io/,Wireless Communications/MIMO/Cognitive Radio/Wireless Power Transfer/UAV,https://scholar.google.com.sg/citations?user=yoJqPIkAAAAJ&hl=en
99,Xian-Ming Zhang,Swinburne University of Technology,46,2039,10270,41,8600,https://scholar.google.com/scholar_url?url=https://www.researchgate.net/profile/Ming-Liang-Tong/publication/227560878_Hydroxylation_of_N-Heterocycle_Ligands_Observed_in_Two_Unusual_Mixed-Valence_CuICuII_Complexes/links/00b7d52c39d137be8d000000/Hydroxylation-of-N-Heterocycle-Ligands-Observed-in-Two-Unusual-Mixed-Valence-CuI-CuII-Complexes.pdf&hl=en&sa=X&ei=t_LQYbjhIrvGsQLJnqmwDA&scisig=AAGBfm0oUKshgbd2oo_fCJpR97FtdJX48g&oi=scholarr,Networked Control Systems/Event-triggered Control/H-infinity Filtering/Time-delay Systems/Neural Networks,https://scholar.google.com/citations?user=aZcLkqgAAAAJ&hl=en
100,Xuyun Zhang,Macquarie University,41,1495,5687,38,4993,https://dblp.org/pid/54/8558,big data mining/scalable machine learning/big data privacy and cybersecurity/cloud/edge computing/Internet of Things,https://scholar.google.com.au/citations?user=wbF6HL8AAAAJ&hl=en
101,Yan Zhang,"IEEE Fellow, Highly Cited Researcher, University of Oslo, Norway",88,5419,27664,80,21644,https://yanxzhang.com/academic/,wireless networks/smart grid/edge intelligence/blockchain/digital twin,https://scholar.google.no/citations?user=-gahn9AAAAAJ&hl=no
102,Quan Zou (邹权),University of Electronic Science and Technology of China,65,2661,13011,61,11728,https://scholar.google.com/citations?user=RcaUHs4AAAAJ&hl=en,Bioinformatics/data mining,https://scholar.google.com/citations?user=RcaUHs4AAAAJ&hl=en
