,Name,Affilation,H-index,Citations 2020,Total_citation,H-index_since_2016,Citation_since_2016,HomePage,Area of Research,Google_Scholar
0,"U Rajendra Acharya (SCI Highly Cited Researcher 2016-2021)  PhD, DEng, DSc","Ngee Ann,  Singapore University of Social Science,  Kuamamoto University, Japan",117,11804,55141,104,42714,https://www.journals.elsevier.com/computers-in-biology-and-medicine/editorial-board/rajendra-acharya-mtech-phd-deng-dsc,Artificial Intelligence/Medical Informatics,https://scholar.google.com.sg/citations?user=8FjY99sAAAAJ&hl=en
1,IAN  F.  AKYILDIZ,"Truva Inc. , USA",132,6582,135545,82,40321,https://en.wikipedia.org/wiki/Ian_F._Akyildiz#1990s,Wireless Communication/5G/6G Wireless Systems/Intelligent Surfaces for Wireless Communication/Nano-scale and Molecular Commun,https://scholar.google.com/citations?user=rAGwv14AAAAJ&hl=en
2,Ibrahim Aljarah,"Professor of Big Data Mining and Computational Intelligence, The University of Jordan",45,3279,9347,45,9177,https://scholar.google.com/citations?user=moOTIYEAAAAJ&hl=en,Artificial  intelligence/Swarm Intelligence/Data Science/Machine Learning/Evolutionary Computation,https://scholar.google.com/citations?user=moOTIYEAAAAJ&hl=en
3,Jeffrey Andrews,"Cockrell Family Endowed Chair and Director of 6G@UT, University of Texas at Austin",106,3902,66340,73,29971,https://scholar.google.com/citations?user=Hr9Gey0AAAAJ&hl=en,Wireless Communications/Communication Theory/Machine Learning for Communications/Stochastic Geometry/Information Theory,https://scholar.google.com/citations?user=Hr9Gey0AAAAJ&hl=en
4,Bennis Mehdi,"Full Professor, IEEE Fellow, Head of ICON, University of Oulu",71,7152,27222,68,24668,https://www.oulu.fi/en/researchers/mehdi-bennis,B5G/6G/machine learning/semantic communication,https://scholar.google.com/citations?user=RW4sJu8AAAAJ&hl=en
5,Emil Björnson,"Professor of Wireless Communication, KTH Royal Institute of Technology",63,4567,19341,61,16503,https://www.youtube.com/watch?v=NcQL9vY3ENA,Massive MIMO/Cell-free Massive MIMO/RIS/Signal processing/Wireless communication,https://scholar.google.se/citations?user=Maij4akAAAAJ&hl=en
6,Rajkumar Buyya,"CLOUDS Lab, School of Computing and Information Systems, The University of Melbourne, Australia",155,11341,126481,107,63252,https://findanexpert.unimelb.edu.au/profile/7930-rajkumar-buyya,Computer Systems/Cloud Computing/Distributed Systems/Edge Computing/Internet of Things,https://scholar.google.com/citations?user=7xN6JqYAAAAJ&hl=en
7,Xing Cai,"Senior Research Scientist at Simula Research Laboratory, Professor at University of Oslo",19,136,2073,13,783,https://newptcai.gitlab.io/,Parallel programming/High-performance computing/numerical methods for PDEs,https://scholar.google.com/citations?user=IWQbrcK5CEwC&hl=en
8,Giuseppe Caire,"Professor, Technical University of Berlin, Germany, and Professor of Electrical Engineering (on",82,2909,39841,57,16569,https://en.wikipedia.org/wiki/Giuseppe_Caire#Career,Information Theory/Communications/Signal Processing/Statistics,https://scholar.google.com/citations?user=g66ErTcAAAAJ&hl=en
9,Jinde Cao,"Academician, RAS/AE/RAE/LAS/AAS/EASA/PAS/IASCYS  & FIEEE/FAAIA/DFIETI; Southeast University",131,8813,72189,93,42442,https://math.seu.edu.cn/jdc_en/list.htm,Complex networks/neural networks/multi-agent systems - engineering stability - dynamics and control - time-delay systems,https://scholar.google.com/citations?user=8_ffELYAAAAJ&hl=en
10,C. L. Philip Chen,"Chair Professor, South China University of Technology, Philip.Chen@ieee.org",95,7362,39611,85,30087,https://www.ae-info.org/ae/User/Chen_Philip,Computational Intelligence/Intelligent Control/Cybernetics/Intelligent Transportation Systems/Data Science/Engineering,https://scholar.google.com/citations?user=Q5248zwAAAAJ&hl=en
11,Jinjun Chen,"MAE (Academia Europea), IEEE Fellow (Computer Society), AAIA Fellow, HiCi; Professor and Deputy",69,2330,13695,51,9460,https://scholar.google.com/scholar?q=Jinjun+Chen+homepage&hl=en&as_sdt=0&as_vis=1&oi=scholart,Cloud Computing/Scalable Architecture/Scalable Data Storage/Scalable Data Processing (Privacy),https://scholar.google.com/citations?user=mQ9vJ24AAAAJ&hl=en
12,Min Chen,"Professor, IEEE Fellow, Highly Cited Researcher, Huazhong University of Science and Technology",90,6111,35176,72,26139,https://business.gmu.edu/profiles/mchen15,Cognitive Computing and Big Data Analytics/IoT Sensing/5G Networks/Robotics/Edge Computing,https://scholar.google.com/citations?user=_HyHTrsAAAAJ&hl=en
13,Xiaofeng Chen,"Professor, Xidian University, China",57,1778,13717,50,10260,https://scholar.google.com/scholar_url?url=https://www.ncbi.nlm.nih.gov/pmc/articles/PMC5934575/&hl=en&sa=X&ei=cWnPYsrGK472mgGq9JnICA&scisig=AAGBfm1JGHd3738y-99jQsFLXmvWq_DEzQ&oi=scholarr,Security/Cryptography/Cloud computing,https://scholar.google.com/citations?user=-3WhJecAAAAJ&hl=en
14,Francisco Chiclana,"Professor of Computational Intelligence and Decision Making, De Montfort University, UK",69,2396,20346,60,11991,https://orcid.org/0000-0002-3952-4210,Decision making/computational intelligence/information fusion/consensus/sentiment analysis,https://scholar.google.com/citations?user=qDOxZIIAAAAJ&hl=en
15,zhihua cui,"Taiyuan University of Science and Technology, Taiyuan, Shanxi, China, 030024",45,1693,8462,35,6348,https://www.zhihuacui.com/about,evolutionary computation,https://scholar.google.com/citations?user=BpDrULIAAAAJ&hl=en
16,Linglong Dai,"Associate Professor, Tsinghua University; IEEE Fellow",65,3365,16963,60,15362,https://scholar.google.com/scholar_url?url=http://oa.ee.tsinghua.edu.cn/~dailinglong/publications/paper/Fast%2520channel%2520tracking%2520for%2520terahertz%2520beamspace%2520massive%2520MIMO%2520systems.pdf&hl=en&sa=X&ei=c2nPYuLuN6iUy9YP6_CtyAQ&scisig=AAGBfm2R-67vcBg3S7LwSqGGTl8xxFiSXw&oi=scholarr,Wireless Communications/RIS/Massive MIMO/Millimeter-Wave/Teraherz Communications/Non-Orthogonal Mutiple Access,https://scholar.google.com/citations?user=OTFnifoAAAAJ&hl=en
17,Merouane Debbah,"Centralesupelec, Technology Innovation Institute, MBZUAI, Lagrange Mathematics Center",100,9108,49294,84,35454,https://scholar.google.com/scholar?q=Merouane+Debbah+homepage&hl=en&as_sdt=0&as_vis=1&oi=scholart,5G/6G/Machine Learning/Random Matrix Theory/Game Theory,https://scholar.google.com/citations?user=HU5I0X4AAAAJ&hl=en
18,Zhiguo Ding,"University of Manchester, Fellow of IEEE, Web of Science Highly Cited Researcher",93,8290,39457,87,35299,https://www.aminer.org/profile/zhiguo-ding/53f4428fdabfaee1c0adf3ed,Wireless communications/signal processing/and cross-layer optimization,https://scholar.google.co.uk/citations?user=V-nB8scAAAAJ&hl=en
19,"Mianxiong Dong, Foreign Fellow of EAJ","Vice President and Professor, Muroran Institute of Technology, Japan",54,2214,11344,50,9974,https://ece.princeton.edu/sites/ee/files/people-cv/vincepoor_cv_long_apr21.pdf,Cyber-Physical Systems/Internet of Things/Artificial Intelligence,https://scholar.google.co.jp/citations?user=TqyApAUAAAAJ&hl=en
20,Yucheng Dong,"Professor of Management and Systems Sciences, Sichuan University",62,2197,12052,58,9782,https://www.aminer.org/profile/yucheng-dong/53f4b65fdabfaedce564b654,Decision Analysis/Human Dynamics/Social Network/Data Science,https://scholar.google.com/citations?user=tFVYDw4AAAAJ&hl=en
21,Maged Elkashlan,"Associate Professor, Queen Mary University of London",61,2742,15725,54,13299,https://scholar.google.com/citations?user=mncnnOAAAAAJ&hl=en,IRS/URLLC/UAV/PLS/NOMA,https://scholar.google.com/citations?user=mncnnOAAAAAJ&hl=en
22,Zubair Md. Fadlullah,"Associate Professor, Research Chair, Department of Computer Science, Lakehead University, TBRHRI",40,1367,7752,38,6044,https://www.zfadlullah.org/experience,Beyond 5G/Smart Health/UAV & Energy efficient Networks/QoS & Security/Deep Learning applications,https://scholar.google.com/citations?user=dZyfKpYAAAAJ&hl=en
23,Hossam Faris,"Professor, The University of Jordan",50,4341,12431,49,12208,https://scholar.google.com/scholar_url?url=https://www.tandfonline.com/doi/abs/10.1080/02626667.2019.1703186&hl=en&sa=X&ei=eWnPYr6KH4rcmwGenrKQAQ&scisig=AAGBfm2ljSNqTnOWCun3FPIs3ZYZtyaZ5Q&oi=scholarr,Data Science/Knowledge Systems/Data Mining/Evolutionary computation,https://scholar.google.com/citations?user=UEYd--YAAAAJ&hl=en
24,Giancarlo Fortino,"Full Prof. of Computer Engineering, University of Calabria, FIEEE, FAAIA, Highly Cited Researcher",68,3729,16796,61,13707,https://scholar.google.it/citations?user=ecImn1MAAAAJ&hl=en,Human-Machine Systems/Agent-based Computing/Internet of Things/Wearable Computing/Wireless/Body Area Networks,https://scholar.google.com/citations?user=ecImn1MAAAAJ&hl=it
25,Hamido Fujita,Iwate Prefectural University,70,4426,17853,70,16597,https://www.journals.elsevier.com/array/editorial-board/dr-hamido-fujita-phd,Machine Learning,https://scholar.google.com/citations?user=MxzV1nQAAAAJ&hl=en
26,Erik G. Larsson,"Professor, Dept. of Electrical Engineering (ISY), Linköping University, Sweden",89,6351,45722,68,29824,https://ieeexplore.ieee.org/author/37085356008,Wireless communications/statistical signal processing/localization/massive MIMO/networks,https://scholar.google.se/citations?user=79Lry6oAAAAJ&hl=en
27,Amir H. Gandomi,"Professor of Data Science, University of Technology Sydney",81,6911,30850,71,24225,https://profiles.uts.edu.au/Amirhossein.Gandomi/professional,Data Analytics/Genetic Programming/Engineering Optimization/Evolutionary Computation/Smart Cities,https://scholar.google.com/citations?user=VMf3wfMAAAAJ&hl=en
28,Xiaohua Ge,"Swinburne University of Technology, Melbourne, Australia",37,2052,7492,37,7293,https://sites.google.com/site/jamiexiaohuage/Home,Networked control systems/Cyber-physical systems/Multi-agent systems/Intelligent vehicles/Connected automated vehicles,https://scholar.google.com.au/citations?user=B37CYFoAAAAJ&hl=en
29,"Mohsen Guizani, FIEEE",Mohamed Bin Zayed University of Artificial Intelligence (MBZUAI),93,10985,46579,82,39201,https://vivo.nkn.uidaho.edu/vivo/display/n62284,Internet of Things/Applied AI/ML and Cybersecurity,https://scholar.google.com/citations?user=RigrYkcAAAAJ&hl=en
30,Song Guo,"FCAE, FIEEE, The Hong Kong Polytechnic University",72,4421,22097,66,18111,https://publons.com/researcher/3910593/song-guo/,Edge Intelligence/Federated Learning/Edge Computing/Distributed System/Wireless Networking,https://scholar.google.com/citations?user=Ib-sizwAAAAJ&hl=en
31,Harald Haas,The University of Edinburgh,96,5590,46361,79,30365,https://ieeexplore.ieee.org/author/37269894900,Optical Wireless Communications/Interference Managment in Wireless Networks/Spatial Modulation,https://scholar.google.com/citations?user=XxIwRJQAAAAJ&hl=ja
32,Yuki Hagiwara,Fraunhofer IKS,30,1973,6936,30,6911,https://scholar.google.com/scholar_url?url=https://www.tandfonline.com/doi/abs/10.1080/01694243.2013.810031&hl=en&sa=X&ei=gWnPYs-jHL6Ty9YPxL6S4As&scisig=AAGBfm24lyAVqM-HNWST9QUNC-hD_IeeBQ&oi=scholarr,Artificial Intelligence,https://scholar.google.com.sg/citations?user=P6WI2DQAAAAJ&hl=en
33,"Qing-Long Han, Pro Vice-Chancellor and Distinguished Professor, MAE, IEEE Fellow",Swinburne University of Technology,110,6353,39665,91,27488,https://scholar.zheng98.com/citations?user=j0pyptAAAAAJ&hl=ko,Networked control systems/time-delay systems/multi-agent systems/smart grids/unmanned surface vehicles,https://scholar.google.com.au/citations?user=j0pyptAAAAAJ&hl=en
34,Zhu Han,University of Houston,119,8616,59124,92,39836,https://scholar.google.com/scholar_url?url=https://www.ncbi.nlm.nih.gov/pmc/articles/PMC4621922/&hl=en&sa=X&ei=g2nPYoXHEo72mgGq9JnICA&scisig=AAGBfm3h3QiNUYxhPGcqt-p8SeBbN6pOow&oi=scholarr,Game Theory/Wireless Networking/Security/Data Science/Smart Grid,https://scholar.google.com/citations?user=ty7wIXoAAAAJ&hl=en
35,L Hanzo,"Chair of Telecommunications, University of Southampton",111,8333,69869,85,36900,https://www.encyclopedia.com/arts/educational-magazines/hanzo-lajos-1952,telecommunications/wireless communication/quantum_information_science/video_coding/video_networking,https://scholar.google.co.uk/citations?user=p0jnEW0AAAAJ&hl=en
36,L Hanzo,"Chair of Telecommunications, University of Southampton",111,8333,69869,85,36900,https://www.encyclopedia.com/arts/educational-magazines/hanzo-lajos-1952,telecommunications/wireless communication/quantum_information_science/video_coding/video_networking,https://scholar.google.co.uk/citations?user=p0jnEW0AAAAJ&hl=en
37,Robert Heath,"Lampe Distinguished Professor, North Carolina State University",138,7723,81203,91,42779,https://robertheath.co.uk/,wireless/MIMO/communications/signal processing/information theory,https://scholar.google.com/citations?user=17Ko8Q0AAAAJ&hl=en
38,Francisco Herrera,"Professor Computer Science and AI, Granada University, Spain",163,14508,115242,122,63074,http://www.herrerabox.com/#contact,Artificial Intelligence/Computational Intelligence/Data mining/Evolutionary Algorithms/Big Data Analytics,https://scholar.google.com/citations?user=HULIk-QAAAAJ&hl=en
39,Enrique Herrera-Viedma,"Professor of Computer Science and Artificial Intelligence, Spain, University of Granada",108,5964,48697,92,27419,https://scholar.google.com/citations?user=g8ZXTuYAAAAJ&hl=en,Fuzzy sets/fuzzy decision making/computing with words/multiple criteria decision making/consensus,https://scholar.google.com/citations?user=g8ZXTuYAAAAJ&hl=en
40,Ekram Hossain,"Professor, University of Manitoba, Canada, IEEE Fellow",98,3261,36781,70,19211,https://scholar.google.com/scholar_url?url=https://books.google.com/books%3Fhl%3Den%26lr%3D%26id%3DFgce1ge4gtwC%26oi%3Dfnd%26pg%3DPA3%26dq%3DEkram%2BHossain%2Bhomepage%26ots%3Dhanhhir1Wl%26sig%3DVcLgVsqxwwbAUSxklQJGGmUHVaw&hl=en&sa=X&ei=h2nPYt7UMM2Ty9YP4YCQuAs&scisig=AAGBfm3JnEqkly4w_HbNeyrdpUeLnmBjWg&oi=scholarr,Wireless communication networks/radio resource allocation/cognitive radio/multi-tier cellular networks,https://scholar.google.com/citations?user=Lb617EMAAAAJ&hl=en
41,Guang-Bin Huang,"Full Professor, Nanyang Technological University, Singapore",72,5622,54889,61,33241,https://research.com/u/guang-bin-huang,Machine Learning/Neural Networks/Neuroscience,https://scholar.google.com.sg/citations?user=LhSqQCIAAAAJ&hl=en
42,Kaibin Huang,"Professor, Dept. of EEE, The University of Hong Kong; IEEE Fellow; ISI Highly Cited Researcher",53,2924,15243,43,11905,https://en.wikipedia.org/wiki/Kaibin_Huang,Machine Learning/Mobile Edge Computing/Wireless Communications/Wireless Power Transfer/Stochastic Geometry,https://scholar.google.com/citations?user=HfuA3uIAAAAJ&hl=en
43,Thomas JR Hughes,"Peter O'Donnell Jr. Chair in Computational and Applied Mathematics, University of Texas at Austin",151,7051,128780,93,41261,https://engineering.purdue.edu/Engr/AboutUs/News/Events/DistinguishedLectures/2019-2020/hughes-lecture,Finite Element Methods/Solid Mechanics/Computational Fluid Dynamics/Partial Differential Equations/Isogeometric Analysis,https://scholar.google.com/citations?user=6tPdlYAAAAAJ&hl=en
44,Yaochu Jin,"A. v. Humboldt Professor for AI, Bielefeld University and Distinguished Chair, University of Surrey",88,5603,32717,73,20875,http://www.soft-computing.de/,Evolutionary computation/Multiobjective optimization/Multiobjective learning/Trustworthy AI/Developmental AI,https://scholar.google.com/citations?user=B5WAkz4AAAAJ&hl=en
45,"Nei Kato(IEEE Fellow, IEICE Fellow)","Professor and Dean, Graduate School of Information Sciences, Tohoku University, Japan",75,3293,22324,60,14784,https://scholar.google.com/citations?user=LfLfZXEAAAAJ&hl=en,Wireless networking,https://scholar.google.com/citations?user=LfLfZXEAAAAJ&hl=en
46,"Dr. Neeraj Kumar, SMIEEE (Web of Science Highly Cited Researcher 2019, 2020,2021)","Professor, CSED, Thapar Institute of Engineering and Technology, India",95,9998,30127,90,28190,https://scholar.google.com/citations?user=gL9gR-4AAAAJ&hl=zh-CN,IoT and Machine Learning/Deep Learning/Blockchain Technology,https://scholar.google.co.in/citations?user=gL9gR-4AAAAJ&hl=en
47,"Dr. Arun Kumar Sangaiah, (Web of Science Highly Cited Researcher, SM'IEEE)","Professor, VIT University, Vellore, India",71,4764,16050,71,15868,https://scholar.google.com/citations?user=jgk3wT4AAAAJ&hl=en,Software Engineering/Computational Intelligence/Internet of Things,https://scholar.google.co.in/citations?user=8yF6Xc4AAAAJ&hl=en
48,Victor C. M. Leung,Shenzhen University / The University of British Columbia,103,6525,49190,86,31699,https://scholar.google.com/scholar_url?url=https://citeseerx.ist.psu.edu/viewdoc/download%3Fdoi%3D10.1.1.941.5437%26rep%3Drep1%26type%3Dpdf&hl=en&sa=X&ei=j2nPYp7ZForcmwGenrKQAQ&scisig=AAGBfm0zezW4rAHdNplD7CDKOE_DZiQqZw&oi=scholarr,communication systems/wireless networks/mobile systems,https://scholar.google.ca/citations?user=ajvCoo4AAAAJ&hl=en
49,Geoffrey Ye Li (李烨),"Chair Professor in Wireless Systems, Dept EEE, Imperial College London",109,5875,54100,79,25864,https://people.ucas.ac.cn/~yeli?language=en,Signal Processing/and/Machine Learning/for/Wireless Communications,https://scholar.google.com/citations?user=d0FzG8YAAAAJ&hl=en
50,Hongyi Li,"Assistant Professor, University of Houston",34,920,3806,31,3213,https://scholar.google.com/scholar?q=Hongyi+Li+homepage&hl=en&as_sdt=0&as_vis=1&oi=scholart,watershed hydrology/earth system modeling/coupled human-nature system,https://scholar.google.com/citations?user=yWy-5icAAAAJ&hl=en
51,Jin Li  李进,Professor @Guangzhou University,60,1995,19117,54,12731,https://m.youtube.com/channel/UCnDTxm-x3m4qD-mQRoG7LpQ/videos,Trust and Security in Artificial Intelligence/Computating and Storage in Cloud Computing/Blockchain,https://scholar.google.com/citations?user=7GDV2vUAAAAJ&hl=en
52,Xuelong Li (Executive Councilor of AAAI),"Professor, Northwestern Polytechnical University, China",120,8549,55949,99,39453,https://copyfuture.com/blogs-details/202112231446333973,artificial intelligence/optics and electronics,https://scholar.google.com/citations?user=ahUibskAAAAJ&hl=en
53,yongming li,"college of computer science, shaanxi normal university",36,393,4980,24,2467,https://loop.frontiersin.org/people/774056/overview,fuzzy systems/quantume logic and quantum information/lattice/topology/model checking,https://scholar.google.com/citations?user=P3VERZ0AAAAJ&hl=en
54,Huchang Liao (廖虎昌),"IET Fellow, BCS Fellow; Business School, Sichuan University",64,3572,13422,60,12357,http://2020.cibda.org/committee,Decision analysis/Fuzzy Systems/Multiple criteria decision making/Preference learning,https://scholar.google.co.uk/citations?user=KlWnnbIAAAAJ&hl=en
55,Chong Lin,Qingdao University,71,1936,16660,53,9358,https://nesea.org/user/14796/presenter,systems and control theory,https://scholar.google.com/citations?user=AQbRErEAAAAJ&hl=en
56,Yan-Jun Liu,Liaoning University of Technology,62,2309,14620,58,11191,https://pku.academia.edu/YanjunLiu,Adaptive control/fuzzy control/neural networks,https://scholar.google.com/citations?user=x_Wk1jAAAAAJ&hl=en
57,Yuanwei Liu,"Associate Professor in Queen Mary University of London, Web of Science Highly Cited Researcher",53,3535,12778,52,12517,https://dblp.org/pid/93/8541,NOMA/RIS/AI/6G/Integrated Sensing and Communications,https://scholar.google.com/citations?user=FxLf7ZAAAAAJ&hl=en
58,Wenjing Lou,"W. C. English Endowed Professor, IEEE Fellow, Virginia Tech, USA",83,2807,39734,59,19321,https://www.linkedin.com/in/wenjing-lou-a605237,Cyber Security/Wireless Networks/Wireless Security/Network Security/Cloud Computing,https://scholar.google.com/citations?user=hM8uAwoAAAAJ&hl=en
59,Majdi Mafarja,"Associate Professor of Computer Science, Birzeit University",35,2635,7088,34,7043,https://www.birzeit.edu/en/faculty-staff/majdi-mafarja,Feature Selection/Machine Learning/Artificial Intelligence/Bio-inspired Algorithms/Metaheuristics,https://scholar.google.com/citations?user=ftkD0MgAAAAJ&hl=en
60,Luis Martínez,"Professor of Computer Science, University of Jaén",64,2692,23077,52,13055,https://findadentist.ada.org/va/loudoun/ashburn/prosthodontics/dr-luis-j-martinez-2703074,Fuzzy decision making/Computing with words/Recommender Systems,https://scholar.google.com/citations?user=PG3D8UMAAAAJ&hl=en
61,Thomas Marzetta,"Distinguished Industry Professor, Department of Electrical and Computer Engineering, New York",59,4650,47722,46,28526,https://dl.acm.org/profile/81100311884,Beyond Massive MIMO,https://scholar.google.com/citations?user=tBLWIBoAAAAJ&hl=en
62,Seyedali Mirjalili,"Professor, Torrens University Australia, Adjunct Griffith University",77,16793,53854,76,51718,https://seyedalimirjalili.com/projects,Metaheuristics/Robust Optimization/Engineering Optimization/Evolutionary Algorithm/Swarm Intelligence,https://scholar.google.com/citations?user=TJHmrREAAAAJ&hl=en
63,Andreas F. Molisch,"Professor of Electrical Engineering, University of Southern California",102,5237,59968,71,28689,https://scholar.google.com/scholar_url?url=https://merl.com/publications/docs/TR2008-072.pdf&hl=en&sa=X&ei=m2nPYsiVGonGsQLQuYRY&scisig=AAGBfm0YMVoBGcBSFij6oNowME7WgCoT9g&oi=scholarr,wireless propagation channels/multi-antenna systems/ultrawideband communications and positioning/cooperative communications,https://scholar.google.com/citations?user=W0wwrucAAAAJ&hl=en
64,Derrick Wing Kwan Ng,"Scientia  Associate Professor,  University of New South Wales",68,3986,19886,64,17237,https://research.com/u/derrick-wing-kwan-ng,Wireless Communications,https://scholar.google.com/citations?user=NUJSHxoAAAAJ&hl=en
65,H. Nguyen-Xuan,"CIRTech Institute, HUTECH University, Vietnam",68,2493,16176,60,11523,https://publons.com/researcher/340227/hung-nguyen-xuan/,Computational Engineering/Large-scale data/3D Printing/Renewable Energy,https://scholar.google.co.uk/citations?user=3iK9h-gAAAAJ&hl=en
66,Dusit (Tao) Niyato,Nanyang Technological University (NTU),104,8952,49541,87,34790,https://faculty.sustech.edu.cn/asheralievaa/,ดุสิต นิยะโต - เต๋า,https://scholar.google.com/citations?user=T8sVhLMAAAAJ&hl=en
67,Kaoru Ota (太田　香),"MEXT Excellent Young Researcher (文部科学省　卓越研究員), Muroran Institute of Technology",50,2104,10112,48,9238,https://www.adscientificindex.com/scientist.php?id=548635,,https://scholar.google.com/citations?user=8JVn8RsAAAAJ&hl=ja
68,Mugen Peng,"Beijing University of Posts & Telecommun., IEEE Fellow, Web of Science Highly Cited Researcher",53,2377,15896,47,11317,https://research.com/u/mugen-peng,Fog Computing/Cloud Radio Access Networks/Integrated Satellite-Terrestrial Networks/6G,https://scholar.google.com/citations?user=85mAZVcAAAAJ&hl=en
69,HV Poor,"Michael Henry Strater University Professor, Princeton University",158,14477,124688,108,63356,https://scholar.google.com/scholar_url?url=http://sdayanik.bilkent.edu.tr/papers/multihypo.pdf&hl=en&sa=X&ei=oGnPYsvbCL6Ty9YPxL6S4As&scisig=AAGBfm3REN89SKP7MZn8b4ytXZKoeP7tDw&oi=scholarr,Communication Systems/Wireless Communications/Communications/Statistical Signal Processing/Information Theory,https://scholar.google.com/citations?user=Dq93mOUAAAAJ&hl=en
70,Lianyong Qi(齐连永),"Professor, Qufu Normal University",46,1880,6267,45,6013,https://www.researchgate.net/profile/Lianyong-Qi,service computing/big data/recommender system,https://scholar.google.com/citations?user=pxNRRsAAAAAJ&hl=en
71,Timon Rabczuk,Bauhaus University Weimar,108,7423,43227,93,32776,https://www.mpie.de/3895910/timon_rabczuk,Computational Mechanics/Solid Mechanics,https://scholar.google.ca/citations?user=3CBuGosAAAAJ&hl=en
72,Kim-Kwang Raymond Choo,"Cloud Tech Endowed Professor, University of Texas at San Antonio; Highly Cited Researcher 2020, 2021",96,6689,26259,88,23779,https://people.unisa.edu.au/raymond.choo,Cloud Forensics/Cyber Forensics/Cyber Security/IoT Security/Blockchain,https://scholar.google.com/citations?user=rRBNI6AAAAAJ&hl=en
73,Kui Ren,"Professor, Zhejiang University, ACM Fellow, IEEE Fellow",84,3756,40522,70,22757,https://ieeexplore.ieee.org/author/37288795500,Data Security & Privacy/IoT Security/AI Security,https://scholar.google.com/citations?user=uuQA_rcAAAAJ&hl=en
74,Walid Saad,"Professor, Electrical and Computer Engineering",82,7545,33345,75,28359,https://www.linkedin.com/in/walid-saad-089640a,6G/machine learning/semantic communications/security and cyber-physical systems/unmanned aerial vehicles,https://scholar.google.com/citations?user=kYDNA0UAAAAJ&hl=en
75,Robert Schober,Friedrich-Alexander-University Erlangen-Nuremberg,94,5443,43630,77,28691,https://www.tf.fau.eu/person/robert-schober/,,https://scholar.google.com/citations?user=Uu0BpX8AAAAJ&hl=en
76,"Ling Shao, Fellow of IEEE/IAPR",Terminus Group,91,8245,33690,85,28635,https://scholar.zheng98.com/citations?user=z84rLjoAAAAJ&hl=ko,Computer Vision/Deep Learning/Artificial Intelligence/Medical Imaging/Vision and Language,https://scholar.google.com/citations?user=z84rLjoAAAAJ&hl=en
77,Xuemin (Sherman) Shen,"University Professor, University of Waterloo",133,9318,75355,105,43931,https://scholar.google.com/scholar_url?url=http://nsec.sjtu.edu.cn/publications/2018/Securing%2520consumer%2520IoT.pdf&hl=en&sa=X&ei=pmnPYofvH5eTy9YP1dOMyAE&scisig=AAGBfm1pezn6VNz-mP8z0oeRL_efmIdJOw&oi=scholarr,Wireless networking/MAC/Network security/VANET,https://scholar.google.com/citations?user=Bjl3GwoAAAAJ&hl=cs
78,Peng Shi,"Professor, School of Electrical and Electronic Engineering, The University of Adelaide",151,8194,78962,114,46861,https://www.pengshi.com/About,Systems and Control/Electrical and Electronic Engineering/Cybernetics/Human-Computer Interaction,https://scholar.google.com.hk/citations?user=EGx1iH0AAAAJ&hl=en
