,Name,Affilation,H-index,Citations 2020,Total_citation,H-index_since_2016,Citation_since_2016,HomePage,Area of Research,Google_Scholar
0,"U Rajendra Acharya (SCI Highly Cited Researcher 2016-2021)  PhD, DEng, DSc","Ngee Ann,  Singapore University of Social Science,  University of Malaya, Malaysia",108,8775,46615,97,36834,https://researchr.org/alias/u.-rajendra-acharya,Artificial Intelligence/Medical Informatics,https://scholar.google.com.sg/citations?user=8FjY99sAAAAJ&hl=en
1,IAN  F.  AKYILDIZ,"Truva Inc. , USA",131,6715,131267,86,45182,https://www.itu.int/en/ITU-T/academia/kaleidoscope/2020/Pages/Ian-Akyildiz.aspx,Wireless Communication/5G/6G Wireless Systems/Intelligent Surfaces for Wireless Communication/Nano-scale and Molecular Commun,https://scholar.google.com/citations?user=rAGwv14AAAAJ&hl=en
2,Ibrahim Aljarah,"Associate Professor, University of Jordan",42,2269,7016,42,6909,https://aljarah.weebly.com/,Artificial  intelligence/Data Security/Data Science/Machine Learning/Evolutionary Computation,https://scholar.google.com/citations?user=moOTIYEAAAAJ&hl=en
3,Jeffrey Andrews,"Cockrell Family Endowed Chair in Engineering, University of Texas at Austin",104,4654,64321,79,34778,https://www.jeffandrewsdesign.com/projects-main,Wireless Communications/Communication Theory/Machine Learning for Communications/Stochastic Geometry/Information Theory,https://scholar.google.com/citations?user=Hr9Gey0AAAAJ&hl=en
4,Bennis Mehdi,"Full Professor, IEEE Fellow, Head of ICON, University of Oulu",64,5575,22100,62,20521,https://icc2021.ieee-icc.org/workshop/ws-11-workshop-decentralized-ai-wireless-networks-zero-touch-dawnz/program,B5G/6G/machine learning/semantic communication,https://scholar.google.com/citations?user=RW4sJu8AAAAJ&hl=en
5,Emil Björnson,KTH Royal Institute of Technology / Linköping University,60,3382,16373,57,14601,https://www.kth.se/profile/emilbjo,Massive MIMO/Cell-free Massive MIMO/RIS/Signal processing/convex optimization,https://scholar.google.se/citations?user=Maij4akAAAAJ&hl=en
6,Rajkumar Buyya,"CLOUDS Lab, School of Computing and Information Systems, The University of Melbourne, Australia",151,11198,119401,110,65936,https://publons.com/researcher/2861619/rajkumar-buyya/,Computer Systems/Cloud Computing/Distributed Systems/Edge Computing/Internet of Things,https://scholar.google.com/citations?user=7xN6JqYAAAAJ&hl=en
7,Xing Cai,"Senior Research Scientist at Simula Research Laboratory, Professor at University of Oslo",19,123,1972,14,855,https://www.simula.no/people/xingca,Parallel programming/High-performance computing/numerical methods for PDEs,https://scholar.google.com/citations?user=IWQbrcK5CEwC&hl=en
8,Giuseppe Caire,"Professor, Technical University of Berlin, Germany, and Professor of Electrical Engineering (on",82,2932,38202,58,17465,https://www.5gitaly.eu/2019/team-member/caire-giuseppe/,Information Theory/Communications/Signal Processing/Statistics,https://scholar.google.com/citations?user=g66ErTcAAAAJ&hl=en
9,Jinde Cao,"Academician, RAE/AE/RAEN/LAS/AAS/EASA/PAS/IASCYS  & FIEEE/FAAIA/DFIETI; Southeast University",128,8797,66181,90,40404,https://dblp.org/pid/77/2845,Complex networks/neural networks/multi-agent systems - engineering stability - dynamics and control - time-delay systems,https://scholar.google.com/citations?user=8_ffELYAAAAJ&hl=en
10,C. L. Philip Chen,"Chair Professor, South China University of Technology, Philip.Chen@ieee.org",91,5869,34305,83,27018,http://www2.scut.edu.cn/cs/2019/0724/c22284a328910/page.htm,Computational Intelligence/Intelligent Control/Cybernetics/Intelligent Transportation Systems/Data Science/Engineering,https://scholar.google.com/citations?user=Q5248zwAAAAJ&hl=en
11,Jinjun Chen,"Professor and Deputy Institute Director, Swinburne University of Technology",65,2162,12059,48,8772,http://www.azxy5kjw.com/research-institutes/data-science/people/jinjun-chen/,Cloud Computing/Scalable Architecture/Scalable Data Storage/Scalable Data Processing (Privacy),https://scholar.google.com/citations?user=mQ9vJ24AAAAJ&hl=en
12,Min Chen,"Professor, IEEE Fellow, Highly Cited Researcher, Huazhong University of Science and Technology",85,5752,31513,71,25062,https://www.uwb.edu/css/faculty/bios/mchen,Cognitive Computing and Big Data Analytics/IoT Sensing/5G Networks/Robotics/Edge Computing,https://scholar.google.com/citations?user=_HyHTrsAAAAJ&hl=en
13,Xiaofeng Chen,"Professor, Xidian University, China",55,1936,13242,51,10466,https://cbe.wwu.edu/people/chenx,Security/Cryptography/Cloud computing,https://scholar.google.com/citations?user=-3WhJecAAAAJ&hl=en
14,Francisco Chiclana,"Professor of Computational Intelligence and Decision Making, De Montfort University, UK",68,2298,18865,59,11882,https://www.tech.dmu.ac.uk/~chiclana/,Decision making/computational intelligence/information fusion/consensus/sentiment analysis,https://scholar.google.com/citations?user=qDOxZIIAAAAJ&hl=en
15,zhihua cui,"Taiyuan University of Science and Technology, Taiyuan, Shanxi, China, 030024",44,1640,7835,33,5725,https://www.longdom.org/editor/zhihua-cui-8740,evolutionary computation,https://scholar.google.com/citations?user=BpDrULIAAAAJ&hl=en
16,Linglong Dai,"Associate Professor, Department of Electronics Engineering, Tsinghua University, Beijing, China",61,3185,14715,56,13785,https://ieeexplore.ieee.org/author/37086337354,Wireless Communications/RIS/Massive MIMO/Millimeter-Wave/Teraherz Communications/Non-Orthogonal Mutiple Access,https://scholar.google.com/citations?user=OTFnifoAAAAJ&hl=en
17,Merouane Debbah,"Centralesupelec, Technology Innovation Institute, MBZUAI, Lagrange Mathematics Center",98,7546,44507,84,33657,https://ieeexplore.ieee.org/author/37284195000,5G/6G/Machine Learning/Random Matrix Theory/Game Theory,https://scholar.google.com/citations?user=HU5I0X4AAAAJ&hl=en
18,Yong Deng,"School of Computer and Information Science, Southwest University",72,3155,18514,66,15052,https://ieeexplore.ieee.org/author/37085569060,Evidence Theory/Fuzzy Set Theory/Bio-inspired AI/Complex Networks,https://scholar.google.com/citations?user=8voeILsAAAAJ&hl=en
19,Zhiguo Ding,"University of Manchester, Fellow of IEEE, Web of Science Highly Cited Researcher",87,7793,33970,81,31203,https://ieeexplore.ieee.org/author/37278653500,Wireless communications/signal processing/and cross-layer optimization,https://scholar.google.co.uk/citations?user=V-nB8scAAAAJ&hl=en
20,"Mianxiong Dong, Foreign Fellow of EAJ","Vice President and Professor, Muroran Institute of Technology, Japan",51,2182,9930,50,9181,https://u.muroran-it.ac.jp/enes/~mxdong/index.html,Cyber-Physical Systems/Internet of Things/Artificial Intelligence,https://scholar.google.co.jp/citations?user=TqyApAUAAAAJ&hl=en
21,Yucheng Dong,"Professor of Management and Systems Sciences, Sichuan University",56,1840,10663,52,8999,https://dblp.org/pid/08/3009,Decision Analysis/Human Dynamics/Social Network/Data Science,https://scholar.google.com/citations?user=tFVYDw4AAAAJ&hl=en
22,Maged Elkashlan,"Associate Professor, Queen Mary University of London",57,2599,13915,54,12588,https://www.researchgate.net/scientific-contributions/Maged-Elkashlan-70038448,IRS/URLLC/UAV/PLS/NOMA,https://scholar.google.com/citations?user=mncnnOAAAAAJ&hl=en
23,Zubair Md. Fadlullah,"Associate Professor, Research Chair, Department of Computer Science, Lakehead University, TBRHRI",38,1479,6791,36,5556,https://www.researchgate.net/profile/Zubair-Fadlullah,Beyond 5G/Smart Health/UAV & Energy efficient Networks/QoS & Security/Deep Learning applications,https://scholar.google.com/citations?user=dZyfKpYAAAAJ&hl=en
24,Hossam Faris,"Professor, The University of Jordan, Al Hussein Technical University",43,2907,9269,43,9140,http://evo-ml.com/hossam-faris/,Data Science/Knowledge Systems/Data Mining/Evolutionary computation,https://scholar.google.com/citations?user=UEYd--YAAAAJ&hl=en
25,Giancarlo Fortino,"Full Prof. of Computer Engineering, Univ. of Calabria, IEEE Fellow, Highly Cited Researcher",62,2820,14211,56,11893,https://orcid.org/0000-0002-4039-891X,Human-Machine Systems/Agent-based Computing/Internet of Things/Wearable Computing/Wireless/Body Area Networks,https://scholar.google.com/citations?user=ecImn1MAAAAJ&hl=it
26,Hamido Fujita,Iwate Prefectural University,62,3959,14440,62,13684,https://www.youtube.com/watch?v=2TIxd5UW_JM&t=3333,Machine Learning,https://scholar.google.com/citations?user=MxzV1nQAAAAJ&hl=en
27,Erik G. Larsson,"Professor, Dept. of Electrical Engineering (ISY), Linköping University, Sweden",83,5591,41704,63,29450,https://ma-mimo.ellintech.se/author/egl/,Wireless communications/statistical signal processing/localization/massive MIMO/networks,https://scholar.google.se/citations?user=79Lry6oAAAAJ&hl=en
28,Amir H. Gandomi,"Professor, University of Technology Sydney",72,4110,24646,64,19868,https://ieeexplore.ieee.org/author/37681044500,Data Analytics/Genetic Programming/Engineering Optimization/Evolutionary Computation/Smart Cities,https://scholar.google.com/citations?user=VMf3wfMAAAAJ&hl=en
29,Xiaohua Ge,"Swinburne University of Technology, Melbourne, Australia",32,1716,5838,32,5780,https://orcid.org/0000-0003-0180-0897,Multi-Agent Systems/Networked Control Systems/Cyber-Physical Systems/Sensor Networks,https://scholar.google.com.au/citations?user=B37CYFoAAAAJ&hl=en
30,"Mohsen Guizani, FIEEE","Qatar University, Doha, Qatar",88,8255,39307,75,33168,https://scholar.google.com/citations?user=RigrYkcAAAAJ&hl=en,Internet of Things/Applied AI/ML and Cybersecurity,https://scholar.google.com/citations?user=RigrYkcAAAAJ&hl=en
31,Song Guo,"FCAE, FIEEE, The Hong Kong Polytechnic University",68,3814,19069,66,16294,https://ieeexplore.ieee.org/author/37086293865,Big Data Computing/Edge AI/Mobile Computing/Distributed System,https://scholar.google.com/citations?user=Ib-sizwAAAAJ&hl=en
32,Harald Haas,The University of Edinburgh,92,5623,43065,78,30687,https://www.youtube.com/watch?v=23iUqNwAbZw,Optical Wireless Communications/Interference Managment in Wireless Networks/Spatial Modulation,https://scholar.google.com/citations?user=XxIwRJQAAAAJ&hl=ja
33,Yuki Hagiwara,Fraunhofer IKS,29,1754,5626,29,5617,https://www.bloombergquint.com/author/1530894/yuki-hagiwara-2,Artificial Intelligence,https://scholar.google.com.sg/citations?user=P6WI2DQAAAAJ&hl=en
34,"Qing-Long Han, Pro Vice-Chancellor and Distinguished Professor, MAE, IEEE Fellow",Swinburne University of Technology,104,5707,34830,86,24420,https://broadnets.eai-conferences.org/2021/keynotes/,Networked control systems/time-delay systems/multi-agent systems/smart grids/unmanned surface vehicles,https://scholar.google.com.au/citations?user=j0pyptAAAAAJ&hl=en
35,Zhu Han,University of Houston,114,7596,52815,91,37804,https://www.ee.uh.edu/faculty/han-zhu,Game Theory/Wireless Networking/Security/Data Science/Smart Grid,https://scholar.google.com/citations?user=ty7wIXoAAAAJ&hl=en
36,L Hanzo,"Chair of Telecommunications, University of Southampton",104,7086,63163,82,33552,https://www.researchgate.net/profile/L-Hanzo,telecommunications/wireless communication/quantum_information_science/video_coding/video_networking,https://scholar.google.co.uk/citations?user=p0jnEW0AAAAJ&hl=en
37,L Hanzo,"Chair of Telecommunications, University of Southampton",104,7086,63163,82,33552,https://www.researchgate.net/profile/L-Hanzo,telecommunications/wireless communication/quantum_information_science/video_coding/video_networking,https://scholar.google.co.uk/citations?user=p0jnEW0AAAAJ&hl=en
38,Robert Heath,"Lampe Distinguished Professor, North Carolina State University",133,7930,77878,93,44879,http://www.profheath.org/,wireless/MIMO/communications/signal processing/information theory,https://scholar.google.com/citations?user=17Ko8Q0AAAAJ&hl=en
39,Francisco Herrera,"Professor Computer Science and AI, Granada University, Senior Research Advisor in DL&ML at Sherpa.ai",157,11544,105480,123,60664,http://www.herrerabox.com/#section-2,Artificial Intelligence/Computational Intelligence/Data mining/Evolutionary Algorithms/Big Data Analytics,https://scholar.google.com/citations?user=HULIk-QAAAAJ&hl=en
40,Enrique Herrera-Viedma,"Professor of Computer Science and Artificial Intelligence, Spain, University of Granada",105,5114,44204,88,26198,https://publons.com/researcher/2882286/enrique-herrera-viedma/,Fuzzy sets/fuzzy decision making/computing with words/multiple criteria decision making/consensus,https://scholar.google.com/citations?user=g8ZXTuYAAAAJ&hl=en
41,Ekram Hossain,"Professor, University of Manitoba, Canada, IEEE Fellow",97,3324,35573,74,20766,https://www.comsoc.org/ekram-hossain,Wireless communication networks/radio resource allocation/cognitive radio/multi-tier cellular networks,https://scholar.google.com/citations?user=Lb617EMAAAAJ&hl=en
42,Guang-Bin Huang,"Full Professor, Nanyang Technological University, Singapore",70,6026,52354,62,35837,https://publons.com/researcher/2816805/guang-bin-huang/,Machine Learning/Neural Networks/Neuroscience,https://scholar.google.com.sg/citations?user=LhSqQCIAAAAJ&hl=en
43,Kaibin Huang,"Associate Professor, Dept. of EEE, The University of Hong Kong; IEEE Fellow",50,2666,13765,43,11150,https://www.eee.hku.hk/~huangkb/,Machine Learning/Mobile Edge Computing/Wireless Communications/Wireless Power Transfer/Stochastic Geometry,https://scholar.google.com/citations?user=HfuA3uIAAAAJ&hl=en
44,Thomas JR Hughes,"Peter O'Donnell Jr. Chair in Computational and Applied Mathematics, University of Texas at Austin",157,7616,128608,99,45096,http://en.wikipedia.org/wiki/Theodore_von_Karman_Medal,Finite Element Methods/Solid Mechanics/Computational Fluid Dynamics/Partial Differential Equations/Isogeometric Analysis,https://scholar.google.com/citations?user=6tPdlYAAAAAJ&hl=en
45,Yaochu Jin,"Humboldt Professor for AI, Bielefeld University and Distinguished Chair, University of Surrey",81,3937,28581,68,18332,https://ekvv.uni-bielefeld.de/blog/uninews/entry/humboldt_professorship_for_artificial_intelligence,Artificial Intelligence/Evolutionary Computation/Multiobjective Optimization/Federated Learning/Developmental AI,https://scholar.google.com/citations?user=B5WAkz4AAAAJ&hl=en
46,"Nei Kato(IEEE Fellow, IEICE Fellow)","Professor, Graduate School of Information Sciences, Tohoku University, Japan",72,3433,20166,58,14048,https://www.aminer.org/profile/nei-kato/54483485dabfae87b7de6863,Wireless networking,https://scholar.google.com/citations?user=LfLfZXEAAAAJ&hl=en
47,"Dr. Neeraj Kumar, SMIEEE (Web of Science Highly Cited Researcher 2019, 2020,2021)","Professor, CSED, Thapar Institute of Engineering and Technology, India",84,6360,23413,79,22244,https://www.amazon.com/Machine-Learning-Cognitive-Neeraj-Kumar/dp/0367359162,IoT and Machine Learning/Deep Learning/Blockchain Technology,https://scholar.google.co.in/citations?user=gL9gR-4AAAAJ&hl=en
48,"Dr. Arun Kumar Sangaiah., Ph.D (SM'IEEE)","Professor, School of Computing Science and Engineering, VIT University, Vellore, India",64,4059,12684,64,12570,https://in.linkedin.com/in/dr-arun-kumar-sangaiah-081452a9,Software Engineering/Computational Intelligence/Internet of Things,https://scholar.google.co.in/citations?user=8yF6Xc4AAAAJ&hl=en
49,Victor C. M. Leung,Shenzhen University / The University of British Columbia,100,6414,45211,85,30933,https://orcid.org/0000-0003-3529-2640,communication systems/wireless networks/mobile systems,https://scholar.google.ca/citations?user=ajvCoo4AAAAJ&hl=en
50,Geoffrey Ye Li (李烨),"Chair Professor in Wireless Systems, Dept EEE, Imperial College London",102,5461,49876,79,25039,https://aquinoscleaning.com/athvxzv/e9efda-geoffrey-ye-li,Signal Processing/and/Machine Learning/for/Wireless Communications,https://scholar.google.com/citations?user=d0FzG8YAAAAJ&hl=en
51,Hongyi Li,"Assistant Professor, University of Houston",32,710,3183,29,2809,https://hongyili.net/Project/,watershed hydrology/earth system modeling/coupled human-nature system,https://scholar.google.com/citations?user=yWy-5icAAAAJ&hl=en
52,Jin Li  李进,Professor @Guangzhou University,56,2256,17934,52,13383,https://books.google.com/books?id=I4BMdO-3eiUC&pg=PA188&lpg=PA188&dq=Jin+Li++%E6%9D%8E%E8%BF%9B+homepage&source=bl&ots=xrI4v2yfXz&sig=ACfU3U1DhTbd3vLne85gh8eELn7G-Rq5LQ&hl=en&sa=X&ved=2ahUKEwiqsOLH4rT0AhXLDzQIHc6EDGIQ6AF6BAgXEAM,Trust and Security in Artificial Intelligence/Computating and Storage in Cloud Computing/Blockchain,https://scholar.google.com/citations?user=7GDV2vUAAAAJ&hl=en
53,Xuelong Li (Executive Councilor of AAAI),"Professor, Northwestern Polytechnical University, China",114,7708,50282,101,38066,https://z-upload.facebook.com/hashtag/aaai?source=feed_text&epa=HASHTAG,artificial intelligence/feature extraction/higher-order data analytics,https://scholar.google.com/citations?user=ahUibskAAAAJ&hl=en
54,yongming li,"college of computer science, shaanxi normal university",36,421,4717,25,2595,https://publons.com/researcher/2277406/yongming-li/,fuzzy systems/quantume logic and quantum information/lattice/topology/model checking,https://scholar.google.com/citations?user=P3VERZ0AAAAJ&hl=en
55,Huchang Liao (廖虎昌),"Fellow of BCS, Business School, Sichuan University",58,2506,11304,56,10750,http://www.sysengi.com/CN/10.12011/SETP2020-2429,Decision analysis/Fuzzy Systems/Multiple criteria decision making/Preference learning,https://scholar.google.co.uk/citations?user=KlWnnbIAAAAJ&hl=en
56,Chong Lin,Qingdao University,67,1866,15324,52,9168,https://www.building-performance.org/conferences/HPCNY18/presenter/chong-lin,systems and control theory,https://scholar.google.com/citations?user=AQbRErEAAAAJ&hl=en
57,Yan-Jun Liu,Liaoning University of Technology,57,2199,12951,54,10863,https://gr.xjtu.edu.cn/en/web/liukeen,Adaptive control/fuzzy control/neural networks,https://scholar.google.com/citations?user=x_Wk1jAAAAAJ&hl=en
58,Yuanwei Liu,"Associate Professor in Queen Mary University of London, Web of Science Highly Cited Researcher",46,2601,9920,46,9826,https://dl.acm.org/profile/81361597529,NOMA/RIS/UAV Communications/Artifical Intelligence/6G,https://scholar.google.com/citations?user=FxLf7ZAAAAAJ&hl=en
59,Wenjing Lou,"W. C. English Endowed Professor, IEEE Fellow, Virginia Tech, USA",80,3005,38158,62,22346,https://cyberinitiative.org/people/faculty/wenjing-lou.html,Cyber Security/Wireless Networks/Wireless Security/Network Security/Cloud Computing,https://scholar.google.com/citations?user=hM8uAwoAAAAJ&hl=en
60,Majdi Mafarja,"Associate Professor of Computer Science, Birzeit University",32,1671,5162,30,5123,https://www.birzeit.edu/en/faculty-staff/majdi-mafarja,Feature Selection/Machine Learning/Artificial Intelligence/Bio-inspired Algorithms/Metaheuristics,https://scholar.google.com/citations?user=ftkD0MgAAAAJ&hl=en
61,Luis Martínez,"Professor of Computer Science, University of Jaén",61,2313,21392,53,12865,https://www.trinity.edu/directory/lmartin6,Fuzzy decision making/Computing with words/Recommender Systems,https://scholar.google.com/citations?user=PG3D8UMAAAAJ&hl=en
62,Thomas Marzetta,"Distinguished Industry Professor, Department of Electrical and Computer Engineering, New York",58,4838,45069,46,30520,https://ieeexplore.ieee.org/author/37282754500,Beyond Massive MIMO,https://scholar.google.com/citations?user=tBLWIBoAAAAJ&hl=en
63,Seyedali Mirjalili,"Professor, Torrens University Australia, Adjunct Griffith University",67,10612,39796,66,38688,https://seyedalimirjalili.com/projects,Metaheuristics/Robust Optimization/Engineering Optimization/Evolutionary Algorithm/Swarm Intelligence,https://scholar.google.com/citations?user=TJHmrREAAAAJ&hl=en
64,Andreas F. Molisch,"Professor of Electrical Engineering, University of Southern California",100,5155,56904,75,29187,https://viterbi.usc.edu/directory/faculty/Molisch/Andreas,wireless propagation channels/multi-antenna systems/ultrawideband communications and positioning/cooperative communications,https://scholar.google.com/citations?user=W0wwrucAAAAJ&hl=en
65,Derrick Wing Kwan Ng,"Scientia Senior Lecturer,  University of New South Wales",63,3490,16889,61,15405,https://ieeexplore.ieee.org/author/37536288000,Wireless Communications,https://scholar.google.com/citations?user=NUJSHxoAAAAJ&hl=en
66,H. Nguyen-Xuan,"CIRTech Institute, Ho Chi Minh City University of Technology (HUTECH), Vietnam",66,2205,14557,57,10850,https://books.google.com/books?id=cDtNDwAAQBAJ&pg=PA393&lpg=PA393&dq=H.+Nguyen-Xuan+homepage&source=bl&ots=-lVPXeJIHy&sig=ACfU3U3hgI6oVnBuG98rB1p6R5tMZMaFeg&hl=en&sa=X&ved=2ahUKEwil76_N4rT0AhXcIDQIHdzcAo0Q6AF6BAgTEAM,Computational Engineering/Large-scale data/3D Printing/Renewable Energy,https://scholar.google.co.uk/citations?user=3iK9h-gAAAAJ&hl=en
67,Dusit (Tao) Niyato,Nanyang Technological University (NTU),95,6843,42816,82,31110,https://books.google.com/books?id=IQngLbr97kYC&pg=PR12&lpg=PR12&dq=Dusit+(Tao)+Niyato+homepage&source=bl&ots=vK-Yl0azRv&sig=ACfU3U0KsplPwtV60E2RYs7x_NckycQ-qw&hl=en&sa=X&ved=2ahUKEwjPiOPN4rT0AhUqCTQIHdymCd8Q6AF6BAgREAM,ดุสิต นิยะโต - เต๋า,https://scholar.google.com/citations?user=T8sVhLMAAAAJ&hl=en
68,Kaoru Ota (太田　香),"MEXT Excellent Young Researcher (文部科学省　卓越研究員), Muroran Institute of Technology",48,2105,8715,47,8360,https://www.facebook.com/kaoru.ota.75,,https://scholar.google.com/citations?user=8JVn8RsAAAAJ&hl=ja
69,Mugen Peng,"Beijing University of Posts & Telecommun., IEEE Fellow, Web of Science Highly Cited Researcher",51,2230,14573,45,10847,https://ieeexplore.ieee.org/author/37286925400,Fog Radio Access Network/Heterogeneous Networks/Cloud Radio Access Networks/Network Coding/Radio Resource Allocation and Opt,https://scholar.google.com/citations?user=85mAZVcAAAAJ&hl=en
70,HV Poor,"Michael Henry Strater University Professor, Princeton University",151,12013,115478,108,61018,https://scholar.google.com/citations?user=Dq93mOUAAAAJ&hl=en,Information Theory/Statistical Signal Processing/Stochastic Analysis,https://scholar.google.com/citations?user=Dq93mOUAAAAJ&hl=en
71,Lianyong Qi(齐连永),"Professor, Qufu Normal University(青年教授，博士生导师，曲阜师范大学)",38,1900,4648,37,4446,https://www.scholat.com/qilianyong.en,service computing/big data/recommender system,https://scholar.google.com/citations?user=pxNRRsAAAAAJ&hl=en
72,Timon Rabczuk,Bauhaus University Weimar,102,6245,38040,91,29924,https://www.uni-weimar.de/en/civil-engineering/institute/ism/team/professors/prof-dr-ing-timon-rabczuk/,Computational Mechanics/Solid Mechanics,https://scholar.google.ca/citations?user=3CBuGosAAAAJ&hl=en
73,Kim-Kwang Raymond Choo,"Cloud Tech Endowed Professor, University of Texas at San Antonio; Highly Cited Researcher 2020, 2021",87,5130,21248,84,19647,https://scholar.google.com/citations?user=rRBNI6AAAAAJ&hl=en,Cloud Forensics/Cyber Forensics/Cyber Security/IoT Security/Blockchain,https://scholar.google.com/citations?user=rRBNI6AAAAAJ&hl=en
74,Kui Ren,"Professor, Zhejiang University, ACM Fellow, IEEE Fellow",80,3814,38221,70,24926,https://engineering.buffalo.edu/computer-science-engineering/people/faculty-directory.host.html/content/shared/engineering/computer-science-engineering/profiles/faculty/ren-kui.detail.research.html,Data Security & Privacy/IoT Security/AI Security,https://scholar.google.com/citations?user=uuQA_rcAAAAJ&hl=en
75,Walid Saad,"Professor, Electrical and Computer Engineering",78,6346,28156,71,24775,https://www.netsciwis.com/,6G wireless systems/machine learning/security/cyber-physical systems/Unmanned aerial vehicles (UAVs),https://scholar.google.com/citations?user=kYDNA0UAAAAJ&hl=en
76,Robert Schober,Friedrich-Alexander-University Erlangen-Nuremberg,90,5387,39888,76,28513,https://dl.acm.org/profile/81343504438,,https://scholar.google.com/citations?user=Uu0BpX8AAAAJ&hl=en
77,"Ling Shao, Fellow of IEEE/IAPR","CEO & Chief Scientist, Inception Institute of Artificial Intelligence (IIAI)",77,5465,27049,74,23831,https://scholar.google.com.co/citations?user=kakwJ5QAAAAJ&hl=en,Computer Vision/Deep Learning/Artificial Intelligence/Medical Imaging/Vision and Language,https://scholar.google.com/citations?user=z84rLjoAAAAJ&hl=en
78,Xuemin (Sherman) Shen,"University Professor, University of Waterloo",127,8697,69051,99,43271,https://www.springer.com/journal/12083/editors,Wireless networking/MAC/Network security/VANET,https://scholar.google.com/citations?user=Bjl3GwoAAAAJ&hl=cs
79,Peng Shi,"Professor, School of Electrical and Electronic Engineering, The University of Adelaide",145,8419,73350,117,47958,http://faculty.marshall.usc.edu/Peng-Shi/,Systems and Control/Electrical and Electronic Engineering/Cybernetics/Human-Computer Interaction,https://scholar.google.com.hk/citations?user=EGx1iH0AAAAJ&hl=en
80,"Dr. P. N. Suganthan (SCI Highly Cited Researcher 2015-2021), FIEEE'2015","Some Codes available at GitHub, (Hon. Doctorate, U. of Maribor, 2020 ; BA & MA, U. of Cambridge, UK)",100,6224,53070,84,33359,https://recognition.webofscience.com/awards/highly-cited/2020/,Machine Learning(ML)/Swarm-Evolutionary Computation(SEC)/Neural Networks(ANN)/Applications of ML SEC ANN.,https://scholar.google.com/citations?user=yZNzBU0AAAAJ&hl=en
81,Xingming Sun,Nanjing University of Information Science and Technology,57,1899,15788,51,13320,https://www.techscience.com/ndetail/editor-in-chief_named,Digital Watermarking/Information Security,http://scholar.google.com/citations?user=epqnljMAAAAJ&hl=en
82,Tarik Taleb,University of Oulu/Aalto University,62,3148,17343,58,14049,https://dblp.org/pid/09/3053.html,Network Function Virtualization/Network Softwarization/Software Defined Networking,https://scholar.google.com/citations?user=o1Ap0TEAAAAJ&hl=en
83,"jen hong, tan","Highly Cited Researcher in Computer Science, National University of Singapore",46,2203,8522,44,7899,https://sg.linkedin.com/in/jen-hong-tan-804b282b?trk=people-guest_people_search-card,image processing/computer vision/deep learning/infrared thermography/fundus image,https://scholar.google.com/citations?user=uJlD-A0AAAAJ&hl=en
