81,Tarik Taleb,University of Oulu,68,3699,20973,62,16547,https://rocketreach.co/tarik-taleb-email_67693,Network Function Virtualization/Network Softwarization/Software Defined Networking,https://scholar.google.com/citations?user=o1Ap0TEAAAAJ&hl=en
82,"jen hong, tan","Highly Cited Researcher in Computer Science, National University of Singapore",49,2350,10823,45,9921,https://www.adscientificindex.com/scientist.php?id=291133,image processing/computer vision/deep learning/infrared thermography/fundus image,https://scholar.google.com/citations?user=uJlD-A0AAAAJ&hl=en
83,Dacheng Tao,The University of Sydney,147,14113,86206,123,64859,https://www.science.org.au/profile/dacheng-tao,artificial intelligence/machine learning/computer vision/image processing/data mining,https://scholar.google.com/citations?user=RwlJNLcAAAAJ&hl=en
84,Athanasios Vasilakos,"PROF OF COMPLEX SYSTEMS, CYBERSECURITY, AI",129,7618,59889,107,42990,https://sites.google.com/a/cs.ku.edu.kw/cswebpage/people/faculty/athanasios-2,Cybersecurity/AI in Cybersecurity/IoTs/Mobile Nets/Big Data Analytics/Artificial Intelligence/Machine Learning,https://scholar.google.com/citations?user=_yWPQWoAAAAJ&hl=en
85,Huanqing Wang,Michigan Technological University,4,9,44,4,44,https://dblp.org/pid/48/10582,Electric vehicle/optimal control/model predictive control,https://scholar.google.com/citations?user=6XxgmPEAAAAJ&hl=en
86,Ping Wang,"York University, IEEE Fellow, York Research Chair, IEEE VTS Distinguished Lecturer",71,3626,23248,60,17681,https://scholar.google.com/citations?user=3sIHxrcAAAAJ&hl=en,wireless communications/Internet of Things/cloud computing/smart grid,https://scholar.google.com/citations?user=3sIHxrcAAAAJ&hl=en
87,Qingqing Wu (武庆庆),University of Macau,51,4938,16314,50,16203,https://elewuqq.wixsite.com/mysite,6G/IRS/Green communication and computing/UAV communications/Machine learning,https://scholar.google.com/citations?user=as1T8CMAAAAJ&hl=en
88,Zheng-Guang Wu,Zhejiang University,78,2554,17585,70,13386,https://orcid.org/0000-0003-4460-9785,Markov Jump Systems/Sampled-Data Control Systems/Neural Networks/Fuzzy Systems/Singular Systems,https://scholar.google.com/citations?user=vy6JCNgAAAAJ&hl=en
89,Yang Xiang,"IEEE Fellow, Professfor, Swinburne University of Technology",69,2815,17686,60,14084,https://scholar.google.com/scholar?q=Yang+Xiang+homepage&hl=en&as_sdt=0&as_vis=1&oi=scholart,Cybersecurity/Network Security/System Security/Software Vulnerability Detection/Blockchain,https://scholar.google.com/citations?user=7ymTWY4AAAAJ&hl=en
90,Xiaolong Xu (许小龙),"Professor, Highly Cited Researcher 2021, Nanjing University of Information Science and Technology",43,1436,5785,43,5729,https://www.footballdatabase.eu/en/player/details/269359-xiaolong-xu,Edge computing/Cloud computing/Big data/Fog computing/Mobile computing,https://scholar.google.com/citations?user=Tyzef4sAAAAJ&hl=en
91,Zeshui Xu (徐泽水),"Member of AE,EASA,IASCYS; DFIETI,FIEEE,FIFSA,FIET,FRSA,FORS,FBCS,FIAAM,FAAIA... Sichuan University",140,8918,77269,112,46824,https://www.ae-info.org/ae/User/Xu_Zeshui,Decision Making/Information Fusion/Fuzzy Sets/Computational Intelligence/Bibliometrics,https://scholar.google.co.uk/citations?user=kd9L_GUAAAAJ&hl=en
92,Xin-She Yang (DPhil),"Computational intelligence, swarm intelligence, optimization, metaheuristics, nature-inspired",93,10669,74672,85,52426,https://scholar.google.com/scholar_url?url=https://books.google.com/books%3Fhl%3Den%26lr%3D%26id%3DJ0VcBQxtcwsC%26oi%3Dfnd%26pg%3DPP1%26dq%3DXin-She%2BYang%2B(DPhil)%2Bhomepage%26ots%3Ds8iFm98_iR%26sig%3DHU2xHlQzrqE3acVp6j5b1JeGnm0&hl=en&sa=X&ei=K-NyY6brIuqK6rQP6q6qsAs&scisig=AAGBfm3EeJWAIJEVzoT5z4jLp9BEns-9OA&oi=scholarr,swarm intelligence/optimization/metaheuristics/computational intelligence.,https://scholar.google.com/citations?user=fA6aTlAAAAAJ&hl=th
93,Fei Yu,University of Southern Denmark,10,69,312,9,250,https://www.biostat.ucla.edu/people/yu,Industry 4.0 technology and smart product development,https://scholar.google.com/citations?user=3OHgAmIAAAAJ&hl=en
94,Xiangxiang Zeng,"Deparment of Computer Science, Hunan University",50,1615,7608,42,6424,https://www.researchgate.net/profile/Xiangxiang-Zeng,Computational Intelligence/Bio-inspired Intelligence,https://scholar.google.com/citations?user=B20HBMIAAAAJ&hl=en
95,Yong Zeng (曾勇）,"Southeast University, China; Purple Mountain Laboratories, China",53,4114,18260,52,17772,https://scholar.google.com.sg/citations?user=ENldmwIAAAAJ&hl=en,UAV communications/Massive MIMO/Extremely-Large MIMO (XL-MIMO)/Integrated Sensing and Communication,https://scholar.google.com/citations?user=ENldmwIAAAAJ&hl=en
96,Jianming Zhan,Hubei University for Nationalities,45,1007,7659,39,5128,https://content.iospress.com/articles/journal-of-intelligent-and-fuzzy-systems/ifs707,logical algebras(BL-algebras/R0-algebras and MTL-algebras)/fuzzy algebras(semirings/hemirings and rings) and their hyperstuctures(hyperring/hypergroups,https://scholar.google.com/citations?user=XmJAmNIAAAAJ&hl=en
97,Rui Zhang,National University of Singapore,124,12286,69463,107,53818,https://scholar.google.com/scholar?q=Rui+Zhang+homepage&hl=en&as_sdt=0&as_vis=1&oi=scholart,Wireless Communications/MIMO/Cognitive Radio/Wireless Power Transfer/UAV,https://scholar.google.com.sg/citations?user=yoJqPIkAAAAJ&hl=en
98,Xian-Ming Zhang,Swinburne University of Technology,48,2162,12506,44,10453,https://scholar.google.com/citations?user=0QgZ9lwAAAAJ&hl=en,Networked Control Systems/Event-triggered Control/H-infinity Filtering/Time-delay Systems/Neural Networks,https://scholar.google.com/citations?user=aZcLkqgAAAAJ&hl=en
99,Xuyun Zhang,Macquarie University,44,1245,7037,42,5917,https://researchers.mq.edu.au/en/persons/xuyun-zhang,big data mining/scalable machine learning/big data privacy and cybersecurity/cloud/edge computing/Internet of Things,https://scholar.google.com.au/citations?user=wbF6HL8AAAAJ&hl=en
100,Yan Zhang,"IEEE Fellow, Highly Cited Researcher, University of Oslo, Norway",96,6497,34023,83,26393,https://yanxzhang.com/,wireless networks/smart grid/edge intelligence/blockchain/digital twin,https://scholar.google.no/citations?user=-gahn9AAAAAJ&hl=no
101,Quan Zou (邹权),University of Electronic Science and Technology of China,72,3210,16006,65,13552,https://oa.mg/author/A305734963,Bioinformatics/data mining,https://scholar.google.com/citations?user=RcaUHs4AAAAJ&hl=en
