,Name,Affilation,H-index,Citations 2020,Total_citation,H-index_since_2016,Citation_since_2016,HomePage,Area of Research,Google_Scholar
0,"U Rajendra Acharya (SCI Highly Cited Researcher 2016-2022)  PhD, DEng, DSc",Unknown affiliation,122,11894,59228,109,46708,https://scholar.google.com.sg/citations?user=8FjY99sAAAAJ&hl=en,Artificial Intelligence,https://scholar.google.com.sg/citations?user=8FjY99sAAAAJ&hl=en
1,IAN  F.  AKYILDIZ,"Truva Inc. , USA",133,6591,137470,85,42027,https://www.itu.int/en/ITU-T/academia/kaleidoscope/2019/Pages/Ian-Akyildiz.aspx,Wireless Communication/5G/6G Wireless Systems/Intelligent Surfaces for Wireless Communication/Nano-scale and Molecular Commun,https://scholar.google.com/citations?user=rAGwv14AAAAJ&hl=en
2,Ibrahim Aljarah,"Professor of Big Data Mining and Computational Intelligence, The University of Jordan",48,3234,10504,47,10312,https://solwszntlnbiguykl8xfvw.on.drv.tw/aljarah/publications.html,Artificial  intelligence/Swarm Intelligence/Data Science/Machine Learning/Evolutionary Computation,https://scholar.google.com/citations?user=moOTIYEAAAAJ&hl=en
3,Jeffrey Andrews,"Truchard Family Chair and Director of 6G@UT, University of Texas at Austin",107,3888,67394,74,30933,https://sites.utexas.edu/jandrews/group/,Wireless Communications/Communication Theory/Machine Learning for Communications/Stochastic Geometry/Information Theory,https://scholar.google.com/citations?user=Hr9Gey0AAAAJ&hl=en
4,Bennis Mehdi,"Full Professor, IEEE Fellow, Head of ICON, University of Oulu",74,7147,29759,70,27175,https://www.oulu.fi/en/researchers/mehdi-bennis,B5G/6G/machine learning/semantic communication/protocol learning,https://scholar.google.com/citations?user=RW4sJu8AAAAJ&hl=en
5,Emil Björnson,"Professor of Wireless Communication, KTH Royal Institute of Technology",67,4494,20983,65,18142,https://ebjornson.com/research/links/,Massive MIMO/Cell-free Massive MIMO/RIS/Signal processing/Wireless communication,https://scholar.google.se/citations?user=Maij4akAAAAJ&hl=en
6,Rajkumar Buyya,"School of Computing and Information Systems, The Uni of Melbourne; Fellow of IEEE & Academia Europea",157,11378,129725,110,66305,https://twitter.com/buyya/status/1584377443015532544?ref_src=twsrc%5Egoogle%7Ctwcamp%5Eserp%7Ctwgr%5Etweet,Computer Systems/Cloud Computing/Distributed Systems/Edge Computing/Internet of Things,https://scholar.google.com/citations?user=7xN6JqYAAAAJ&hl=en
7,Xing Cai,"Senior Research Scientist at Simula Research Laboratory, Professor at University of Oslo",19,138,2104,13,810,https://www.mn.uio.no/ifi/english/people/aca/xingca/index.html,Parallel programming/High-performance computing/numerical methods for PDEs,https://scholar.google.com/citations?user=IWQbrcK5CEwC&hl=en
8,Giuseppe Caire,"Professor, Technical University of Berlin, Germany, and Professor of Electrical Engineering (on",85,2895,40787,59,17453,https://en.wikipedia.org/wiki/Giuseppe_Caire,Information Theory/Communications/Signal Processing/Statistics,https://scholar.google.com/citations?user=g66ErTcAAAAJ&hl=en
9,Jinde Cao,"Academician, RAS/AE/RAE/LAS/AAS/EASA/PAS/IASCYS  & FIEEE/FAAIA/DFIETI; Southeast University",132,8747,75023,95,45257,https://research.com/u/jinde-cao,Complex networks/neural networks/multi-agent systems - engineering stability - dynamics and control - time-delay systems,https://scholar.google.com/citations?user=8_ffELYAAAAJ&hl=en
10,C. L. Philip Chen,"Chair Professor, South China University of Technology, Philip.Chen@ieee.org",98,7299,42025,88,32452,https://www.ae-info.org/ae/User/Chen_Philip,Computational Intelligence/Intelligent Control/Cybernetics/Intelligent Transportation Systems/Data Science/Engineering,https://scholar.google.com/citations?user=Q5248zwAAAAJ&hl=en
11,Jinjun Chen,"MAE (Academia Europea), IEEE Fellow (Computer Society), AAIA Fellow, HiCi; Professor and Deputy",70,2321,14447,53,10205,https://orcid.org/0000-0003-1677-9525,Cloud Computing/Scalable Architecture/Scalable Data Storage/Scalable Data Processing (Privacy),https://scholar.google.com/citations?user=mQ9vJ24AAAAJ&hl=en
12,Min Chen,"Professor, IEEE Fellow, Highly Cited Researcher, Huazhong University of Science and Technology",91,6166,36843,73,27750,https://cob.sfsu.edu/directory/min-chen,Cognitive Computing and Big Data Analytics/IoT Sensing/5G Networks/Robotics/Edge Computing,https://scholar.google.com/citations?user=_HyHTrsAAAAJ&hl=en
13,Xiaofeng Chen,"Professor, Xidian University, China",60,1795,14387,52,10914,https://geogeo.tamu.edu/people/profiles/research-staff/chenxiaofeng.html,Security/Cryptography/Cloud computing,https://scholar.google.com/citations?user=-3WhJecAAAAJ&hl=en
14,Francisco Chiclana,"Professor of Computational Intelligence and Decision Making, De Montfort University, UK",71,2366,21277,62,12883,https://www.tech.dmu.ac.uk/~chiclana/,Decision making/computational intelligence/information fusion/consensus/sentiment analysis,https://scholar.google.com/citations?user=qDOxZIIAAAAJ&hl=en
15,zhihua cui,"Taiyuan University of Science and Technology, Taiyuan, Shanxi, China, 030024",46,1678,9002,36,6884,http://www.mirlabs.net/global/index.php?c=main&a=person&id=489,evolutionary computation,https://scholar.google.com/citations?user=BpDrULIAAAAJ&hl=en
16,Linglong Dai,"Associate Professor, Tsinghua University; IEEE Fellow",66,3337,18131,63,16508,https://scholar.google.com/citations?user=OTFnifoAAAAJ&hl=en,Wireless Communications/RIS/Massive MIMO/Millimeter-Wave/Teraherz Communications/Non-Orthogonal Mutiple Access,https://scholar.google.com/citations?user=OTFnifoAAAAJ&hl=en
17,Merouane Debbah,"Centralesupelec, Technology Innovation Institute, MBZUAI, Lagrange Mathematics Center",103,9044,52386,89,38471,https://scholar.google.com/citations?user=HU5I0X4AAAAJ&hl=en,5G/6G/Machine Learning/Random Matrix Theory/Game Theory,https://scholar.google.com/citations?user=HU5I0X4AAAAJ&hl=en
18,Zhiguo Ding,"University of Manchester, Fellow of IEEE, Web of Science Highly Cited Researcher",97,8203,42212,91,38034,https://www.comsoc.org/zhiguo-ding,Wireless communications/signal processing/and cross-layer optimization,https://scholar.google.co.uk/citations?user=V-nB8scAAAAJ&hl=en
19,"Mianxiong Dong, Foreign Fellow of EAJ","Vice President and Professor, Muroran Institute of Technology, Japan",56,2237,12095,51,10718,https://www.researchgate.net/publication/342058853_Congestion-aware_Traffic_Allocation_for_Geo-distributed_Data_Centers,Cyber-Physical Systems/Internet of Things/Artificial Intelligence,https://scholar.google.co.jp/citations?user=TqyApAUAAAAJ&hl=en
20,Yucheng Dong,"Professor of Management and Systems Sciences, Sichuan University",65,2184,13009,60,10718,https://dblp.org/pid/08/3009,Decision Analysis/Human Dynamics/Social Network/Data Science,https://scholar.google.com/citations?user=tFVYDw4AAAAJ&hl=en
21,Maged Elkashlan,"Associate Professor, Queen Mary University of London",63,2718,16662,55,14232,https://ieeexplore.ieee.org/author/37269057400,IRS/URLLC/UAV/PLS/NOMA,https://scholar.google.com/citations?user=mncnnOAAAAAJ&hl=en
22,Zubair Md. Fadlullah,"Associate Professor, Research Chair, Department of Computer Science, Lakehead University, TBRHRI",41,1357,8142,39,6426,https://www.lakeheadu.ca/users/F/zfadlull/node/50708,Beyond 5G/Smart Health/UAV & Energy efficient Networks/QoS & Security/Deep Learning applications,https://scholar.google.com/citations?user=dZyfKpYAAAAJ&hl=en
23,Hossam Faris,"Professor, The University of Jordan",52,4254,13866,50,13624,http://evo-ml.com/hossam-faris/,Data Science/Knowledge Systems/Data Mining/Evolutionary computation,https://scholar.google.com/citations?user=UEYd--YAAAAJ&hl=en
24,Giancarlo Fortino,"Full Prof. of Computer Engineering, University of Calabria, FIEEE, FAAIA, Highly Cited Researcher",69,3727,17941,63,14835,https://en.wikipedia.org/wiki/Giancarlo_Fortino,Human-Machine Systems/Agent-based Computing/Internet of Things/Wearable Computing/Wireless/Body Area Networks,https://scholar.google.com/citations?user=ecImn1MAAAAJ&hl=it
25,Hamido Fujita,Iwate Prefectural University,73,4438,19408,73,18138,http://www.fujita.soft.iwate-pu.ac.jp/,Machine Learning,https://scholar.google.com/citations?user=MxzV1nQAAAAJ&hl=en
26,Erik G. Larsson,"Professor, Dept. of Electrical Engineering (ISY), Linköping University, Sweden",91,6312,47795,72,31833,https://research.com/u/erik-g-larsson,Wireless communications/statistical signal processing/localization/massive MIMO/networks,https://scholar.google.se/citations?user=79Lry6oAAAAJ&hl=en
27,Amir H. Gandomi,"Professor of Data Science, University of Technology Sydney",85,6831,34038,74,27367,https://dblp.org/pid/43/8647,Data Analytics/Genetic Programming/Engineering Optimization/Evolutionary Computation/Smart Cities,https://scholar.google.com/citations?user=VMf3wfMAAAAJ&hl=en
28,Xiaohua Ge,"Swinburne University of Technology, Melbourne, Australia",39,2011,8228,39,8028,https://dblp.org/pid/118/3514,Networked control systems/Cyber-physical systems/Multi-agent systems/Intelligent vehicles/Connected automated vehicles,https://scholar.google.com.au/citations?user=B37CYFoAAAAJ&hl=en
29,"Mohsen Guizani, FIEEE",Mohamed Bin Zayed University of Artificial Intelligence (MBZUAI),96,11068,50396,86,42966,https://scholar.google.com/citations?user=RigrYkcAAAAJ&hl=en,Internet of Things/Applied AI/ML and Cybersecurity,https://scholar.google.com/citations?user=RigrYkcAAAAJ&hl=en
30,Song Guo,"FCAE, FIEEE, The Hong Kong Polytechnic University",75,4421,23518,68,19520,https://ieeexplore.ieee.org/author/37085386183,Edge Intelligence/Federated Learning/Edge Computing/Distributed System/Wireless Networking,https://scholar.google.com/citations?user=Ib-sizwAAAAJ&hl=en
31,Harald Haas,The University of Edinburgh,97,5640,48091,80,32054,https://www.comsoc.org/harald-haas,Optical Wireless Communications/Interference Managment in Wireless Networks/Spatial Modulation,https://scholar.google.com/citations?user=XxIwRJQAAAAJ&hl=ja
32,Yuki Hagiwara,Fraunhofer IKS,30,1990,7546,30,7521,https://goaztecs.com/sports/womens-tennis/roster/yuki-hagiwara/4062,Artificial Intelligence,https://scholar.google.com.sg/citations?user=P6WI2DQAAAAJ&hl=en
33,"Qing-Long Han, Pro Vice-Chancellor and Distinguished Professor, MAE, IEEE Fellow, IFAC Fellow",Swinburne University of Technology,112,6095,41164,96,28951,https://www.engr.uconn.edu/pdf/annual2002.pdf,Networked control systems/time-delay systems/multi-agent systems/smart grids/unmanned surface vehicles,https://scholar.google.com.au/citations?user=j0pyptAAAAAJ&hl=en
34,Zhu Han,University of Houston,122,8583,62335,95,42971,https://www.ee.uh.edu/faculty/han-zhu,Game Theory/Wireless Networking/Security/Data Science/Smart Grid,https://scholar.google.com/citations?user=ty7wIXoAAAAJ&hl=en
35,L Hanzo,"Chair of Telecommunications, University of Southampton",113,8288,73210,89,40128,https://ieeexplore.ieee.org/author/37276255400,telecommunications/wireless communication/quantum_information_science/video_coding/video_networking,https://scholar.google.co.uk/citations?user=p0jnEW0AAAAJ&hl=en
36,L Hanzo,"Chair of Telecommunications, University of Southampton",113,8288,73210,89,40128,https://ieeexplore.ieee.org/author/37276255400,telecommunications/wireless communication/quantum_information_science/video_coding/video_networking,https://scholar.google.co.uk/citations?user=p0jnEW0AAAAJ&hl=en
37,Robert Heath,"Lampe Distinguished Professor, North Carolina State University",139,7720,83496,93,44999,https://en.wikipedia.org/wiki/Robert_W._Heath_Jr.,wireless/MIMO/communications/signal processing/information theory,https://scholar.google.com/citations?user=17Ko8Q0AAAAJ&hl=en
38,Francisco Herrera,"Professor Computer Science and AI, Granada University, Spain",165,14438,120286,127,67913,http://www.herrerabox.com/#section-4,Artificial Intelligence/Computational Intelligence/Data mining/Evolutionary Algorithms/Big Data Analytics,https://scholar.google.com/citations?user=HULIk-QAAAAJ&hl=en
39,Enrique Herrera-Viedma,"Professor of Computer Science and Artificial Intelligence, Spain, University of Granada",111,5927,50993,92,29610,https://scholar.google.com/citations?user=g8ZXTuYAAAAJ&hl=en,Fuzzy sets/fuzzy decision making/computing with words/multiple criteria decision making/consensus,https://scholar.google.com/citations?user=g8ZXTuYAAAAJ&hl=en
40,Ekram Hossain,"Professor, University of Manitoba, Canada, IEEE Fellow",99,3258,37877,72,20267,https://www.comsoc.org/ekram-hossain-2,Wireless communication networks/radio resource allocation/cognitive radio/multi-tier cellular networks,https://scholar.google.com/citations?user=Lb617EMAAAAJ&hl=en
41,Guang-Bin Huang,"Full Professor, Nanyang Technological University, Singapore",73,5626,56369,61,34633,https://esd.sutd.edu.sg/news-events/distinguished-speaker-seminar-series/guang-bin-huang-nanyang-technological-university/,Machine Learning/Neural Networks/Neuroscience,https://scholar.google.com.sg/citations?user=LhSqQCIAAAAJ&hl=en
42,Kaibin Huang,"Professor, Dept. of EEE, The University of Hong Kong; IEEE Fellow; ISI Highly Cited Researcher",54,2886,16216,45,12868,https://ieeexplore.ieee.org/author/37290266200,Machine Learning/Mobile Edge Computing/Wireless Communications/Wireless Power Transfer/Stochastic Geometry,https://scholar.google.com/citations?user=HfuA3uIAAAAJ&hl=en
43,Thomas JR Hughes,"Peter O'Donnell Jr. Chair in Computational and Applied Mathematics, University of Texas at Austin",151,7030,131316,95,43452,https://www.nae.edu/29165/Dr-Thomas-JR-Hughes,Finite Element Methods/Solid Mechanics/Computational Fluid Dynamics/Partial Differential Equations/Isogeometric Analysis,https://scholar.google.com/citations?user=6tPdlYAAAAAJ&hl=en
44,Yaochu Jin,"A. v. Humboldt Professor for AI, Bielefeld University and Distinguished Chair, University of Surrey",92,5581,35046,74,23138,http://www.soft-computing.de/jin.html,Evolutionary algorithms/Multiobjective optimization/Multiobjective learning/Trustworthy AI/Developmental AI,https://scholar.google.com/citations?user=B5WAkz4AAAAJ&hl=en
45,"Nei Kato(IEEE Fellow, IEICE Fellow)","Professor and Dean, Graduate School of Information Sciences, Tohoku University, Japan",77,3284,23458,62,15893,https://vtsociety.org/contact/nei-kato,Wireless networking,https://scholar.google.com/citations?user=LfLfZXEAAAAJ&hl=en
46,"Dr. Neeraj Kumar, SMIEEE","Professor, CSED, Thapar Institute of Engineering and Technology, India",101,10007,33503,97,31518,https://biology.pnnl.gov/people/neeraj-kumar,IoT and Machine Learning/Deep Learning/Blockchain Technology,https://scholar.google.co.in/citations?user=gL9gR-4AAAAJ&hl=en
47,"Dr.Arun Kumar Sangaiah, SM'IEEE (WoS-Highly Cited Researcher, Yushan Young Scholar)","National Yunlin University of Science & Technology, Taiwan & VIT University, India",74,4763,17358,74,17174,https://scholar.google.com.hk/citations?user=8yF6Xc4AAAAJ&hl=ja,Computational Intelligence/Internet of Things/Cognitive Computing,https://scholar.google.co.in/citations?user=8yF6Xc4AAAAJ&hl=en
48,Victor C. M. Leung,Shenzhen University / The University of British Columbia,106,6573,51415,88,33850,https://ieeexplore.ieee.org/author/37279114300,communication systems/wireless networks/mobile systems,https://scholar.google.ca/citations?user=ajvCoo4AAAAJ&hl=en
49,Geoffrey Ye Li (李烨),"Chair Professor in Wireless Systems, Dept EEE, Imperial College London",112,5844,56256,81,27939,https://academic.oup.com/book/9870/chapter/157179782,Signal Processing/and/Machine Learning/for/Wireless Communications,https://scholar.google.com/citations?user=d0FzG8YAAAAJ&hl=en
50,Hongyi Li,"Assistant Professor, University of Houston",35,917,4104,31,3505,https://hongyili.net/Album/,watershed hydrology/earth system modeling/coupled human-nature system,https://scholar.google.com/citations?user=yWy-5icAAAAJ&hl=en
51,Jin Li  李进,Professor @Guangzhou University,61,1988,19774,55,13376,https://www.facebook.com/LI-JIN-ART-Atelier-749684642040678/videos/%E6%9D%8E%E8%BF%9B%E8%89%BA%E6%9C%AF%E5%B7%A5%E4%BD%9C%E5%AE%A4-%E8%AF%BE%E5%A0%82%E4%B9%A6%E7%94%BB%E6%95%99%E5%AD%A6-cours-de-peinture-et-calligraphe-chinoise/2248643622100004/,Trust and Security in Artificial Intelligence/Computating and Storage in Cloud Computing/Blockchain,https://scholar.google.com/citations?user=7GDV2vUAAAAJ&hl=en
52,Xuelong Li (Executive Councilor of AAAI),"Professor, Northwestern Polytechnical University, China",123,8506,58833,102,42286,https://www.aaia-ai.org/,artificial intelligence/optics and electronics,https://scholar.google.com/citations?user=ahUibskAAAAJ&hl=en
53,yongming li,"college of computer science, shaanxi normal university",37,398,5091,24,2576,https://ieeexplore.ieee.org/author/37086287900,fuzzy systems/quantume logic and quantum information/lattice/topology/model checking,https://scholar.google.com/citations?user=P3VERZ0AAAAJ&hl=en
54,Huchang Liao (廖虎昌),"IET Fellow, BCS Fellow; Business School, Sichuan University",66,3507,14546,63,13479,https://baike.baidu.com/item/%E5%BB%96%E8%99%8E%E6%98%8C/16960663,Decision analysis/Fuzzy Systems/Multiple criteria decision making/Preference learning,https://scholar.google.co.uk/citations?user=KlWnnbIAAAAJ&hl=en
55,Chong Lin,Qingdao University,72,1910,17248,54,9931,https://ieeexplore.ieee.org/author/37404176900,systems and control theory,https://scholar.google.com/citations?user=AQbRErEAAAAJ&hl=en
56,Yan-Jun Liu,Liaoning University of Technology,65,2265,15372,60,11933,https://scholar.google.com.sg/citations?user=Gd96gEEAAAAJ&hl=en,Adaptive control/fuzzy control/neural networks,https://scholar.google.com/citations?user=x_Wk1jAAAAAJ&hl=en
57,Yuanwei Liu,"Associate Professor in Queen Mary University of London, Web of Science Highly Cited Researcher",57,3426,14381,56,14114,https://uk.linkedin.com/in/yuanwei-liu-2a6a8a75,NOMA/RIS/AI/6G/Integrated Sensing and Communications,https://scholar.google.com/citations?user=FxLf7ZAAAAAJ&hl=en
58,Wenjing Lou,"W. C. English Endowed Professor, IEEE Fellow, Virginia Tech, USA",83,2824,40715,61,20238,https://scholar.google.com/citations?user=hM8uAwoAAAAJ&hl=en,Cyber Security/Wireless Networks/Wireless Security/Network Security/Cloud Computing,https://scholar.google.com/citations?user=hM8uAwoAAAAJ&hl=en
59,Majdi Mafarja,"Associate Professor of Computer Science, Birzeit University",36,2599,8124,36,8079,https://www.researchgate.net/profile/Majdi-Mafarja,Feature Selection/Machine Learning/Artificial Intelligence/Bio-inspired Algorithms/Metaheuristics,https://scholar.google.com/citations?user=ftkD0MgAAAAJ&hl=en
60,Luis Martínez,"Professor of Computer Science, University of Jaén",67,2666,24049,53,13978,https://www.internetsociety.org/author/martinez/,Fuzzy decision making/Computing with words/Recommender Systems,https://scholar.google.com/citations?user=PG3D8UMAAAAJ&hl=en
61,Thomas Marzetta,"Distinguished Industry Professor, Department of Electrical and Computer Engineering, New York",62,4620,48971,46,29716,https://www.fiercewireless.com/wireless/inventor-massive-mimo-technology-didn-t-always-want-to-call-it,Beyond Massive MIMO,https://scholar.google.com/citations?user=tBLWIBoAAAAJ&hl=en
62,Seyedali Mirjalili,"Professor, Torrens University Australia, Adjunct Griffith University",81,16596,61075,81,58769,http://www.alimirjalili.com/RO.html,Metaheuristics/Robust Optimization/Engineering Optimization/Evolutionary Algorithm/Swarm Intelligence,https://scholar.google.com/citations?user=TJHmrREAAAAJ&hl=en
63,Andreas F. Molisch,"Professor of Electrical Engineering, University of Southern California",104,5263,61713,72,30353,https://viterbi.usc.edu/directory/faculty/Molisch/Andreas,wireless propagation channels/multi-antenna systems/ultrawideband communications and positioning/cooperative communications,https://scholar.google.com/citations?user=W0wwrucAAAAJ&hl=en
64,Derrick Wing Kwan Ng,"Scientia  Associate Professor,  University of New South Wales",71,3935,21692,67,19027,https://dblp.org/pid/42/8146,Wireless Communications,https://scholar.google.com/citations?user=NUJSHxoAAAAJ&hl=en
65,H. Nguyen-Xuan,"CIRTech Institute, HUTECH University, Vietnam",70,2416,16809,61,12121,https://www.humboldt-foundation.de/en/connect/explore-the-humboldt-network/singleview?tx_rsmavhsolr_solrview%5BpPersonId%5D=1161838&cHash=3aa5374901f6c8be351a3688a257aaa4,Computational Engineering/Large-scale Data/3D Printing/Renewable Energy,https://scholar.google.co.uk/citations?user=3iK9h-gAAAAJ&hl=en
66,Dusit (Tao) Niyato,Nanyang Technological University (NTU),108,8947,53010,93,38215,https://dl.acm.org/profile/81313481268,ดุสิต นิยะโต - เต๋า,https://scholar.google.com/citations?user=T8sVhLMAAAAJ&hl=en
67,Kaoru Ota (太田　香),"MEXT Excellent Young Researcher (文部科学省　卓越研究員), Muroran Institute of Technology",52,2128,10751,49,9871,https://scholar.google.com/citations?user=8JVn8RsAAAAJ&hl=ja,,https://scholar.google.com/citations?user=8JVn8RsAAAAJ&hl=ja
68,Mugen Peng,"Beijing University of Posts & Telecommun., IEEE Fellow, Web of Science Highly Cited Researcher",56,2394,16692,49,12102,https://dblp.org/pid/75/6927,Fog Computing/Cloud Radio Access Networks/Integrated Satellite-Terrestrial Networks/6G,https://scholar.google.com/citations?user=85mAZVcAAAAJ&hl=en
69,HV Poor,"Michael Henry Strater University Professor, Princeton University",162,14328,129971,112,68483,https://ieeexplore.ieee.org/author/38558600000,Communication Systems/Wireless Communications/Communications/Statistical Signal Processing/Information Theory,https://scholar.google.com/citations?user=Dq93mOUAAAAJ&hl=en
70,Lianyong Qi(齐连永),"Professor, China University of Petroleum (East China)",47,1838,6975,47,6721,https://scholar.google.com.au/citations?user=BQ0mBRIAAAAJ&hl=en,service computing/big data/recommender system,https://scholar.google.com/citations?user=pxNRRsAAAAAJ&hl=en
71,Timon Rabczuk,Bauhaus University Weimar,111,7336,45411,96,34922,https://imechanica.org/user/60470,Computational Mechanics/Solid Mechanics,https://scholar.google.ca/citations?user=3CBuGosAAAAJ&hl=en
72,Kim-Kwang Raymond Choo,"Cloud Tech Endowed Professor, University of Texas at San Antonio; Highly Cited Researcher 2020, 2021",99,6675,28306,94,25818,https://www.youtube.com/watch?v=0AlIJB7fsds,Cloud Forensics/Cyber Forensics/Cyber Security/IoT Security/Blockchain,https://scholar.google.com/citations?user=rRBNI6AAAAAJ&hl=en
73,Kui Ren,"Professor, Zhejiang University, ACM Fellow, IEEE Fellow",87,3775,41788,71,23973,https://www.acm.org/articles/people-of-acm/2021/kui-ren,Data Security & Privacy/IoT Security/AI Security,https://scholar.google.com/citations?user=uuQA_rcAAAAJ&hl=en
74,Walid Saad,"Professor, Electrical and Computer Engineering",86,7502,35930,79,30907,https://scholar.google.com/citations?user=kYDNA0UAAAAJ&hl=en,6G/machine learning/semantic communications/security and cyber-physical systems/unmanned aerial vehicles,https://scholar.google.com/citations?user=kYDNA0UAAAAJ&hl=en
75,Robert Schober,Friedrich-Alexander-University Erlangen-Nuremberg,96,5355,45506,82,30525,https://cargocollective.com/robertschober,,https://scholar.google.com/citations?user=Uu0BpX8AAAAJ&hl=en
76,"Ling Shao, Fellow of IEEE/IAPR",Terminus Group,97,8283,37818,92,32742,https://cszhengzhang.cn/,Computer Vision/Deep Learning/Artificial Intelligence/Medical Imaging/Vision and Language,https://scholar.google.com/citations?user=z84rLjoAAAAJ&hl=en
77,Xuemin (Sherman) Shen,"University Professor, University of Waterloo",136,9309,78732,107,47207,https://scholar.google.ca/citations?user=Bjl3GwoAAAAJ&hl=en,Wireless networking/MAC/Network security/VANET,https://scholar.google.com/citations?user=Bjl3GwoAAAAJ&hl=cs
78,Peng Shi,"Professor, School of Electrical and Electronic Engineering, The University of Adelaide",154,8148,81449,116,49272,https://www.pengshi.com/,Systems and Control/Electrical and Electronic Engineering/Cybernetics/Human-Computer Interaction,https://scholar.google.com.hk/citations?user=EGx1iH0AAAAJ&hl=en
79,"R. Prof. P. N. Suganthan, FIEEE'2015, SCI Highly Cited Researcher 2015-2022, (Codes from my GitHub)","KINDI Center for Computing Research, Qatar University (Hon Doc: U of Maribor; BA/MA: Cambridge U, UK",110,7010,60549,92,36443,https://scholar.google.com/citations?user=yZNzBU0AAAAJ&hl=en,Machine Learning(ML)/Swarm-Evolutionary Computation(SEC)/Neural Networks(ANN)/Applications of ML SEC ANN.,https://scholar.google.com/citations?user=yZNzBU0AAAAJ&hl=en
80,Xingming Sun,Nanjing University of Information Science and Technology,59,1696,16369,53,13094,https://research.com/u/xingming-sun,Digital Watermarking/Information Security,http://scholar.google.com/citations?user=epqnljMAAAAJ&hl=en
81,Tarik Taleb,University of Oulu,68,3679,20755,61,16334,https://scholar.google.com/citations?user=o1Ap0TEAAAAJ&hl=en,Network Function Virtualization/Network Softwarization/Software Defined Networking,https://scholar.google.com/citations?user=o1Ap0TEAAAAJ&hl=en
82,"jen hong, tan","Highly Cited Researcher in Computer Science, National University of Singapore",49,2341,10727,45,9829,https://research.com/u/jen-hong-tan,image processing/computer vision/deep learning/infrared thermography/fundus image,https://scholar.google.com/citations?user=uJlD-A0AAAAJ&hl=en
83,Dacheng Tao,The University of Sydney,146,14019,85351,123,64019,https://openreview.net/profile?id=~Dacheng_Tao1,artificial intelligence/machine learning/computer vision/image processing/data mining,https://scholar.google.com/citations?user=RwlJNLcAAAAJ&hl=en
84,Athanasios Vasilakos,"PROF OF COMPLEX SYSTEMS, CYBERSECURITY, AI",128,7581,59573,107,42681,https://www.journals.elsevier.com/sustainable-energy-grids-and-networks/editorial-board/athanasios-vasilakos,Cybersecurity/AI in Cybersecurity/IoTs/Mobile Nets/Big Data Analytics/Artificial Intelligence/Machine Learning,https://scholar.google.com/citations?user=_yWPQWoAAAAJ&hl=en
85,Huanqing Wang,Michigan Technological University,4,9,44,4,44,https://dl.acm.org/profile/81490664781,Electric vehicle/optimal control/model predictive control,https://scholar.google.com/citations?user=6XxgmPEAAAAJ&hl=en
