78,"Dr. P. N. Suganthan (SCI Highly Cited Researcher 2015-2021), FIEEE'2015","Some Codes available at GitHub, (Hon. Doctorate, U. of Maribor, 2020 ; BA & MA, U. of Cambridge, UK)",106,7246,57167,89,33012,https://www.ludwigcancerresearch.org/wp-content/uploads/2018/09/37a987a9-e378-4888-8baa-d4ba20efdbfd_tr_scientific_minds_online_final.pdf,Machine Learning(ML)/Swarm-Evolutionary Computation(SEC)/Neural Networks(ANN)/Applications of ML SEC ANN.,https://scholar.google.com/citations?user=yZNzBU0AAAAJ&hl=en
79,Xingming Sun,Nanjing University of Information Science and Technology,57,1712,15506,51,12279,https://faculty.nuist.edu.cn/sunxingming/en/index.htm,Digital Watermarking/Information Security,http://scholar.google.com/citations?user=epqnljMAAAAJ&hl=en
80,Tarik Taleb,University of Oulu,67,3596,19124,58,14698,https://ieeexplore.ieee.org/author/37088408078,Network Function Virtualization/Network Softwarization/Software Defined Networking,https://scholar.google.com/citations?user=o1Ap0TEAAAAJ&hl=en
81,"jen hong, tan","Highly Cited Researcher in Computer Science, National University of Singapore",48,2307,9652,44,8759,https://publons.com/researcher/4043557/jen-hong-tan/,image processing/computer vision/deep learning/infrared thermography/fundus image,https://scholar.google.com/citations?user=uJlD-A0AAAAJ&hl=en
82,Dacheng Tao,The University of Sydney,139,14109,76858,116,55577,https://en.wikipedia.org/wiki/Dacheng_Tao,artificial intelligence/machine learning/computer vision/image processing/data mining,https://scholar.google.com/citations?user=RwlJNLcAAAAJ&hl=en
83,Athanasios Vasilakos,"PROF OF COMPLEX SYSTEMS, CYBERSECURITY, AI",126,7492,56488,105,39595,https://dblp.org/pid/40/4747,Cybersecurity/IoTs/Mobile Nets/Big Data Analytics/Cloud Computing/Artificial Intelligence/Machine Learning,https://scholar.google.com/citations?user=_yWPQWoAAAAJ&hl=en
84,Huanqing Wang,Michigan Technological University,4,9,36,4,36,https://www.stat.ubc.ca/huanqing-william-wang,Electric vehicle/optimal control/model predictive control,https://scholar.google.com/citations?user=6XxgmPEAAAAJ&hl=en
85,Ping Wang,"York University, IEEE Fellow, York Research Chair, IEEE VTS Distinguished Lecturer",70,3550,21520,56,15920,https://www.med.upenn.edu/pwanglab/,wireless communications/Internet of Things/cloud computing/smart grid,https://scholar.google.com/citations?user=3sIHxrcAAAAJ&hl=en
86,Qingqing Wu (武庆庆),"Assistant Professor, University of Macau",46,5076,12739,45,12615,https://www.fst.um.edu.mo/people/qingqingwu/,6G/IRS/UAV communications/Machine learning/MIMO transceiver design,https://scholar.google.com/citations?user=as1T8CMAAAAJ&hl=en
87,Zheng-Guang Wu,Zhejiang University,72,2576,16000,65,11831,https://orcid.org/0000-0003-4460-9785,Markov Jump Systems/Sampled-Data Control Systems/Neural Networks/Fuzzy Systems/Singular Systems,https://scholar.google.com/citations?user=vy6JCNgAAAAJ&hl=en
88,Yang Xiang,"IEEE Fellow, Professfor, Swinburne University of Technology",65,2776,16214,58,12594,https://scholar.google.com/scholar?q=Yang+Xiang+homepage&hl=en&as_sdt=0&as_vis=1&oi=scholart,Cybersecurity/Network Security/System Security/Software Vulnerability Detection/Blockchain,https://scholar.google.com/citations?user=7ymTWY4AAAAJ&hl=en
89,Xiaolong Xu (许小龙),"Professor, Highly Cited Researcher 2021, Nanjing University of Information Science and Technology",38,1477,4666,38,4611,https://scholar.google.com/citations?user=Tyzef4sAAAAJ&hl=en,Edge computing/Cloud computing/Big data/Fog computing/Mobile computing,https://scholar.google.com/citations?user=Tyzef4sAAAAJ&hl=en
90,Zeshui Xu (徐泽水),"Academician of EASA,IASCYS; DFIETI,FIEEE,FIFSA,FIET,FRSA,FORS,FBCS,FIAAM,FAAIA... Sichuan University",138,9719,72772,106,42401,https://baike.baidu.com/item/%E5%BE%90%E6%B3%BD%E6%B0%B4/7518284#2,Decision Making/Information Fusion/Fuzzy Sets/Computational Intelligence/Bibliometrics,https://scholar.google.co.uk/citations?user=kd9L_GUAAAAJ&hl=en
91,Xin-She Yang (DPhil),"Computational intelligence, swarm intelligence, optimization, metaheuristics, nature-inspired",90,10740,69785,82,47727,https://jrlab.science/member/xin-she-yang,swarm intelligence/optimization/metaheuristics/computational intelligence.,https://scholar.google.com/citations?user=fA6aTlAAAAAJ&hl=th
92,Fei Yu,University of Southern Denmark,9,71,256,8,194,https://heep.hks.harvard.edu/people/fei-yu,Industry 4.0 technology and smart product development,https://scholar.google.com/citations?user=3OHgAmIAAAAJ&hl=en
93,Xiangxiang Zeng,"Deparment of Computer Science, Hunan University",49,1603,6604,40,5421,https://scholar.google.com/citations?user=B20HBMIAAAAJ&hl=en,Computational Intelligence/Bio-inspired Intelligence,https://scholar.google.com/citations?user=B20HBMIAAAAJ&hl=en
94,Yong Zeng (曾勇）,"Southeast University, China; Purple Mountain Laboratories, China",47,3809,15217,47,14728,http://gkcccc.org/openchurch/multimedia/podcasts/church%E2%80%99s-role-%0B-purify-assembly?page=19,UAV communications/Massive MIMO/Extremely-Large MIMO (XL-MIMO)/Integrated Sensing and Communication,https://scholar.google.com/citations?user=ENldmwIAAAAJ&hl=en
95,Jianming Zhan,Hubei University for Nationalities,43,1076,7021,36,4474,https://orcid.org/0000-0003-2510-9515,logical algebras(BL-algebras/R0-algebras and MTL-algebras)/fuzzy algebras(semirings/hemirings and rings) and their hyperstuctures(hyperring/hypergroups,https://scholar.google.com/citations?user=XmJAmNIAAAAJ&hl=en
96,Haijun Zhang,"Professor, University of Science and Technology Beijing",45,1900,10134,43,8932,http://chemen.lzu.edu.cn/index.php?m=content&c=index&a=show&catid=12&id=184,6G/AI enabled Wireless Communications/Resource Allocation/Mobility Management,https://scholar.google.ca/citations?user=B3oYgSIAAAAJ&hl=en
97,Rui Zhang,"Chair Professor, National University of Singapore",120,12464,62478,103,46765,https://people.eng.unimelb.edu.au/zr/,Wireless Communications/MIMO/Cognitive Radio/Wireless Power Transfer/UAV,https://scholar.google.com.sg/citations?user=yoJqPIkAAAAJ&hl=en
98,Xian-Ming Zhang,Swinburne University of Technology,47,2232,11301,41,9249,https://www.concordia.ca/artsci/chemistry/faculty.html?fpid=xianming-zhang,Networked Control Systems/Event-triggered Control/H-infinity Filtering/Time-delay Systems/Neural Networks,https://scholar.google.com/citations?user=aZcLkqgAAAAJ&hl=en
99,Xuyun Zhang,Macquarie University,42,1198,6114,39,5006,https://itseg.org/group.php,big data mining/scalable machine learning/big data privacy and cybersecurity/cloud/edge computing/Internet of Things,https://scholar.google.com.au/citations?user=wbF6HL8AAAAJ&hl=en
100,Yan Zhang,"IEEE Fellow, Highly Cited Researcher, University of Oslo, Norway",93,6330,30379,78,22758,https://scholar.google.com/scholar_url?url=https://medcentral.net/doi/pdf/10.3760/cma.j.issn.0366-6999.2004.05.123&hl=en&sa=X&ei=uDWIYsPpCKKP6rQPwMuZuAk&scisig=AAGBfm30t6KPEyoshC6AvzN1XXT98st-bg&oi=scholarr,wireless networks/smart grid/edge intelligence/blockchain/digital twin,https://scholar.google.no/citations?user=-gahn9AAAAAJ&hl=no
101,Quan Zou (邹权),University of Electronic Science and Technology of China,69,3224,14429,62,11986,https://xzenglab.github.io/xzeng/,Bioinformatics/data mining,https://scholar.google.com/citations?user=RcaUHs4AAAAJ&hl=en
