,Name,Affilation,H-index,Citations 2020,Total_citation,H-index_since_2016,Citation_since_2016,HomePage,Area of Research,Google_Scholar
0,"U Rajendra Acharya (SCI Highly Cited Researcher 2016-2021)  PhD, DEng, DSc","Ngee Ann,  Singapore University of Social Science,  Kuamamoto University, Japan",118,11831,56052,105,43615,https://scholar.google.com/citations?user=8FjY99sAAAAJ&hl=en,Artificial Intelligence/Medical Informatics,https://scholar.google.com.sg/citations?user=8FjY99sAAAAJ&hl=en
1,IAN  F.  AKYILDIZ,"Truva Inc. , USA",132,6584,135992,83,40702,https://en.wikipedia.org/wiki/Ian_F._Akyildiz#2000s,Wireless Communication/5G/6G Wireless Systems/Intelligent Surfaces for Wireless Communication/Nano-scale and Molecular Commun,https://scholar.google.com/citations?user=rAGwv14AAAAJ&hl=en
2,Ibrahim Aljarah,"Professor of Big Data Mining and Computational Intelligence, The University of Jordan",46,3273,9601,46,9426,https://orcid.org/0000-0002-9265-9819,Artificial  intelligence/Swarm Intelligence/Data Science/Machine Learning/Evolutionary Computation,https://scholar.google.com/citations?user=moOTIYEAAAAJ&hl=en
3,Jeffrey Andrews,"Cockrell Family Endowed Chair and Director of 6G@UT, University of Texas at Austin",106,3888,66573,73,30182,https://www.jeffandrewsdesign.com/projects-main,Wireless Communications/Communication Theory/Machine Learning for Communications/Stochastic Geometry/Information Theory,https://scholar.google.com/citations?user=Hr9Gey0AAAAJ&hl=en
4,Bennis Mehdi,"Full Professor, IEEE Fellow, Head of ICON, University of Oulu",72,7142,27783,69,25208,https://orcid.org/0000-0003-0261-0171,B5G/6G/machine learning/semantic communication,https://scholar.google.com/citations?user=RW4sJu8AAAAJ&hl=en
5,Emil Björnson,"Professor of Wireless Communication, KTH Royal Institute of Technology",63,4537,19714,62,16876,https://ebjornson.com/research/reproducibility/,Massive MIMO/Cell-free Massive MIMO/RIS/Signal processing/Wireless communication,https://scholar.google.se/citations?user=Maij4akAAAAJ&hl=en
6,Rajkumar Buyya,"Redmond Barry Distinguished Professor, University of Melbourne; Fellow of IEEE & Academia Europaea",155,11349,127233,108,63973,https://scholar.google.com/scholar?q=Rajkumar+Buyya+homepage&hl=en&as_sdt=0&as_vis=1&oi=scholart,Computer Systems/Cloud Computing/Distributed Systems/Edge Computing/Internet of Things,https://scholar.google.com/citations?user=7xN6JqYAAAAJ&hl=en
7,Xing Cai,"Senior Research Scientist at Simula Research Laboratory, Professor at University of Oslo",19,137,2083,13,792,https://dl.acm.org/profile/81485643669,Parallel programming/High-performance computing/numerical methods for PDEs,https://scholar.google.com/citations?user=IWQbrcK5CEwC&hl=en
8,Giuseppe Caire,"Professor, Technical University of Berlin, Germany, and Professor of Electrical Engineering (on",82,2895,40094,58,16805,https://viterbi.usc.edu/directory/faculty/Caire/Giuseppe,Information Theory/Communications/Signal Processing/Statistics,https://scholar.google.com/citations?user=g66ErTcAAAAJ&hl=en
9,Jinde Cao,"Academician, RAS/AE/RAE/LAS/AAS/EASA/PAS/IASCYS  & FIEEE/FAAIA/DFIETI; Southeast University",132,8802,72741,93,43030,https://publons.com/wos-op/researcher/1206292/jinde-cao/,Complex networks/neural networks/multi-agent systems - engineering stability - dynamics and control - time-delay systems,https://scholar.google.com/citations?user=8_ffELYAAAAJ&hl=en
10,C. L. Philip Chen,"Chair Professor, South China University of Technology, Philip.Chen@ieee.org",96,7357,40225,86,30680,https://repository.um.edu.mo/profile/philipchen,Computational Intelligence/Intelligent Control/Cybernetics/Intelligent Transportation Systems/Data Science/Engineering,https://scholar.google.com/citations?user=Q5248zwAAAAJ&hl=en
11,Jinjun Chen,"MAE (Academia Europea), IEEE Fellow (Computer Society), AAIA Fellow, HiCi; Professor and Deputy",69,2332,13871,51,9634,http://www.azxy5kjw.com/research-institutes/data-science/people/jinjun-chen/,Cloud Computing/Scalable Architecture/Scalable Data Storage/Scalable Data Processing (Privacy),https://scholar.google.com/citations?user=mQ9vJ24AAAAJ&hl=en
12,Min Chen,"Professor, IEEE Fellow, Highly Cited Researcher, Huazhong University of Science and Technology",91,6115,35529,72,26473,https://www.bcm.edu/people-search/min-chen-19449,Cognitive Computing and Big Data Analytics/IoT Sensing/5G Networks/Robotics/Edge Computing,https://scholar.google.com/citations?user=_HyHTrsAAAAJ&hl=en
13,Xiaofeng Chen,"Professor, Xidian University, China",58,1792,13876,50,10412,https://www.beg.utexas.edu/people/xiaofeng-chen,Security/Cryptography/Cloud computing,https://scholar.google.com/citations?user=-3WhJecAAAAJ&hl=en
14,Francisco Chiclana,"Professor of Computational Intelligence and Decision Making, De Montfort University, UK",69,2396,20562,61,12204,https://www.mdpi.com/about/announcements/3570,Decision making/computational intelligence/information fusion/consensus/sentiment analysis,https://scholar.google.com/citations?user=qDOxZIIAAAAJ&hl=en
15,zhihua cui,"Taiyuan University of Science and Technology, Taiyuan, Shanxi, China, 030024",45,1695,8583,35,6468,https://orcid.org/0000-0001-7388-3180,evolutionary computation,https://scholar.google.com/citations?user=BpDrULIAAAAJ&hl=en
16,Linglong Dai,"Associate Professor, Tsinghua University; IEEE Fellow",65,3358,17273,61,15669,https://www.ee.tsinghua.edu.cn/en/info/1059/1261.htm,Wireless Communications/RIS/Massive MIMO/Millimeter-Wave/Teraherz Communications/Non-Orthogonal Mutiple Access,https://scholar.google.com/citations?user=OTFnifoAAAAJ&hl=en
17,Merouane Debbah,"Centralesupelec, Technology Innovation Institute, MBZUAI, Lagrange Mathematics Center",101,9093,50021,85,36147,https://scholar.google.com/scholar_url?url=http://download.garuda.kemdikbud.go.id/article.php%3Farticle%3D1306491%26val%3D146%26title%3DPerformance%2520Analysis%2520of%2520Antenna%2520Selection%2520Techniques%2520in%2520MIMO-OFDM%2520System%2520with%2520Hardware%2520Impairments%2520Energy%2520Efficiency%2520perspective&hl=en&sa=X&ei=aA3vYqH1Ko6yyATixq7YDg&scisig=AAGBfm2QqgY0P_vhV--mK0KKPTEPYFEimA&oi=scholarr,5G/6G/Machine Learning/Random Matrix Theory/Game Theory,https://scholar.google.com/citations?user=HU5I0X4AAAAJ&hl=en
18,Zhiguo Ding,"University of Manchester, Fellow of IEEE, Web of Science Highly Cited Researcher",93,8259,40148,88,35983,https://scholar.google.com/scholar?q=Zhiguo+Ding+homepage&hl=en&as_sdt=0&as_vis=1&oi=scholart,Wireless communications/signal processing/and cross-layer optimization,https://scholar.google.co.uk/citations?user=V-nB8scAAAAJ&hl=en
19,"Mianxiong Dong, Foreign Fellow of EAJ","Vice President and Professor, Muroran Institute of Technology, Japan",56,2222,11534,50,10164,https://scholar.google.com/citations?user=TqyApAUAAAAJ&hl=zh-CN,Cyber-Physical Systems/Internet of Things/Artificial Intelligence,https://scholar.google.co.jp/citations?user=TqyApAUAAAAJ&hl=en
20,Yucheng Dong,"Professor of Management and Systems Sciences, Sichuan University",62,2193,12321,59,10049,https://ieeexplore.ieee.org/author/37536522700,Decision Analysis/Human Dynamics/Social Network/Data Science,https://scholar.google.com/citations?user=tFVYDw4AAAAJ&hl=en
21,Maged Elkashlan,"Associate Professor, Queen Mary University of London",61,2726,15943,55,13517,https://www.researchgate.net/scientific-contributions/Maged-Elkashlan-70038448,IRS/URLLC/UAV/PLS/NOMA,https://scholar.google.com/citations?user=mncnnOAAAAAJ&hl=en
22,Zubair Md. Fadlullah,"Associate Professor, Research Chair, Department of Computer Science, Lakehead University, TBRHRI",40,1370,7843,38,6135,https://www.zfadlullah.org/qualifications,Beyond 5G/Smart Health/UAV & Energy efficient Networks/QoS & Security/Deep Learning applications,https://scholar.google.com/citations?user=dZyfKpYAAAAJ&hl=en
23,Hossam Faris,"Professor, The University of Jordan",50,4336,12763,49,12538,http://eacademic.ju.edu.jo/Hossam.faris,Data Science/Knowledge Systems/Data Mining/Evolutionary computation,https://scholar.google.com/citations?user=UEYd--YAAAAJ&hl=en
24,Giancarlo Fortino,"Full Prof. of Computer Engineering, University of Calabria, FIEEE, FAAIA, Highly Cited Researcher",68,3730,17057,62,13958,https://orcid.org/0000-0002-4039-891X,Human-Machine Systems/Agent-based Computing/Internet of Things/Wearable Computing/Wireless/Body Area Networks,https://scholar.google.com/citations?user=ecImn1MAAAAJ&hl=it
25,Hamido Fujita,Iwate Prefectural University,70,4430,18219,70,16959,https://orcid.org/0000-0001-5256-210X,Machine Learning,https://scholar.google.com/citations?user=MxzV1nQAAAAJ&hl=en
26,Erik G. Larsson,"Professor, Dept. of Electrical Engineering (ISY), Linköping University, Sweden",90,6345,46268,69,30334,https://scholar.google.com/scholar_url?url=http://download.garuda.kemdikbud.go.id/article.php%3Farticle%3D1306855%26val%3D146%26title%3DPerformance%2520Analysis%2520of%2520Adaptive%2520Filter%2520Channel%2520Estimated%2520MIMO%2520OFDM%2520Communication%2520System&hl=en&sa=X&ei=cg3vYrLhC4SYywSFp6iYAw&scisig=AAGBfm1IJ50CwidsVreyPtM355Q3oUw1XQ&oi=scholarr,Wireless communications/statistical signal processing/localization/massive MIMO/networks,https://scholar.google.se/citations?user=79Lry6oAAAAJ&hl=en
27,Amir H. Gandomi,"Professor of Data Science, University of Technology Sydney",81,6922,31643,71,25004,https://www.linkedin.com/in/amir-h-gandomi-4225023b,Data Analytics/Genetic Programming/Engineering Optimization/Evolutionary Computation/Smart Cities,https://scholar.google.com/citations?user=VMf3wfMAAAAJ&hl=en
28,Xiaohua Ge,"Swinburne University of Technology, Melbourne, Australia",37,2048,7691,37,7492,https://orcid.org/0000-0003-0180-0897,Networked control systems/Cyber-physical systems/Multi-agent systems/Intelligent vehicles/Connected automated vehicles,https://scholar.google.com.au/citations?user=B37CYFoAAAAJ&hl=en
29,"Mohsen Guizani, FIEEE",Mohamed Bin Zayed University of Artificial Intelligence (MBZUAI),94,11007,47512,83,40123,https://vtsociety.org/contact/mohsen-guizani,Internet of Things/Applied AI/ML and Cybersecurity,https://scholar.google.com/citations?user=RigrYkcAAAAJ&hl=en
30,Song Guo,"FCAE, FIEEE, The Hong Kong Polytechnic University",73,4417,22419,66,18430,https://dblp.org/pid/01/267,Edge Intelligence/Federated Learning/Edge Computing/Distributed System/Wireless Networking,https://scholar.google.com/citations?user=Ib-sizwAAAAJ&hl=en
31,Harald Haas,The University of Edinburgh,96,5609,46842,79,30845,https://lifi.co/harald-haas/,Optical Wireless Communications/Interference Managment in Wireless Networks/Spatial Modulation,https://scholar.google.com/citations?user=XxIwRJQAAAAJ&hl=ja
32,Yuki Hagiwara,Fraunhofer IKS,30,1972,7082,30,7057,https://ieeexplore.ieee.org/author/37088752434,Artificial Intelligence,https://scholar.google.com.sg/citations?user=P6WI2DQAAAAJ&hl=en
33,"Qing-Long Han, Pro Vice-Chancellor and Distinguished Professor, MAE, IEEE Fellow, IFAC Fellow",Swinburne University of Technology,111,6157,39457,93,27280,https://0-scholar-google-com.brum.beds.ac.uk/citations?user=nlu3CqUAAAAJ&hl=es,Networked control systems/time-delay systems/multi-agent systems/smart grids/unmanned surface vehicles,https://scholar.google.com.au/citations?user=j0pyptAAAAAJ&hl=en
34,Zhu Han,University of Houston,119,8604,59850,92,40549,https://scholar.google.com/scholar_url?url=https://www.ncbi.nlm.nih.gov/pmc/articles/PMC4621922/&hl=en&sa=X&ei=eQ3vYpznHIakywTS6Y6IDQ&scisig=AAGBfm3h3QiNUYxhPGcqt-p8SeBbN6pOow&oi=scholarr,Game Theory/Wireless Networking/Security/Data Science/Smart Grid,https://scholar.google.com/citations?user=ty7wIXoAAAAJ&hl=en
35,L Hanzo,"Chair of Telecommunications, University of Southampton",112,8320,70768,85,37792,https://scholar.google.co.uk/citations?user=p0jnEW0AAAAJ&hl=en,telecommunications/wireless communication/quantum_information_science/video_coding/video_networking,https://scholar.google.co.uk/citations?user=p0jnEW0AAAAJ&hl=en
36,L Hanzo,"Chair of Telecommunications, University of Southampton",112,8320,70768,85,37792,https://scholar.google.co.uk/citations?user=p0jnEW0AAAAJ&hl=en,telecommunications/wireless communication/quantum_information_science/video_coding/video_networking,https://scholar.google.co.uk/citations?user=p0jnEW0AAAAJ&hl=en
37,Robert Heath,"Lampe Distinguished Professor, North Carolina State University",138,7729,81784,92,43335,https://www.facebook.com/RobertHeathInsuranceAgency/,wireless/MIMO/communications/signal processing/information theory,https://scholar.google.com/citations?user=17Ko8Q0AAAAJ&hl=en
38,Francisco Herrera,"Professor Computer Science and AI, Granada University, Spain",164,14486,116379,123,64190,http://www.herrerabox.com/,Artificial Intelligence/Computational Intelligence/Data mining/Evolutionary Algorithms/Big Data Analytics,https://scholar.google.com/citations?user=HULIk-QAAAAJ&hl=en
39,Enrique Herrera-Viedma,"Professor of Computer Science and Artificial Intelligence, Spain, University of Granada",110,5952,49207,92,27917,https://www.ae-info.org/ae/User/Herrera_Viedma_Enrique,Fuzzy sets/fuzzy decision making/computing with words/multiple criteria decision making/consensus,https://scholar.google.com/citations?user=g8ZXTuYAAAAJ&hl=en
40,Ekram Hossain,"Professor, University of Manitoba, Canada, IEEE Fellow",98,3263,37031,71,19458,https://dblp.org/pid/45/1224,Wireless communication networks/radio resource allocation/cognitive radio/multi-tier cellular networks,https://scholar.google.com/citations?user=Lb617EMAAAAJ&hl=en
41,Guang-Bin Huang,"Full Professor, Nanyang Technological University, Singapore",72,5621,55245,61,33594,https://scholar.google.com/scholar_url?url=https://citeseerx.ist.psu.edu/viewdoc/download%3Fdoi%3D10.1.1.217.3643%26rep%3Drep1%26type%3Dpdf&hl=en&sa=X&ei=fw3vYp-BMI6yyATixq7YDg&scisig=AAGBfm3Edopupko6TfZgRcK__u7dn_2tmA&oi=scholarr,Machine Learning/Neural Networks/Neuroscience,https://scholar.google.com.sg/citations?user=LhSqQCIAAAAJ&hl=en
42,Kaibin Huang,"Professor, Dept. of EEE, The University of Hong Kong; IEEE Fellow; ISI Highly Cited Researcher",53,2908,15483,44,12146,https://www.researchgate.net/profile/Kaibin-Huang-2,Machine Learning/Mobile Edge Computing/Wireless Communications/Wireless Power Transfer/Stochastic Geometry,https://scholar.google.com/citations?user=HfuA3uIAAAAJ&hl=en
43,Thomas JR Hughes,"Peter O'Donnell Jr. Chair in Computational and Applied Mathematics, University of Texas at Austin",151,7040,129222,94,41701,https://oden.utexas.edu/people/directory/Thomas-J.R.-Hughes/,Finite Element Methods/Solid Mechanics/Computational Fluid Dynamics/Partial Differential Equations/Isogeometric Analysis,https://scholar.google.com/citations?user=6tPdlYAAAAAJ&hl=en
44,Yaochu Jin,"A. v. Humboldt Professor for AI, Bielefeld University and Distinguished Chair, University of Surrey",90,5619,33342,74,21489,https://www.ae-info.org/ae/User/Jin_Yaochu,Evolutionary computation/Multiobjective optimization/Multiobjective learning/Trustworthy AI/Developmental AI,https://scholar.google.com/citations?user=B5WAkz4AAAAJ&hl=en
45,"Nei Kato(IEEE Fellow, IEICE Fellow)","Professor and Dean, Graduate School of Information Sciences, Tohoku University, Japan",76,3297,22613,60,15066,https://wicon.eai-conferences.org/2017/keynotes/,Wireless networking,https://scholar.google.com/citations?user=LfLfZXEAAAAJ&hl=en
46,"Dr. Neeraj Kumar, SMIEEE (Web of Science Highly Cited Researcher 2019, 2020,2021)","Professor, CSED, Thapar Institute of Engineering and Technology, India",96,9991,30934,92,28995,https://www.routledge.com/Internet-of-Energy-for-Smart-Cities-Machine-Learning-Models-and-Techniques/Jindal-Kumar-Aujla/p/book/9780367497750,IoT and Machine Learning/Deep Learning/Blockchain Technology,https://scholar.google.co.in/citations?user=gL9gR-4AAAAJ&hl=en
47,"Dr. Arun Kumar Sangaiah, (Web of Science Highly Cited Researcher, SM'IEEE)","VIT University, India and National Yunlin University of Science & Technology, Taiwan",72,4764,16369,72,16182,https://research.vit.ac.in/researcher/arun-kumar-s-2,Computational Intelligence/Internet of Things/Cognitive Computing,https://scholar.google.co.in/citations?user=8yF6Xc4AAAAJ&hl=en
48,Victor C. M. Leung,Shenzhen University / The University of British Columbia,104,6535,49690,87,32190,https://polyu.netlify.app/people/victor-c.-m.-leung/,communication systems/wireless networks/mobile systems,https://scholar.google.ca/citations?user=ajvCoo4AAAAJ&hl=en
49,Geoffrey Ye Li (李烨),"Chair Professor in Wireless Systems, Dept EEE, Imperial College London",110,5873,54626,79,26383,https://www.grmmuskogee.org/how-to-bcaf/e1eccc-geoffrey-ye-li,Signal Processing/and/Machine Learning/for/Wireless Communications,https://scholar.google.com/citations?user=d0FzG8YAAAAJ&hl=en
50,Hongyi Li,"Assistant Professor, University of Houston",34,919,3880,31,3286,https://scholar.google.com/scholar_url?url=https://www.sciencedirect.com/science/article/pii/S0005109818305041&hl=en&sa=X&ei=iA3vYu1yhqHIBOX5hbgJ&scisig=AAGBfm07IpZpQXydInmU-QHVvwAO8_jpHA&oi=scholarr,watershed hydrology/earth system modeling/coupled human-nature system,https://scholar.google.com/citations?user=yWy-5icAAAAJ&hl=en
51,Jin Li  李进,Professor @Guangzhou University,60,1992,19247,54,12863,http://scholar.google.com/citations?user=7GDV2vUAAAAJ&hl=zh-CN,Trust and Security in Artificial Intelligence/Computating and Storage in Cloud Computing/Blockchain,https://scholar.google.com/citations?user=7GDV2vUAAAAJ&hl=en
52,Xuelong Li (Executive Councilor of AAAI),"Professor, Northwestern Polytechnical University, China",121,8549,56637,100,40134,https://cfm.uestc.edu.cn/~shenht/,artificial intelligence/optics and electronics,https://scholar.google.com/citations?user=ahUibskAAAAJ&hl=en
53,yongming li,"college of computer science, shaanxi normal university",37,393,5006,24,2492,https://www.aaaom.edu/staff/yongming-li-ph-d-m-d-l-ac-new-jersey/,fuzzy systems/quantume logic and quantum information/lattice/topology/model checking,https://scholar.google.com/citations?user=P3VERZ0AAAAJ&hl=en
54,Huchang Liao (廖虎昌),"IET Fellow, BCS Fellow; Business School, Sichuan University",65,3564,13708,61,12641,https://www.researchgate.net/profile/Huchang-Liao,Decision analysis/Fuzzy Systems/Multiple criteria decision making/Preference learning,https://scholar.google.co.uk/citations?user=KlWnnbIAAAAJ&hl=en
55,Chong Lin,Qingdao University,71,1925,16782,53,9480,https://mminchonglin.weebly.com/,systems and control theory,https://scholar.google.com/citations?user=AQbRErEAAAAJ&hl=en
56,Yan-Jun Liu,Liaoning University of Technology,62,2294,14775,59,11344,https://scholar.google.com/scholar_url?url=https://www.researchgate.net/profile/Yan-Jun-Liu/publication/318371880_Ultrasensitive_Wearable_Soft_Strain_Sensors_of_Conductive_Self-healing_and_Elastic_Hydrogels_with_Synergistic_Soft_and_Hard_Hybrid_Networks/links/5d2fdcb5a6fdcc2462e87993/Ultrasensitive-Wearable-Soft-Strain-Sensors-of-Conductive-Self-healing-and-Elastic-Hydrogels-with-Synergistic-Soft-and-Hard-Hybrid-Networks.pdf&hl=en&sa=X&ei=jg3vYre8DYahyATl-YW4CQ&scisig=AAGBfm3jHF0WzGKPMpNElwkryUOX4wtd4w&oi=scholarr,Adaptive control/fuzzy control/neural networks,https://scholar.google.com/citations?user=x_Wk1jAAAAAJ&hl=en
57,Yuanwei Liu,"Associate Professor in Queen Mary University of London, Web of Science Highly Cited Researcher",53,3505,13122,53,12860,https://scholar.google.com/scholar_url?url=https://www.sciencedirect.com/science/article/pii/S0360319919347548&hl=en&sa=X&ei=jw3vYufdCIahyATl-YW4CQ&scisig=AAGBfm0dID0tGKA5nhB1YoJCN4Z5cUozHw&oi=scholarr,NOMA/RIS/AI/6G/Integrated Sensing and Communications,https://scholar.google.com/citations?user=FxLf7ZAAAAAJ&hl=en
58,Wenjing Lou,"W. C. English Endowed Professor, IEEE Fellow, Virginia Tech, USA",83,2807,39922,60,19504,https://www.linkedin.com/in/wenjing-lou-a605237,Cyber Security/Wireless Networks/Wireless Security/Network Security/Cloud Computing,https://scholar.google.com/citations?user=hM8uAwoAAAAJ&hl=en
59,Majdi Mafarja,"Associate Professor of Computer Science, Birzeit University",35,2637,7322,34,7277,https://sites.google.com/site/drmafarja/contact-me,Feature Selection/Machine Learning/Artificial Intelligence/Bio-inspired Algorithms/Metaheuristics,https://scholar.google.com/citations?user=ftkD0MgAAAAJ&hl=en
60,Luis Martínez,"Professor of Computer Science, University of Jaén",65,2686,23268,52,13237,https://www.linkedin.com/in/luis-martinez-amago-950b36b,Fuzzy decision making/Computing with words/Recommender Systems,https://scholar.google.com/citations?user=PG3D8UMAAAAJ&hl=en
61,Thomas Marzetta,"Distinguished Industry Professor, Department of Electrical and Computer Engineering, New York",59,4636,48033,46,28821,https://scholar.google.com/citations?user=tBLWIBoAAAAJ&hl=en,Beyond Massive MIMO,https://scholar.google.com/citations?user=tBLWIBoAAAAJ&hl=en
62,Seyedali Mirjalili,"Professor, Torrens University Australia, Adjunct Griffith University",77,16714,55395,77,53249,https://experts.griffith.edu.au/9404-seyedali-mirjalili,Metaheuristics/Robust Optimization/Engineering Optimization/Evolutionary Algorithm/Swarm Intelligence,https://scholar.google.com/citations?user=TJHmrREAAAAJ&hl=en
63,Andreas F. Molisch,"Professor of Electrical Engineering, University of Southern California",103,5238,60427,71,29125,https://scholar.google.com/scholar_url?url=https://merl.com/publications/docs/TR2008-072.pdf&hl=en&sa=X&ei=lA3vYpiQOYSYywSFp6iYAw&scisig=AAGBfm0YMVoBGcBSFij6oNowME7WgCoT9g&oi=scholarr,wireless propagation channels/multi-antenna systems/ultrawideband communications and positioning/cooperative communications,https://scholar.google.com/citations?user=W0wwrucAAAAJ&hl=en
64,Derrick Wing Kwan Ng,"Scientia  Associate Professor,  University of New South Wales",69,3976,20293,65,17641,https://research.unsw.edu.au/people/associate-professor-derrick-wing-kwan-ng,Wireless Communications,https://scholar.google.com/citations?user=NUJSHxoAAAAJ&hl=en
65,H. Nguyen-Xuan,"CIRTech Institute, HUTECH University, Vietnam",68,2487,16278,60,11626,https://faculty.sites.iastate.edu/xhnguyen/,Computational Engineering/Large-scale data/3D Printing/Renewable Energy,https://scholar.google.co.uk/citations?user=3iK9h-gAAAAJ&hl=en
66,Dusit (Tao) Niyato,Nanyang Technological University (NTU),105,8951,50290,88,35532,https://personal.ntu.edu.sg/dniyato/,ดุสิต นิยะโต - เต๋า,https://scholar.google.com/citations?user=T8sVhLMAAAAJ&hl=en
67,Kaoru Ota (太田　香),"MEXT Excellent Young Researcher (文部科学省　卓越研究員), Muroran Institute of Technology",51,2111,10257,48,9383,http://www3.muroran-it.ac.jp/enes/~ota/,,https://scholar.google.com/citations?user=8JVn8RsAAAAJ&hl=ja
68,Mugen Peng,"Beijing University of Posts & Telecommun., IEEE Fellow, Web of Science Highly Cited Researcher",54,2388,16089,48,11514,https://www.researchgate.net/profile/Mugen-Peng,Fog Computing/Cloud Radio Access Networks/Integrated Satellite-Terrestrial Networks/6G,https://scholar.google.com/citations?user=85mAZVcAAAAJ&hl=en
69,HV Poor,"Michael Henry Strater University Professor, Princeton University",158,14422,125954,109,64589,https://en.wikipedia.org/wiki/Vincent_Poor,Communication Systems/Wireless Communications/Communications/Statistical Signal Processing/Information Theory,https://scholar.google.com/citations?user=Dq93mOUAAAAJ&hl=en
70,Lianyong Qi(齐连永),"Professor, Qufu Normal University",46,1873,6442,45,6188,https://sites.google.com/view/lianyongqi/home,service computing/big data/recommender system,https://scholar.google.com/citations?user=pxNRRsAAAAAJ&hl=en
71,Timon Rabczuk,Bauhaus University Weimar,109,7397,43708,93,33263,https://scholar.google.com/citations?user=3CBuGosAAAAJ&hl=it,Computational Mechanics/Solid Mechanics,https://scholar.google.ca/citations?user=3CBuGosAAAAJ&hl=en
72,Kim-Kwang Raymond Choo,"Cloud Tech Endowed Professor, University of Texas at San Antonio; Highly Cited Researcher 2020, 2021",97,6683,26728,89,24244,https://books.google.com/books?id=jlkhrERbrRcC&pg=PA13&lpg=PA13&dq=Kim-Kwang+Raymond+Choo+homepage&source=bl&ots=SfmPC53TuF&sig=ACfU3U2tcqXGx1CiT_2sngGdGgafB4ppEg&hl=en&sa=X&ved=2ahUKEwiCod_LwrP5AhUsIUQIHXQhCJwQ6AF6BAgjEAM,Cloud Forensics/Cyber Forensics/Cyber Security/IoT Security/Blockchain,https://scholar.google.com/citations?user=rRBNI6AAAAAJ&hl=en
73,Kui Ren,"Professor, Zhejiang University, ACM Fellow, IEEE Fellow",85,3751,40790,70,23026,https://www.apam.columbia.edu/faculty/kui-ren,Data Security & Privacy/IoT Security/AI Security,https://scholar.google.com/citations?user=uuQA_rcAAAAJ&hl=en
74,Walid Saad,"Professor, Electrical and Computer Engineering",83,7529,33880,76,28879,https://healthcare.ascension.org/doctors/1164752499/walid-youssef-saad-murfreesboro-tn,6G/machine learning/semantic communications/security and cyber-physical systems/unmanned aerial vehicles,https://scholar.google.com/citations?user=kYDNA0UAAAAJ&hl=en
75,Robert Schober,Friedrich-Alexander-University Erlangen-Nuremberg,94,5413,44071,77,29125,https://scholar.google.com/scholar_url?url=https://www.ncbi.nlm.nih.gov/pmc/articles/PMC8314813/&hl=en&sa=X&ei=nw3vYsW-MYSYywSFp6iYAw&scisig=AAGBfm2NGpcHf-21t415nqzu63GvCltaYA&oi=scholarr,,https://scholar.google.com/citations?user=Uu0BpX8AAAAJ&hl=en
76,"Ling Shao, Fellow of IEEE/IAPR",Terminus Group,91,8245,34501,87,29440,https://0-scholar-google-com.brum.beds.ac.uk/citations?user=z84rLjoAAAAJ&hl=el,Computer Vision/Deep Learning/Artificial Intelligence/Medical Imaging/Vision and Language,https://scholar.google.com/citations?user=z84rLjoAAAAJ&hl=en
77,Xuemin (Sherman) Shen,"University Professor, University of Waterloo",134,9314,76141,105,44675,https://orcid.org/0000-0002-4140-287X,Wireless networking/MAC/Network security/VANET,https://scholar.google.com/citations?user=Bjl3GwoAAAAJ&hl=cs
