79,"Dr. P. N. Suganthan (SCI Highly Cited Researcher 2015-2021), FIEEE'2015","Some Codes available at GitHub, (Hon. Doctorate, U. of Maribor, 2020 ; BA & MA, U. of Cambridge, UK)",106,7001,58063,90,34052,https://www.timeshighereducation.com/hub/macau-university-science-and-technology/p/highly-cited-researchers-must,Machine Learning(ML)/Swarm-Evolutionary Computation(SEC)/Neural Networks(ANN)/Applications of ML SEC ANN.,https://scholar.google.com/citations?user=yZNzBU0AAAAJ&hl=en
80,Xingming Sun,Nanjing University of Information Science and Technology,58,1702,15820,52,12543,https://ieeexplore.ieee.org/author/37290262300,Digital Watermarking/Information Security,http://scholar.google.com/citations?user=epqnljMAAAAJ&hl=en
81,Tarik Taleb,University of Oulu,68,3660,19696,59,15289,https://ieeexplore.ieee.org/author/37265763700,Network Function Virtualization/Network Softwarization/Software Defined Networking,https://scholar.google.com/citations?user=o1Ap0TEAAAAJ&hl=en
82,"jen hong, tan","Highly Cited Researcher in Computer Science, National University of Singapore",48,2326,10028,44,9141,https://www.aminer.cn/profile/jen-hong-tan/53f448b1dabfaee1c0af63a7,image processing/computer vision/deep learning/infrared thermography/fundus image,https://scholar.google.com/citations?user=uJlD-A0AAAAJ&hl=en
83,Dacheng Tao,The University of Sydney,141,14096,79958,119,58684,https://scholar.google.com/scholar_url?url=https://www.researchgate.net/profile/Xinbo-Gao/publication/221696851_Image_Super-Resolution_With_Sparse_Neighbor_Embedding/links/0a85e52f4e27d23f70000000/Image-Super-Resolution-With-Sparse-Neighbor-Embedding.pdf&hl=en&sa=X&ei=q2nPYuabI5eTy9YP1dOMyAE&scisig=AAGBfm1pw9WQBTUehMMnahSp0KgENWjAAQ&oi=scholarr,artificial intelligence/machine learning/computer vision/image processing/data mining,https://scholar.google.com/citations?user=RwlJNLcAAAAJ&hl=en
84,Athanasios Vasilakos,"PROF OF COMPLEX SYSTEMS, CYBERSECURITY, AI",127,7524,57403,106,40581,https://orcid.org/0000-0003-1902-9877,Cybersecurity/IoTs/Mobile Nets/Big Data Analytics/Cloud Computing/Artificial Intelligence/Machine Learning,https://scholar.google.com/citations?user=_yWPQWoAAAAJ&hl=en
85,Huanqing Wang,Michigan Technological University,4,9,38,4,38,https://dl.acm.org/profile/81490664781,Electric vehicle/optimal control/model predictive control,https://scholar.google.com/citations?user=6XxgmPEAAAAJ&hl=en
86,Ping Wang,"York University, IEEE Fellow, York Research Chair, IEEE VTS Distinguished Lecturer",70,3608,22011,57,16460,https://economics.wustl.edu/people/ping-wang,wireless communications/Internet of Things/cloud computing/smart grid,https://scholar.google.com/citations?user=3sIHxrcAAAAJ&hl=en
87,Qingqing Wu (武庆庆),University of Macau,47,5058,13845,47,13734,https://www.adscientificindex.com/scientist.php?id=413278,6G/IRS/UAV communications/Machine learning/MIMO transceiver design,https://scholar.google.com/citations?user=as1T8CMAAAAJ&hl=en
88,Zheng-Guang Wu,Zhejiang University,74,2556,16497,66,12321,https://scholar.google.com/citations?user=vy6JCNgAAAAJ&hl=en,Markov Jump Systems/Sampled-Data Control Systems/Neural Networks/Fuzzy Systems/Singular Systems,https://scholar.google.com/citations?user=vy6JCNgAAAAJ&hl=en
89,Yang Xiang,"IEEE Fellow, Professfor, Swinburne University of Technology",67,2806,16643,59,13049,https://psychology.fas.harvard.edu/people/yang-xiang,Cybersecurity/Network Security/System Security/Software Vulnerability Detection/Blockchain,https://scholar.google.com/citations?user=7ymTWY4AAAAJ&hl=en
90,Xiaolong Xu (许小龙),"Professor, Highly Cited Researcher 2021, Nanjing University of Information Science and Technology",40,1475,5061,40,5006,https://scholar.google.com/scholar_url?url=http://www.ricesci.cn/EN/Y2004/V18/I2/176&hl=zh-CN&sa=X&ei=sGnPYsutJYnGsQLQuYRY&scisig=AAGBfm018b4_c2zRALEguvtm1krir4xf-Q&oi=scholarr,Edge computing/Cloud computing/Big data/Fog computing/Mobile computing,https://scholar.google.com/citations?user=Tyzef4sAAAAJ&hl=en
91,Zeshui Xu (徐泽水),"Member of AE,EASA,IASCYS; DFIETI,FIEEE,FIFSA,FIET,FRSA,FORS,FBCS,FIAAM,FAAIA... Sichuan University",139,8992,74024,108,43674,https://baike.baidu.com/item/%E5%BE%90%E6%B3%BD%E6%B0%B4/7518284#2,Decision Making/Information Fusion/Fuzzy Sets/Computational Intelligence/Bibliometrics,https://scholar.google.co.uk/citations?user=kd9L_GUAAAAJ&hl=en
92,Xin-She Yang (DPhil),"Computational intelligence, swarm intelligence, optimization, metaheuristics, nature-inspired",91,10486,71243,82,49262,https://orcid.org/0000-0001-8231-5556,swarm intelligence/optimization/metaheuristics/computational intelligence.,https://scholar.google.com/citations?user=fA6aTlAAAAAJ&hl=th
93,Fei Yu,University of Southern Denmark,9,72,278,8,216,https://sils.unc.edu/people/faculty/profiles/Fei-Yu,Industry 4.0 technology and smart product development,https://scholar.google.com/citations?user=3OHgAmIAAAAJ&hl=en
94,Xiangxiang Zeng,"Deparment of Computer Science, Hunan University",49,1615,6905,40,5725,https://scholar.google.com/scholar_url?url=https://www.ncbi.nlm.nih.gov/pmc/articles/PMC6036756/&hl=en&sa=X&ei=tWnPYoX4PIeymgGXrJ7IBQ&scisig=AAGBfm1U97y7xBmfDhd92aUxkv0BKhrO9g&oi=scholarr,Computational Intelligence/Bio-inspired Intelligence,https://scholar.google.com/citations?user=B20HBMIAAAAJ&hl=en
95,Yong Zeng (曾勇）,"Southeast University, China; Purple Mountain Laboratories, China",51,4167,16515,50,16043,http://www.gkcccc.org/openchurch/multimedia/podcasts/%E7%9C%8B%E5%93%AA%EF%BC%8C%E7%88%B6%E8%B5%90%E7%BB%99%E6%88%91%E4%BB%AC%E7%9A%84%E6%98%AF%E4%BD%95%E7%AD%89%E7%9A%84%E6%85%88%E7%88%B1,UAV communications/Massive MIMO/Extremely-Large MIMO (XL-MIMO)/Integrated Sensing and Communication,https://scholar.google.com/citations?user=ENldmwIAAAAJ&hl=en
96,Jianming Zhan,Hubei University for Nationalities,44,993,7218,37,4688,https://www.aminer.cn/profile/jianming-zhan/53f42ed7dabfaec22ba2ad74,logical algebras(BL-algebras/R0-algebras and MTL-algebras)/fuzzy algebras(semirings/hemirings and rings) and their hyperstuctures(hyperring/hypergroups,https://scholar.google.com/citations?user=XmJAmNIAAAAJ&hl=en
97,Haijun Zhang,"Professor, University of Science and Technology Beijing",46,1940,10460,44,9248,https://www.anesthesiology.cuimc.columbia.edu/profile/haijun-zhang-md,6G/AI enabled Wireless Communications/Resource Allocation/Mobility Management,https://scholar.google.ca/citations?user=B3oYgSIAAAAJ&hl=en
98,Rui Zhang,"Chair Professor, National University of Singapore",122,12524,64393,104,48815,https://scholar.google.com/scholar?q=Rui+Zhang+homepage&hl=en&as_sdt=0&as_vis=1&oi=scholart,Wireless Communications/MIMO/Cognitive Radio/Wireless Power Transfer/UAV,https://scholar.google.com.sg/citations?user=yoJqPIkAAAAJ&hl=en
99,Xian-Ming Zhang,Swinburne University of Technology,47,2220,11658,42,9615,https://www.feinberg.northwestern.edu/faculty-profiles/az/profile.html?xid=39702,Networked Control Systems/Event-triggered Control/H-infinity Filtering/Time-delay Systems/Neural Networks,https://scholar.google.com/citations?user=aZcLkqgAAAAJ&hl=en
100,Xuyun Zhang,Macquarie University,43,1267,6539,40,5426,https://scholar.google.com.au/citations?user=wbF6HL8AAAAJ&hl=en,big data mining/scalable machine learning/big data privacy and cybersecurity/cloud/edge computing/Internet of Things,https://scholar.google.com.au/citations?user=wbF6HL8AAAAJ&hl=en
101,Yan Zhang,"IEEE Fellow, Highly Cited Researcher, University of Oslo, Norway",93,6452,31459,78,23854,https://scholar.google.com/scholar_url?url=https://www.ncbi.nlm.nih.gov/pmc/articles/PMC5877353/&hl=en&sa=X&ei=u2nPYqzeDY72mgGq9JnICA&scisig=AAGBfm0sN-iqJWkHm97XchsKU6m10d-P3A&oi=scholarr,wireless networks/smart grid/edge intelligence/blockchain/digital twin,https://scholar.google.no/citations?user=-gahn9AAAAAJ&hl=no
102,Quan Zou (邹权),University of Electronic Science and Technology of China,70,3208,14950,62,12510,https://www.qzc.edu.cn/2020/1214/c1219a54995/page.htm,Bioinformatics/data mining,https://scholar.google.com/citations?user=RcaUHs4AAAAJ&hl=en
