,Name,Affilation,H-index,Citations 2020,Total_citation,H-index_since_2016,Citation_since_2016,HomePage,Area of Research,Google_Scholar
0,"U Rajendra Acharya (SCI Highly Cited Researcher 2016-2021)  PhD, DEng, DSc","Ngee Ann,  Singapore University of Social Science,  Kuamamoto University, Japan",114,11719,53079,101,40547,https://www.nyu.edu/about/news-publications/news/2021/november/highly-cited-researchers-2021.html,Artificial Intelligence/Medical Informatics,https://scholar.google.com.sg/citations?user=8FjY99sAAAAJ&hl=en
1,IAN  F.  AKYILDIZ,"Truva Inc. , USA",132,6564,134839,81,39361,https://scholar.google.com/citations?user=rAGwv14AAAAJ&hl=en,Wireless Communication/5G/6G Wireless Systems/Intelligent Surfaces for Wireless Communication/Nano-scale and Molecular Commun,https://scholar.google.com/citations?user=rAGwv14AAAAJ&hl=en
2,Ibrahim Aljarah,"Associate Professor, University of Jordan",45,3393,8755,44,8579,http://evo-ml.com/ibrahim/index.html,Artificial  intelligence/Swarm Intelligence/Data Science/Machine Learning/Evolutionary Computation,https://scholar.google.com/citations?user=moOTIYEAAAAJ&hl=en
3,Jeffrey Andrews,"Cockrell Family Endowed Chair and Director of 6G@UT, University of Texas at Austin",106,3862,65999,72,29570,https://www.jeffandrewsdesign.com/new-index,Wireless Communications/Communication Theory/Machine Learning for Communications/Stochastic Geometry/Information Theory,https://scholar.google.com/citations?user=Hr9Gey0AAAAJ&hl=en
4,Bennis Mehdi,"Full Professor, IEEE Fellow, Head of ICON, University of Oulu",69,7061,26015,66,23431,https://orcid.org/0000-0003-0261-0171,B5G/6G/machine learning/semantic communication,https://scholar.google.com/citations?user=RW4sJu8AAAAJ&hl=en
5,Emil Björnson,"Professor of Wireless Communication, KTH Royal Institute of Technology",63,4525,18559,60,15691,https://www.linkedin.com/today/author/emilbjornson,Massive MIMO/Cell-free Massive MIMO/RIS/Signal processing/Wireless communication,https://scholar.google.se/citations?user=Maij4akAAAAJ&hl=en
6,Rajkumar Buyya,"CLOUDS Lab, School of Computing and Information Systems, The University of Melbourne, Australia",154,11486,125122,105,61735,https://fedcsis.org/2021/keynotes/buyya,Computer Systems/Cloud Computing/Distributed Systems/Edge Computing/Internet of Things,https://scholar.google.com/citations?user=7xN6JqYAAAAJ&hl=en
7,Xing Cai,"Senior Research Scientist at Simula Research Laboratory, Professor at University of Oslo",19,136,2044,13,761,https://koei.fandom.com/wiki/Xingcai#Warriors_Orochi,Parallel programming/High-performance computing/numerical methods for PDEs,https://scholar.google.com/citations?user=IWQbrcK5CEwC&hl=en
8,Giuseppe Caire,"Professor, Technical University of Berlin, Germany, and Professor of Electrical Engineering (on",83,2866,39694,57,16253,https://orcid.org/0000-0002-7749-1333,Information Theory/Communications/Signal Processing/Statistics,https://scholar.google.com/citations?user=g66ErTcAAAAJ&hl=en
9,Jinde Cao,"Academician, RAE/AE/RAEN/LAS/AAS/EASA/PAS/IASCYS  & FIEEE/FAAIA/DFIETI; Southeast University",131,9088,70721,91,40979,https://scholar.google.com/scholar_url?url=https://www.academia.edu/download/47218042/j.physleta.2005.12.09220160713-3495-ogznky.pdf&hl=en&sa=X&ei=ZTWIYp2mD4a4ygS4j4ioAg&scisig=AAGBfm3AG3uqLpP-r7ToTPy2KPuZC60JUQ&oi=scholarr,Complex networks/neural networks/multi-agent systems - engineering stability - dynamics and control - time-delay systems,https://scholar.google.com/citations?user=8_ffELYAAAAJ&hl=en
10,C. L. Philip Chen,"Chair Professor, South China University of Technology, Philip.Chen@ieee.org",95,7367,38257,83,28746,https://scholar.google.com/citations?user=Q5248zwAAAAJ&hl=en,Computational Intelligence/Intelligent Control/Cybernetics/Intelligent Transportation Systems/Data Science/Engineering,https://scholar.google.com/citations?user=Q5248zwAAAAJ&hl=en
11,Jinjun Chen,"Professor and Deputy Institute Director, Swinburne University of Technology",68,2332,13275,51,9037,https://scholar.google.com/scholar?q=Jinjun+Chen+homepage&hl=en&as_sdt=0&as_vis=1&oi=scholart,Cloud Computing/Scalable Architecture/Scalable Data Storage/Scalable Data Processing (Privacy),https://scholar.google.com/citations?user=mQ9vJ24AAAAJ&hl=en
12,Min Chen,"Professor, IEEE Fellow, Highly Cited Researcher, Huazhong University of Science and Technology",90,6013,34312,71,25232,https://faculty.washington.edu/minchen2/,Cognitive Computing and Big Data Analytics/IoT Sensing/5G Networks/Robotics/Edge Computing,https://scholar.google.com/citations?user=_HyHTrsAAAAJ&hl=en
13,Xiaofeng Chen,"Professor, Xidian University, China",58,1752,13353,49,9901,https://www.ratemyprofessors.com/ShowRatings.jsp?tid=1992688,Security/Cryptography/Cloud computing,https://scholar.google.com/citations?user=-3WhJecAAAAJ&hl=en
14,Francisco Chiclana,"Professor of Computational Intelligence and Decision Making, De Montfort University, UK",68,2551,19935,59,11573,https://ieeexplore.ieee.org/author/37330500000,Decision making/computational intelligence/information fusion/consensus/sentiment analysis,https://scholar.google.com/citations?user=qDOxZIIAAAAJ&hl=en
15,zhihua cui,"Taiyuan University of Science and Technology, Taiyuan, Shanxi, China, 030024",44,1710,8173,34,6060,https://dl.acm.org/profile/81100229087,evolutionary computation,https://scholar.google.com/citations?user=BpDrULIAAAAJ&hl=en
16,Linglong Dai,"Associate Professor, Tsinghua University; IEEE Fellow",65,3353,16473,59,14835,https://scholar.google.com/scholar?q=Linglong+Dai+homepage&hl=en&as_sdt=0&as_vis=1&oi=scholart,Wireless Communications/RIS/Massive MIMO/Millimeter-Wave/Teraherz Communications/Non-Orthogonal Mutiple Access,https://scholar.google.com/citations?user=OTFnifoAAAAJ&hl=en
17,Merouane Debbah,"Centralesupelec, Technology Innovation Institute, MBZUAI, Lagrange Mathematics Center",99,9045,47955,82,33999,https://www.taylorfrancis.com/chapters/edit/10.1201/9781351105668-8/random-matrix-theory-romain-couillet-merouane-debbah,5G/6G/Machine Learning/Random Matrix Theory/Game Theory,https://scholar.google.com/citations?user=HU5I0X4AAAAJ&hl=en
18,Zhiguo Ding,"University of Manchester, Fellow of IEEE, Web of Science Highly Cited Researcher",93,8206,37956,86,33712,https://www.research.lancs.ac.uk/portal/en/people/zhiguo-ding(6f420ab8-4825-4195-a3d8-07e5c5b7716e).html,Wireless communications/signal processing/and cross-layer optimization,https://scholar.google.co.uk/citations?user=V-nB8scAAAAJ&hl=en
19,"Mianxiong Dong, Foreign Fellow of EAJ","Vice President and Professor, Muroran Institute of Technology, Japan",54,2197,10979,49,9601,https://www.computer.org/csdl/journal/sc/2022/02/09540249/1wWC9LGR6aA,Cyber-Physical Systems/Internet of Things/Artificial Intelligence,https://scholar.google.co.jp/citations?user=TqyApAUAAAAJ&hl=en
20,Yucheng Dong,"Professor of Management and Systems Sciences, Sichuan University",60,2236,11746,56,9462,https://www.journals.elsevier.com/computers-and-industrial-engineering/editorial-board/yucheng-dong,Decision Analysis/Human Dynamics/Social Network/Data Science,https://scholar.google.com/citations?user=tFVYDw4AAAAJ&hl=en
21,Maged Elkashlan,"Associate Professor, Queen Mary University of London",60,2718,15296,53,12850,http://mbmc.info/index.php/editorial-board/maged-elkashlan/,IRS/URLLC/UAV/PLS/NOMA,https://scholar.google.com/citations?user=mncnnOAAAAAJ&hl=en
22,Zubair Md. Fadlullah,"Associate Professor, Research Chair, Department of Computer Science, Lakehead University, TBRHRI",40,1322,7519,38,5794,https://www.zfadlullah.org/research,Beyond 5G/Smart Health/UAV & Energy efficient Networks/QoS & Security/Deep Learning applications,https://scholar.google.com/citations?user=dZyfKpYAAAAJ&hl=en
23,Hossam Faris,"Professor, The University of Jordan",48,4480,11611,47,11380,https://scholar.google.com/scholar_url?url=https://www.tandfonline.com/doi/abs/10.1080/02626667.2019.1703186&hl=en&sa=X&ei=cjWIYszcHsWN6rQP5J-c2AQ&scisig=AAGBfm2ljSNqTnOWCun3FPIs3ZYZtyaZ5Q&oi=scholarr,Data Science/Knowledge Systems/Data Mining/Evolutionary computation,https://scholar.google.com/citations?user=UEYd--YAAAAJ&hl=en
24,Giancarlo Fortino,"Full Prof. of Computer Engineering, University of Calabria, FIEEE, FAAIA, Highly Cited Researcher",66,3722,16174,58,13092,http://www.ocibe.com/page13.html,Human-Machine Systems/Agent-based Computing/Internet of Things/Wearable Computing/Wireless/Body Area Networks,https://scholar.google.com/citations?user=ecImn1MAAAAJ&hl=it
25,Hamido Fujita,Iwate Prefectural University,67,4491,16958,67,15757,https://research.com/u/hamido-fujita,Machine Learning,https://scholar.google.com/citations?user=MxzV1nQAAAAJ&hl=en
26,Erik G. Larsson,"Professor, Dept. of Electrical Engineering (ISY), Linköping University, Sweden",88,6304,44893,68,28928,https://scholar.google.com/scholar_url?url=https://www.tandfonline.com/doi/pdf/10.1080/03009734.2018.1521890&hl=en&sa=X&ei=dTWIYquwCpT0yASct56wBQ&scisig=AAGBfm0_a-SP56cpVqgcFTGzvJTifbHjeQ&oi=scholarr,Wireless communications/statistical signal processing/localization/massive MIMO/networks,https://scholar.google.se/citations?user=79Lry6oAAAAJ&hl=en
27,Amir H. Gandomi,"Professor of Data Science, University of Technology Sydney",76,7074,29134,67,22521,https://scholar.google.com/scholar_url?url=https://www.tandfonline.com/doi/abs/10.1080/17499518.2020.1771739&hl=en&sa=X&ei=dTWIYpncOsWN6rQP5J-c2AQ&scisig=AAGBfm0whMFCeehngf6NOKxJiGJR3knqCQ&oi=scholarr,Data Analytics/Genetic Programming/Engineering Optimization/Evolutionary Computation/Smart Cities,https://scholar.google.com/citations?user=VMf3wfMAAAAJ&hl=en
28,Xiaohua Ge,"Swinburne University of Technology, Melbourne, Australia",37,2038,7144,36,6943,https://publons.com/a/1375878/,Networked control systems/Cyber-physical systems/Multi-agent systems/Intelligent vehicles/Connected automated vehicles,https://scholar.google.com.au/citations?user=B37CYFoAAAAJ&hl=en
29,"Mohsen Guizani, FIEEE",Mohamed Bin Zayed University of Artificial Intelligence (MBZUAI),92,10842,44516,79,37132,https://vivo.nkn.uidaho.edu/vivo/display/n62284,Internet of Things/Applied AI/ML and Cybersecurity,https://scholar.google.com/citations?user=RigrYkcAAAAJ&hl=en
30,Song Guo,"FCAE, FIEEE, The Hong Kong Polytechnic University",72,4341,21375,65,17379,https://ieeexplore.ieee.org/author/37274156400,Edge AI/Wireless Networking/Big Data Computing/Distributed System,https://scholar.google.com/citations?user=Ib-sizwAAAAJ&hl=en
31,Harald Haas,The University of Edinburgh,94,5570,45504,76,29469,https://www.youtube.com/watch?v=NaoSp4NpkGg,Optical Wireless Communications/Interference Managment in Wireless Networks/Spatial Modulation,https://scholar.google.com/citations?user=XxIwRJQAAAAJ&hl=ja
32,Yuki Hagiwara,Fraunhofer IKS,29,1960,6619,29,6596,https://www.japantimes.co.jp/author/int-yuki_hagiwara/page/3/,Artificial Intelligence,https://scholar.google.com.sg/citations?user=P6WI2DQAAAAJ&hl=en
33,"Qing-Long Han, Pro Vice-Chancellor and Distinguished Professor, MAE, IEEE Fellow",Swinburne University of Technology,110,6353,38630,90,26431,https://www.aminer.org/profile/qing-long-han/53f469b2dabfaee02ada1fc0,Networked control systems/time-delay systems/multi-agent systems/smart grids/unmanned surface vehicles,https://scholar.google.com.au/citations?user=j0pyptAAAAAJ&hl=en
34,Zhu Han,University of Houston,119,8502,57526,90,38140,https://ieeexplore.ieee.org/author/37086883988,Game Theory/Wireless Networking/Security/Data Science/Smart Grid,https://scholar.google.com/citations?user=ty7wIXoAAAAJ&hl=en
35,L Hanzo,"Chair of Telecommunications, University of Southampton",109,8252,68114,83,35331,https://www.ecs.soton.ac.uk/people/hanzo,telecommunications/wireless communication/quantum_information_science/video_coding/video_networking,https://scholar.google.co.uk/citations?user=p0jnEW0AAAAJ&hl=en
36,L Hanzo,"Chair of Telecommunications, University of Southampton",109,8252,68114,83,35331,https://www.ecs.soton.ac.uk/people/hanzo,telecommunications/wireless communication/quantum_information_science/video_coding/video_networking,https://scholar.google.co.uk/citations?user=p0jnEW0AAAAJ&hl=en
37,Robert Heath,"Lampe Distinguished Professor, North Carolina State University",136,7710,80491,91,41908,https://en.wikipedia.org/wiki/Robert_W._Heath_Jr.,wireless/MIMO/communications/signal processing/information theory,https://scholar.google.com/citations?user=17Ko8Q0AAAAJ&hl=en
38,Francisco Herrera,"Professor Computer Science and AI, Granada University, Spain",162,15109,113178,121,60949,https://scholar.google.com/citations?user=HULIk-QAAAAJ&hl=en,Artificial Intelligence/Computational Intelligence/Data mining/Evolutionary Algorithms/Big Data Analytics,https://scholar.google.com/citations?user=HULIk-QAAAAJ&hl=en
39,Enrique Herrera-Viedma,"Professor of Computer Science and Artificial Intelligence, Spain, University of Granada",108,6206,47631,90,26421,https://dasci.es/about-dasci/resources/human-resources/enrique-herrera-viedma/,Fuzzy sets/fuzzy decision making/computing with words/multiple criteria decision making/consensus,https://scholar.google.com/citations?user=g8ZXTuYAAAAJ&hl=en
40,Ekram Hossain,"Professor, University of Manitoba, Canada, IEEE Fellow",97,3241,36437,70,18728,https://www.comsoc.org/ekram-hossain-2,Wireless communication networks/radio resource allocation/cognitive radio/multi-tier cellular networks,https://scholar.google.com/citations?user=Lb617EMAAAAJ&hl=en
41,Guang-Bin Huang,"Full Professor, Nanyang Technological University, Singapore",71,5590,54501,61,32509,https://scholar.google.com/scholar_url?url=https://citeseerx.ist.psu.edu/viewdoc/download%3Fdoi%3D10.1.1.217.3643%26rep%3Drep1%26type%3Dpdf&hl=en&sa=X&ei=gzWIYszmHpT0yASct56wBQ&scisig=AAGBfm3Edopupko6TfZgRcK__u7dn_2tmA&oi=scholarr,Machine Learning/Neural Networks/Neuroscience,https://scholar.google.com.sg/citations?user=LhSqQCIAAAAJ&hl=en
42,Kaibin Huang,"Professor, Dept. of EEE, The University of Hong Kong; IEEE Fellow; ISI Highly Cited Researcher",51,2905,14724,42,11378,https://ieeexplore.ieee.org/author/37290266200,Machine Learning/Mobile Edge Computing/Wireless Communications/Wireless Power Transfer/Stochastic Geometry,https://scholar.google.com/citations?user=HfuA3uIAAAAJ&hl=en
43,Thomas JR Hughes,"Peter O'Donnell Jr. Chair in Computational and Applied Mathematics, University of Texas at Austin",150,7139,127578,92,39996,http://en.wikipedia.org/wiki/Timoshenko_Medal,Finite Element Methods/Solid Mechanics/Computational Fluid Dynamics/Partial Differential Equations/Isogeometric Analysis,https://scholar.google.com/citations?user=6tPdlYAAAAAJ&hl=en
44,Yaochu Jin,"A. v. Humboldt Professor for AI, Bielefeld University and Distinguished Chair, University of Surrey",88,5624,31825,72,19917,http://www.ic-wcsp.org/2019/show.asp?id=107,Evolutionary Computation/Multiobjective Optimization/Multiobjective Learning/Federated Learning/Artificial Intelligence,https://scholar.google.com/citations?user=B5WAkz4AAAAJ&hl=en
45,"Nei Kato(IEEE Fellow, IEICE Fellow)","Professor and Dean, Graduate School of Information Sciences, Tohoku University, Japan",74,3201,21728,58,14148,https://0-scholar-google-com.brum.beds.ac.uk/citations?user=LfLfZXEAAAAJ&hl=es,Wireless networking,https://scholar.google.com/citations?user=LfLfZXEAAAAJ&hl=en
46,"Dr. Neeraj Kumar, SMIEEE (Web of Science Highly Cited Researcher 2019, 2020,2021)","Professor, CSED, Thapar Institute of Engineering and Technology, India",92,9979,28340,87,26379,https://www.ludwigcancerresearch.org/wp-content/uploads/2018/09/37a987a9-e378-4888-8baa-d4ba20efdbfd_tr_scientific_minds_online_final.pdf,IoT and Machine Learning/Deep Learning/Blockchain Technology,https://scholar.google.co.in/citations?user=gL9gR-4AAAAJ&hl=en
47,"Dr. Arun Kumar Sangaiah, (Web of Science Highly Cited Researcher, SM'IEEE)","Professor, VIT University, Vellore, India",70,4769,14956,70,14766,https://ieeexplore.ieee.org/iel7/6287639/6514899/08082789.pdf,Software Engineering/Computational Intelligence/Internet of Things,https://scholar.google.co.in/citations?user=8yF6Xc4AAAAJ&hl=en
48,Victor C. M. Leung,Shenzhen University / The University of British Columbia,102,6440,48062,83,30567,https://people.ece.ubc.ca/vleung/,communication systems/wireless networks/mobile systems,https://scholar.google.ca/citations?user=ajvCoo4AAAAJ&hl=en
49,Geoffrey Ye Li (李烨),"Chair Professor in Wireless Systems, Dept EEE, Imperial College London",108,5780,53068,78,24684,https://people.ucas.edu.cn/~yeli?language=en,Signal Processing/and/Machine Learning/for/Wireless Communications,https://scholar.google.com/citations?user=d0FzG8YAAAAJ&hl=en
50,Hongyi Li,"Assistant Professor, University of Houston",33,925,3706,30,3115,https://scholar.google.com/scholar_url?url=https://www.sciencedirect.com/science/article/pii/S0002929715001007&hl=en&sa=X&ei=jDWIYvjJFomsyASoqJ64Cg&scisig=AAGBfm2U2ixenp4KE_2wngBbLfsLlCUzJQ&oi=scholarr,watershed hydrology/earth system modeling/coupled human-nature system,https://scholar.google.com/citations?user=yWy-5icAAAAJ&hl=en
51,Jin Li  李进,Professor @Guangzhou University,59,1967,18900,52,12474,https://books.google.com/books?id=I4BMdO-3eiUC&pg=PA188&lpg=PA188&dq=Jin+Li++%E6%9D%8E%E8%BF%9B+homepage&source=bl&ots=xrK0n3viYw&sig=ACfU3U0qwV3de4Li14PwcvLi9_NvkGYeMA&hl=en&sa=X&ved=2ahUKEwiiwIiZru_3AhUoqY4IHT-eBigQ6AF6BAggEAM,Trust and Security in Artificial Intelligence/Computating and Storage in Cloud Computing/Blockchain,https://scholar.google.com/citations?user=7GDV2vUAAAAJ&hl=en
52,Xuelong Li (Executive Councilor of AAAI),"Professor, Northwestern Polytechnical University, China",118,8385,54347,97,37735,https://aaai.org/Organization/officers.php,artificial intelligence/optics and electronics,https://scholar.google.com/citations?user=ahUibskAAAAJ&hl=en
53,yongming li,"college of computer science, shaanxi normal university",37,415,4935,25,2405,https://www.math.tamu.edu/directory/formalpg.php?user=liyo0008,fuzzy systems/quantume logic and quantum information/lattice/topology/model checking,https://scholar.google.com/citations?user=P3VERZ0AAAAJ&hl=en
54,Chong Lin,Qingdao University,70,2004,16373,51,9073,https://dblp.org/pid/72/4213,systems and control theory,https://scholar.google.com/citations?user=AQbRErEAAAAJ&hl=en
55,Yan-Jun Liu,Liaoning University of Technology,61,2322,14176,58,10755,https://ieeexplore.ieee.org/author/37577989800,Adaptive control/fuzzy control/neural networks,https://scholar.google.com/citations?user=x_Wk1jAAAAAJ&hl=en
56,Yuanwei Liu,"Associate Professor in Queen Mary University of London, Web of Science Highly Cited Researcher",50,3534,11932,50,11653,https://scholar.google.com/scholar_url?url=https://www.sciencedirect.com/science/article/pii/S0378778818317110&hl=en&sa=X&ei=kjWIYqTeIYaaygST2KGgDA&scisig=AAGBfm0NUt612pXzvHjlNQojuv2XnTc3cg&oi=scholarr,NOMA/RIS/AI/6G/Integrated Sensing and Communications,https://scholar.google.com/citations?user=FxLf7ZAAAAAJ&hl=en
57,Wenjing Lou,"W. C. English Endowed Professor, IEEE Fellow, Virginia Tech, USA",83,2776,39521,60,19016,https://ieeexplore.ieee.org/author/37275345500,Cyber Security/Wireless Networks/Wireless Security/Network Security/Cloud Computing,https://scholar.google.com/citations?user=hM8uAwoAAAAJ&hl=en
58,Majdi Mafarja,"Associate Professor of Computer Science, Birzeit University",33,2693,6599,32,6547,https://www.researchgate.net/profile/Majdi_Mafarja/3,Feature Selection/Machine Learning/Artificial Intelligence/Bio-inspired Algorithms/Metaheuristics,https://scholar.google.com/citations?user=ftkD0MgAAAAJ&hl=en
59,Luis Martínez,"Professor of Computer Science, University of Jaén",63,2880,22656,52,12636,https://renaissance.stonybrookmedicine.edu/pathology/faculty/martinez,Fuzzy decision making/Computing with words/Recommender Systems,https://scholar.google.com/citations?user=PG3D8UMAAAAJ&hl=en
60,Thomas Marzetta,"Distinguished Industry Professor, Department of Electrical and Computer Engineering, New York",59,4680,47258,46,28026,https://dblp.org/pid/84/6779,Beyond Massive MIMO,https://scholar.google.com/citations?user=tBLWIBoAAAAJ&hl=en
61,Seyedali Mirjalili,"Professor, Torrens University Australia, Adjunct Griffith University",75,17095,50393,74,48203,https://seyedalimirjalili.com/projects,Metaheuristics/Robust Optimization/Engineering Optimization/Evolutionary Algorithm/Swarm Intelligence,https://scholar.google.com/citations?user=TJHmrREAAAAJ&hl=en
62,Andreas F. Molisch,"Professor of Electrical Engineering, University of Southern California",101,5229,59214,71,27846,https://ieeexplore.ieee.org/author/37279677800,wireless propagation channels/multi-antenna systems/ultrawideband communications and positioning/cooperative communications,https://scholar.google.com/citations?user=W0wwrucAAAAJ&hl=en
63,Derrick Wing Kwan Ng,"Scientia  Assoicate Professor,  University of New South Wales",65,3943,19176,62,16510,https://scholar.google.com/scholar_url?url=https://arxiv.org/pdf/2002.03491&hl=en&sa=X&ei=mDWIYqe6GKuO6rQP296DwAY&scisig=AAGBfm1TcPmbxt5VQKeRlcCOecIAV8FeBw&oi=scholarr,Wireless Communications,https://scholar.google.com/citations?user=NUJSHxoAAAAJ&hl=en
64,H. Nguyen-Xuan,"CIRTech Institute, HUTECH University, Vietnam",68,2553,15790,59,11133,https://www.researchgate.net/profile/H-Nguyen-Xuan,Computational Engineering/Large-scale data/3D Printing/Renewable Energy,https://scholar.google.co.uk/citations?user=3iK9h-gAAAAJ&hl=en
65,Dusit (Tao) Niyato,Nanyang Technological University (NTU),103,8806,47856,85,32939,https://dl.acm.org/profile/81313481268,ดุสิต นิยะโต - เต๋า,https://scholar.google.com/citations?user=T8sVhLMAAAAJ&hl=en
66,Kaoru Ota (太田　香),"MEXT Excellent Young Researcher (文部科学省　卓越研究員), Muroran Institute of Technology",50,2084,9768,48,8895,https://scholar.google.com/citations?user=8JVn8RsAAAAJ&hl=en,,https://scholar.google.com/citations?user=8JVn8RsAAAAJ&hl=ja
67,Mugen Peng,"Beijing University of Posts & Telecommun., IEEE Fellow, Web of Science Highly Cited Researcher",53,2343,15587,46,10954,https://dl.acm.org/profile/81339521539,Fog Computing/Cloud Radio Access Networks/Integrated Satellite-Terrestrial Networks/6G,https://scholar.google.com/citations?user=85mAZVcAAAAJ&hl=en
68,HV Poor,"Michael Henry Strater University Professor, Princeton University",155,14361,122066,106,60527,https://ieeexplore.ieee.org/author/38558600000,Communication Systems/Wireless Communications/Communications/Statistical Signal Processing/Information Theory,https://scholar.google.com/citations?user=Dq93mOUAAAAJ&hl=en
69,Lianyong Qi(齐连永),"Professor, Qufu Normal University",44,1893,5825,43,5574,https://www.scholat.com/qilianyong.en,service computing/big data/recommender system,https://scholar.google.com/citations?user=pxNRRsAAAAAJ&hl=en
70,Timon Rabczuk,Bauhaus University Weimar,108,7410,42055,91,31500,https://scholar.google.com/scholar_url?url=https://www.researchgate.net/profile/Chien-Thai-Hoang/publication/235903027_Isogeometric_Analysis_of_Laminated_Composite_Plates_Using_the_Higher-Order_Shear_Deformation_Theory/links/02e7e516360ecb9a35000000/Isogeometric-Analysis-of-Laminated-Composite-Plates-Using-the-Higher-Order-Shear-Deformation-Theory.pdf&hl=en&sa=X&ei=njWIYsmdBquO6rQP296DwAY&scisig=AAGBfm38XDBZptm8Gbek_l19jeXxFXPZrg&oi=scholarr,Computational Mechanics/Solid Mechanics,https://scholar.google.ca/citations?user=3CBuGosAAAAJ&hl=en
71,Kim-Kwang Raymond Choo,"Cloud Tech Endowed Professor, University of Texas at San Antonio; Highly Cited Researcher 2020, 2021",93,6539,24997,86,22557,https://people.unisa.edu.au/raymond.choo,Cloud Forensics/Cyber Forensics/Cyber Security/IoT Security/Blockchain,https://scholar.google.com/citations?user=rRBNI6AAAAAJ&hl=en
72,Kui Ren,"Professor, Zhejiang University, ACM Fellow, IEEE Fellow",84,3698,40048,70,22192,https://scholar.google.com/scholar_url?url=https://acmccs.github.io/papers/p425-qinAemb.pdf&hl=en&sa=X&ei=nzWIYtPhK4a4ygS4j4ioAg&scisig=AAGBfm0AfjHr9DisjPShiKwP5VhpuLY-eA&oi=scholarr,Data Security & Privacy/IoT Security/AI Security,https://scholar.google.com/citations?user=uuQA_rcAAAAJ&hl=en
73,Walid Saad,"Professor, Electrical and Computer Engineering",82,7406,32040,74,26990,https://www.youtube.com/watch?v=WMyT_44GIng,6G/machine learning/semantic communications/security and cyber-physical systems/unmanned aerial vehicles,https://scholar.google.com/citations?user=kYDNA0UAAAAJ&hl=en
74,Robert Schober,Friedrich-Alexander-University Erlangen-Nuremberg,94,5364,42600,75,27621,https://www.humboldt-foundation.de/en/entdecken/newsroom/dossier-alexander-von-humboldt-professur/robert-schober,,https://scholar.google.com/citations?user=Uu0BpX8AAAAJ&hl=en
75,"Ling Shao, Fellow of IEEE/IAPR",Terminus Group,86,8381,31932,82,26865,https://scholar.google.com/citations?user=z84rLjoAAAAJ&hl=en,Computer Vision/Deep Learning/Artificial Intelligence/Medical Imaging/Vision and Language,https://scholar.google.com/citations?user=z84rLjoAAAAJ&hl=en
76,Xuemin (Sherman) Shen,"University Professor, University of Waterloo",131,9046,73556,102,42206,https://scholar.google.com/scholar_url?url=http://nsec.sjtu.edu.cn/publications/2018/Securing%2520consumer%2520IoT.pdf&hl=en&sa=X&ei=ojWIYqDhOaKP6rQPwMuZuAk&scisig=AAGBfm1pezn6VNz-mP8z0oeRL_efmIdJOw&oi=scholarr,Wireless networking/MAC/Network security/VANET,https://scholar.google.com/citations?user=Bjl3GwoAAAAJ&hl=cs
77,Peng Shi,"Professor, School of Electrical and Electronic Engineering, The University of Adelaide",149,8210,77614,112,45496,https://scholar.google.com/scholar_url?url=https://www.sciencedirect.com/science/article/pii/S1995764513600619/pdf%3Fmd5%3D3f5336bf24528ae5d90dcefe0b8bc2b3%26pid%3D1-s2.0-S1995764513600619-main.pdf%26_valck%3D1&hl=en&sa=X&ei=ozWIYuDbMIa4ygS4j4ioAg&scisig=AAGBfm0hU3tO_A7A08zmY8gukf8kyetufg&oi=scholarr,Systems and Control/Electrical and Electronic Engineering/Cybernetics/Human-Computer Interaction,https://scholar.google.com.hk/citations?user=EGx1iH0AAAAJ&hl=en
