,Name,Affilation,H-index,Citations 2020,Total_citation,H-index_since_2016,Citation_since_2016,HomePage,Area of Research,Google_Scholar
0,"U Rajendra Acharya (SCI Highly Cited Researcher 2016-2021)  PhD, DEng, DSc","Ngee Ann,  Singapore University of Social Science,  University of Malaya, Malaysia",111,8749,47940,99,38108,https://www.longdom.org/editor/u-rajendra-acharya-5101,Artificial Intelligence/Medical Informatics,https://scholar.google.com.sg/citations?user=8FjY99sAAAAJ&hl=en
1,IAN  F.  AKYILDIZ,"Truva Inc. , USA",132,6776,132147,87,45869,https://www.computer.org/profiles/ian-akyildiz,Wireless Communication/5G/6G Wireless Systems/Intelligent Surfaces for Wireless Communication/Nano-scale and Molecular Commun,https://scholar.google.com/citations?user=rAGwv14AAAAJ&hl=en
2,Ibrahim Aljarah,"Associate Professor, University of Jordan",43,2268,7338,43,7230,http://evo-ml.com/ibrahim/biography.html,Artificial  intelligence/Swarm Intelligence/Data Science/Machine Learning/Evolutionary Computation,https://scholar.google.com/citations?user=moOTIYEAAAAJ&hl=en
3,Jeffrey Andrews,"Cockrell Family Endowed Chair in Engineering, University of Texas at Austin",105,4710,64819,80,35218,https://scholar.google.com/citations?user=Hr9Gey0AAAAJ&hl=en,Wireless Communications/Communication Theory/Machine Learning for Communications/Stochastic Geometry/Information Theory,https://scholar.google.com/citations?user=Hr9Gey0AAAAJ&hl=en
4,Bennis Mehdi,"Full Professor, IEEE Fellow, Head of ICON, University of Oulu",65,5660,22875,63,21288,https://sites.google.com/view/dr-mehdi-bennis/publications,B5G/6G/machine learning/semantic communication,https://scholar.google.com/citations?user=RW4sJu8AAAAJ&hl=en
5,Emil Björnson,"Professor of Wireless Communication, KTH Royal Institute of Technology",61,3478,16811,58,15026,https://ebjornson.com/,Massive MIMO/Cell-free Massive MIMO/RIS/Signal processing/Wireless communication,https://scholar.google.se/citations?user=Maij4akAAAAJ&hl=en
6,Rajkumar Buyya,"CLOUDS Lab, School of Computing and Information Systems, The University of Melbourne, Australia",152,11185,120710,111,67098,https://scholar.google.com/scholar_url?url=https://citeseerx.ist.psu.edu/viewdoc/download%3Fdoi%3D10.1.1.151.5661%26rep%3Drep1%26type%3Dpdf&hl=en&sa=X&ei=T_LQYbSUM6KbywSgloz4Ag&scisig=AAGBfm0TqIsDd7_mq_ZkvPWSd2qxGnQkdg&oi=scholarr,Computer Systems/Cloud Computing/Distributed Systems/Edge Computing/Internet of Things,https://scholar.google.com/citations?user=7xN6JqYAAAAJ&hl=en
7,Xing Cai,"Senior Research Scientist at Simula Research Laboratory, Professor at University of Oslo",19,125,1987,14,870,https://koei.fandom.com/wiki/Xingcai#Dynasty_Warriors,Parallel programming/High-performance computing/numerical methods for PDEs,https://scholar.google.com/citations?user=IWQbrcK5CEwC&hl=en
8,Giuseppe Caire,"Professor, Technical University of Berlin, Germany, and Professor of Electrical Engineering (on",82,2990,38492,59,17736,https://www.researchgate.net/profile/Giuseppe-Caire,Information Theory/Communications/Signal Processing/Statistics,https://scholar.google.com/citations?user=g66ErTcAAAAJ&hl=en
9,Jinde Cao,"Academician, RAE/AE/RAEN/LAS/AAS/EASA/PAS/IASCYS  & FIEEE/FAAIA/DFIETI; Southeast University",129,8726,67171,91,41352,https://www.peertechzpublications.com/editor-in-chief/jinde-cao,Complex networks/neural networks/multi-agent systems - engineering stability - dynamics and control - time-delay systems,https://scholar.google.com/citations?user=8_ffELYAAAAJ&hl=en
10,C. L. Philip Chen,"Chair Professor, South China University of Technology, Philip.Chen@ieee.org",91,5837,35094,84,27795,https://dblp.org/pid/48/4856,Computational Intelligence/Intelligent Control/Cybernetics/Intelligent Transportation Systems/Data Science/Engineering,https://scholar.google.com/citations?user=Q5248zwAAAAJ&hl=en
11,Jinjun Chen,"Professor and Deputy Institute Director, Swinburne University of Technology",67,2159,12350,49,9051,https://orcid.org/0000-0003-1677-9525,Cloud Computing/Scalable Architecture/Scalable Data Storage/Scalable Data Processing (Privacy),https://scholar.google.com/citations?user=mQ9vJ24AAAAJ&hl=en
12,Min Chen,"Professor, IEEE Fellow, Highly Cited Researcher, Huazhong University of Science and Technology",86,5733,32094,71,25633,https://sydney.edu.au/science/people/min.chen.php,Cognitive Computing and Big Data Analytics/IoT Sensing/5G Networks/Robotics/Edge Computing,https://scholar.google.com/citations?user=_HyHTrsAAAAJ&hl=en
13,Xiaofeng Chen,"Professor, Xidian University, China",55,1835,12607,51,10185,https://www.linkedin.com/in/xiaofeng-chen-75a158189?trk=people-guest_people_search-card,Security/Cryptography/Cloud computing,https://scholar.google.com/citations?user=-3WhJecAAAAJ&hl=en
14,Francisco Chiclana,"Professor of Computational Intelligence and Decision Making, De Montfort University, UK",67,2277,19117,60,12101,https://scholar.google.com/citations?user=qDOxZIIAAAAJ&hl=en,Decision making/computational intelligence/information fusion/consensus/sentiment analysis,https://scholar.google.com/citations?user=qDOxZIIAAAAJ&hl=en
15,zhihua cui,"Taiyuan University of Science and Technology, Taiyuan, Shanxi, China, 030024",42,1568,7567,33,5629,https://www.zhihuacui.com/,evolutionary computation,https://scholar.google.com/citations?user=BpDrULIAAAAJ&hl=en
16,Linglong Dai,"Associate Professor, Tsinghua University; IEEE Fellow",61,3229,15091,58,14155,http://oa.ee.tsinghua.edu.cn/dailinglong/,Wireless Communications/RIS/Massive MIMO/Millimeter-Wave/Teraherz Communications/Non-Orthogonal Mutiple Access,https://scholar.google.com/citations?user=OTFnifoAAAAJ&hl=en
17,Merouane Debbah,"Centralesupelec, Technology Innovation Institute, MBZUAI, Lagrange Mathematics Center",98,7757,45413,85,34534,https://scholar.google.com/scholar_url?url=https://www.academia.edu/download/63929595/58_21Sep18_5Dec17_10176_Modified_RIAHI_ed_iqbal_fix20200715-110873-1jr8o8j.pdf&hl=en&sa=X&ei=XPLQYbTNOcKM6rQP2tWjIA&scisig=AAGBfm0WTmYieer7uAEUvDHA4rYRxuxHDQ&oi=scholarr,5G/6G/Machine Learning/Random Matrix Theory/Game Theory,https://scholar.google.com/citations?user=HU5I0X4AAAAJ&hl=en
18,Yong Deng,"School of Computer and Information Science, Southwest University",74,3148,18955,67,15470,https://www.botanical-medicine.org/Botanical-Medicine-Speakers/Deng-Yong,Evidence Theory/Fuzzy Set Theory/Bio-inspired AI/Complex Networks,https://scholar.google.com/citations?user=8voeILsAAAAJ&hl=en
19,Zhiguo Ding,"University of Manchester, Fellow of IEEE, Web of Science Highly Cited Researcher",87,7914,34728,83,31959,https://www.research.lancs.ac.uk/portal/en/people/zhiguo-ding(6f420ab8-4825-4195-a3d8-07e5c5b7716e).html,Wireless communications/signal processing/and cross-layer optimization,https://scholar.google.co.uk/citations?user=V-nB8scAAAAJ&hl=en
20,"Mianxiong Dong, Foreign Fellow of EAJ","Vice President and Professor, Muroran Institute of Technology, Japan",52,2155,10031,51,9300,https://aib.msu.edu/aibfellows.asp,Cyber-Physical Systems/Internet of Things/Artificial Intelligence,https://scholar.google.co.jp/citations?user=TqyApAUAAAAJ&hl=en
21,Yucheng Dong,"Professor of Management and Systems Sciences, Sichuan University",57,1830,10941,54,9261,https://loop.frontiersin.org/people/642641/overview,Decision Analysis/Human Dynamics/Social Network/Data Science,https://scholar.google.com/citations?user=tFVYDw4AAAAJ&hl=en
22,Maged Elkashlan,"Associate Professor, Queen Mary University of London",57,2653,14190,55,12859,https://ieeexplore.ieee.org/author/37085382681,IRS/URLLC/UAV/PLS/NOMA,https://scholar.google.com/citations?user=mncnnOAAAAAJ&hl=en
23,Zubair Md. Fadlullah,"Associate Professor, Research Chair, Department of Computer Science, Lakehead University, TBRHRI",38,1483,6963,36,5721,https://www.youtube.com/watch?v=X-HRkyrFwY0,Beyond 5G/Smart Health/UAV & Energy efficient Networks/QoS & Security/Deep Learning applications,https://scholar.google.com/citations?user=dZyfKpYAAAAJ&hl=en
24,Hossam Faris,"Professor, The University of Jordan, Al Hussein Technical University",44,2902,9706,44,9576,https://scholar.google.com/scholar_url?url=https://www.tandfonline.com/doi/abs/10.1080/0951192X.2013.766937&hl=en&sa=X&ei=ZvLQYYmOAsyO6rQPz_2SyAI&scisig=AAGBfm3ryv4EqQSDCLV7IhoN3X-bYuryMw&oi=scholarr,Data Science/Knowledge Systems/Data Mining/Evolutionary computation,https://scholar.google.com/citations?user=UEYd--YAAAAJ&hl=en
25,Giancarlo Fortino,"Full Prof. of Computer Engineering, University of Calabria, IEEE Fellow, Highly Cited Researcher",63,2815,14675,57,12350,https://scholar.google.it/citations?user=ecImn1MAAAAJ&hl=it,Human-Machine Systems/Agent-based Computing/Internet of Things/Wearable Computing/Wireless/Body Area Networks,https://scholar.google.com/citations?user=ecImn1MAAAAJ&hl=it
26,Hamido Fujita,Iwate Prefectural University,63,3946,14900,63,14128,https://ieeexplore.ieee.org/author/37275244500,Machine Learning,https://scholar.google.com/citations?user=MxzV1nQAAAAJ&hl=en
27,Erik G. Larsson,"Professor, Dept. of Electrical Engineering (ISY), Linköping University, Sweden",83,5711,42410,65,30118,https://scholar.google.com/scholar?q=Erik+G.+Larsson+homepage&hl=en&as_sdt=0&as_vis=1&oi=scholart,Wireless communications/statistical signal processing/localization/massive MIMO/networks,https://scholar.google.se/citations?user=79Lry6oAAAAJ&hl=en
28,Amir H. Gandomi,"Professor, University of Technology Sydney",73,4088,25441,60,18679,https://ieeexplore.ieee.org/author/37681044500,Data Analytics/Genetic Programming/Engineering Optimization/Evolutionary Computation/Smart Cities,https://scholar.google.com/citations?user=VMf3wfMAAAAJ&hl=en
29,Xiaohua Ge,"Swinburne University of Technology, Melbourne, Australia",33,1714,6075,33,6017,https://sites.google.com/site/jamiexiaohuage/Home,Multi-agent systems/Networked control systems/Cyber-physical systems,https://scholar.google.com.au/citations?user=B37CYFoAAAAJ&hl=en
30,"Mohsen Guizani, FIEEE",Mohamed Bin Zayed University of Artificial Intelligence (MBZUAI),88,8298,40501,76,34315,https://ieeexplore.ieee.org/author/37273043000,Internet of Things/Applied AI/ML and Cybersecurity,https://scholar.google.com/citations?user=RigrYkcAAAAJ&hl=en
31,Song Guo,"FCAE, FIEEE, The Hong Kong Polytechnic University",69,3812,19523,67,16729,https://dblp.org/pid/01/267-1,Big Data Computing/Edge AI/Mobile Computing/Distributed System,https://scholar.google.com/citations?user=Ib-sizwAAAAJ&hl=en
32,Harald Haas,The University of Edinburgh,92,5656,43738,79,31317,https://ieeexplore.ieee.org/author/37269894900,Optical Wireless Communications/Interference Managment in Wireless Networks/Spatial Modulation,https://scholar.google.com/citations?user=XxIwRJQAAAAJ&hl=ja
33,Yuki Hagiwara,Fraunhofer IKS,29,1749,5819,29,5809,https://www.bloombergquint.com/author/28807/yuki-hagiwara,Artificial Intelligence,https://scholar.google.com.sg/citations?user=P6WI2DQAAAAJ&hl=en
34,"Qing-Long Han, Pro Vice-Chancellor and Distinguished Professor, MAE, IEEE Fellow",Swinburne University of Technology,104,5698,35537,87,25100,https://scholar.zheng98.com/citations?user=j0pyptAAAAAJ&hl=ko,Networked control systems/time-delay systems/multi-agent systems/smart grids/unmanned surface vehicles,https://scholar.google.com.au/citations?user=j0pyptAAAAAJ&hl=en
35,Zhu Han,University of Houston,115,7623,53647,92,38621,https://scholar.google.com/scholar?q=Zhu+Han+homepage&hl=en&as_sdt=0&as_vis=1&oi=scholart,Game Theory/Wireless Networking/Security/Data Science/Smart Grid,https://scholar.google.com/citations?user=ty7wIXoAAAAJ&hl=en
36,L Hanzo,"Chair of Telecommunications, University of Southampton",105,7201,64121,83,34452,https://research.com/u/l-hanzo,telecommunications/wireless communication/quantum_information_science/video_coding/video_networking,https://scholar.google.co.uk/citations?user=p0jnEW0AAAAJ&hl=en
37,L Hanzo,"Chair of Telecommunications, University of Southampton",105,7201,64121,83,34452,https://research.com/u/l-hanzo,telecommunications/wireless communication/quantum_information_science/video_coding/video_networking,https://scholar.google.co.uk/citations?user=p0jnEW0AAAAJ&hl=en
38,Robert Heath,"Lampe Distinguished Professor, North Carolina State University",134,8130,78871,94,45830,https://ieeexplore.ieee.org/author/38029441300,wireless/MIMO/communications/signal processing/information theory,https://scholar.google.com/citations?user=17Ko8Q0AAAAJ&hl=en
39,Francisco Herrera,"Professor Computer Science and AI, Granada University, Senior Research Advisor in DL&ML at Sherpa.ai",158,11586,107158,124,62138,https://www.instagram.com/herrerabox/?hl=en,Artificial Intelligence/Computational Intelligence/Data mining/Evolutionary Algorithms/Big Data Analytics,https://scholar.google.com/citations?user=HULIk-QAAAAJ&hl=en
40,Enrique Herrera-Viedma,"Professor of Computer Science and Artificial Intelligence, Spain, University of Granada",105,5103,44867,90,26761,https://scholar.google.com/citations?user=g8ZXTuYAAAAJ&hl=en,Fuzzy sets/fuzzy decision making/computing with words/multiple criteria decision making/consensus,https://scholar.google.com/citations?user=g8ZXTuYAAAAJ&hl=en
41,Ekram Hossain,"Professor, University of Manitoba, Canada, IEEE Fellow",98,3346,35930,75,21119,https://home.cc.umanitoba.ca/~hossaina/,Wireless communication networks/radio resource allocation/cognitive radio/multi-tier cellular networks,https://scholar.google.com/citations?user=Lb617EMAAAAJ&hl=en
42,Guang-Bin Huang,"Full Professor, Nanyang Technological University, Singapore",69,5979,52326,61,35971,https://scholar.google.com/scholar_url?url=https://arxiv.org/pdf/1607.03306&hl=en&sa=X&ei=evLQYbmYNoqKmgHR3ZC4Aw&scisig=AAGBfm3n8VBHtKCQIQQM_9G7Eya7fEJUCA&oi=scholarr,Machine Learning/Neural Networks/Neuroscience,https://scholar.google.com.sg/citations?user=LhSqQCIAAAAJ&hl=en
43,Kaibin Huang,"Associate Professor, Dept. of EEE, The University of Hong Kong; IEEE Fellow",50,2618,13524,42,10985,https://scholar.google.com/scholar_url?url=https://www.researchgate.net/profile/Changsheng_You/publication/312061424_Mobile_Edge_Computing_Survey_and_Research_Outlook/links/5870ec3408ae8fce491ed97b/Mobile-Edge-Computing-Survey-and-Research-Outlook.pdf%3Fdownload%3Dtrue&hl=en&sa=X&ei=e_LQYaqfN7vGsQLJnqmwDA&scisig=AAGBfm1IBh1Npy0QSOGBHqx88IBfYXSvRw&oi=scholarr,Machine Learning/Mobile Edge Computing/Wireless Communications/Wireless Power Transfer/Stochastic Geometry,https://scholar.google.com/citations?user=HfuA3uIAAAAJ&hl=en
44,Thomas JR Hughes,"Peter O'Donnell Jr. Chair in Computational and Applied Mathematics, University of Texas at Austin",158,7614,129563,101,45750,https://engineering.purdue.edu/Engr/AboutUs/News/Events/DistinguishedLectures/2019-2020/hughes-lecture,Finite Element Methods/Solid Mechanics/Computational Fluid Dynamics/Partial Differential Equations/Isogeometric Analysis,https://scholar.google.com/citations?user=6tPdlYAAAAAJ&hl=en
45,Yaochu Jin,"Humboldt Professor for AI, Bielefeld University and Distinguished Chair, University of Surrey",83,3957,29129,69,18830,https://ieeexplore.ieee.org/author/37086335156,Artificial Intelligence/Evolutionary Computation/Multiobjective Optimization/Federated Learning/Developmental AI,https://scholar.google.com/citations?user=B5WAkz4AAAAJ&hl=en
46,"Nei Kato(IEEE Fellow, IEICE Fellow)","Professor, Graduate School of Information Sciences, Tohoku University, Japan",72,3443,20521,59,14385,https://iccc2013.ieee-iccc.org/tutorials.html,Wireless networking,https://scholar.google.com/citations?user=LfLfZXEAAAAJ&hl=en
47,"Dr. Neeraj Kumar, SMIEEE (Web of Science Highly Cited Researcher 2019, 2020,2021)","Professor, CSED, Thapar Institute of Engineering and Technology, India",86,6292,24528,82,23342,https://www.routledge.com/Internet-of-Energy-for-Smart-Cities-Machine-Learning-Models-and-Techniques/Jindal-Kumar-Aujla/p/book/9780367497750,IoT and Machine Learning/Deep Learning/Blockchain Technology,https://scholar.google.co.in/citations?user=gL9gR-4AAAAJ&hl=en
48,"Dr. Arun Kumar Sangaiah., Ph.D (SM'IEEE)","Professor, School of Computing Science and Engineering, VIT University, Vellore, India",65,4016,13102,65,12986,https://0-scholar-google-com.brum.beds.ac.uk/citations?user=8yF6Xc4AAAAJ&hl=ja,Software Engineering/Computational Intelligence/Internet of Things,https://scholar.google.co.in/citations?user=8yF6Xc4AAAAJ&hl=en
49,Victor C. M. Leung,Shenzhen University / The University of British Columbia,100,6438,45864,85,31573,https://scholar.google.com/scholar_url?url=https://citeseerx.ist.psu.edu/viewdoc/download%3Fdoi%3D10.1.1.941.5437%26rep%3Drep1%26type%3Dpdf&hl=en&sa=X&ei=gvLQYf7MOIf0mgGq2bPADA&scisig=AAGBfm0zezW4rAHdNplD7CDKOE_DZiQqZw&oi=scholarr,communication systems/wireless networks/mobile systems,https://scholar.google.ca/citations?user=ajvCoo4AAAAJ&hl=en
50,Geoffrey Ye Li (李烨),"Chair Professor in Wireless Systems, Dept EEE, Imperial College London",103,5547,50522,80,25678,https://scholar.google.com.sg/citations?user=d0FzG8YAAAAJ&hl=zh-CN,Signal Processing/and/Machine Learning/for/Wireless Communications,https://scholar.google.com/citations?user=d0FzG8YAAAAJ&hl=en
51,Hongyi Li,"Assistant Professor, University of Houston",32,712,3260,30,2880,https://hongyili.net/,watershed hydrology/earth system modeling/coupled human-nature system,https://scholar.google.com/citations?user=yWy-5icAAAAJ&hl=en
52,Jin Li  李进,Professor @Guangzhou University,56,2247,18101,53,13537,http://seea.tju.edu.cn/info/1012/1504.htm,Trust and Security in Artificial Intelligence/Computating and Storage in Cloud Computing/Blockchain,https://scholar.google.com/citations?user=7GDV2vUAAAAJ&hl=en
53,Xuelong Li (Executive Councilor of AAAI),"Professor, Northwestern Polytechnical University, China",115,7686,50846,101,38605,https://studylib.net/doc/13643651/thirtieth-aaai-conference-on-artificial-intelligence-twen...,artificial intelligence/feature extraction/higher-order data analytics,https://scholar.google.com/citations?user=ahUibskAAAAJ&hl=en
54,yongming li,"college of computer science, shaanxi normal university",36,418,4744,25,2616,https://dblp.org/pid/225/2500.html,fuzzy systems/quantume logic and quantum information/lattice/topology/model checking,https://scholar.google.com/citations?user=P3VERZ0AAAAJ&hl=en
55,Huchang Liao (廖虎昌),"IET Fellow, BCS Fellow; Business School, Sichuan University",59,2490,11618,57,11054,https://scholar.google.com/citations?user=rprb9KwAAAAJ&hl=en,Decision analysis/Fuzzy Systems/Multiple criteria decision making/Preference learning,https://scholar.google.co.uk/citations?user=KlWnnbIAAAAJ&hl=en
56,Chong Lin,Qingdao University,68,1846,15518,52,9352,https://clustrmaps.com/person/Chonglin-77b3js,systems and control theory,https://scholar.google.com/citations?user=AQbRErEAAAAJ&hl=en
57,Yan-Jun Liu,Liaoning University of Technology,58,2165,13250,55,11155,https://eee.sustech.edu.cn/?view=%E5%88%98%E8%A8%80%E5%86%9B&jsid=18&lang=en,Adaptive control/fuzzy control/neural networks,https://scholar.google.com/citations?user=x_Wk1jAAAAAJ&hl=en
58,Yuanwei Liu,"Associate Professor in Queen Mary University of London, Web of Science Highly Cited Researcher",47,2700,10280,47,10183,https://scholar.google.com/scholar_url?url=https://www.tandfonline.com/doi/abs/10.3109/09513590.2015.1065478&hl=en&sa=X&ei=jfLQYf3cDZOSy9YPqLqpyA0&scisig=AAGBfm29o-3uEEEDNc7UZCCCy8IwrepMqg&oi=scholarr,NOMA/RIS/UAV Communications/Artifical Intelligence/6G,https://scholar.google.com/citations?user=FxLf7ZAAAAAJ&hl=en
59,Wenjing Lou,"W. C. English Endowed Professor, IEEE Fellow, Virginia Tech, USA",80,3025,38424,62,22590,https://ieeexplore.ieee.org/author/37275345500,Cyber Security/Wireless Networks/Wireless Security/Network Security/Cloud Computing,https://scholar.google.com/citations?user=hM8uAwoAAAAJ&hl=en
60,Majdi Mafarja,"Associate Professor of Computer Science, Birzeit University",32,1663,5394,30,5355,https://ieeexplore.ieee.org/author/37086290316,Feature Selection/Machine Learning/Artificial Intelligence/Bio-inspired Algorithms/Metaheuristics,https://scholar.google.com/citations?user=ftkD0MgAAAAJ&hl=en
61,Luis Martínez,"Professor of Computer Science, University of Jaén",61,2307,21696,53,13139,https://renaissance.stonybrookmedicine.edu/pathology/faculty/martinez,Fuzzy decision making/Computing with words/Recommender Systems,https://scholar.google.com/citations?user=PG3D8UMAAAAJ&hl=en
62,Thomas Marzetta,"Distinguished Industry Professor, Department of Electrical and Computer Engineering, New York",58,4923,45592,46,30998,https://nsf.gov/events/event_summ.jsp?cntn_id=302487&org=NSF,Beyond Massive MIMO,https://scholar.google.com/citations?user=tBLWIBoAAAAJ&hl=en
63,Andreas F. Molisch,"Professor of Electrical Engineering, University of Southern California",100,5194,57656,76,29882,https://researchpapers4scolars.files.wordpress.com/2015/06/andreas-f-molisch-wireless-comm.pdf,wireless propagation channels/multi-antenna systems/ultrawideband communications and positioning/cooperative communications,https://scholar.google.com/citations?user=W0wwrucAAAAJ&hl=en
64,Derrick Wing Kwan Ng,"Scientia  Assoicate Professor,  University of New South Wales",63,3570,17307,62,15834,https://orcid.org/0000-0001-6400-712X,Wireless Communications,https://scholar.google.com/citations?user=NUJSHxoAAAAJ&hl=en
65,H. Nguyen-Xuan,"CIRTech Institute, Ho Chi Minh City University of Technology (HUTECH), Vietnam",66,2195,14795,59,11058,https://www.researchgate.net/profile/H-Nguyen-Xuan,Computational Engineering/Large-scale data/3D Printing/Renewable Energy,https://scholar.google.co.uk/citations?user=3iK9h-gAAAAJ&hl=en
66,Dusit (Tao) Niyato,Nanyang Technological University (NTU),98,6889,43636,82,31994,https://faculty.sustech.edu.cn/asheralievaa/,ดุสิต นิยะโต - เต๋า,https://scholar.google.com/citations?user=T8sVhLMAAAAJ&hl=en
67,Kaoru Ota (太田　香),"MEXT Excellent Young Researcher (文部科学省　卓越研究員), Muroran Institute of Technology",49,2096,8900,47,8545,https://beta.aminer.cn/pub/5c757007f56def97986b569c/customized-network-security-for-cloud-service,,https://scholar.google.com/citations?user=8JVn8RsAAAAJ&hl=ja
68,Mugen Peng,"Beijing University of Posts & Telecommun., IEEE Fellow, Web of Science Highly Cited Researcher",52,2251,14801,45,11062,https://scholar.google.com/citations?user=85mAZVcAAAAJ&hl=en,Fog Radio Access Network/Heterogeneous Networks/Cloud Radio Access Networks/Network Coding/Radio Resource Allocation and Opt,https://scholar.google.com/citations?user=85mAZVcAAAAJ&hl=en
69,HV Poor,"Michael Henry Strater University Professor, Princeton University",152,12225,117074,110,62523,http://en.wikipedia.org/wiki/Xiaodong_Wang_(electrical_engineer),Information Theory/Statistical Signal Processing/Stochastic Analysis,https://scholar.google.com/citations?user=Dq93mOUAAAAJ&hl=en
70,Lianyong Qi(齐连永),"Professor, Qufu Normal University(青年教授，博士生导师，曲阜师范大学)",40,1888,4858,38,4656,https://scholar.google.com/citations?user=pxNRRsAAAAAJ&hl=en,service computing/big data/recommender system,https://scholar.google.com/citations?user=pxNRRsAAAAAJ&hl=en
71,Timon Rabczuk,Bauhaus University Weimar,104,6219,38792,93,30557,https://www.mpie.de/3895910/timon_rabczuk,Computational Mechanics/Solid Mechanics,https://scholar.google.ca/citations?user=3CBuGosAAAAJ&hl=en
72,Kim-Kwang Raymond Choo,"Cloud Tech Endowed Professor, University of Texas at San Antonio; Highly Cited Researcher 2020, 2021",88,5099,22117,85,20507,https://www.linkedin.com/in/raymondchoo?trk=ugc-post-bar__share-text,Cloud Forensics/Cyber Forensics/Cyber Security/IoT Security/Blockchain,https://scholar.google.com/citations?user=rRBNI6AAAAAJ&hl=en
73,Kui Ren,"Professor, Zhejiang University, ACM Fellow, IEEE Fellow",81,3823,38556,71,25225,https://scholar.google.com/scholar?q=Kui+Ren+homepage&hl=en&as_sdt=0&as_vis=1&oi=scholart,Data Security & Privacy/IoT Security/AI Security,https://scholar.google.com/citations?user=uuQA_rcAAAAJ&hl=en
74,Walid Saad,"Professor, Electrical and Computer Engineering",79,6450,28917,72,25520,https://ieeexplore.ieee.org/author/37392237900,6G wireless systems/machine learning/security/cyber-physical systems/Unmanned aerial vehicles (UAVs),https://scholar.google.com/citations?user=kYDNA0UAAAAJ&hl=en
75,Robert Schober,Friedrich-Alexander-University Erlangen-Nuremberg,90,5480,40389,76,29035,https://dblp.org/pid/95/2265,,https://scholar.google.com/citations?user=Uu0BpX8AAAAJ&hl=en
76,"Ling Shao, Fellow of IEEE/IAPR","CTO and Chief Scientist, National Center for Artificial Intelligence (NCAI), KSA",77,5483,28002,76,24766,https://www.aaia-ai.org/fellows?page=14,Computer Vision/Deep Learning/Artificial Intelligence/Medical Imaging/Vision and Language,https://scholar.google.com/citations?user=z84rLjoAAAAJ&hl=en
77,Xuemin (Sherman) Shen,"University Professor, University of Waterloo",127,8687,69963,100,44199,https://scholar.google.com/scholar_url?url=http://bbcr.uwaterloo.ca/~xshen/paper/2017/sapisc.pdf&hl=en&sa=X&ei=oPLQYbv3LsCVy9YPmtSkoAE&scisig=AAGBfm0mRUBpJz65qE5AaKp3thCW8lT70w&oi=scholarr,Wireless networking/MAC/Network security/VANET,https://scholar.google.com/citations?user=Bjl3GwoAAAAJ&hl=cs
78,Peng Shi,"Professor, School of Electrical and Electronic Engineering, The University of Adelaide",147,8363,74227,118,48764,http://faculty.marshall.usc.edu/Peng-Shi/,Systems and Control/Electrical and Electronic Engineering/Cybernetics/Human-Computer Interaction,https://scholar.google.com.hk/citations?user=EGx1iH0AAAAJ&hl=en
79,"Dr. P. N. Suganthan (SCI Highly Cited Researcher 2015-2021), FIEEE'2015","Some Codes available at GitHub, (Hon. Doctorate, U. of Maribor, 2020 ; BA & MA, U. of Cambridge, UK)",101,6235,53860,86,34031,https://www.comp.hkbu.edu.hk/v1/?page=news&id=403,Machine Learning(ML)/Swarm-Evolutionary Computation(SEC)/Neural Networks(ANN)/Applications of ML SEC ANN.,https://scholar.google.com/citations?user=yZNzBU0AAAAJ&hl=en
