85,Huanqing Wang,Michigan Technological University,4,9,39,4,39,https://dl.acm.org/profile/81490664781,Electric vehicle/optimal control/model predictive control,https://scholar.google.com/citations?user=6XxgmPEAAAAJ&hl=en
86,Ping Wang,"York University, IEEE Fellow, York Research Chair, IEEE VTS Distinguished Lecturer",70,3609,22191,58,16633,https://asian.washington.edu/people/ping-wang,wireless communications/Internet of Things/cloud computing/smart grid,https://scholar.google.com/citations?user=3sIHxrcAAAAJ&hl=en
87,Qingqing Wu (武庆庆),University of Macau,48,5056,14166,47,14055,https://zhuanlan.zhihu.com/p/504808950,6G/IRS/UAV communications/Machine learning/MIMO transceiver design,https://scholar.google.com/citations?user=as1T8CMAAAAJ&hl=en
88,Zheng-Guang Wu,Zhejiang University,74,2551,16686,66,12507,https://ieeexplore-ieee-org.ezproxy.u-pec.fr/author/37404351000,Markov Jump Systems/Sampled-Data Control Systems/Neural Networks/Fuzzy Systems/Singular Systems,https://scholar.google.com/citations?user=vy6JCNgAAAAJ&hl=en
89,Yang Xiang,"IEEE Fellow, Professfor, Swinburne University of Technology",67,2801,16830,59,13232,http://www.cis.uoguelph.ca/~yxiang/,Cybersecurity/Network Security/System Security/Software Vulnerability Detection/Blockchain,https://scholar.google.com/citations?user=7ymTWY4AAAAJ&hl=en
90,Xiaolong Xu (许小龙),"Professor, Highly Cited Researcher 2021, Nanjing University of Information Science and Technology",41,1472,5186,41,5131,https://www.transfermarkt.com/xiaolong-xu/profil/spieler/218025,Edge computing/Cloud computing/Big data/Fog computing/Mobile computing,https://scholar.google.com/citations?user=Tyzef4sAAAAJ&hl=en
91,Zeshui Xu (徐泽水),"Member of AE,EASA,IASCYS; DFIETI,FIEEE,FIFSA,FIET,FRSA,FORS,FBCS,FIAAM,FAAIA... Sichuan University",139,8975,74670,109,44302,https://www.researchgate.net/publication/360463578_A_survey_of_linguistic_hedges_Progress_and_prospect,Decision Making/Information Fusion/Fuzzy Sets/Computational Intelligence/Bibliometrics,https://scholar.google.co.uk/citations?user=kd9L_GUAAAAJ&hl=en
92,Xin-She Yang (DPhil),"Computational intelligence, swarm intelligence, optimization, metaheuristics, nature-inspired",91,10488,71777,82,49786,https://www.aminer.org/profile/xin-she-yang/54352decdabfaebba58ad51b,swarm intelligence/optimization/metaheuristics/computational intelligence.,https://scholar.google.com/citations?user=fA6aTlAAAAAJ&hl=th
93,Fei Yu,University of Southern Denmark,9,69,285,8,223,https://www.feiyu-tech.com/vimble-3/,Industry 4.0 technology and smart product development,https://scholar.google.com/citations?user=3OHgAmIAAAAJ&hl=en
94,Xiangxiang Zeng,"Deparment of Computer Science, Hunan University",49,1609,7025,40,5848,https://ieeexplore.ieee.org/author/37087074633,Computational Intelligence/Bio-inspired Intelligence,https://scholar.google.com/citations?user=B20HBMIAAAAJ&hl=en
95,Yong Zeng (曾勇）,"Southeast University, China; Purple Mountain Laboratories, China",52,4168,16747,51,16271,http://gkcccc.org/openchurch/multimedia/podcasts/church%E2%80%99s-role-%0B-purify-assembly?page=19,UAV communications/Massive MIMO/Extremely-Large MIMO (XL-MIMO)/Integrated Sensing and Communication,https://scholar.google.com/citations?user=ENldmwIAAAAJ&hl=en
96,Jianming Zhan,Hubei University for Nationalities,44,992,7296,37,4764,https://dblp.org/pid/23/6246.html,logical algebras(BL-algebras/R0-algebras and MTL-algebras)/fuzzy algebras(semirings/hemirings and rings) and their hyperstuctures(hyperring/hypergroups,https://scholar.google.com/citations?user=XmJAmNIAAAAJ&hl=en
97,Rui Zhang,"Chair Professor, National University of Singapore",123,12512,65184,104,49601,https://ryanzhumich.github.io/,Wireless Communications/MIMO/Cognitive Radio/Wireless Power Transfer/UAV,https://scholar.google.com.sg/citations?user=yoJqPIkAAAAJ&hl=en
98,Xian-Ming Zhang,Swinburne University of Technology,47,2214,11789,43,9745,https://chem.wsu.edu/faculty/xian-ming/,Networked Control Systems/Event-triggered Control/H-infinity Filtering/Time-delay Systems/Neural Networks,https://scholar.google.com/citations?user=aZcLkqgAAAAJ&hl=en
99,Xuyun Zhang,Macquarie University,43,1262,6613,40,5499,https://sites.google.com/site/seanzhangcs/,big data mining/scalable machine learning/big data privacy and cybersecurity/cloud/edge computing/Internet of Things,https://scholar.google.com.au/citations?user=wbF6HL8AAAAJ&hl=en
100,Yan Zhang,"IEEE Fellow, Highly Cited Researcher, University of Oslo, Norway",94,6467,31875,79,24264,https://yz-cnsdqz.github.io/,wireless networks/smart grid/edge intelligence/blockchain/digital twin,https://scholar.google.no/citations?user=-gahn9AAAAAJ&hl=no
101,Quan Zou (邹权),University of Electronic Science and Technology of China,70,3200,15130,62,12687,http://ir.xmu.edu.cn/items/07bdcb2a-7363-46ae-b842-d009a2371d94,Bioinformatics/data mining,https://scholar.google.com/citations?user=RcaUHs4AAAAJ&hl=en
