,Name,Affilation,H-index,Citations 2020,Total_citation,H-index_since_2016,Citation_since_2016,HomePage,Area of Research,Google_Scholar
0,"U Rajendra Acharya (SCI Highly Cited Researcher 2016-2021)  PhD, DEng, DSc","Ngee Ann,  Singapore University of Social Science,  Kuamamoto University, Japan",115,11713,53745,101,41202,https://www.researchgate.net/profile/U-Rajendra-Acharya,Artificial Intelligence/Medical Informatics,https://scholar.google.com.sg/citations?user=8FjY99sAAAAJ&hl=en
1,IAN  F.  AKYILDIZ,"Truva Inc. , USA",133,6616,135299,82,39773,https://scholar.google.com/citations?user=rAGwv14AAAAJ&hl=en,Wireless Communication/5G/6G Wireless Systems/Intelligent Surfaces for Wireless Communication/Nano-scale and Molecular Commun,https://scholar.google.com/citations?user=rAGwv14AAAAJ&hl=en
2,Ibrahim Aljarah,"Professor of Big Data Mining and Computational Intelligence, The University of Jordan",45,3314,8916,44,8740,https://scholar.google.com/citations?user=moOTIYEAAAAJ&hl=en,Artificial  intelligence/Swarm Intelligence/Data Science/Machine Learning/Evolutionary Computation,https://scholar.google.com/citations?user=moOTIYEAAAAJ&hl=en
3,Jeffrey Andrews,"Cockrell Family Endowed Chair and Director of 6G@UT, University of Texas at Austin",106,3857,66122,72,29685,https://www.jeffandrewsdesign.com/projects-main,Wireless Communications/Communication Theory/Machine Learning for Communications/Stochastic Geometry/Information Theory,https://scholar.google.com/citations?user=Hr9Gey0AAAAJ&hl=en
4,Bennis Mehdi,"Full Professor, IEEE Fellow, Head of ICON, University of Oulu",69,7061,26338,66,23756,https://fi.linkedin.com/in/mehdi-bennis-56a4715?trk=public_profile_browsemap,B5G/6G/machine learning/semantic communication,https://scholar.google.com/citations?user=RW4sJu8AAAAJ&hl=en
5,Emil Björnson,"Professor of Wireless Communication, KTH Royal Institute of Technology",63,4519,18833,60,15964,https://ebjornson.com/,Massive MIMO/Cell-free Massive MIMO/RIS/Signal processing/Wireless communication,https://scholar.google.se/citations?user=Maij4akAAAAJ&hl=en
6,Rajkumar Buyya,"CLOUDS Lab, School of Computing and Information Systems, The University of Melbourne, Australia",155,11294,125613,106,62200,https://au.linkedin.com/in/rajkumar-buyya-aba219,Computer Systems/Cloud Computing/Distributed Systems/Edge Computing/Internet of Things,https://scholar.google.com/citations?user=7xN6JqYAAAAJ&hl=en
7,Xing Cai,"Senior Research Scientist at Simula Research Laboratory, Professor at University of Oslo",19,137,2050,13,767,https://koei.fandom.com/wiki/Xingcai#Dynasty_Warriors,Parallel programming/High-performance computing/numerical methods for PDEs,https://scholar.google.com/citations?user=IWQbrcK5CEwC&hl=en
8,Giuseppe Caire,"Professor, Technical University of Berlin, Germany, and Professor of Electrical Engineering (on",83,2864,39784,57,16338,https://braincity.berlin/en/our-ambassadors/prof-dr-giuseppe-caire,Information Theory/Communications/Signal Processing/Statistics,https://scholar.google.com/citations?user=g66ErTcAAAAJ&hl=en
9,Jinde Cao,"Academician, RAE/AE/RAEN/LAS/AAS/EASA/PAS/IASCYS  & FIEEE/FAAIA/DFIETI; Southeast University",131,8925,71142,91,41397,https://dblp.org/pid/77/2845,Complex networks/neural networks/multi-agent systems - engineering stability - dynamics and control - time-delay systems,https://scholar.google.com/citations?user=8_ffELYAAAAJ&hl=en
10,C. L. Philip Chen,"Chair Professor, South China University of Technology, Philip.Chen@ieee.org",95,7367,38586,83,29076,https://engineering.purdue.edu/ECE/Alums/OECE/2016/chen.html,Computational Intelligence/Intelligent Control/Cybernetics/Intelligent Transportation Systems/Data Science/Engineering,https://scholar.google.com/citations?user=Q5248zwAAAAJ&hl=en
11,Jinjun Chen,"Professor and Deputy Institute Director, Swinburne University of Technology",68,2312,13389,51,9151,https://au.linkedin.com/in/jinjun-chen-b6767053,Cloud Computing/Scalable Architecture/Scalable Data Storage/Scalable Data Processing (Privacy),https://scholar.google.com/citations?user=mQ9vJ24AAAAJ&hl=en
12,Min Chen,"Professor, IEEE Fellow, Highly Cited Researcher, Huazhong University of Science and Technology",90,6037,34619,72,25527,https://twitter.com/minchenduoduo?lang=en,Cognitive Computing and Big Data Analytics/IoT Sensing/5G Networks/Robotics/Edge Computing,https://scholar.google.com/citations?user=_HyHTrsAAAAJ&hl=en
13,Xiaofeng Chen,"Professor, Xidian University, China",58,1736,13428,49,9972,https://sites.google.com/view/rickychen,Security/Cryptography/Cloud computing,https://scholar.google.com/citations?user=-3WhJecAAAAJ&hl=en
14,Francisco Chiclana,"Professor of Computational Intelligence and Decision Making, De Montfort University, UK",68,2409,20042,59,11678,https://orcid.org/0000-0002-3952-4210,Decision making/computational intelligence/information fusion/consensus/sentiment analysis,https://scholar.google.com/citations?user=qDOxZIIAAAAJ&hl=en
15,zhihua cui,"Taiyuan University of Science and Technology, Taiyuan, Shanxi, China, 030024",44,1708,8286,35,6171,http://www.mirlabs.net/global/index.php?c=main&a=person&id=489,evolutionary computation,https://scholar.google.com/citations?user=BpDrULIAAAAJ&hl=en
16,Linglong Dai,"Associate Professor, Tsinghua University; IEEE Fellow",65,3330,16645,59,15007,http://oa.ee.tsinghua.edu.cn/dailinglong/,Wireless Communications/RIS/Massive MIMO/Millimeter-Wave/Teraherz Communications/Non-Orthogonal Mutiple Access,https://scholar.google.com/citations?user=OTFnifoAAAAJ&hl=en
17,Merouane Debbah,"Centralesupelec, Technology Innovation Institute, MBZUAI, Lagrange Mathematics Center",100,9029,48362,83,34403,https://scholar.google.com/scholar?q=Merouane+Debbah+homepage&hl=en&as_sdt=0&as_vis=1&oi=scholart,5G/6G/Machine Learning/Random Matrix Theory/Game Theory,https://scholar.google.com/citations?user=HU5I0X4AAAAJ&hl=en
18,Zhiguo Ding,"University of Manchester, Fellow of IEEE, Web of Science Highly Cited Researcher",93,8188,38410,86,34168,https://ece.princeton.edu/people/zhiguo-ding,Wireless communications/signal processing/and cross-layer optimization,https://scholar.google.co.uk/citations?user=V-nB8scAAAAJ&hl=en
19,"Mianxiong Dong, Foreign Fellow of EAJ","Vice President and Professor, Muroran Institute of Technology, Japan",55,2180,11074,49,9695,http://www.wikicfp.com/cfp/servlet/event.showcfp?eventid=94233&copyownerid=110304,Cyber-Physical Systems/Internet of Things/Artificial Intelligence,https://scholar.google.co.jp/citations?user=TqyApAUAAAAJ&hl=en
20,Yucheng Dong,"Professor of Management and Systems Sciences, Sichuan University",61,2221,11828,56,9543,https://www.linkedin.com/in/yuchendong,Decision Analysis/Human Dynamics/Social Network/Data Science,https://scholar.google.com/citations?user=tFVYDw4AAAAJ&hl=en
21,Maged Elkashlan,"Associate Professor, Queen Mary University of London",60,2704,15428,54,12983,http://mbmc.info/index.php/editorial-board/maged-elkashlan/,IRS/URLLC/UAV/PLS/NOMA,https://scholar.google.com/citations?user=mncnnOAAAAAJ&hl=en
22,Zubair Md. Fadlullah,"Associate Professor, Research Chair, Department of Computer Science, Lakehead University, TBRHRI",40,1327,7595,38,5869,https://www.tbrhri.ca/scientists/dr-zubair-fadlullah/,Beyond 5G/Smart Health/UAV & Energy efficient Networks/QoS & Security/Deep Learning applications,https://scholar.google.com/citations?user=dZyfKpYAAAAJ&hl=en
23,Hossam Faris,"Professor, The University of Jordan",49,4365,11828,48,11597,https://ieeexplore.ieee.org/author/38016215500,Data Science/Knowledge Systems/Data Mining/Evolutionary computation,https://scholar.google.com/citations?user=UEYd--YAAAAJ&hl=en
24,Giancarlo Fortino,"Full Prof. of Computer Engineering, University of Calabria, FIEEE, FAAIA, Highly Cited Researcher",67,3683,16321,59,13240,http://www.ocibe.com/page13.html,Human-Machine Systems/Agent-based Computing/Internet of Things/Wearable Computing/Wireless/Body Area Networks,https://scholar.google.com/citations?user=ecImn1MAAAAJ&hl=it
25,Hamido Fujita,Iwate Prefectural University,69,4452,17198,69,15996,http://www.fujita.soft.iwate-pu.ac.jp/,Machine Learning,https://scholar.google.com/citations?user=MxzV1nQAAAAJ&hl=en
26,Erik G. Larsson,"Professor, Dept. of Electrical Engineering (ISY), Linköping University, Sweden",88,6288,45149,68,29176,https://www.amazon.com/Books-Erik-G-Larsson/s?rh=n%3A283155%2Cp_27%3AErik+G.+Larsson,Wireless communications/statistical signal processing/localization/massive MIMO/networks,https://scholar.google.se/citations?user=79Lry6oAAAAJ&hl=en
27,Amir H. Gandomi,"Professor of Data Science, University of Technology Sydney",78,6891,29517,68,22902,https://scholar.google.com/scholar_url?url=https://www.tandfonline.com/doi/abs/10.1080/10298436.2021.1969019&hl=en&sa=X&ei=Rf6bYoa-MIWVy9YPguGT4Ag&scisig=AAGBfm3ILy9_ZioDeMB_XjZm0Fn2lTszmw&oi=scholarr,Data Analytics/Genetic Programming/Engineering Optimization/Evolutionary Computation/Smart Cities,https://scholar.google.com/citations?user=VMf3wfMAAAAJ&hl=en
28,Xiaohua Ge,"Swinburne University of Technology, Melbourne, Australia",37,2030,7228,36,7027,https://www.researchgate.net/profile/Xiaohua_Ge/2,Networked control systems/Cyber-physical systems/Multi-agent systems/Intelligent vehicles/Connected automated vehicles,https://scholar.google.com.au/citations?user=B37CYFoAAAAJ&hl=en
29,"Mohsen Guizani, FIEEE",Mohamed Bin Zayed University of Artificial Intelligence (MBZUAI),92,10813,45101,80,37708,https://ietresearch.onlinelibrary.wiley.com/hub/journal/26328925/homepage/editorial-board,Internet of Things/Applied AI/ML and Cybersecurity,https://scholar.google.com/citations?user=RigrYkcAAAAJ&hl=en
30,Song Guo,"FCAE, FIEEE, The Hong Kong Polytechnic University",72,4322,21581,65,17582,https://dblp.org/pid/01/267-1,Edge AI/Wireless Networking/Big Data Computing/Distributed System,https://scholar.google.com/citations?user=Ib-sizwAAAAJ&hl=en
31,Harald Haas,The University of Edinburgh,95,5570,45811,76,29762,https://www.comsoc.org/harald-haas,Optical Wireless Communications/Interference Managment in Wireless Networks/Spatial Modulation,https://scholar.google.com/citations?user=XxIwRJQAAAAJ&hl=ja
32,Yuki Hagiwara,Fraunhofer IKS,30,1957,6717,30,6692,https://scholar.google.com/scholar?q=Yuki+Hagiwara+homepage&hl=en&as_sdt=0&as_vis=1&oi=scholart,Artificial Intelligence,https://scholar.google.com.sg/citations?user=P6WI2DQAAAAJ&hl=en
33,"Qing-Long Han, Pro Vice-Chancellor and Distinguished Professor, MAE, IEEE Fellow",Swinburne University of Technology,110,6292,38892,91,26688,https://scholar.zheng98.com/citations?user=j0pyptAAAAAJ&hl=ko,Networked control systems/time-delay systems/multi-agent systems/smart grids/unmanned surface vehicles,https://scholar.google.com.au/citations?user=j0pyptAAAAAJ&hl=en
34,Zhu Han,University of Houston,119,8465,57997,91,38605,http://www2.egr.uh.edu/~zhan2/,Game Theory/Wireless Networking/Security/Data Science/Smart Grid,https://scholar.google.com/citations?user=ty7wIXoAAAAJ&hl=en
35,L Hanzo,"Chair of Telecommunications, University of Southampton",109,8258,68673,84,35880,https://www.researchgate.net/profile/L-Hanzo,telecommunications/wireless communication/quantum_information_science/video_coding/video_networking,https://scholar.google.co.uk/citations?user=p0jnEW0AAAAJ&hl=en
36,L Hanzo,"Chair of Telecommunications, University of Southampton",109,8258,68673,84,35880,https://www.encyclopedia.com/arts/educational-magazines/hanzo-lajos-1952,telecommunications/wireless communication/quantum_information_science/video_coding/video_networking,https://scholar.google.co.uk/citations?user=p0jnEW0AAAAJ&hl=en
37,Robert Heath,"Lampe Distinguished Professor, North Carolina State University",137,7693,80838,91,42232,https://www.linkedin.com/in/robert-heath-7516201bb,wireless/MIMO/communications/signal processing/information theory,https://scholar.google.com/citations?user=17Ko8Q0AAAAJ&hl=en
38,Francisco Herrera,"Professor Computer Science and AI, Granada University, Spain",163,14634,113842,122,61599,https://twitter.com/herrerabox?lang=en,Artificial Intelligence/Computational Intelligence/Data mining/Evolutionary Algorithms/Big Data Analytics,https://scholar.google.com/citations?user=HULIk-QAAAAJ&hl=en
39,Enrique Herrera-Viedma,"Professor of Computer Science and Artificial Intelligence, Spain, University of Granada",108,5980,47891,91,26673,https://www.ugr.es/en/about/organization/positions/vice-rector-for-research-and-transfer,Fuzzy sets/fuzzy decision making/computing with words/multiple criteria decision making/consensus,https://scholar.google.com/citations?user=g8ZXTuYAAAAJ&hl=en
40,Ekram Hossain,"Professor, University of Manitoba, Canada, IEEE Fellow",98,3234,36573,70,18862,https://scholar.google.com/scholar_url?url=https://ieeexplore.ieee.org/abstract/document/6678114/&hl=en&sa=X&ei=UP6bYpuYAdCVy9YPsMWc2Ao&scisig=AAGBfm1lCS9mN0IUc9bE6aflBmdmJeXNYg&oi=scholarr,Wireless communication networks/radio resource allocation/cognitive radio/multi-tier cellular networks,https://scholar.google.com/citations?user=Lb617EMAAAAJ&hl=en
41,Guang-Bin Huang,"Full Professor, Nanyang Technological University, Singapore",71,5611,54844,61,32830,https://scholar.google.com/scholar_url?url=https://www.researchgate.net/profile/Narasimhan-Sundararajan/publication/7281816_Classification_of_Mental_Tasks_from_EEG_Signals_Using_Extreme_Learning_Machines/links/00b7d5190fb196fe3e000000/Classification-of-Mental-Tasks-from-EEG-Signals-Using-Extreme-Learning-Machines.pdf&hl=en&sa=X&ei=UP6bYsriMYWVy9YPguGT4Ag&scisig=AAGBfm2C1jkiPMDUoN2_KiL7H43tHbSfaA&oi=scholarr,Machine Learning/Neural Networks/Neuroscience,https://scholar.google.com.sg/citations?user=LhSqQCIAAAAJ&hl=en
42,Kaibin Huang,"Professor, Dept. of EEE, The University of Hong Kong; IEEE Fellow; ISI Highly Cited Researcher",51,2891,14874,43,11528,https://scholar.google.com/scholar?q=Kaibin+Huang+homepage&hl=en&as_sdt=0&as_vis=1&oi=scholart,Machine Learning/Mobile Edge Computing/Wireless Communications/Wireless Power Transfer/Stochastic Geometry,https://scholar.google.com/citations?user=HfuA3uIAAAAJ&hl=en
43,Thomas JR Hughes,"Peter O'Donnell Jr. Chair in Computational and Applied Mathematics, University of Texas at Austin",150,7028,127899,92,40295,https://www.nae.edu/29165/Dr-Thomas-JR-Hughes,Finite Element Methods/Solid Mechanics/Computational Fluid Dynamics/Partial Differential Equations/Isogeometric Analysis,https://scholar.google.com/citations?user=6tPdlYAAAAAJ&hl=en
44,Yaochu Jin,"A. v. Humboldt Professor for AI, Bielefeld University and Distinguished Chair, University of Surrey",88,5623,32092,73,20174,https://en.wikipedia.org/wiki/Yaochu_Jin,Evolutionary computation/Multiobjective optimization/Multiobjective learning/Trustworthy AI/Developmental AI,https://scholar.google.com/citations?user=B5WAkz4AAAAJ&hl=en
45,"Nei Kato(IEEE Fellow, IEICE Fellow)","Professor and Dean, Graduate School of Information Sciences, Tohoku University, Japan",74,3193,21873,58,14292,http://www.ic-wcsp.org/2013/show.asp?id=36,Wireless networking,https://scholar.google.com/citations?user=LfLfZXEAAAAJ&hl=en
46,"Dr. Neeraj Kumar, SMIEEE (Web of Science Highly Cited Researcher 2019, 2020,2021)","Professor, CSED, Thapar Institute of Engineering and Technology, India",93,9864,28923,89,26940,https://cse.umn.edu/cs/news/knights-named-2020-highly-cited-researcher,IoT and Machine Learning/Deep Learning/Blockchain Technology,https://scholar.google.co.in/citations?user=gL9gR-4AAAAJ&hl=en
47,"Dr. Arun Kumar Sangaiah, (Web of Science Highly Cited Researcher, SM'IEEE)","Professor, VIT University, Vellore, India",71,4689,15159,70,14969,http://www.hebmlc.org/en/,Software Engineering/Computational Intelligence/Internet of Things,https://scholar.google.co.in/citations?user=8yF6Xc4AAAAJ&hl=en
48,Victor C. M. Leung,Shenzhen University / The University of British Columbia,103,6395,48369,84,30867,https://scholar.google.com/scholar_url?url=https://citeseerx.ist.psu.edu/viewdoc/download%3Fdoi%3D10.1.1.941.5437%26rep%3Drep1%26type%3Dpdf&hl=en&sa=X&ei=Vv6bYpKjAraTy9YPssShsA0&scisig=AAGBfm0zezW4rAHdNplD7CDKOE_DZiQqZw&oi=scholarr,communication systems/wireless networks/mobile systems,https://scholar.google.ca/citations?user=ajvCoo4AAAAJ&hl=en
49,Geoffrey Ye Li (李烨),"Chair Professor in Wireless Systems, Dept EEE, Imperial College London",108,5785,53421,78,25037,http://scholar.google.com/citations?user=d0FzG8YAAAAJ&hl=zh-CN,Signal Processing/and/Machine Learning/for/Wireless Communications,https://scholar.google.com/citations?user=d0FzG8YAAAAJ&hl=en
50,Hongyi Li,"Assistant Professor, University of Houston",34,927,3741,31,3149,https://hongyili.net/,watershed hydrology/earth system modeling/coupled human-nature system,https://scholar.google.com/citations?user=yWy-5icAAAAJ&hl=en
51,Jin Li  李进,Professor @Guangzhou University,59,1970,18999,53,12566,https://www.facebook.com/LI-JIN-ART-Atelier-749684642040678/videos/%E6%9D%8E%E8%BF%9B%E8%89%BA%E6%9C%AF%E5%B7%A5%E4%BD%9C%E5%AE%A4-%E8%AF%BE%E5%A0%82%E4%B9%A6%E7%94%BB%E6%95%99%E5%AD%A6-cours-de-peinture-et-calligraphe-chinoise/2248643622100004/,Trust and Security in Artificial Intelligence/Computating and Storage in Cloud Computing/Blockchain,https://scholar.google.com/citations?user=7GDV2vUAAAAJ&hl=en
52,Xuelong Li (Executive Councilor of AAAI),"Professor, Northwestern Polytechnical University, China",119,8375,54777,98,38158,https://twitter.com/NPUintl/status/1451154302274359299,artificial intelligence/optics and electronics,https://scholar.google.com/citations?user=ahUibskAAAAJ&hl=en
53,yongming li,"college of computer science, shaanxi normal university",37,410,4961,25,2431,https://www.healthprofs.com/us/acupuncturists/yong-ming-li-bridgewater-nj/507114,fuzzy systems/quantume logic and quantum information/lattice/topology/model checking,https://scholar.google.com/citations?user=P3VERZ0AAAAJ&hl=en
54,Huchang Liao (廖虎昌),"IET Fellow, BCS Fellow; Business School, Sichuan University",63,3629,13063,59,11994,http://2019.ecnct.org/committee,Decision analysis/Fuzzy Systems/Multiple criteria decision making/Preference learning,https://scholar.google.co.uk/citations?user=KlWnnbIAAAAJ&hl=en
55,Chong Lin,Qingdao University,70,1955,16446,52,9145,https://dblp.org/pid/72/4213,systems and control theory,https://scholar.google.com/citations?user=AQbRErEAAAAJ&hl=en
56,Yan-Jun Liu,Liaoning University of Technology,62,2325,14299,58,10878,https://eee.sustech.edu.cn/?view=%E5%88%98%E8%A8%80%E5%86%9B&jsid=18&lang=en,Adaptive control/fuzzy control/neural networks,https://scholar.google.com/citations?user=x_Wk1jAAAAAJ&hl=en
57,Yuanwei Liu,"Associate Professor in Queen Mary University of London, Web of Science Highly Cited Researcher",51,3495,12128,50,11849,https://dblp.org/pid/93/8541,NOMA/RIS/AI/6G/Integrated Sensing and Communications,https://scholar.google.com/citations?user=FxLf7ZAAAAAJ&hl=en
58,Wenjing Lou,"W. C. English Endowed Professor, IEEE Fellow, Virginia Tech, USA",83,2776,39658,60,19138,https://en.wikipedia.org/wiki/Wenjing_Lou,Cyber Security/Wireless Networks/Wireless Security/Network Security/Cloud Computing,https://scholar.google.com/citations?user=hM8uAwoAAAAJ&hl=en
59,Majdi Mafarja,"Associate Professor of Computer Science, Birzeit University",34,2677,6747,33,6696,https://dl.acm.org/profile/83058775557,Feature Selection/Machine Learning/Artificial Intelligence/Bio-inspired Algorithms/Metaheuristics,https://scholar.google.com/citations?user=ftkD0MgAAAAJ&hl=en
60,Luis Martínez,"Professor of Computer Science, University of Jaén",63,2732,22765,52,12743,https://medicine.missouri.edu/faculty/luis-martinez-lemus-dvm-phd,Fuzzy decision making/Computing with words/Recommender Systems,https://scholar.google.com/citations?user=PG3D8UMAAAAJ&hl=en
61,Thomas Marzetta,"Distinguished Industry Professor, Department of Electrical and Computer Engineering, New York",59,4654,47420,46,28178,https://ieeexplore.ieee.org/author/37282754500,Beyond Massive MIMO,https://scholar.google.com/citations?user=tBLWIBoAAAAJ&hl=en
62,Seyedali Mirjalili,"Professor, Torrens University Australia, Adjunct Griffith University",76,17035,51568,75,49379,https://scholar.google.com/scholar?q=Seyedali+Mirjalili+homepage&hl=en&as_sdt=0&as_vis=1&oi=scholart,Metaheuristics/Robust Optimization/Engineering Optimization/Evolutionary Algorithm/Swarm Intelligence,https://scholar.google.com/citations?user=TJHmrREAAAAJ&hl=en
63,Andreas F. Molisch,"Professor of Electrical Engineering, University of Southern California",101,5223,59475,71,28098,https://research.com/u/andreas-f-molisch,wireless propagation channels/multi-antenna systems/ultrawideband communications and positioning/cooperative communications,https://scholar.google.com/citations?user=W0wwrucAAAAJ&hl=en
64,Derrick Wing Kwan Ng,"Scientia  Assoicate Professor,  University of New South Wales",66,3938,19354,63,16689,https://research.com/u/derrick-wing-kwan-ng,Wireless Communications,https://scholar.google.com/citations?user=NUJSHxoAAAAJ&hl=en
65,H. Nguyen-Xuan,"CIRTech Institute, HUTECH University, Vietnam",69,2524,15908,59,11247,https://scholar.google.co.uk/citations?user=3iK9h-gAAAAJ&hl=en,Computational Engineering/Large-scale data/3D Printing/Renewable Energy,https://scholar.google.co.uk/citations?user=3iK9h-gAAAAJ&hl=en
66,Dusit (Tao) Niyato,Nanyang Technological University (NTU),103,8763,48407,85,33483,https://scholar.google.com/citations?user=T8sVhLMAAAAJ&hl=en,ดุสิต นิยะโต - เต๋า,https://scholar.google.com/citations?user=T8sVhLMAAAAJ&hl=en
67,Kaoru Ota (太田　香),"MEXT Excellent Young Researcher (文部科学省　卓越研究員), Muroran Institute of Technology",50,2071,9845,48,8971,https://m.facebook.com/kaoru.ota.7524,,https://scholar.google.com/citations?user=8JVn8RsAAAAJ&hl=ja
68,Mugen Peng,"Beijing University of Posts & Telecommun., IEEE Fellow, Web of Science Highly Cited Researcher",53,2318,15685,46,11050,https://dl.acm.org/profile/81456639314,Fog Computing/Cloud Radio Access Networks/Integrated Satellite-Terrestrial Networks/6G,https://scholar.google.com/citations?user=85mAZVcAAAAJ&hl=en
69,HV Poor,"Michael Henry Strater University Professor, Princeton University",155,14311,122771,106,61216,https://dl.acm.org/profile/81100081201,Communication Systems/Wireless Communications/Communications/Statistical Signal Processing/Information Theory,https://scholar.google.com/citations?user=Dq93mOUAAAAJ&hl=en
70,Lianyong Qi(齐连永),"Professor, Qufu Normal University",45,1879,5924,44,5673,https://www.scholat.com/qilianyong.en,service computing/big data/recommender system,https://scholar.google.com/citations?user=pxNRRsAAAAAJ&hl=en
71,Timon Rabczuk,Bauhaus University Weimar,109,7401,42512,92,31949,https://scholar.google.com/scholar_url?url=https://www.researchgate.net/profile/Chien-Thai-Hoang/publication/235903027_Isogeometric_Analysis_of_Laminated_Composite_Plates_Using_the_Higher-Order_Shear_Deformation_Theory/links/02e7e516360ecb9a35000000/Isogeometric-Analysis-of-Laminated-Composite-Plates-Using-the-Higher-Order-Shear-Deformation-Theory.pdf&hl=en&sa=X&ei=Z_6bYrymC6zcsQLXiouQBA&scisig=AAGBfm38XDBZptm8Gbek_l19jeXxFXPZrg&oi=scholarr,Computational Mechanics/Solid Mechanics,https://scholar.google.ca/citations?user=3CBuGosAAAAJ&hl=en
72,Kim-Kwang Raymond Choo,"Cloud Tech Endowed Professor, University of Texas at San Antonio; Highly Cited Researcher 2020, 2021",93,6559,25338,86,22894,https://www.computer.org/profiles/kim-kwang-raymond-choo,Cloud Forensics/Cyber Forensics/Cyber Security/IoT Security/Blockchain,https://scholar.google.com/citations?user=rRBNI6AAAAAJ&hl=en
73,Kui Ren,"Professor, Zhejiang University, ACM Fellow, IEEE Fellow",84,3720,40311,70,22442,https://scholar.google.com/scholar_url?url=https://www.tandfonline.com/doi/abs/10.1080/08927022.2017.1355552&hl=en&sa=X&ei=aP6bYs-8Kp6Ty9YPpIScuAE&scisig=AAGBfm2ZxoUBEsLVxvmTcbtjGIZGa9X3gg&oi=scholarr,Data Security & Privacy/IoT Security/AI Security,https://scholar.google.com/citations?user=uuQA_rcAAAAJ&hl=en
74,Walid Saad,"Professor, Electrical and Computer Engineering",83,7444,32486,74,27430,https://ieeexplore.ieee.org/author/37392237900,6G/machine learning/semantic communications/security and cyber-physical systems/unmanned aerial vehicles,https://scholar.google.com/citations?user=kYDNA0UAAAAJ&hl=en
75,Robert Schober,Friedrich-Alexander-University Erlangen-Nuremberg,94,5358,42945,76,27965,https://dl.acm.org/profile/81343504438,,https://scholar.google.com/citations?user=Uu0BpX8AAAAJ&hl=en
76,"Ling Shao, Fellow of IEEE/IAPR",Terminus Group,86,8253,32327,83,27257,http://www.inceptioniai.org/congratulations-to-prof-ling-shao-on-receiving-the-iapr-fellow-award,Computer Vision/Deep Learning/Artificial Intelligence/Medical Imaging/Vision and Language,https://scholar.google.com/citations?user=z84rLjoAAAAJ&hl=en
77,Xuemin (Sherman) Shen,"University Professor, University of Waterloo",132,9088,74156,103,42725,https://blog.eai-conferences.org/2021/07/23/prof-xuemin-sherman-shen-on-reinforcement-learning-for-resource-management-in-space-air-ground-sag-integrated-vehicular-networks-eai-distinguished-lecture/,Wireless networking/MAC/Network security/VANET,https://scholar.google.com/citations?user=Bjl3GwoAAAAJ&hl=cs
78,Peng Shi,"Professor, School of Electrical and Electronic Engineering, The University of Adelaide",150,8194,77957,113,45837,https://scholar.google.com/scholar_url?url=https://www.tandfonline.com/doi/abs/10.1080/00207720601053675&hl=en&sa=X&ei=bP6bYs7IEtCVy9YPsMWc2Ao&scisig=AAGBfm3lcYinZh33PjNBFk3r-iGvMIkVFQ&oi=scholarr,Systems and Control/Electrical and Electronic Engineering/Cybernetics/Human-Computer Interaction,https://scholar.google.com.hk/citations?user=EGx1iH0AAAAJ&hl=en
