,Name,Affilation,H-index,Citations 2020,Total_citation,H-index_since_2016,Citation_since_2016,HomePage,Area of Research,Google_Scholar
0,"U Rajendra Acharya (SCI Highly Cited Researcher 2016-2021)  PhD, DEng, DSc","Ngee Ann,  Singapore University of Social Science,  University of Malaya, Malaysia",112,11743,50171,98,37682,https://www.mdpi.com/journal/heritage/announcements/3261,Artificial Intelligence/Medical Informatics,https://scholar.google.com.sg/citations?user=8FjY99sAAAAJ&hl=en
1,IAN  F.  AKYILDIZ,"Truva Inc. , USA",131,6585,133411,79,38079,https://ianakyildiz.com/publications/,Wireless Communication/5G/6G Wireless Systems/Intelligent Surfaces for Wireless Communication/Nano-scale and Molecular Commun,https://scholar.google.com/citations?user=rAGwv14AAAAJ&hl=en
2,Ibrahim Aljarah,"Associate Professor, University of Jordan",44,3325,8005,43,7830,https://aljarah.weebly.com/,Artificial  intelligence/Swarm Intelligence/Data Science/Machine Learning/Evolutionary Computation,https://scholar.google.com/citations?user=moOTIYEAAAAJ&hl=en
3,Jeffrey Andrews,"Cockrell Family Endowed Chair in Engineering, University of Texas at Austin",105,3771,65206,71,28821,https://sites.utexas.edu/jandrews/,Wireless Communications/Communication Theory/Machine Learning for Communications/Stochastic Geometry/Information Theory,https://scholar.google.com/citations?user=Hr9Gey0AAAAJ&hl=en
4,Bennis Mehdi,"Full Professor, IEEE Fellow, Head of ICON, University of Oulu",68,6982,24416,64,21831,https://dblp.org/pid/09/3625,B5G/6G/machine learning/semantic communication,https://scholar.google.com/citations?user=RW4sJu8AAAAJ&hl=en
5,Emil Björnson,"Professor of Wireless Communication, KTH Royal Institute of Technology",61,4573,17645,59,14791,https://ebjornson.com/research/publications/,Massive MIMO/Cell-free Massive MIMO/RIS/Signal processing/Wireless communication,https://scholar.google.se/citations?user=Maij4akAAAAJ&hl=en
6,Rajkumar Buyya,"CLOUDS Lab, School of Computing and Information Systems, The University of Melbourne, Australia",153,11156,122597,102,59301,https://ieeexplore.ieee.org/author/37267557900,Computer Systems/Cloud Computing/Distributed Systems/Edge Computing/Internet of Things,https://scholar.google.com/citations?user=7xN6JqYAAAAJ&hl=en
7,Xing Cai,"Senior Research Scientist at Simula Research Laboratory, Professor at University of Oslo",19,134,2011,13,728,https://www.linkedin.com/in/xingcai,Parallel programming/High-performance computing/numerical methods for PDEs,https://scholar.google.com/citations?user=IWQbrcK5CEwC&hl=en
8,Giuseppe Caire,"Professor, Technical University of Berlin, Germany, and Professor of Electrical Engineering (on",82,2867,39080,55,15693,https://scholar.google.com/citations?user=g66ErTcAAAAJ&hl=en,Information Theory/Communications/Signal Processing/Statistics,https://scholar.google.com/citations?user=g66ErTcAAAAJ&hl=en
9,Jinde Cao,"Academician, RAE/AE/RAEN/LAS/AAS/EASA/PAS/IASCYS  & FIEEE/FAAIA/DFIETI; Southeast University",130,9054,68934,89,39229,https://www.ae-info.org/ae/User/Cao_Jinde,Complex networks/neural networks/multi-agent systems - engineering stability - dynamics and control - time-delay systems,https://scholar.google.com/citations?user=8_ffELYAAAAJ&hl=en
10,C. L. Philip Chen,"Chair Professor, South China University of Technology, Philip.Chen@ieee.org",93,7551,36542,82,27055,https://scholar.google.com/citations?user=Q5248zwAAAAJ&hl=en,Computational Intelligence/Intelligent Control/Cybernetics/Intelligent Transportation Systems/Data Science/Engineering,https://scholar.google.com/citations?user=Q5248zwAAAAJ&hl=en
11,Jinjun Chen,"Professor and Deputy Institute Director, Swinburne University of Technology",68,2313,12739,48,8505,https://publons.com/researcher/3665109/jinjun-chen/,Cloud Computing/Scalable Architecture/Scalable Data Storage/Scalable Data Processing (Privacy),https://scholar.google.com/citations?user=mQ9vJ24AAAAJ&hl=en
12,Min Chen,"Professor, IEEE Fellow, Highly Cited Researcher, Huazhong University of Science and Technology",87,5939,33074,69,24020,https://faculty.washington.edu/minchen2/#Bio,Cognitive Computing and Big Data Analytics/IoT Sensing/5G Networks/Robotics/Edge Computing,https://scholar.google.com/citations?user=_HyHTrsAAAAJ&hl=en
13,Xiaofeng Chen,"Professor, Xidian University, China",56,1705,12893,48,9465,https://dblp.org/pid/c/XiaofengChen1,Security/Cryptography/Cloud computing,https://scholar.google.com/citations?user=-3WhJecAAAAJ&hl=en
14,Francisco Chiclana,"Professor of Computational Intelligence and Decision Making, De Montfort University, UK",68,2517,19366,57,11014,https://scholar.google.fi/citations?user=qDOxZIIAAAAJ&hl=it,Decision making/computational intelligence/information fusion/consensus/sentiment analysis,https://scholar.google.com/citations?user=qDOxZIIAAAAJ&hl=en
15,zhihua cui,"Taiyuan University of Science and Technology, Taiyuan, Shanxi, China, 030024",44,1708,7799,33,5681,https://www.researchgate.net/profile/Zhihua-Cui-6,evolutionary computation,https://scholar.google.com/citations?user=BpDrULIAAAAJ&hl=en
16,Linglong Dai,"Associate Professor, Tsinghua University; IEEE Fellow",64,3338,15713,58,14078,https://ieeexplore.ieee.org/author/37399861100,Wireless Communications/RIS/Massive MIMO/Millimeter-Wave/Teraherz Communications/Non-Orthogonal Mutiple Access,https://scholar.google.com/citations?user=OTFnifoAAAAJ&hl=en
17,Merouane Debbah,"Centralesupelec, Technology Innovation Institute, MBZUAI, Lagrange Mathematics Center",98,9005,46123,81,32198,https://laneas.com/merouane-debbah,5G/6G/Machine Learning/Random Matrix Theory/Game Theory,https://scholar.google.com/citations?user=HU5I0X4AAAAJ&hl=en
18,Yong Deng,"School of Computer and Information Science, Southwest University",75,3524,19506,66,14851,https://dblp.org/pid/66/3604,Evidence Theory/Fuzzy Set Theory/Bio-inspired AI/Complex Networks,https://scholar.google.com/citations?user=8voeILsAAAAJ&hl=en
19,Zhiguo Ding,"University of Manchester, Fellow of IEEE, Web of Science Highly Cited Researcher",91,8212,36221,83,31989,https://ece.princeton.edu/people/zhiguo-ding,Wireless communications/signal processing/and cross-layer optimization,https://scholar.google.co.uk/citations?user=V-nB8scAAAAJ&hl=en
20,"Mianxiong Dong, Foreign Fellow of EAJ","Vice President and Professor, Muroran Institute of Technology, Japan",53,2163,10491,49,9112,http://mail.ibr.cs.tu-bs.de/pipermail/cfp/2021-April/009623.html,Cyber-Physical Systems/Internet of Things/Artificial Intelligence,https://scholar.google.co.jp/citations?user=TqyApAUAAAAJ&hl=en
21,Yucheng Dong,"Professor of Management and Systems Sciences, Sichuan University",58,2324,11256,54,8976,https://www.wpi.edu/people/ydong,Decision Analysis/Human Dynamics/Social Network/Data Science,https://scholar.google.com/citations?user=tFVYDw4AAAAJ&hl=en
22,Maged Elkashlan,"Associate Professor, Queen Mary University of London",60,2725,14741,53,12303,https://dl.acm.org/profile/81461660943,IRS/URLLC/UAV/PLS/NOMA,https://scholar.google.com/citations?user=mncnnOAAAAAJ&hl=en
23,Zubair Md. Fadlullah,"Associate Professor, Research Chair, Department of Computer Science, Lakehead University, TBRHRI",39,1313,7282,37,5558,https://www.zfadlullah.org/experience,Beyond 5G/Smart Health/UAV & Energy efficient Networks/QoS & Security/Deep Learning applications,https://scholar.google.com/citations?user=dZyfKpYAAAAJ&hl=en
24,Hossam Faris,"Professor, The University of Jordan, Al Hussein Technical University",46,4393,10589,44,10361,https://ieeexplore.ieee.org/author/38016215500,Data Science/Knowledge Systems/Data Mining/Evolutionary computation,https://scholar.google.com/citations?user=UEYd--YAAAAJ&hl=en
25,Giancarlo Fortino,"Full Prof. of Computer Engineering, University of Calabria, IEEE Fellow, Highly Cited Researcher",65,3647,15336,55,12264,https://ieeexplore.ieee.org/author/37273318600,Human-Machine Systems/Agent-based Computing/Internet of Things/Wearable Computing/Wireless/Body Area Networks,https://scholar.google.com/citations?user=ecImn1MAAAAJ&hl=it
26,Hamido Fujita,Iwate Prefectural University,64,4789,15887,64,14687,https://ieeexplore.ieee.org/author/37275244500,Machine Learning,https://scholar.google.com/citations?user=MxzV1nQAAAAJ&hl=en
27,Erik G. Larsson,"Professor, Dept. of Electrical Engineering (ISY), Linköping University, Sweden",84,6269,43595,67,27667,https://www.abebooks.com/book-search/title/fundamentals-massive-mimo/author/thomas-marzetta-erik-larsson-hong/,Wireless communications/statistical signal processing/localization/massive MIMO/networks,https://scholar.google.se/citations?user=79Lry6oAAAAJ&hl=en
28,Amir H. Gandomi,"Professor, University of Technology Sydney",74,6882,27027,62,20436,https://ieeexplore.ieee.org/author/37681044500,Data Analytics/Genetic Programming/Engineering Optimization/Evolutionary Computation/Smart Cities,https://scholar.google.com/citations?user=VMf3wfMAAAAJ&hl=en
29,Xiaohua Ge,"Swinburne University of Technology, Melbourne, Australia",35,2052,6624,35,6432,https://au.linkedin.com/in/xiaohua-ge-450982122,Networked control systems/Cyber-physical systems/Multi-agent systems/Intelligent vehicles/Connected automated vehicles,https://scholar.google.com.au/citations?user=B37CYFoAAAAJ&hl=en
30,"Mohsen Guizani, FIEEE",Mohamed Bin Zayed University of Artificial Intelligence (MBZUAI),90,10602,41911,77,34551,http://nljrc.njau.edu.cn/index.php/lecture-prof-mohsen-guizani-qatar-university/,Internet of Things/Applied AI/ML and Cybersecurity,https://scholar.google.com/citations?user=RigrYkcAAAAJ&hl=en
31,Song Guo,"FCAE, FIEEE, The Hong Kong Polytechnic University",71,4287,20503,65,16523,https://www4.comp.polyu.edu.hk/~cssongguo/,Big Data Computing/Edge AI/Mobile Computing/Distributed System,https://scholar.google.com/citations?user=Ib-sizwAAAAJ&hl=en
32,Harald Haas,The University of Edinburgh,93,5513,44355,75,28335,https://www.strath.ac.uk/staff/haasharaldprofessor/,Optical Wireless Communications/Interference Managment in Wireless Networks/Spatial Modulation,https://scholar.google.com/citations?user=XxIwRJQAAAAJ&hl=ja
33,Yuki Hagiwara,Fraunhofer IKS,29,1963,6170,29,6149,https://tumsatdb.kaiyodai.ac.jp/html/100000513_en.html,Artificial Intelligence,https://scholar.google.com.sg/citations?user=P6WI2DQAAAAJ&hl=en
34,"Qing-Long Han, Pro Vice-Chancellor and Distinguished Professor, MAE, IEEE Fellow",Swinburne University of Technology,108,6370,37081,88,24907,https://au.linkedin.com/in/qing-long-han-22992227,Networked control systems/time-delay systems/multi-agent systems/smart grids/unmanned surface vehicles,https://scholar.google.com.au/citations?user=j0pyptAAAAAJ&hl=en
35,L Hanzo,"Chair of Telecommunications, University of Southampton",107,8318,65246,81,32498,https://www.amazon.com/Books-Lajos-Hanzo/s?rh=n%3A283155%2Cp_27%3ALajos+Hanzo,telecommunications/wireless communication/quantum_information_science/video_coding/video_networking,https://scholar.google.co.uk/citations?user=p0jnEW0AAAAJ&hl=en
36,L Hanzo,"Chair of Telecommunications, University of Southampton",107,8318,65246,81,32498,https://www.amazon.com/Books-Lajos-Hanzo/s?rh=n%3A283155%2Cp_27%3ALajos+Hanzo,telecommunications/wireless communication/quantum_information_science/video_coding/video_networking,https://scholar.google.co.uk/citations?user=p0jnEW0AAAAJ&hl=en
37,Robert Heath,"Lampe Distinguished Professor, North Carolina State University",134,7668,79051,89,40547,https://scholar.google.com/citations?user=17Ko8Q0AAAAJ&hl=en,wireless/MIMO/communications/signal processing/information theory,https://scholar.google.com/citations?user=17Ko8Q0AAAAJ&hl=en
38,Francisco Herrera,"Professor Computer Science and AI, Granada University, Spain",160,14746,109831,118,57718,https://www.facebook.com/HERRERABOX/,Artificial Intelligence/Computational Intelligence/Data mining/Evolutionary Algorithms/Big Data Analytics,https://scholar.google.com/citations?user=HULIk-QAAAAJ&hl=en
39,Enrique Herrera-Viedma,"Professor of Computer Science and Artificial Intelligence, Spain, University of Granada",108,6068,46173,87,25017,https://loop.frontiersin.org/people/308448/bio,Fuzzy sets/fuzzy decision making/computing with words/multiple criteria decision making/consensus,https://scholar.google.com/citations?user=g8ZXTuYAAAAJ&hl=en
40,Ekram Hossain,"Professor, University of Manitoba, Canada, IEEE Fellow",96,3168,35724,70,18044,https://home.cc.umanitoba.ca/~hossaina/,Wireless communication networks/radio resource allocation/cognitive radio/multi-tier cellular networks,https://scholar.google.com/citations?user=Lb617EMAAAAJ&hl=en
41,Guang-Bin Huang,"Full Professor, Nanyang Technological University, Singapore",70,5564,53229,60,31249,https://www.ntu.edu.sg/research/research-capabilities/faculty-directory,Machine Learning/Neural Networks/Neuroscience,https://scholar.google.com.sg/citations?user=LhSqQCIAAAAJ&hl=en
42,Kaibin Huang,"Associate Professor, Dept. of EEE, The University of Hong Kong; IEEE Fellow",51,2883,14135,40,10795,https://scholar.google.com/citations?user=HfuA3uIAAAAJ&hl=en,Machine Learning/Mobile Edge Computing/Wireless Communications/Wireless Power Transfer/Stochastic Geometry,https://scholar.google.com/citations?user=HfuA3uIAAAAJ&hl=en
43,Thomas JR Hughes,"Peter O'Donnell Jr. Chair in Computational and Applied Mathematics, University of Texas at Austin",149,7123,125779,90,38339,https://en.wikipedia.org/wiki/Thomas_J.R._Hughes#Books,Finite Element Methods/Solid Mechanics/Computational Fluid Dynamics/Partial Differential Equations/Isogeometric Analysis,https://scholar.google.com/citations?user=6tPdlYAAAAAJ&hl=en
44,Yaochu Jin,"A. v. Humboldt Professor for AI, Bielefeld University and Distinguished Chair, University of Surrey",85,5731,30217,70,18367,https://ieeexplore.ieee.org/author/37276322600,Artificial Intelligence/Evolutionary Computation/Multiobjective Optimization/Federated Learning/Developmental AI,https://scholar.google.com/citations?user=B5WAkz4AAAAJ&hl=en
45,"Nei Kato(IEEE Fellow, IEICE Fellow)","Professor, Graduate School of Information Sciences, Tohoku University, Japan",73,3137,21095,57,13508,http://dce.jlu.edu.cn/info/1196/7937.htm,Wireless networking,https://scholar.google.com/citations?user=LfLfZXEAAAAJ&hl=en
46,"Dr. Neeraj Kumar, SMIEEE (Web of Science Highly Cited Researcher 2019, 2020,2021)","Professor, CSED, Thapar Institute of Engineering and Technology, India",88,9886,26501,83,24509,https://www.mdpi.com/about/announcements/3261,IoT and Machine Learning/Deep Learning/Blockchain Technology,https://scholar.google.co.in/citations?user=gL9gR-4AAAAJ&hl=en
47,"Dr. Arun Kumar Sangaiah., Ph.D (SM'IEEE)","Professor, School of Computing Science and Engineering, VIT University, Vellore, India",67,4681,13989,67,13797,http://www.hebmlc.org/en/,Software Engineering/Computational Intelligence/Internet of Things,https://scholar.google.co.in/citations?user=8yF6Xc4AAAAJ&hl=en
48,Victor C. M. Leung,Shenzhen University / The University of British Columbia,101,6317,46664,82,29207,https://ieeexplore.ieee.org/author/37279114300,communication systems/wireless networks/mobile systems,https://scholar.google.ca/citations?user=ajvCoo4AAAAJ&hl=en
49,Geoffrey Ye Li (李烨),"Chair Professor in Wireless Systems, Dept EEE, Imperial College London",106,5768,51644,78,23334,https://scholar.google.com.sg/citations?user=d0FzG8YAAAAJ&hl=ko,Signal Processing/and/Machine Learning/for/Wireless Communications,https://scholar.google.com/citations?user=d0FzG8YAAAAJ&hl=en
50,Hongyi Li,"Assistant Professor, University of Houston",32,941,3462,28,2872,https://hongyili.net/,watershed hydrology/earth system modeling/coupled human-nature system,https://scholar.google.com/citations?user=yWy-5icAAAAJ&hl=en
51,Jin Li  李进,Professor @Guangzhou University,58,1947,18391,51,11983,http://scholar.google.com/citations?user=7GDV2vUAAAAJ&hl=zh-CN,Trust and Security in Artificial Intelligence/Computating and Storage in Cloud Computing/Blockchain,https://scholar.google.com/citations?user=7GDV2vUAAAAJ&hl=en
52,Xuelong Li (Executive Councilor of AAAI),"Professor, Northwestern Polytechnical University, China",117,8309,52500,95,35900,https://bd.linkedin.com/company/npu-international-college?trk=ppro_cprof,artificial intelligence/optics and electronics,https://scholar.google.com/citations?user=ahUibskAAAAJ&hl=en
53,yongming li,"college of computer science, shaanxi normal university",37,423,4847,24,2315,https://www.linkedin.com/in/yong-ming-li-10991535,fuzzy systems/quantume logic and quantum information/lattice/topology/model checking,https://scholar.google.com/citations?user=P3VERZ0AAAAJ&hl=en
54,Huchang Liao (廖虎昌),"IET Fellow, BCS Fellow; Business School, Sichuan University",61,3862,12164,57,11098,https://baike.baidu.com/item/%E5%BB%96%E8%99%8E%E6%98%8C/16960663,Decision analysis/Fuzzy Systems/Multiple criteria decision making/Preference learning,https://scholar.google.co.uk/citations?user=KlWnnbIAAAAJ&hl=en
55,Chong Lin,Qingdao University,69,2000,15977,50,8695,https://clustrmaps.com/persons/Chong-Lin,systems and control theory,https://scholar.google.com/citations?user=AQbRErEAAAAJ&hl=en
56,Yan-Jun Liu,Liaoning University of Technology,61,2411,13731,57,10313,https://ieeexplore.ieee.org/author/37577989800,Adaptive control/fuzzy control/neural networks,https://scholar.google.com/citations?user=x_Wk1jAAAAAJ&hl=en
57,Yuanwei Liu,"Associate Professor in Queen Mary University of London, Web of Science Highly Cited Researcher",48,3547,11050,47,10770,https://kclpure.kcl.ac.uk/portal/en/persons/yuanwei-liu(2b436c4e-ff5b-46ee-a6a7-eff58f0a7f72).html,NOMA/RIS/AI/6G/Integrated Sensing and Communications,https://scholar.google.com/citations?user=FxLf7ZAAAAAJ&hl=en
58,Wenjing Lou,"W. C. English Endowed Professor, IEEE Fellow, Virginia Tech, USA",81,2700,38796,57,18358,https://cyberinitiative.org/research/researcher-directory/lou-wenjing.html,Cyber Security/Wireless Networks/Wireless Security/Network Security/Cloud Computing,https://scholar.google.com/citations?user=hM8uAwoAAAAJ&hl=en
59,Majdi Mafarja,"Associate Professor of Computer Science, Birzeit University",33,2700,5971,31,5919,https://www.researchgate.net/profile/Majdi-Mafarja,Feature Selection/Machine Learning/Artificial Intelligence/Bio-inspired Algorithms/Metaheuristics,https://scholar.google.com/citations?user=ftkD0MgAAAAJ&hl=en
60,Luis Martínez,"Professor of Computer Science, University of Jaén",61,2882,22074,50,12083,https://scholar.google.com/citations?user=PG3D8UMAAAAJ&hl=en,Fuzzy decision making/Computing with words/Recommender Systems,https://scholar.google.com/citations?user=PG3D8UMAAAAJ&hl=en
61,Thomas Marzetta,"Distinguished Industry Professor, Department of Electrical and Computer Engineering, New York",58,4632,46316,44,27115,https://ieeexplore.ieee.org/author/37282754500,Beyond Massive MIMO,https://scholar.google.com/citations?user=tBLWIBoAAAAJ&hl=en
62,Seyedali Mirjalili,"Professor, Torrens University Australia, Adjunct Griffith University",73,17413,45816,71,43654,https://au.linkedin.com/in/alimirjalili,Metaheuristics/Robust Optimization/Engineering Optimization/Evolutionary Algorithm/Swarm Intelligence,https://scholar.google.com/citations?user=TJHmrREAAAAJ&hl=en
63,Andreas F. Molisch,"Professor of Electrical Engineering, University of Southern California",101,5181,58200,70,26902,https://www.amazon.com/Wireless-Communications-Andreas-F-Molisch/dp/0470741864,wireless propagation channels/multi-antenna systems/ultrawideband communications and positioning/cooperative communications,https://scholar.google.com/citations?user=W0wwrucAAAAJ&hl=en
64,Derrick Wing Kwan Ng,"Scientia  Assoicate Professor,  University of New South Wales",64,3949,18307,61,15643,https://www.researchgate.net/profile/Derrick-Wing-Kwan-Ng,Wireless Communications,https://scholar.google.com/citations?user=NUJSHxoAAAAJ&hl=en
65,H. Nguyen-Xuan,"CIRTech Institute, HUTECH University, Vietnam",67,2544,15211,57,10562,https://dl.acm.org/profile/81418592885,Computational Engineering/Large-scale data/3D Printing/Renewable Energy,https://scholar.google.co.uk/citations?user=3iK9h-gAAAAJ&hl=en
66,Dusit (Tao) Niyato,Nanyang Technological University (NTU),101,8624,45686,82,30798,https://dblp.org/pid/76/440,ดุสิต นิยะโต - เต๋า,https://scholar.google.com/citations?user=T8sVhLMAAAAJ&hl=en
67,Kaoru Ota (太田　香),"MEXT Excellent Young Researcher (文部科学省　卓越研究員), Muroran Institute of Technology",49,2045,9365,47,8492,https://www.adscientificindex.com/university/Muroran+Institute+of+Technology/,,https://scholar.google.com/citations?user=8JVn8RsAAAAJ&hl=ja
68,Mugen Peng,"Beijing University of Posts & Telecommun., IEEE Fellow, Web of Science Highly Cited Researcher",53,2314,15023,44,10402,https://research.com/u/mugen-peng,Fog Computing/Cloud Radio Access Networks/Integrated Satellite-Terrestrial Networks/6G,https://scholar.google.com/citations?user=85mAZVcAAAAJ&hl=en
69,HV Poor,"Michael Henry Strater University Professor, Princeton University",154,14254,118838,103,57391,https://engineering.princeton.edu/faculty/h-vincent-poor,Communication Systems/Wireless Communications/Communications/Statistical Signal Processing/Information Theory,https://scholar.google.com/citations?user=Dq93mOUAAAAJ&hl=en
70,Lianyong Qi(齐连永),"Professor, Qufu Normal University",41,1808,5233,40,4985,https://scholar.google.ca/citations?user=aTZFM3EAAAAJ&hl=en,service computing/big data/recommender system,https://scholar.google.com/citations?user=pxNRRsAAAAAJ&hl=en
71,Timon Rabczuk,Bauhaus University Weimar,106,7512,40288,89,29748,https://scholar.google.com/citations?user=3CBuGosAAAAJ&hl=it,Computational Mechanics/Solid Mechanics,https://scholar.google.ca/citations?user=3CBuGosAAAAJ&hl=en
72,Kim-Kwang Raymond Choo,"Cloud Tech Endowed Professor, University of Texas at San Antonio; Highly Cited Researcher 2020, 2021",91,6419,23484,83,21054,https://people.unisa.edu.au/raymond.choo,Cloud Forensics/Cyber Forensics/Cyber Security/IoT Security/Blockchain,https://scholar.google.com/citations?user=rRBNI6AAAAAJ&hl=en
73,Kui Ren,"Professor, Zhejiang University, ACM Fellow, IEEE Fellow",82,3628,39050,67,21259,http://www.columbia.edu/~kr2002/,Data Security & Privacy/IoT Security/AI Security,https://scholar.google.com/citations?user=uuQA_rcAAAAJ&hl=en
74,Walid Saad,"Professor, Electrical and Computer Engineering",80,7421,30457,72,25418,https://www.netsciwis.com/,6G/machine learning/semantic communications/security and cyber-physical systems/unmanned aerial vehicles,https://scholar.google.com/citations?user=kYDNA0UAAAAJ&hl=en
75,Robert Schober,Friedrich-Alexander-University Erlangen-Nuremberg,92,5446,41440,74,26486,https://www.idc.tf.fau.de/person/robert-schober/,,https://scholar.google.com/citations?user=Uu0BpX8AAAAJ&hl=en
76,"Ling Shao, Fellow of IEEE/IAPR","CTO and Chief Scientist, National Center for Artificial Intelligence (NCAI), SDAIA, KSA",81,8274,29751,78,24697,https://ieeexplore.ieee.org/author/38265369400,Computer Vision/Deep Learning/Artificial Intelligence/Medical Imaging/Vision and Language,https://scholar.google.com/citations?user=z84rLjoAAAAJ&hl=en
77,Xuemin (Sherman) Shen,"University Professor, University of Waterloo",130,8982,71595,100,40330,http://bbcr.uwaterloo.ca/~xshen/research_interests.htm,Wireless networking/MAC/Network security/VANET,https://scholar.google.com/citations?user=Bjl3GwoAAAAJ&hl=cs
78,Peng Shi,"Professor, School of Electrical and Electronic Engineering, The University of Adelaide",149,8414,75727,110,43684,https://www.adelaide.edu.au/directory/peng.shi,Systems and Control/Electrical and Electronic Engineering/Cybernetics/Human-Computer Interaction,https://scholar.google.com.hk/citations?user=EGx1iH0AAAAJ&hl=en
79,"Dr. P. N. Suganthan (SCI Highly Cited Researcher 2015-2021), FIEEE'2015","Some Codes available at GitHub, (Hon. Doctorate, U. of Maribor, 2020 ; BA & MA, U. of Cambridge, UK)",103,7050,55478,85,31389,https://recognition.webofscience.com/awards/highly-cited/2021/,Machine Learning(ML)/Swarm-Evolutionary Computation(SEC)/Neural Networks(ANN)/Applications of ML SEC ANN.,https://scholar.google.com/citations?user=yZNzBU0AAAAJ&hl=en
80,Xingming Sun,Nanjing University of Information Science and Technology,56,1664,15152,50,11926,https://dl.acm.org/profile/81100448221,Digital Watermarking/Information Security,http://scholar.google.com/citations?user=epqnljMAAAAJ&hl=en
81,Tarik Taleb,University of Oulu,66,3511,18381,58,13960,https://www.aalto.fi/en/people/tarik-taleb,Network Function Virtualization/Network Softwarization/Software Defined Networking,https://scholar.google.com/citations?user=o1Ap0TEAAAAJ&hl=en
82,"jen hong, tan","Highly Cited Researcher in Computer Science, National University of Singapore",47,2315,9140,43,8253,https://publons.com/researcher/4043557/jen-hong-tan/,image processing/computer vision/deep learning/infrared thermography/fundus image,https://scholar.google.com/citations?user=uJlD-A0AAAAJ&hl=en
83,Dacheng Tao,The University of Sydney,138,13947,73576,112,52312,https://www.ae-info.org/ae/User/Tao_Dacheng,artificial intelligence/machine learning/computer vision/image processing/data mining,https://scholar.google.com/citations?user=RwlJNLcAAAAJ&hl=en
84,Athanasios Vasilakos,"PROF OF COMPLEX SYSTEMS, CYBERSECURITY, AI",123,7331,54948,104,38083,https://cair.uia.no/people/athanasios-v-vasilakos/,Cybersecurity/IoTs/Mobile Nets/Big Data Analytics/Cloud Computing/Artificial Intelligence/Machine Learning,https://scholar.google.com/citations?user=_yWPQWoAAAAJ&hl=en
85,Huanqing Wang,Michigan Technological University,3,9,32,3,32,https://www.linkedin.com/in/huanqing-wang,Electric vehicle/optimal control/model predictive control,https://scholar.google.com/citations?user=6XxgmPEAAAAJ&hl=en
86,Ping Wang,"York University, IEEE Fellow, York Research Chair, IEEE VTS Distinguished Lecturer",69,3478,20814,56,15222,https://sites.google.com/view/ping-wang-homepage,wireless communications/Internet of Things/cloud computing/smart grid,https://scholar.google.com/citations?user=3sIHxrcAAAAJ&hl=en
