80,"Dr. P. N. Suganthan (SCI Highly Cited Researcher 2015-2021), FIEEE'2015","Some Codes available at GitHub, (Hon. Doctorate, U. of Maribor, 2020 ; BA & MA, U. of Cambridge, UK)",102,6942,54307,84,30248,https://insights2techinfo.com/highly-cited-researchers-by-web-of-science-for-2021/,Machine Learning(ML)/Swarm-Evolutionary Computation(SEC)/Neural Networks(ANN)/Applications of ML SEC ANN.,https://scholar.google.com/citations?user=yZNzBU0AAAAJ&hl=en
81,Xingming Sun,Nanjing University of Information Science and Technology,56,1613,15006,49,11729,https://faculty.nuist.edu.cn/sunxingming/en/index.htm,Digital Watermarking/Information Security,http://scholar.google.com/citations?user=epqnljMAAAAJ&hl=en
82,Tarik Taleb,University of Oulu/Aalto University,64,3349,17983,58,13553,https://www.oulu.fi/university/news/make-noise-about-6g,Network Function Virtualization/Network Softwarization/Software Defined Networking,https://scholar.google.com/citations?user=o1Ap0TEAAAAJ&hl=en
83,"jen hong, tan","Highly Cited Researcher in Computer Science, National University of Singapore",46,2257,8906,43,8016,https://publons.com/researcher/4043557/jen-hong-tan/,image processing/computer vision/deep learning/infrared thermography/fundus image,https://scholar.google.com/citations?user=uJlD-A0AAAAJ&hl=en
84,Dacheng Tao,The University of Sydney,136,13301,71639,111,50311,https://dl.acm.org/profile/81100159571,artificial intelligence/machine learning/computer vision/image processing/data mining,https://scholar.google.com/citations?user=RwlJNLcAAAAJ&hl=en
85,Athanasios Vasilakos,"PROF OF COMPLEX SYSTEMS, CYBERSECURITY, AI",122,6957,53894,101,37026,https://scholar.google.com/scholar_url?url=https://arxiv.org/pdf/1512.05449&hl=en&sa=X&ei=6_LtYce-DpKoywTOyoTACA&scisig=AAGBfm3-H9WShnb_Oat9d_uyBPpjhb9Cfw&oi=scholarr,Cybersecurity/IoTs/Mobile Nets/Big Data Analytics/Cloud Computing/Artificial Intelligence/Machine Learning,https://scholar.google.com/citations?user=_yWPQWoAAAAJ&hl=en
86,Huanqing Wang,Michigan Technological University,2,7,29,2,29,https://dl.acm.org/profile/81490664781,Electric vehicle/optimal control/model predictive control,https://scholar.google.com/citations?user=6XxgmPEAAAAJ&hl=en
87,Ping Wang,York University,68,3292,20335,56,14734,https://economics.wustl.edu/people/ping-wang,wireless communications/Internet of Things/cloud computing/smart grid,https://scholar.google.com/citations?user=3sIHxrcAAAAJ&hl=en
88,Qingqing Wu (武庆庆),"Assistant Professor, University of Macau",43,4818,10727,42,10604,https://qingqingwu.weebly.com/,6G/IRS/UAV communications/Machine learning/MIMO transceiver design,https://scholar.google.com/citations?user=as1T8CMAAAAJ&hl=en
89,Zheng-Guang Wu,Zhejiang University,68,2655,14887,59,10726,https://orcid.org/0000-0003-4460-9785,Markov Jump Systems/Sampled-Data Control Systems/Neural Networks/Fuzzy Systems/Singular Systems,https://scholar.google.com/citations?user=vy6JCNgAAAAJ&hl=en
90,Yang Xiang,"IEEE Fellow, Professfor, Swinburne University of Technology",64,2613,15092,56,11478,https://scholar.google.com/scholar?q=Yang+Xiang+homepage&hl=en&as_sdt=0&as_vis=1&oi=scholart,Cybersecurity/network and system security/deep learning/vulnerability detection/traffic classification,https://scholar.google.com/citations?user=7ymTWY4AAAAJ&hl=en
91,Xiaolong Xu (许小龙),"Professor, Nanjing University of Information Science and Technology",36,1378,3944,36,3891,https://scholar.google.com/scholar_url?url=http://www.gcdz.org/en/article/doi/10.13544/j.cnki.jeg.2017.01.027&hl=zh-CN&sa=X&ei=8PLtYc6JGOGN6rQPhP6PmAg&scisig=AAGBfm01PDBWbO2GMXSCOl44Rt1Su-y0vQ&oi=scholarr,Edge computing/Cloud computing/Big data/Fog computing/Mobile computing,https://scholar.google.com/citations?user=Tyzef4sAAAAJ&hl=en
92,Zeshui Xu (徐泽水),"Academician of EASA,IASCYS; Fellow of IEEE,IFSA,IET,RSA,ORS,BCS,VEBLEO,IAAM,AAIA; Sichuan University",137,9557,71510,105,39873,https://www.aminer.cn.ipv6.dsjfzj.nanning.gov.cn/pub/53e9b586b7602d97040c742d,Decision Making/Information Fusion/Fuzzy Sets/Computational Intelligence/Bibliometrics,https://scholar.google.co.uk/citations?user=kd9L_GUAAAAJ&hl=en
93,Xin-She Yang (DPhil),"Computational intelligence, swarm intelligence, optimization, metaheuristics, nature-inspired",87,10000,66153,79,44228,https://orcid.org/0000-0001-8231-5556,swarm intelligence/optimization/metaheuristics/computational intelligence.,https://scholar.google.com/citations?user=fA6aTlAAAAAJ&hl=th
94,Fei Yu,University of Southern Denmark,9,62,219,7,156,https://www.abe.msstate.edu/people/faculty/fei-yu/,Industry 4.0 technology and smart product development,https://scholar.google.com/citations?user=3OHgAmIAAAAJ&hl=en
95,Xiangxiang Zeng,"Deparment of Computer Science, Hunan University",47,1598,5961,39,4786,https://ieeexplore.ieee.org/author/37591081000,Computational Intelligence/Bio-inspired Intelligence,https://scholar.google.com/citations?user=B20HBMIAAAAJ&hl=en
96,Yong Zeng (曾勇）,"Southeast University, China; Purple Mountain Laboratories, China",43,3575,13814,43,13314,https://www.chinesechemsoc.org/publications/ccschem/authorspotlight,UAV communications/Massive MIMO/Extremely-Large MIMO (XL-MIMO)/Integrated Sensing and Communication,https://scholar.google.com/citations?user=ENldmwIAAAAJ&hl=en
97,Jianming Zhan,Hubei University for Nationalities,42,1054,6704,34,4150,https://dblp.org/pid/23/6246.html,logical algebras(BL-algebras/R0-algebras and MTL-algebras)/fuzzy algebras(semirings/hemirings and rings) and their hyperstuctures(hyperring/hypergroups,https://scholar.google.com/citations?user=XmJAmNIAAAAJ&hl=en
98,Haijun Zhang,"Professor, University of Science and Technology Beijing",43,1676,9258,41,8057,"https://scholar.google.com/scholar_url?url=http://surface.iphy.ac.cn/SF4/publications/papers/2010/14%2520Intrinsic%2520Topological%2520Insulator%2520Bi%25202%2520Te%25203%2520Thin%2520Films%2520on%2520Si%2520and%2520Their%2520Thickness%2520Limit,%2520Adv.%2520Mater.%252022,%25204002%2520(2010).pdf&hl=en&sa=X&ei=9_LtYe7UCY74yASX442gDg&scisig=AAGBfm19TH_ZRTm-1zq0M3Lm7RNumIwe3Q&oi=scholarr",Wireless Communications/Resource Allocation/Mobility Management,https://scholar.google.ca/citations?user=B3oYgSIAAAAJ&hl=en
99,Rui Zhang,"Chair Professor, National University of Singapore",119,11845,58033,99,42289,https://www.eecis.udel.edu/~ruizhang/,Wireless Communications/MIMO/Cognitive Radio/Wireless Power Transfer/UAV,https://scholar.google.com.sg/citations?user=yoJqPIkAAAAJ&hl=en
100,Xian-Ming Zhang,Swinburne University of Technology,46,2252,10401,39,8342,https://scholar.google.com/scholar_url?url=https://www.researchgate.net/profile/Ming-Liang-Tong/publication/227560878_Hydroxylation_of_N-Heterocycle_Ligands_Observed_in_Two_Unusual_Mixed-Valence_CuICuII_Complexes/links/00b7d52c39d137be8d000000/Hydroxylation-of-N-Heterocycle-Ligands-Observed-in-Two-Unusual-Mixed-Valence-CuI-CuII-Complexes.pdf&hl=en&sa=X&ei=-PLtYaG2M43gygTh1Y2wCg&scisig=AAGBfm0oUKshgbd2oo_fCJpR97FtdJX48g&oi=scholarr,Networked Control Systems/Event-triggered Control/H-infinity Filtering/Time-delay Systems/Neural Networks,https://scholar.google.com/citations?user=aZcLkqgAAAAJ&hl=en
101,Xuyun Zhang,Macquarie University,41,1164,5742,38,4616,https://scholar.google.com/scholar?q=Xuyun+Zhang+homepage&hl=en&as_sdt=0&as_vis=1&oi=scholart,big data mining/scalable machine learning/big data privacy and cybersecurity/cloud/edge computing/Internet of Things,https://scholar.google.com.au/citations?user=wbF6HL8AAAAJ&hl=en
102,Yan Zhang,"IEEE Fellow, Highly Cited Researcher, University of Oslo, Norway",89,5863,28083,75,20463,https://www.usf.edu/engineering/cse/people/zhang-yan.aspx,wireless networks/smart grid/edge intelligence/blockchain/digital twin,https://scholar.google.no/citations?user=-gahn9AAAAAJ&hl=no
103,Quan Zou (邹权),University of Electronic Science and Technology of China,65,3210,13249,58,10777,http://upload.xueshu.baidu.com/homepage/u/a75ab6991fe03c8c793d50d5ab666e6c,Bioinformatics/data mining,https://scholar.google.com/citations?user=RcaUHs4AAAAJ&hl=en
