,Name,Affilation,H-index,Citations 2020,Total_citation,H-index_since_2016,Citation_since_2016,HomePage,Area of Research,Google_Scholar
0,"U Rajendra Acharya (SCI Highly Cited Researcher 2016-2021)  PhD, DEng, DSc","Ngee Ann,  Singapore University of Social Science,  Kuamamoto University, Japan",115,11715,53349,101,40813,https://www.researchgate.net/profile/U-Rajendra-Acharya,Artificial Intelligence/Medical Informatics,https://scholar.google.com.sg/citations?user=8FjY99sAAAAJ&hl=en
1,IAN  F.  AKYILDIZ,"Truva Inc. , USA",133,6567,135053,81,39543,https://en.wikipedia.org/wiki/Ian_F._Akyildiz#Research_Contributions,Wireless Communication/5G/6G Wireless Systems/Intelligent Surfaces for Wireless Communication/Nano-scale and Molecular Commun,https://scholar.google.com/citations?user=rAGwv14AAAAJ&hl=en
2,Ibrahim Aljarah,"Professor of Big Data Mining and Computational Intelligence, The University of Jordan",45,3314,8820,44,8644,http://evo-ml.com/ibrahim/biography.html,Artificial  intelligence/Swarm Intelligence/Data Science/Machine Learning/Evolutionary Computation,https://scholar.google.com/citations?user=moOTIYEAAAAJ&hl=en
3,Jeffrey Andrews,"Cockrell Family Endowed Chair and Director of 6G@UT, University of Texas at Austin",106,3856,66044,72,29618,https://www.jeffandrewsdesign.com/new-index,Wireless Communications/Communication Theory/Machine Learning for Communications/Stochastic Geometry/Information Theory,https://scholar.google.com/citations?user=Hr9Gey0AAAAJ&hl=en
4,Bennis Mehdi,"Full Professor, IEEE Fellow, Head of ICON, University of Oulu",69,7035,26109,66,23529,https://twitter.com/PhantomBenn?ref_src=twsrc%5Egoogle%7Ctwcamp%5Eserp%7Ctwgr%5Eauthor,B5G/6G/machine learning/semantic communication,https://scholar.google.com/citations?user=RW4sJu8AAAAJ&hl=en
5,Emil Björnson,"Professor of Wireless Communication, KTH Royal Institute of Technology",63,4512,18694,60,15826,https://dblp.org/pid/67/1658,Massive MIMO/Cell-free Massive MIMO/RIS/Signal processing/Wireless communication,https://scholar.google.se/citations?user=Maij4akAAAAJ&hl=en
6,Rajkumar Buyya,"CLOUDS Lab, School of Computing and Information Systems, The University of Melbourne, Australia",154,11282,125324,106,61926,https://publons.com/researcher/2861619/rajkumar-buyya/,Computer Systems/Cloud Computing/Distributed Systems/Edge Computing/Internet of Things,https://scholar.google.com/citations?user=7xN6JqYAAAAJ&hl=en
7,Xing Cai,"Senior Research Scientist at Simula Research Laboratory, Professor at University of Oslo",19,135,2044,13,761,https://koei.fandom.com/wiki/Xingcai#Dynasty_Warriors,Parallel programming/High-performance computing/numerical methods for PDEs,https://scholar.google.com/citations?user=IWQbrcK5CEwC&hl=en
8,Giuseppe Caire,"Professor, Technical University of Berlin, Germany, and Professor of Electrical Engineering (on",83,2864,39727,57,16286,https://scholar.google.com/citations?user=g66ErTcAAAAJ&hl=en,Information Theory/Communications/Signal Processing/Statistics,https://scholar.google.com/citations?user=g66ErTcAAAAJ&hl=en
9,Jinde Cao,"Academician, RAE/AE/RAEN/LAS/AAS/EASA/PAS/IASCYS  & FIEEE/FAAIA/DFIETI; Southeast University",131,8949,70862,91,41117,https://orcid.org/0000-0003-3133-7119,Complex networks/neural networks/multi-agent systems - engineering stability - dynamics and control - time-delay systems,https://scholar.google.com/citations?user=8_ffELYAAAAJ&hl=en
10,C. L. Philip Chen,"Chair Professor, South China University of Technology, Philip.Chen@ieee.org",95,7360,38396,83,28888,https://engineering.purdue.edu/ECE/Alums/OECE/2016/chen.html,Computational Intelligence/Intelligent Control/Cybernetics/Intelligent Transportation Systems/Data Science/Engineering,https://scholar.google.com/citations?user=Q5248zwAAAAJ&hl=en
11,Jinjun Chen,"Professor and Deputy Institute Director, Swinburne University of Technology",68,2303,13306,51,9068,http://www.azxy5kjw.com/research-institutes/data-science/people/jinjun-chen/,Cloud Computing/Scalable Architecture/Scalable Data Storage/Scalable Data Processing (Privacy),https://scholar.google.com/citations?user=mQ9vJ24AAAAJ&hl=en
12,Min Chen,"Professor, IEEE Fellow, Highly Cited Researcher, Huazhong University of Science and Technology",90,6027,34452,71,25361,https://www.sydney.edu.au/science/about/our-people/academic-staff/min-chen.html,Cognitive Computing and Big Data Analytics/IoT Sensing/5G Networks/Robotics/Edge Computing,https://scholar.google.com/citations?user=_HyHTrsAAAAJ&hl=en
13,Xiaofeng Chen,"Professor, Xidian University, China",58,1723,13370,49,9915,https://dblp.org/pers/hd/c/Chen_0001:Xiaofeng,Security/Cryptography/Cloud computing,https://scholar.google.com/citations?user=-3WhJecAAAAJ&hl=en
14,Francisco Chiclana,"Professor of Computational Intelligence and Decision Making, De Montfort University, UK",68,2421,19993,59,11629,https://ieeexplore.ieee.org/author/37330500000,Decision making/computational intelligence/information fusion/consensus/sentiment analysis,https://scholar.google.com/citations?user=qDOxZIIAAAAJ&hl=en
15,zhihua cui,"Taiyuan University of Science and Technology, Taiyuan, Shanxi, China, 030024",44,1709,8230,35,6116,https://scholar.google.com/citations?user=BpDrULIAAAAJ&hl=en,evolutionary computation,https://scholar.google.com/citations?user=BpDrULIAAAAJ&hl=en
16,Linglong Dai,"Associate Professor, Tsinghua University; IEEE Fellow",65,3326,16529,59,14892,https://dblp.org/pid/50/7910,Wireless Communications/RIS/Massive MIMO/Millimeter-Wave/Teraherz Communications/Non-Orthogonal Mutiple Access,https://scholar.google.com/citations?user=OTFnifoAAAAJ&hl=en
17,Merouane Debbah,"Centralesupelec, Technology Innovation Institute, MBZUAI, Lagrange Mathematics Center",100,9000,48079,83,34123,https://ieeexplore.ieee.org/author/37284195000,5G/6G/Machine Learning/Random Matrix Theory/Game Theory,https://scholar.google.com/citations?user=HU5I0X4AAAAJ&hl=en
18,Zhiguo Ding,"University of Manchester, Fellow of IEEE, Web of Science Highly Cited Researcher",93,8212,38151,86,33910,http://www.research.lancs.ac.uk/portal/en/people/zhiguo-ding(6f420ab8-4825-4195-a3d8-07e5c5b7716e)/publications.html,Wireless communications/signal processing/and cross-layer optimization,https://scholar.google.co.uk/citations?user=V-nB8scAAAAJ&hl=en
19,"Mianxiong Dong, Foreign Fellow of EAJ","Vice President and Professor, Muroran Institute of Technology, Japan",54,2180,11005,49,9626,https://scholar.google.co.id/citations?user=TqyApAUAAAAJ&hl=fil,Cyber-Physical Systems/Internet of Things/Artificial Intelligence,https://scholar.google.co.jp/citations?user=TqyApAUAAAAJ&hl=en
20,Yucheng Dong,"Professor of Management and Systems Sciences, Sichuan University",61,2235,11797,56,9512,https://scholar.google.com/citations?user=tFVYDw4AAAAJ&hl=en,Decision Analysis/Human Dynamics/Social Network/Data Science,https://scholar.google.com/citations?user=tFVYDw4AAAAJ&hl=en
21,Maged Elkashlan,"Associate Professor, Queen Mary University of London",60,2707,15332,53,12885,https://scholar.google.com/citations?user=mncnnOAAAAAJ&hl=en,IRS/URLLC/UAV/PLS/NOMA,https://scholar.google.com/citations?user=mncnnOAAAAAJ&hl=en
22,Zubair Md. Fadlullah,"Associate Professor, Research Chair, Department of Computer Science, Lakehead University, TBRHRI",40,1324,7559,38,5833,https://www.researchgate.net/profile/Zubair-Fadlullah,Beyond 5G/Smart Health/UAV & Energy efficient Networks/QoS & Security/Deep Learning applications,https://scholar.google.com/citations?user=dZyfKpYAAAAJ&hl=en
23,Hossam Faris,"Professor, The University of Jordan",48,4368,11690,47,11459,https://www.researchgate.net/profile/Hossam-Faris,Data Science/Knowledge Systems/Data Mining/Evolutionary computation,https://scholar.google.com/citations?user=UEYd--YAAAAJ&hl=en
24,Giancarlo Fortino,"Full Prof. of Computer Engineering, University of Calabria, FIEEE, FAAIA, Highly Cited Researcher",66,3676,16223,59,13140,https://scholar.google.it/citations?user=ecImn1MAAAAJ&hl=en,Human-Machine Systems/Agent-based Computing/Internet of Things/Wearable Computing/Wireless/Body Area Networks,https://scholar.google.com/citations?user=ecImn1MAAAAJ&hl=it
25,Hamido Fujita,Iwate Prefectural University,68,4478,17053,68,15851,https://scholar.google.com/scholar_url?url=https://link.springer.com/article/10.1007/s10489-018-1278-z&hl=en&sa=X&ei=eh-QYu2oCsnFywSFg47QCw&scisig=AAGBfm3a883HHXF5fCk7ogGNjAC7a287cw&oi=scholarr,Machine Learning,https://scholar.google.com/citations?user=MxzV1nQAAAAJ&hl=en
26,Erik G. Larsson,"Professor, Dept. of Electrical Engineering (ISY), Linköping University, Sweden",88,6279,44970,68,29005,https://dblp.org/pid/76/3752,Wireless communications/statistical signal processing/localization/massive MIMO/networks,https://scholar.google.se/citations?user=79Lry6oAAAAJ&hl=en
27,Amir H. Gandomi,"Professor of Data Science, University of Technology Sydney",77,6908,29293,68,22678,https://scholar.google.com/scholar?q=Amir+H.+Gandomi+homepage&hl=en&as_sdt=0&as_vis=1&oi=scholart,Data Analytics/Genetic Programming/Engineering Optimization/Evolutionary Computation/Smart Cities,https://scholar.google.com/citations?user=VMf3wfMAAAAJ&hl=en
28,Xiaohua Ge,"Swinburne University of Technology, Melbourne, Australia",37,2028,7180,36,6979,https://dblp.org/pid/118/3514.html,Networked control systems/Cyber-physical systems/Multi-agent systems/Intelligent vehicles/Connected automated vehicles,https://scholar.google.com.au/citations?user=B37CYFoAAAAJ&hl=en
29,"Mohsen Guizani, FIEEE",Mohamed Bin Zayed University of Artificial Intelligence (MBZUAI),92,10785,44714,80,37325,https://www.aminer.cn/profile/mohsen-guizani/5489f0acdabfaed7b5fa3e39,Internet of Things/Applied AI/ML and Cybersecurity,https://scholar.google.com/citations?user=RigrYkcAAAAJ&hl=en
30,Song Guo,"FCAE, FIEEE, The Hong Kong Polytechnic University",72,4308,21425,65,17427,https://dblp.org/pid/01/267-1,Edge AI/Wireless Networking/Big Data Computing/Distributed System,https://scholar.google.com/citations?user=Ib-sizwAAAAJ&hl=en
31,Harald Haas,The University of Edinburgh,94,5548,45612,76,29576,https://lifi.co/harald-haas/,Optical Wireless Communications/Interference Managment in Wireless Networks/Spatial Modulation,https://scholar.google.com/citations?user=XxIwRJQAAAAJ&hl=ja
32,Yuki Hagiwara,Fraunhofer IKS,29,1959,6654,29,6630,https://scholar.google.com/scholar_url?url=https://www.tandfonline.com/doi/abs/10.1080/01694243.2013.810031&hl=en&sa=X&ei=gR-QYqj_GsnFywSFg47QCw&scisig=AAGBfm24lyAVqM-HNWST9QUNC-hD_IeeBQ&oi=scholarr,Artificial Intelligence,https://scholar.google.com.sg/citations?user=P6WI2DQAAAAJ&hl=en
33,"Qing-Long Han, Pro Vice-Chancellor and Distinguished Professor, MAE, IEEE Fellow",Swinburne University of Technology,110,6306,38727,91,26528,https://au.linkedin.com/in/qing-long-han-22992227,Networked control systems/time-delay systems/multi-agent systems/smart grids/unmanned surface vehicles,https://scholar.google.com.au/citations?user=j0pyptAAAAAJ&hl=en
34,Zhu Han,University of Houston,119,8451,57677,90,38289,https://scholar.google.com/scholar_url?url=https://arxiv.org/pdf/1801.02294.pdf%3Fref%3Dhttps://githubhelp.com&hl=en&sa=X&ei=gx-QYqXsKIqaygSozpTQCQ&scisig=AAGBfm3rwb7Nu7BAcC2ypPfj4hMjV64KBQ&oi=scholarr,Game Theory/Wireless Networking/Security/Data Science/Smart Grid,https://scholar.google.com/citations?user=ty7wIXoAAAAJ&hl=en
35,L Hanzo,"Chair of Telecommunications, University of Southampton",109,8243,68365,83,35578,https://scholar.google.com/scholar_url?url=https://arxiv.org/pdf/1907.10102&hl=en&sa=X&ei=hB-QYvOCIOCO6rQPzPWC4Ac&scisig=AAGBfm0yFw1vJvZ6yeAYDs0Jt6qY7Ks-AQ&oi=scholarr,telecommunications/wireless communication/quantum_information_science/video_coding/video_networking,https://scholar.google.co.uk/citations?user=p0jnEW0AAAAJ&hl=en
36,L Hanzo,"Chair of Telecommunications, University of Southampton",109,8243,68365,83,35578,https://www-mobile.ecs.soton.ac.uk/people/lh,telecommunications/wireless communication/quantum_information_science/video_coding/video_networking,https://scholar.google.co.uk/citations?user=p0jnEW0AAAAJ&hl=en
37,Robert Heath,"Lampe Distinguished Professor, North Carolina State University",136,7699,80610,91,42025,https://scholar.google.com/citations?user=17Ko8Q0AAAAJ&hl=en,wireless/MIMO/communications/signal processing/information theory,https://scholar.google.com/citations?user=17Ko8Q0AAAAJ&hl=en
38,Francisco Herrera,"Professor Computer Science and AI, Granada University, Spain",162,14658,113433,122,61192,https://franciscoherreramusic.com/music-musica,Artificial Intelligence/Computational Intelligence/Data mining/Evolutionary Algorithms/Big Data Analytics,https://scholar.google.com/citations?user=HULIk-QAAAAJ&hl=en
39,Enrique Herrera-Viedma,"Professor of Computer Science and Artificial Intelligence, Spain, University of Granada",108,6008,47756,90,26543,https://dblp.org/pid/93/6680,Fuzzy sets/fuzzy decision making/computing with words/multiple criteria decision making/consensus,https://scholar.google.com/citations?user=g8ZXTuYAAAAJ&hl=en
40,Ekram Hossain,"Professor, University of Manitoba, Canada, IEEE Fellow",97,3226,36496,70,18786,https://en.wikipedia.org/wiki/Ekram_Hossain,Wireless communication networks/radio resource allocation/cognitive radio/multi-tier cellular networks,https://scholar.google.com/citations?user=Lb617EMAAAAJ&hl=en
41,Guang-Bin Huang,"Full Professor, Nanyang Technological University, Singapore",71,5596,54661,61,32646,https://www.researchgate.net/profile/Guang-Bin-Huang,Machine Learning/Neural Networks/Neuroscience,https://scholar.google.com.sg/citations?user=LhSqQCIAAAAJ&hl=en
42,Kaibin Huang,"Professor, Dept. of EEE, The University of Hong Kong; IEEE Fellow; ISI Highly Cited Researcher",51,2890,14778,43,11433,https://en.wikipedia.org/wiki/Kaibin_Huang,Machine Learning/Mobile Edge Computing/Wireless Communications/Wireless Power Transfer/Stochastic Geometry,https://scholar.google.com/citations?user=HfuA3uIAAAAJ&hl=en
43,Thomas JR Hughes,"Peter O'Donnell Jr. Chair in Computational and Applied Mathematics, University of Texas at Austin",150,7025,127701,92,40116,https://en.wikipedia.org/wiki/Thomas_J.R._Hughes#Career,Finite Element Methods/Solid Mechanics/Computational Fluid Dynamics/Partial Differential Equations/Isogeometric Analysis,https://scholar.google.com/citations?user=6tPdlYAAAAAJ&hl=en
44,Yaochu Jin,"A. v. Humboldt Professor for AI, Bielefeld University and Distinguished Chair, University of Surrey",88,5625,31966,72,20048,http://www.soft-computing.de/,Evolutionary computation/Multiobjective optimization/Multiobjective learning/Trustworthy AI/Developmental AI,https://scholar.google.com/citations?user=B5WAkz4AAAAJ&hl=en
45,"Nei Kato(IEEE Fellow, IEICE Fellow)","Professor and Dean, Graduate School of Information Sciences, Tohoku University, Japan",74,3179,21773,58,14193,https://mlicom.eai-conferences.org/2018/show/keynotes.html,Wireless networking,https://scholar.google.com/citations?user=LfLfZXEAAAAJ&hl=en
46,"Dr. Neeraj Kumar, SMIEEE (Web of Science Highly Cited Researcher 2019, 2020,2021)","Professor, CSED, Thapar Institute of Engineering and Technology, India",93,9867,28540,87,26577,https://scholar.google.com.co/citations?user=3VQArpYAAAAJ&hl=es,IoT and Machine Learning/Deep Learning/Blockchain Technology,https://scholar.google.co.in/citations?user=gL9gR-4AAAAJ&hl=en
47,"Dr. Arun Kumar Sangaiah, (Web of Science Highly Cited Researcher, SM'IEEE)","Professor, VIT University, Vellore, India",70,4688,15026,70,14835,https://research.vit.ac.in/researcher/arun-kumar-s-2,Software Engineering/Computational Intelligence/Internet of Things,https://scholar.google.co.in/citations?user=8yF6Xc4AAAAJ&hl=en
48,Victor C. M. Leung,Shenzhen University / The University of British Columbia,102,6387,48165,83,30667,https://scholar.google.com/scholar_url?url=https://citeseerx.ist.psu.edu/viewdoc/download%3Fdoi%3D10.1.1.941.5437%26rep%3Drep1%26type%3Dpdf&hl=en&sa=X&ei=kR-QYo61D5T0yASct56wBQ&scisig=AAGBfm0zezW4rAHdNplD7CDKOE_DZiQqZw&oi=scholarr,communication systems/wireless networks/mobile systems,https://scholar.google.ca/citations?user=ajvCoo4AAAAJ&hl=en
49,Geoffrey Ye Li (李烨),"Chair Professor in Wireless Systems, Dept EEE, Imperial College London",108,5782,53218,78,24841,https://www.aminer.org/profile/geoffrey-ye-li/542a1abedabfae61d4954592,Signal Processing/and/Machine Learning/for/Wireless Communications,https://scholar.google.com/citations?user=d0FzG8YAAAAJ&hl=en
50,Hongyi Li,"Assistant Professor, University of Houston",33,927,3719,31,3128,https://www.bschool.cuhk.edu.hk/staff/li-hongyi/,watershed hydrology/earth system modeling/coupled human-nature system,https://scholar.google.com/citations?user=yWy-5icAAAAJ&hl=en
51,Jin Li  李进,Professor @Guangzhou University,59,1962,18941,53,12509,https://idealliancechina.org/2021/07/09/mr-jin-li-%E6%9D%8E%E8%BF%9B/,Trust and Security in Artificial Intelligence/Computating and Storage in Cloud Computing/Blockchain,https://scholar.google.com/citations?user=7GDV2vUAAAAJ&hl=en
52,Xuelong Li (Executive Councilor of AAAI),"Professor, Northwestern Polytechnical University, China",118,8369,54506,97,37890,https://sigai.acm.org/static/aimatters/3-3/AIMatters-3-3-08-Dong.pdf,artificial intelligence/optics and electronics,https://scholar.google.com/citations?user=ahUibskAAAAJ&hl=en
53,yongming li,"college of computer science, shaanxi normal university",37,414,4955,25,2425,https://ieeexplore.ieee.org/author/37405724900,fuzzy systems/quantume logic and quantum information/lattice/topology/model checking,https://scholar.google.com/citations?user=P3VERZ0AAAAJ&hl=en
54,Huchang Liao (廖虎昌),"IET Fellow, BCS Fellow; Business School, Sichuan University",63,3643,12963,59,11894,https://www.adscientificindex.com/scientist.php?id=694472,Decision analysis/Fuzzy Systems/Multiple criteria decision making/Preference learning,https://scholar.google.co.uk/citations?user=KlWnnbIAAAAJ&hl=en
55,Chong Lin,Qingdao University,70,1956,16403,52,9103,https://nesea.org/user/14796/presenter,systems and control theory,https://scholar.google.com/citations?user=AQbRErEAAAAJ&hl=en
56,Yan-Jun Liu,Liaoning University of Technology,61,2325,14236,58,10815,https://scholar.google.com/scholar_url?url=https://www.researchgate.net/profile/Yan-Jun-Liu/publication/318371880_Ultrasensitive_Wearable_Soft_Strain_Sensors_of_Conductive_Self-healing_and_Elastic_Hydrogels_with_Synergistic_Soft_and_Hard_Hybrid_Networks/links/5d2fdcb5a6fdcc2462e87993/Ultrasensitive-Wearable-Soft-Strain-Sensors-of-Conductive-Self-healing-and-Elastic-Hydrogels-with-Synergistic-Soft-and-Hard-Hybrid-Networks.pdf&hl=en&sa=X&ei=mR-QYpz0G8nFywSFg47QCw&scisig=AAGBfm3jHF0WzGKPMpNElwkryUOX4wtd4w&oi=scholarr,Adaptive control/fuzzy control/neural networks,https://scholar.google.com/citations?user=x_Wk1jAAAAAJ&hl=en
57,Yuanwei Liu,"Associate Professor in Queen Mary University of London, Web of Science Highly Cited Researcher",51,3510,11993,50,11714,https://scholar.google.com/scholar_url?url=https://www.sciencedirect.com/science/article/pii/S0378778818317110&hl=en&sa=X&ei=mh-QYoa1IpT0yASct56wBQ&scisig=AAGBfm0NUt612pXzvHjlNQojuv2XnTc3cg&oi=scholarr,NOMA/RIS/AI/6G/Integrated Sensing and Communications,https://scholar.google.com/citations?user=FxLf7ZAAAAAJ&hl=en
58,Wenjing Lou,"W. C. English Endowed Professor, IEEE Fellow, Virginia Tech, USA",83,2767,39570,60,19053,https://scholar.google.com/scholar?q=Wenjing+Lou+homepage&hl=en&as_sdt=0&as_vis=1&oi=scholart,Cyber Security/Wireless Networks/Wireless Security/Network Security/Cloud Computing,https://scholar.google.com/citations?user=hM8uAwoAAAAJ&hl=en
59,Majdi Mafarja,"Associate Professor of Computer Science, Birzeit University",33,2678,6669,32,6618,https://publons.com/researcher/3984634/majdi-mafarja/,Feature Selection/Machine Learning/Artificial Intelligence/Bio-inspired Algorithms/Metaheuristics,https://scholar.google.com/citations?user=ftkD0MgAAAAJ&hl=en
60,Luis Martínez,"Professor of Computer Science, University of Jaén",63,2740,22704,52,12682,https://www.sausd.us/domain/3504,Fuzzy decision making/Computing with words/Recommender Systems,https://scholar.google.com/citations?user=PG3D8UMAAAAJ&hl=en
61,Thomas Marzetta,"Distinguished Industry Professor, Department of Electrical and Computer Engineering, New York",59,4649,47315,46,28083,https://engineering.nyu.edu/faculty/thomas-marzetta,Beyond Massive MIMO,https://scholar.google.com/citations?user=tBLWIBoAAAAJ&hl=en
62,Seyedali Mirjalili,"Professor, Torrens University Australia, Adjunct Griffith University",75,17046,50909,74,48719,https://scholar.google.com/scholar_url?url=https://www.tandfonline.com/doi/abs/10.1080/02533839.2020.1771205&hl=en&sa=X&ei=nx-QYtS3JIL2yASmto7YDA&scisig=AAGBfm2Pe8LtMHdoXPhdkHFPtnc3D4DThA&oi=scholarr,Metaheuristics/Robust Optimization/Engineering Optimization/Evolutionary Algorithm/Swarm Intelligence,https://scholar.google.com/citations?user=TJHmrREAAAAJ&hl=en
63,Andreas F. Molisch,"Professor of Electrical Engineering, University of Southern California",101,5224,59334,71,27961,https://winslab.lids.mit.edu/people/andreas-f-molisch/,wireless propagation channels/multi-antenna systems/ultrawideband communications and positioning/cooperative communications,https://scholar.google.com/citations?user=W0wwrucAAAAJ&hl=en
64,Derrick Wing Kwan Ng,"Scientia  Assoicate Professor,  University of New South Wales",66,3932,19238,63,16573,https://orcid.org/0000-0001-6400-712X,Wireless Communications,https://scholar.google.com/citations?user=NUJSHxoAAAAJ&hl=en
65,H. Nguyen-Xuan,"CIRTech Institute, HUTECH University, Vietnam",69,2523,15850,59,11192,https://sites.google.com/site/nguyenxuanhungsite/,Computational Engineering/Large-scale data/3D Printing/Renewable Energy,https://scholar.google.co.uk/citations?user=3iK9h-gAAAAJ&hl=en
66,Dusit (Tao) Niyato,Nanyang Technological University (NTU),103,8763,48043,85,33125,https://dl.acm.org/profile/81313481268/publications?Role=author,ดุสิต นิยะโต - เต๋า,https://scholar.google.com/citations?user=T8sVhLMAAAAJ&hl=en
67,Kaoru Ota (太田　香),"MEXT Excellent Young Researcher (文部科学省　卓越研究員), Muroran Institute of Technology",50,2071,9788,48,8914,https://scholar.google.com/citations?user=8JVn8RsAAAAJ&hl=ja,,https://scholar.google.com/citations?user=8JVn8RsAAAAJ&hl=ja
68,Mugen Peng,"Beijing University of Posts & Telecommun., IEEE Fellow, Web of Science Highly Cited Researcher",53,2317,15620,46,10986,https://dl.acm.org/profile/81339521539,Fog Computing/Cloud Radio Access Networks/Integrated Satellite-Terrestrial Networks/6G,https://scholar.google.com/citations?user=85mAZVcAAAAJ&hl=en
69,HV Poor,"Michael Henry Strater University Professor, Princeton University",155,14303,122291,106,60748,https://ece.princeton.edu/people/h-vincent-poor,Communication Systems/Wireless Communications/Communications/Statistical Signal Processing/Information Theory,https://scholar.google.com/citations?user=Dq93mOUAAAAJ&hl=en
70,Lianyong Qi(齐连永),"Professor, Qufu Normal University",44,1867,5846,43,5595,https://www.adscientificindex.com/scientist.php?id=4346170,service computing/big data/recommender system,https://scholar.google.com/citations?user=pxNRRsAAAAAJ&hl=en
71,Timon Rabczuk,Bauhaus University Weimar,109,7407,42263,91,31704,https://www.journals.elsevier.com/computational-materials-science/editorial-board/timon-rabczuk,Computational Mechanics/Solid Mechanics,https://scholar.google.ca/citations?user=3CBuGosAAAAJ&hl=en
72,Kim-Kwang Raymond Choo,"Cloud Tech Endowed Professor, University of Texas at San Antonio; Highly Cited Researcher 2020, 2021",93,6550,25109,86,22669,https://www.acm.org/articles/people-of-acm/2021/raymond-choo,Cloud Forensics/Cyber Forensics/Cyber Security/IoT Security/Blockchain,https://scholar.google.com/citations?user=rRBNI6AAAAAJ&hl=en
73,Kui Ren,"Professor, Zhejiang University, ACM Fellow, IEEE Fellow",84,3706,40141,70,22276,https://dblp.org/pid/20/6179-1,Data Security & Privacy/IoT Security/AI Security,https://scholar.google.com/citations?user=uuQA_rcAAAAJ&hl=en
74,Walid Saad,"Professor, Electrical and Computer Engineering",82,7416,32254,74,27200,https://scholar.google.com/scholar_url?url=https://www.tandfonline.com/doi/abs/10.1080/10803920802569324&hl=en&sa=X&ei=qx-QYsihEYOM6rQP5peH2A4&scisig=AAGBfm0aYhrIQOcBEjhxMyvvKLLMs2-roQ&oi=scholarr,6G/machine learning/semantic communications/security and cyber-physical systems/unmanned aerial vehicles,https://scholar.google.com/citations?user=kYDNA0UAAAAJ&hl=en
75,Robert Schober,Friedrich-Alexander-University Erlangen-Nuremberg,94,5361,42790,75,27810,https://www.ece.ubc.ca/~rschober/,,https://scholar.google.com/citations?user=Uu0BpX8AAAAJ&hl=en
76,"Ling Shao, Fellow of IEEE/IAPR",Terminus Group,86,8248,32033,82,26966,https://www.yahoo.com/now/terminus-group-appoints-chief-scientist-135500545.html,Computer Vision/Deep Learning/Artificial Intelligence/Medical Imaging/Vision and Language,https://scholar.google.com/citations?user=z84rLjoAAAAJ&hl=en
77,Xuemin (Sherman) Shen,"University Professor, University of Waterloo",131,9053,73813,102,42411,https://www.comsoc.org/xuemin-sherman-shen,Wireless networking/MAC/Network security/VANET,https://scholar.google.com/citations?user=Bjl3GwoAAAAJ&hl=cs
78,Peng Shi,"Professor, School of Electrical and Electronic Engineering, The University of Adelaide",149,8208,77732,113,45614,https://scholar.google.com/scholar_url?url=https://www.sciencedirect.com/science/article/pii/S1995764513600619/pdf%3Fmd5%3D3f5336bf24528ae5d90dcefe0b8bc2b3%26pid%3D1-s2.0-S1995764513600619-main.pdf%26_valck%3D1&hl=en&sa=X&ei=rh-QYrzEKoL2yASmto7YDA&scisig=AAGBfm0hU3tO_A7A08zmY8gukf8kyetufg&oi=scholarr,Systems and Control/Electrical and Electronic Engineering/Cybernetics/Human-Computer Interaction,https://scholar.google.com.hk/citations?user=EGx1iH0AAAAJ&hl=en
