,Name,Affilation,H-index,Citations 2020,Total_citation,H-index_since_2016,Citation_since_2016,HomePage,Area of Research,Google_Scholar
0,"U Rajendra Acharya (SCI Highly Cited Researcher 2016-2021)  PhD, DEng, DSc","Ngee Ann,  Singapore University of Social Science,  University of Malaya, Malaysia",110,8717,47485,98,37672,https://www.journals.elsevier.com/computers-in-biology-and-medicine/editorial-board/rajendra-acharya-mtech-phd-deng-dsc,Artificial Intelligence/Medical Informatics,https://scholar.google.com.sg/citations?user=8FjY99sAAAAJ&hl=en
1,IAN  F.  AKYILDIZ,"Truva Inc. , USA",131,6707,131743,86,45571,https://scholar.google.com/citations?user=rAGwv14AAAAJ&hl=en,Wireless Communication/5G/6G Wireless Systems/Intelligent Surfaces for Wireless Communication/Nano-scale and Molecular Commun,https://scholar.google.com/citations?user=rAGwv14AAAAJ&hl=en
2,Ibrahim Aljarah,"Associate Professor, University of Jordan",43,2292,7234,43,7127,https://www.adscientificindex.com/scientist.php?id=343968,Artificial  intelligence/Swarm Intelligence/Data Science/Machine Learning/Evolutionary Computation,https://scholar.google.com/citations?user=moOTIYEAAAAJ&hl=en
3,Jeffrey Andrews,"Cockrell Family Endowed Chair in Engineering, University of Texas at Austin",105,4658,64605,79,35037,https://scholar.google.com/citations?user=Hr9Gey0AAAAJ&hl=en,Wireless Communications/Communication Theory/Machine Learning for Communications/Stochastic Geometry/Information Theory,https://scholar.google.com/citations?user=Hr9Gey0AAAAJ&hl=en
4,Bennis Mehdi,"Full Professor, IEEE Fellow, Head of ICON, University of Oulu",65,5561,22673,63,21091,https://www.aminer.cn/profile/mehdi-bennis/5448862edabfae87b7e3b101,B5G/6G/machine learning/semantic communication,https://scholar.google.com/citations?user=RW4sJu8AAAAJ&hl=en
5,Emil Björnson,"Professor of Wireless Communication, KTH Royal Institute of Technology",61,3410,16735,58,14966,https://ebjornson.com/research/podcast/,Massive MIMO/Cell-free Massive MIMO/RIS/Signal processing/Wireless communication,https://scholar.google.se/citations?user=Maij4akAAAAJ&hl=en
6,Rajkumar Buyya,"CLOUDS Lab, School of Computing and Information Systems, The University of Melbourne, Australia",152,11156,120176,110,66626,https://scholar.google.com/citations?user=7xN6JqYAAAAJ&hl=en,Computer Systems/Cloud Computing/Distributed Systems/Edge Computing/Internet of Things,https://scholar.google.com/citations?user=7xN6JqYAAAAJ&hl=en
7,Xing Cai,"Senior Research Scientist at Simula Research Laboratory, Professor at University of Oslo",19,126,1982,14,865,https://koei.fandom.com/wiki/Xingcai#Quotes,Parallel programming/High-performance computing/numerical methods for PDEs,https://scholar.google.com/citations?user=IWQbrcK5CEwC&hl=en
8,Giuseppe Caire,"Professor, Technical University of Berlin, Germany, and Professor of Electrical Engineering (on",82,2927,38345,59,17597,https://twitter.com/borlazzi?lang=en,Information Theory/Communications/Signal Processing/Statistics,https://scholar.google.com/citations?user=g66ErTcAAAAJ&hl=en
9,Jinde Cao,"Academician, RAE/AE/RAEN/LAS/AAS/EASA/PAS/IASCYS  & FIEEE/FAAIA/DFIETI; Southeast University",129,8692,66977,91,41156,https://math.seu.edu.cn/jdc_en/list.htm,Complex networks/neural networks/multi-agent systems - engineering stability - dynamics and control - time-delay systems,https://scholar.google.com/citations?user=8_ffELYAAAAJ&hl=en
10,C. L. Philip Chen,"Chair Professor, South China University of Technology, Philip.Chen@ieee.org",91,5846,34817,84,27540,https://scholar.google.com/scholar_url?url=https://ieeexplore.ieee.org/abstract/document/9178458/&hl=en&sa=X&ei=eSDBYbzmHfKP6rQPj7ShiAo&scisig=AAGBfm3b9C9ZMQIuomtY__AYzKPAZ8SXfg&oi=scholarr,Computational Intelligence/Intelligent Control/Cybernetics/Intelligent Transportation Systems/Data Science/Engineering,https://scholar.google.com/citations?user=Q5248zwAAAAJ&hl=en
11,Jinjun Chen,"Professor and Deputy Institute Director, Swinburne University of Technology",66,2144,12243,48,8945,https://dl.acm.org/profile/81452604018,Cloud Computing/Scalable Architecture/Scalable Data Storage/Scalable Data Processing (Privacy),https://scholar.google.com/citations?user=mQ9vJ24AAAAJ&hl=en
12,Min Chen,"Professor, IEEE Fellow, Highly Cited Researcher, Huazhong University of Science and Technology",85,5740,31919,71,25450,https://cmse.msu.edu/directory/faculty/min-chen/about-me/,Cognitive Computing and Big Data Analytics/IoT Sensing/5G Networks/Robotics/Edge Computing,https://scholar.google.com/citations?user=_HyHTrsAAAAJ&hl=en
13,Xiaofeng Chen,"Professor, Xidian University, China",55,1928,13347,51,10559,https://scholar.google.com/scholar_url?url=https://www.researchgate.net/profile/Xiaofeng-Chen-7/publication/312248508_Factors_That_Influence_Employees%27_Security_Policy_Compliance_An_Awareness-Motivation-Capability_Perspective/links/5fbb09c1458515b797627588/Factors-That-Influence-Employees-Security-Policy-Compliance-An-Awareness-Motivation-Capability-Perspective.pdf&hl=en&sa=X&ei=fCDBYYOyIYbmyQS5qJvQCA&scisig=AAGBfm0h7_-Q5jGp55ZZ9OHAyE740P1Qig&oi=scholarr,Security/Cryptography/Cloud computing,https://scholar.google.com/citations?user=-3WhJecAAAAJ&hl=en
14,Francisco Chiclana,"Professor of Computational Intelligence and Decision Making, De Montfort University, UK",67,2298,19037,60,12035,https://www.researchgate.net/profile/Francisco-Chiclana,Decision making/computational intelligence/information fusion/consensus/sentiment analysis,https://scholar.google.com/citations?user=qDOxZIIAAAAJ&hl=en
15,zhihua cui,"Taiyuan University of Science and Technology, Taiyuan, Shanxi, China, 030024",44,1630,7958,34,5837,https://scholar.google.com/citations?user=BpDrULIAAAAJ&hl=en,evolutionary computation,https://scholar.google.com/citations?user=BpDrULIAAAAJ&hl=en
16,Linglong Dai,"Associate Professor, Tsinghua University; IEEE Fellow",61,3211,14994,58,14065,https://ieeexplore.ieee.org/author/37399861100,Wireless Communications/RIS/Massive MIMO/Millimeter-Wave/Teraherz Communications/Non-Orthogonal Mutiple Access,https://scholar.google.com/citations?user=OTFnifoAAAAJ&hl=en
17,Merouane Debbah,"Centralesupelec, Technology Innovation Institute, MBZUAI, Lagrange Mathematics Center",98,7573,45178,85,34313,https://www.youtube.com/watch?v=VcUU42ZXnQs,5G/6G/Machine Learning/Random Matrix Theory/Game Theory,https://scholar.google.com/citations?user=HU5I0X4AAAAJ&hl=en
18,Yong Deng,"School of Computer and Information Science, Southwest University",73,3137,18767,66,15288,https://scholar.google.com/scholar?q=Yong+Deng+homepage&hl=en&as_sdt=0&as_vis=1&oi=scholart,Evidence Theory/Fuzzy Set Theory/Bio-inspired AI/Complex Networks,https://scholar.google.com/citations?user=8voeILsAAAAJ&hl=en
19,Zhiguo Ding,"University of Manchester, Fellow of IEEE, Web of Science Highly Cited Researcher",87,7830,34566,82,31790,https://ieeexplore.ieee.org/author/37278653500,Wireless communications/signal processing/and cross-layer optimization,https://scholar.google.co.uk/citations?user=V-nB8scAAAAJ&hl=en
20,"Mianxiong Dong, Foreign Fellow of EAJ","Vice President and Professor, Muroran Institute of Technology, Japan",52,2183,10080,51,9329,https://scholar.google.co.id/citations?user=TqyApAUAAAAJ&hl=fil,Cyber-Physical Systems/Internet of Things/Artificial Intelligence,https://scholar.google.co.jp/citations?user=TqyApAUAAAAJ&hl=en
21,Yucheng Dong,"Professor of Management and Systems Sciences, Sichuan University",57,1823,10840,53,9167,https://dblp.org/pid/08/3009,Decision Analysis/Human Dynamics/Social Network/Data Science,https://scholar.google.com/citations?user=tFVYDw4AAAAJ&hl=en
22,Maged Elkashlan,"Associate Professor, Queen Mary University of London",57,2606,14117,54,12785,http://eecs.qmul.ac.uk/profiles/elkashlanmaged.html,IRS/URLLC/UAV/PLS/NOMA,https://scholar.google.com/citations?user=mncnnOAAAAAJ&hl=en
23,Zubair Md. Fadlullah,"Associate Professor, Research Chair, Department of Computer Science, Lakehead University, TBRHRI",38,1480,6887,36,5647,https://www.lakeheadu.ca/users/F/zfadlull/node/50708,Beyond 5G/Smart Health/UAV & Energy efficient Networks/QoS & Security/Deep Learning applications,https://scholar.google.com/citations?user=dZyfKpYAAAAJ&hl=en
24,Hossam Faris,"Professor, The University of Jordan, Al Hussein Technical University",44,2928,9563,44,9432,https://ieeexplore.ieee.org/author/38016215500,Data Science/Knowledge Systems/Data Mining/Evolutionary computation,https://scholar.google.com/citations?user=UEYd--YAAAAJ&hl=en
25,Giancarlo Fortino,"Full Prof. of Computer Engineering, University of Calabria, IEEE Fellow, Highly Cited Researcher",63,2820,14553,58,12228,https://scholar.google.com/citations?user=ecImn1MAAAAJ&hl=it,Human-Machine Systems/Agent-based Computing/Internet of Things/Wearable Computing/Wireless/Body Area Networks,https://scholar.google.com/citations?user=ecImn1MAAAAJ&hl=it
26,Hamido Fujita,Iwate Prefectural University,62,3931,14757,62,13992,https://portal.insticc.org/KeynotesInterviewsArchive/5fac038fe261a5eed8511c13,Machine Learning,https://scholar.google.com/citations?user=MxzV1nQAAAAJ&hl=en
27,Erik G. Larsson,"Professor, Dept. of Electrical Engineering (ISY), Linköping University, Sweden",83,5616,42193,65,29920,https://books.google.com/books?id=GFTGDwAAQBAJ&pg=PA194&lpg=PA194&dq=Erik+G.+Larsson+homepage&source=bl&ots=rVc4iu4h4J&sig=ACfU3U1ZSQgcQ7__P5LyrZmdEsZVMHXWyw&hl=en&sa=X&ved=2ahUKEwjq5cWV0vP0AhVFIzQIHeJcDW8Q6AF6BAgUEAM,Wireless communications/statistical signal processing/localization/massive MIMO/networks,https://scholar.google.se/citations?user=79Lry6oAAAAJ&hl=en
28,Amir H. Gandomi,"Professor, University of Technology Sydney",73,4140,25138,64,20345,https://scholar.google.com/scholar_url?url=https://www.tandfonline.com/doi/abs/10.1080/17499518.2020.1771739&hl=en&sa=X&ei=iiDBYe_5A_KP6rQPj7ShiAo&scisig=AAGBfm0whMFCeehngf6NOKxJiGJR3knqCQ&oi=scholarr,Data Analytics/Genetic Programming/Engineering Optimization/Evolutionary Computation/Smart Cities,https://scholar.google.com/citations?user=VMf3wfMAAAAJ&hl=en
29,Xiaohua Ge,"Swinburne University of Technology, Melbourne, Australia",33,1717,6020,33,5961,https://dblp.org/pid/118/3514.html,Multi-Agent Systems/Networked Control Systems/Cyber-Physical Systems/Sensor Networks,https://scholar.google.com.au/citations?user=B37CYFoAAAAJ&hl=en
30,"Mohsen Guizani, FIEEE","Qatar University, Doha, Qatar",88,8264,40046,75,33874,https://ieeexplore-ieee-org.ezproxy.u-pec.fr/author/37085356466,Internet of Things/Applied AI/ML and Cybersecurity,https://scholar.google.com/citations?user=RigrYkcAAAAJ&hl=en
31,Song Guo,"FCAE, FIEEE, The Hong Kong Polytechnic University",68,3796,19364,67,16582,https://hk.linkedin.com/in/song-guo-30066228,Big Data Computing/Edge AI/Mobile Computing/Distributed System,https://scholar.google.com/citations?user=Ib-sizwAAAAJ&hl=en
32,Harald Haas,The University of Edinburgh,92,5614,43557,79,31144,https://www.ted.com/speakers/harald_haas,Optical Wireless Communications/Interference Managment in Wireless Networks/Spatial Modulation,https://scholar.google.com/citations?user=XxIwRJQAAAAJ&hl=ja
33,Yuki Hagiwara,Fraunhofer IKS,29,1718,5764,29,5755,https://twitter.com/losolivoscal,Artificial Intelligence,https://scholar.google.com.sg/citations?user=P6WI2DQAAAAJ&hl=en
34,"Qing-Long Han, Pro Vice-Chancellor and Distinguished Professor, MAE, IEEE Fellow",Swinburne University of Technology,104,5693,35365,87,24940,https://www.ae-info.org/ae/User/Han_Qing-Long,Networked control systems/time-delay systems/multi-agent systems/smart grids/unmanned surface vehicles,https://scholar.google.com.au/citations?user=j0pyptAAAAAJ&hl=en
35,Zhu Han,University of Houston,115,7574,53498,91,38454,https://scholar.google.com/scholar_url?url=https://arxiv.org/pdf/1902.07565&hl=en&sa=X&ei=kCDBYebtIob4yATTuZiACw&scisig=AAGBfm0fqs2afuj52YoEZIDuOWOGnUDa3Q&oi=scholarr,Game Theory/Wireless Networking/Security/Data Science/Smart Grid,https://scholar.google.com/citations?user=ty7wIXoAAAAJ&hl=en
36,L Hanzo,"Chair of Telecommunications, University of Southampton",105,7117,63815,83,34182,https://ieeexplore.ieee.org/author/37276255400,telecommunications/wireless communication/quantum_information_science/video_coding/video_networking,https://scholar.google.co.uk/citations?user=p0jnEW0AAAAJ&hl=en
37,L Hanzo,"Chair of Telecommunications, University of Southampton",105,7117,63815,83,34182,https://ieeexplore.ieee.org/author/37276255400,telecommunications/wireless communication/quantum_information_science/video_coding/video_networking,https://scholar.google.co.uk/citations?user=p0jnEW0AAAAJ&hl=en
38,Robert Heath,"Lampe Distinguished Professor, North Carolina State University",133,7989,78247,93,45219,https://robertheath.co.uk/,wireless/MIMO/communications/signal processing/information theory,https://scholar.google.com/citations?user=17Ko8Q0AAAAJ&hl=en
39,Francisco Herrera,"Professor Computer Science and AI, Granada University, Senior Research Advisor in DL&ML at Sherpa.ai",158,11506,106515,123,61589,https://scholar.google.com/citations?user=HULIk-QAAAAJ&hl=en,Artificial Intelligence/Computational Intelligence/Data mining/Evolutionary Algorithms/Big Data Analytics,https://scholar.google.com/citations?user=HULIk-QAAAAJ&hl=en
40,Enrique Herrera-Viedma,"Professor of Computer Science and Artificial Intelligence, Spain, University of Granada",105,5117,44620,89,26556,https://dblp.org/pid/93/6680,Fuzzy sets/fuzzy decision making/computing with words/multiple criteria decision making/consensus,https://scholar.google.com/citations?user=g8ZXTuYAAAAJ&hl=en
41,Ekram Hossain,"Professor, University of Manitoba, Canada, IEEE Fellow",97,3318,35833,75,21017,https://dblp.org/pid/45/1224,Wireless communication networks/radio resource allocation/cognitive radio/multi-tier cellular networks,https://scholar.google.com/citations?user=Lb617EMAAAAJ&hl=en
42,Guang-Bin Huang,"Full Professor, Nanyang Technological University, Singapore",70,5991,52732,62,36142,https://orcid.org/0000-0002-2480-4965,Machine Learning/Neural Networks/Neuroscience,https://scholar.google.com.sg/citations?user=LhSqQCIAAAAJ&hl=en
43,Kaibin Huang,"Associate Professor, Dept. of EEE, The University of Hong Kong; IEEE Fellow",50,2662,13948,43,11329,https://dblp.org/pid/21/506,Machine Learning/Mobile Edge Computing/Wireless Communications/Wireless Power Transfer/Stochastic Geometry,https://scholar.google.com/citations?user=HfuA3uIAAAAJ&hl=en
44,Thomas JR Hughes,"Peter O'Donnell Jr. Chair in Computational and Applied Mathematics, University of Texas at Austin",158,7611,129179,99,45473,https://en.wikipedia.org/wiki/Thomas_J.R._Hughes#Awards_and_honors,Finite Element Methods/Solid Mechanics/Computational Fluid Dynamics/Partial Differential Equations/Isogeometric Analysis,https://scholar.google.com/citations?user=6tPdlYAAAAAJ&hl=en
45,Yaochu Jin,"Humboldt Professor for AI, Bielefeld University and Distinguished Chair, University of Surrey",83,3933,28996,69,18718,http://users.jyu.fi/~yaojin/,Artificial Intelligence/Evolutionary Computation/Multiobjective Optimization/Federated Learning/Developmental AI,https://scholar.google.com/citations?user=B5WAkz4AAAAJ&hl=en
46,"Nei Kato(IEEE Fellow, IEICE Fellow)","Professor, Graduate School of Information Sciences, Tohoku University, Japan",72,3436,20405,58,14280,https://scholar.google.com/citations?user=LfLfZXEAAAAJ&hl=en,Wireless networking,https://scholar.google.com/citations?user=LfLfZXEAAAAJ&hl=en
47,"Dr. Neeraj Kumar, SMIEEE (Web of Science Highly Cited Researcher 2019, 2020,2021)","Professor, CSED, Thapar Institute of Engineering and Technology, India",85,6307,24156,81,22974,https://www.routledge.com/Internet-of-Energy-for-Smart-Cities-Machine-Learning-Models-and-Techniques/Jindal-Kumar-Aujla/p/book/9780367497750,IoT and Machine Learning/Deep Learning/Blockchain Technology,https://scholar.google.co.in/citations?user=gL9gR-4AAAAJ&hl=en
48,"Dr. Arun Kumar Sangaiah., Ph.D (SM'IEEE)","Professor, School of Computing Science and Engineering, VIT University, Vellore, India",65,4017,12945,65,12829,https://orcid.org/0000-0002-0229-2460,Software Engineering/Computational Intelligence/Internet of Things,https://scholar.google.co.in/citations?user=8yF6Xc4AAAAJ&hl=en
49,Victor C. M. Leung,Shenzhen University / The University of British Columbia,100,6408,45656,85,31351,https://www.aminer.org/profile/victor-c-m-leung/5487fa09dabfaed7b5fa33e9,communication systems/wireless networks/mobile systems,https://scholar.google.ca/citations?user=ajvCoo4AAAAJ&hl=en
50,Geoffrey Ye Li (李烨),"Chair Professor in Wireless Systems, Dept EEE, Imperial College London",102,5506,50363,80,25511,https://kyy.bupt.edu.cn/__local/4/90/6B/6474B8057A6E4AB04BD423F82B4_5C411C39_826844.pdf?e=.pdf,Signal Processing/and/Machine Learning/for/Wireless Communications,https://scholar.google.com/citations?user=d0FzG8YAAAAJ&hl=en
51,Hongyi Li,"Assistant Professor, University of Houston",32,715,3258,29,2879,https://www.hongyi.li/,watershed hydrology/earth system modeling/coupled human-nature system,https://scholar.google.com/citations?user=yWy-5icAAAAJ&hl=en
52,Jin Li  李进,Professor @Guangzhou University,56,2270,18036,53,13478,https://scholar.google.fr/citations?user=63OkIl8AAAAJ&hl=fr,Trust and Security in Artificial Intelligence/Computating and Storage in Cloud Computing/Blockchain,https://scholar.google.com/citations?user=7GDV2vUAAAAJ&hl=en
53,Xuelong Li (Executive Councilor of AAAI),"Professor, Northwestern Polytechnical University, China",114,7669,50879,101,38609,https://mobile.twitter.com/npuintl/with_replies,artificial intelligence/feature extraction/higher-order data analytics,https://scholar.google.com/citations?user=ahUibskAAAAJ&hl=en
54,yongming li,"college of computer science, shaanxi normal university",36,421,4765,25,2630,https://ieeexplore.ieee.org/author/37086034102,fuzzy systems/quantume logic and quantum information/lattice/topology/model checking,https://scholar.google.com/citations?user=P3VERZ0AAAAJ&hl=en
55,Huchang Liao (廖虎昌),"Fellow of IET, BCS; Business School, Sichuan University",58,2498,11507,57,10949,https://baike.baidu.com/item/%E5%BB%96%E8%99%8E%E6%98%8C/16960663,Decision analysis/Fuzzy Systems/Multiple criteria decision making/Preference learning,https://scholar.google.co.uk/citations?user=KlWnnbIAAAAJ&hl=en
56,Chong Lin,Qingdao University,68,1852,15464,52,9303,https://www.linkedin.com/in/chonglin,systems and control theory,https://scholar.google.com/citations?user=AQbRErEAAAAJ&hl=en
57,Yan-Jun Liu,Liaoning University of Technology,57,2167,13180,55,11087,https://scholar.google.com/scholar_url?url=https://www.sciencedirect.com/science/article/pii/S1534580719308561&hl=en&sa=X&ei=pCDBYamtCobmyQS5qJvQCA&scisig=AAGBfm3jpcFyWa45-Eu8j6QENVeWn4y6-w&oi=scholarr,Adaptive control/fuzzy control/neural networks,https://scholar.google.com/citations?user=x_Wk1jAAAAAJ&hl=en
58,Yuanwei Liu,"Associate Professor in Queen Mary University of London, Web of Science Highly Cited Researcher",47,2595,10208,47,10112,https://spcc.committees.comsoc.org/special-interest-groups/sig-ngma/,NOMA/RIS/UAV Communications/Artifical Intelligence/6G,https://scholar.google.com/citations?user=FxLf7ZAAAAAJ&hl=en
59,Wenjing Lou,"W. C. English Endowed Professor, IEEE Fellow, Virginia Tech, USA",80,3032,38325,62,22508,https://www.cnsr.ictas.vt.edu/WJLou.html,Cyber Security/Wireless Networks/Wireless Security/Network Security/Cloud Computing,https://scholar.google.com/citations?user=hM8uAwoAAAAJ&hl=en
60,Majdi Mafarja,"Associate Professor of Computer Science, Birzeit University",32,1687,5313,30,5274,https://dl.acm.org/profile/83058775557,Feature Selection/Machine Learning/Artificial Intelligence/Bio-inspired Algorithms/Metaheuristics,https://scholar.google.com/citations?user=ftkD0MgAAAAJ&hl=en
61,Luis Martínez,"Professor of Computer Science, University of Jaén",61,2300,21549,53,13009,https://sites.google.com/site/lrmartineza,Fuzzy decision making/Computing with words/Recommender Systems,https://scholar.google.com/citations?user=PG3D8UMAAAAJ&hl=en
62,Thomas Marzetta,"Distinguished Industry Professor, Department of Electrical and Computer Engineering, New York",58,4874,45391,45,30825,https://www.researchgate.net/profile/Thomas-Marzetta,Beyond Massive MIMO,https://scholar.google.com/citations?user=tBLWIBoAAAAJ&hl=en
63,Seyedali Mirjalili,"Professor, Torrens University Australia, Adjunct Griffith University",69,10669,41079,68,39879,https://scholar.google.com/scholar_url?url=https://www.researchgate.net/profile/Mohamed-Abdel-Basset/publication/323864555_Hybrid_whale_optimization_algorithm_based_on_local_search_strategy_for_the_permutation_flow_shop_scheduling_problem/links/603268684585158939be8f4f/Hybrid-whale-optimization-algorithm-based-on-local-search-strategy-for-the-permutation-flow-shop-scheduling-problem.pdf&hl=en&sa=X&ei=qSDBYYu2CvKP6rQPj7ShiAo&scisig=AAGBfm3ZuHYddaQutensy7JyqwaCvCYVyw&oi=scholarr,Metaheuristics/Robust Optimization/Engineering Optimization/Evolutionary Algorithm/Swarm Intelligence,https://scholar.google.com/citations?user=TJHmrREAAAAJ&hl=en
64,Andreas F. Molisch,"Professor of Electrical Engineering, University of Southern California",100,5169,57381,76,29649,https://scholar.google.com/scholar_url?url=https://merl.com/publications/docs/TR2008-072.pdf&hl=en&sa=X&ei=qSDBYdLROsmUywSklYrIBQ&scisig=AAGBfm0YMVoBGcBSFij6oNowME7WgCoT9g&oi=scholarr,wireless propagation channels/multi-antenna systems/ultrawideband communications and positioning/cooperative communications,https://scholar.google.com/citations?user=W0wwrucAAAAJ&hl=en
65,Derrick Wing Kwan Ng,"Scientia Senior Lecturer,  University of New South Wales",63,3508,17222,62,15734,https://ieeexplore.ieee.org/author/37085358194,Wireless Communications,https://scholar.google.com/citations?user=NUJSHxoAAAAJ&hl=en
66,H. Nguyen-Xuan,"CIRTech Institute, Ho Chi Minh City University of Technology (HUTECH), Vietnam",66,2213,14716,59,10984,https://scholar.google.co.uk/citations?user=3iK9h-gAAAAJ&hl=en,Computational Engineering/Large-scale data/3D Printing/Renewable Energy,https://scholar.google.co.uk/citations?user=3iK9h-gAAAAJ&hl=en
67,Dusit (Tao) Niyato,Nanyang Technological University (NTU),98,6829,43478,81,31758,https://faculty.sustech.edu.cn/asheralievaa/,ดุสิต นิยะโต - เต๋า,https://scholar.google.com/citations?user=T8sVhLMAAAAJ&hl=en
68,Kaoru Ota (太田　香),"MEXT Excellent Young Researcher (文部科学省　卓越研究員), Muroran Institute of Technology",49,2105,8844,47,8489,https://jglobal.jst.go.jp/en/detail?JGLOBAL_ID=201801018750503459,,https://scholar.google.com/citations?user=8JVn8RsAAAAJ&hl=ja
69,Mugen Peng,"Beijing University of Posts & Telecommun., IEEE Fellow, Web of Science Highly Cited Researcher",52,2223,14726,45,10991,https://orcid.org/0000-0002-4755-7231,Fog Radio Access Network/Heterogeneous Networks/Cloud Radio Access Networks/Network Coding/Radio Resource Allocation and Opt,https://scholar.google.com/citations?user=85mAZVcAAAAJ&hl=en
70,HV Poor,"Michael Henry Strater University Professor, Princeton University",152,12016,116635,109,62120,https://sites.google.com/view/mmamiri/home,Information Theory/Statistical Signal Processing/Stochastic Analysis,https://scholar.google.com/citations?user=Dq93mOUAAAAJ&hl=en
71,Lianyong Qi(齐连永),"Professor, Qufu Normal University(青年教授，博士生导师，曲阜师范大学)",39,1852,4793,38,4591,http://web.qfnu.edu.cn/qly,service computing/big data/recommender system,https://scholar.google.com/citations?user=pxNRRsAAAAAJ&hl=en
72,Timon Rabczuk,Bauhaus University Weimar,103,6304,38552,92,30361,https://www.uni-weimar.de/en/civil-engineering/institute/ism/team/professors/prof-dr-ing-timon-rabczuk/,Computational Mechanics/Solid Mechanics,https://scholar.google.ca/citations?user=3CBuGosAAAAJ&hl=en
73,Kim-Kwang Raymond Choo,"Cloud Tech Endowed Professor, University of Texas at San Antonio; Highly Cited Researcher 2020, 2021",88,5106,21880,85,20275,https://www.linkedin.com/in/raymondchoo?trk=ugc-post-bar__share-text,Cloud Forensics/Cyber Forensics/Cyber Security/IoT Security/Blockchain,https://scholar.google.com/citations?user=rRBNI6AAAAAJ&hl=en
74,Kui Ren,"Professor, Zhejiang University, ACM Fellow, IEEE Fellow",80,3836,38452,71,25144,https://spie.org/profile/Kui.Ren-61358,Data Security & Privacy/IoT Security/AI Security,https://scholar.google.com/citations?user=uuQA_rcAAAAJ&hl=en
75,Walid Saad,"Professor, Electrical and Computer Engineering",79,6318,28728,72,25337,https://www.linkedin.com/in/walid-saad-089640a,6G wireless systems/machine learning/security/cyber-physical systems/Unmanned aerial vehicles (UAVs),https://scholar.google.com/citations?user=kYDNA0UAAAAJ&hl=en
76,Robert Schober,Friedrich-Alexander-University Erlangen-Nuremberg,90,5384,40314,76,28916,https://www.comsoc.org/robert-schober,,https://scholar.google.com/citations?user=Uu0BpX8AAAAJ&hl=en
77,"Ling Shao, Fellow of IEEE/IAPR","CEO & Chief Scientist, Inception Institute of Artificial Intelligence (IIAI)",77,5453,27737,75,24505,https://www.aaia-ai.org/fellows?page=14,Computer Vision/Deep Learning/Artificial Intelligence/Medical Imaging/Vision and Language,https://scholar.google.com/citations?user=z84rLjoAAAAJ&hl=en
78,Xuemin (Sherman) Shen,"University Professor, University of Waterloo",127,8683,69774,99,43960,https://www.polyu.edu.hk/riaiot/people/international-advisory-committee/prof-sherman-xuemin-shen,Wireless networking/MAC/Network security/VANET,https://scholar.google.com/citations?user=Bjl3GwoAAAAJ&hl=cs
79,Peng Shi,"Professor, School of Electrical and Electronic Engineering, The University of Adelaide",147,8365,73962,118,48537,http://faculty.marshall.usc.edu/Peng-Shi/,Systems and Control/Electrical and Electronic Engineering/Cybernetics/Human-Computer Interaction,https://scholar.google.com.hk/citations?user=EGx1iH0AAAAJ&hl=en
