,Name,Affilation,H-index,Citations 2020,Total_citation,H-index_since_2016,Citation_since_2016,HomePage,Area of Research,Google_Scholar
0,"U Rajendra Acharya (SCI Highly Cited Researcher 2016-2021)  PhD, DEng, DSc","Ngee Ann,  Singapore University of Social Science,  Kuamamoto University, Japan",119,11879,58061,108,45586,https://scholar.google.com/citations?user=8FjY99sAAAAJ&hl=zh-CN,Artificial Intelligence/Medical Informatics,https://scholar.google.com.sg/citations?user=8FjY99sAAAAJ&hl=en
1,IAN  F.  AKYILDIZ,"Truva Inc. , USA",133,6584,136848,84,41482,https://scholar.google.com/scholar_url?url=https://infoscience.epfl.ch/record/131247/files/compnet2008b.pdf&hl=en&sa=X&ei=7KcvY4qiNuSTy9YP8ce-sA8&scisig=AAGBfm0lcMN8Mo4iI2kVDw9gQKwXKfVdcQ&oi=scholarr,Wireless Communication/5G/6G Wireless Systems/Intelligent Surfaces for Wireless Communication/Nano-scale and Molecular Commun,https://scholar.google.com/citations?user=rAGwv14AAAAJ&hl=en
2,Ibrahim Aljarah,"Professor of Big Data Mining and Computational Intelligence, The University of Jordan",48,3240,10153,47,9968,http://eacademic.ju.edu.jo/i.aljarah/,Artificial  intelligence/Swarm Intelligence/Data Science/Machine Learning/Evolutionary Computation,https://scholar.google.com/citations?user=moOTIYEAAAAJ&hl=en
3,Jeffrey Andrews,"Truchard Family Chair and Director of 6G@UT, University of Texas at Austin",106,3893,67105,74,30680,https://jeffreyandrews.co.uk/,Wireless Communications/Communication Theory/Machine Learning for Communications/Stochastic Geometry/Information Theory,https://scholar.google.com/citations?user=Hr9Gey0AAAAJ&hl=en
4,Bennis Mehdi,"Full Professor, IEEE Fellow, Head of ICON, University of Oulu",73,7127,28946,70,26369,https://www.youtube.com/watch?v=hQakkuf17ro,B5G/6G/machine learning/semantic communication/protocol learning,https://scholar.google.com/citations?user=RW4sJu8AAAAJ&hl=en
5,Emil Björnson,"Professor of Wireless Communication, KTH Royal Institute of Technology",66,4498,20553,65,17713,https://github.com/emilbjornson/,Massive MIMO/Cell-free Massive MIMO/RIS/Signal processing/Wireless communication,https://scholar.google.se/citations?user=Maij4akAAAAJ&hl=en
6,Rajkumar Buyya,"Redmond Barry Distinguished Professor, University of Melbourne; Fellow of IEEE & Academia Europaea",156,11389,128623,109,65271,https://findanexpert.unimelb.edu.au/profile/7930-rajkumar-buyya,Computer Systems/Cloud Computing/Distributed Systems/Edge Computing/Internet of Things,https://scholar.google.com/citations?user=7xN6JqYAAAAJ&hl=en
7,Xing Cai,"Senior Research Scientist at Simula Research Laboratory, Professor at University of Oslo",19,137,2095,13,800,https://koei.fandom.com/wiki/Xingcai#Quotes,Parallel programming/High-performance computing/numerical methods for PDEs,https://scholar.google.com/citations?user=IWQbrcK5CEwC&hl=en
8,Giuseppe Caire,"Professor, Technical University of Berlin, Germany, and Professor of Electrical Engineering (on",83,2905,40490,59,17183,https://en.wikipedia.org/wiki/Giuseppe_Caire#Awards,Information Theory/Communications/Signal Processing/Statistics,https://scholar.google.com/citations?user=g66ErTcAAAAJ&hl=en
9,Jinde Cao,"Academician, RAS/AE/RAE/LAS/AAS/EASA/PAS/IASCYS  & FIEEE/FAAIA/DFIETI; Southeast University",132,8765,73925,95,44188,https://math.seu.edu.cn/jdc_en/list.htm,Complex networks/neural networks/multi-agent systems - engineering stability - dynamics and control - time-delay systems,https://scholar.google.com/citations?user=8_ffELYAAAAJ&hl=en
10,C. L. Philip Chen,"Chair Professor, South China University of Technology, Philip.Chen@ieee.org",97,7331,41214,87,31655,https://www.cas.cn/zt/hyzt/icfs/html/show-31-1618-1.html,Computational Intelligence/Intelligent Control/Cybernetics/Intelligent Transportation Systems/Data Science/Engineering,https://scholar.google.com/citations?user=Q5248zwAAAAJ&hl=en
11,Jinjun Chen,"MAE (Academia Europea), IEEE Fellow (Computer Society), AAIA Fellow, HiCi; Professor and Deputy",70,2325,14221,53,9980,https://dblp.org/pid/06/2379.html,Cloud Computing/Scalable Architecture/Scalable Data Storage/Scalable Data Processing (Privacy),https://scholar.google.com/citations?user=mQ9vJ24AAAAJ&hl=en
12,Min Chen,"Professor, IEEE Fellow, Highly Cited Researcher, Huazhong University of Science and Technology",91,6145,36321,72,27253,https://picsl.upenn.edu/people/post-docs/min-chen-2/,Cognitive Computing and Big Data Analytics/IoT Sensing/5G Networks/Robotics/Edge Computing,https://scholar.google.com/citations?user=_HyHTrsAAAAJ&hl=en
13,Xiaofeng Chen,"Professor, Xidian University, China",60,1797,14191,51,10721,https://dblp.org/pid/c/XiaofengChen,Security/Cryptography/Cloud computing,https://scholar.google.com/citations?user=-3WhJecAAAAJ&hl=en
14,Francisco Chiclana,"Professor of Computational Intelligence and Decision Making, De Montfort University, UK",71,2365,21035,62,12660,https://www.researchgate.net/profile/Francisco-Chiclana,Decision making/computational intelligence/information fusion/consensus/sentiment analysis,https://scholar.google.com/citations?user=qDOxZIIAAAAJ&hl=en
15,zhihua cui,"Taiyuan University of Science and Technology, Taiyuan, Shanxi, China, 030024",45,1680,8841,36,6723,https://www.zhihuacui.com/,evolutionary computation,https://scholar.google.com/citations?user=BpDrULIAAAAJ&hl=en
16,Linglong Dai,"Associate Professor, Tsinghua University; IEEE Fellow",66,3354,17837,62,16225,https://dblp.org/pid/50/7910,Wireless Communications/RIS/Massive MIMO/Millimeter-Wave/Teraherz Communications/Non-Orthogonal Mutiple Access,https://scholar.google.com/citations?user=OTFnifoAAAAJ&hl=en
17,Merouane Debbah,"Centralesupelec, Technology Innovation Institute, MBZUAI, Lagrange Mathematics Center",101,9053,51470,87,37584,https://dblp.org/pid/75/4085,5G/6G/Machine Learning/Random Matrix Theory/Game Theory,https://scholar.google.com/citations?user=HU5I0X4AAAAJ&hl=en
18,Zhiguo Ding,"University of Manchester, Fellow of IEEE, Web of Science Highly Cited Researcher",97,8214,41410,91,37236,https://ieeexplore.ieee.org/author/37278653500,Wireless communications/signal processing/and cross-layer optimization,https://scholar.google.co.uk/citations?user=V-nB8scAAAAJ&hl=en
19,"Mianxiong Dong, Foreign Fellow of EAJ","Vice President and Professor, Muroran Institute of Technology, Japan",56,2239,11873,51,10497,https://www.computer.org/csdl/journal/sc/2022/02/09540249/1wWC9LGR6aA,Cyber-Physical Systems/Internet of Things/Artificial Intelligence,https://scholar.google.co.jp/citations?user=TqyApAUAAAAJ&hl=en
20,Yucheng Dong,"Professor of Management and Systems Sciences, Sichuan University",64,2170,12768,60,10497,https://dblp.org/pid/08/3009.html?view=joint&param=9,Decision Analysis/Human Dynamics/Social Network/Data Science,https://scholar.google.com/citations?user=tFVYDw4AAAAJ&hl=en
21,Maged Elkashlan,"Associate Professor, Queen Mary University of London",62,2721,16397,55,13969,http://www.eecs.qmul.ac.uk/~maged/,IRS/URLLC/UAV/PLS/NOMA,https://scholar.google.com/citations?user=mncnnOAAAAAJ&hl=en
22,Zubair Md. Fadlullah,"Associate Professor, Research Chair, Department of Computer Science, Lakehead University, TBRHRI",40,1357,8026,39,6313,https://www.zfadlullah.org/,Beyond 5G/Smart Health/UAV & Energy efficient Networks/QoS & Security/Deep Learning applications,https://scholar.google.com/citations?user=dZyfKpYAAAAJ&hl=en
23,Hossam Faris,"Professor, The University of Jordan",51,4293,13464,50,13229,https://www.researchgate.net/profile/Hossam-Faris,Data Science/Knowledge Systems/Data Mining/Evolutionary computation,https://scholar.google.com/citations?user=UEYd--YAAAAJ&hl=en
24,Giancarlo Fortino,"Full Prof. of Computer Engineering, University of Calabria, FIEEE, FAAIA, Highly Cited Researcher",68,3735,17563,63,14465,https://labs.dimes.unical.it/speme/people/giancarlo-fortino/,Human-Machine Systems/Agent-based Computing/Internet of Things/Wearable Computing/Wireless/Body Area Networks,https://scholar.google.com/citations?user=ecImn1MAAAAJ&hl=it
25,Hamido Fujita,Iwate Prefectural University,73,4436,18973,73,17710,http://www.fujita.soft.iwate-pu.ac.jp/,Machine Learning,https://scholar.google.com/citations?user=MxzV1nQAAAAJ&hl=en
26,Erik G. Larsson,"Professor, Dept. of Electrical Engineering (ISY), Linköping University, Sweden",90,6317,47224,71,31277,https://scholar.google.com/scholar?q=Erik+G.+Larsson+homepage&hl=en&as_sdt=0&as_vis=1&oi=scholart,Wireless communications/statistical signal processing/localization/massive MIMO/networks,https://scholar.google.se/citations?user=79Lry6oAAAAJ&hl=en
27,Amir H. Gandomi,"Professor of Data Science, University of Technology Sydney",82,6835,33039,73,26388,https://scholar.google.com/citations?user=VMf3wfMAAAAJ&hl=en,Data Analytics/Genetic Programming/Engineering Optimization/Evolutionary Computation/Smart Cities,https://scholar.google.com/citations?user=VMf3wfMAAAAJ&hl=en
28,Xiaohua Ge,"Swinburne University of Technology, Melbourne, Australia",38,2041,8007,38,7807,https://ieee-cas.org/contact/xiaohua-ge,Networked control systems/Cyber-physical systems/Multi-agent systems/Intelligent vehicles/Connected automated vehicles,https://scholar.google.com.au/citations?user=B37CYFoAAAAJ&hl=en
29,"Mohsen Guizani, FIEEE",Mohamed Bin Zayed University of Artificial Intelligence (MBZUAI),95,11038,49250,85,41847,https://scholar.google.com/citations?user=RigrYkcAAAAJ&hl=en,Internet of Things/Applied AI/ML and Cybersecurity,https://scholar.google.com/citations?user=RigrYkcAAAAJ&hl=en
30,Song Guo,"FCAE, FIEEE, The Hong Kong Polytechnic University",74,4420,23037,67,19040,https://forestgeo.si.edu/song-guo-zhang-michael,Edge Intelligence/Federated Learning/Edge Computing/Distributed System/Wireless Networking,https://scholar.google.com/citations?user=Ib-sizwAAAAJ&hl=en
31,Harald Haas,The University of Edinburgh,96,5635,47611,80,31596,https://scholar.google.com/citations?user=XxIwRJQAAAAJ&hl=en,Optical Wireless Communications/Interference Managment in Wireless Networks/Spatial Modulation,https://scholar.google.com/citations?user=XxIwRJQAAAAJ&hl=ja
32,Yuki Hagiwara,Fraunhofer IKS,30,1989,7390,30,7365,https://www.researchgate.net/profile/Yuki-Hagiwara,Artificial Intelligence,https://scholar.google.com.sg/citations?user=P6WI2DQAAAAJ&hl=en
33,"Qing-Long Han, Pro Vice-Chancellor and Distinguished Professor, MAE, IEEE Fellow, IFAC Fellow",Swinburne University of Technology,111,6152,40433,95,28234,https://conference.cs.cityu.edu.hk/iconip/Final%20program.pdf,Networked control systems/time-delay systems/multi-agent systems/smart grids/unmanned surface vehicles,https://scholar.google.com.au/citations?user=j0pyptAAAAAJ&hl=en
34,Zhu Han,University of Houston,121,8584,61424,94,42088,https://hanzhu.wixsite.com/home,Game Theory/Wireless Networking/Security/Data Science/Smart Grid,https://scholar.google.com/citations?user=ty7wIXoAAAAJ&hl=en
35,L Hanzo,"Chair of Telecommunications, University of Southampton",112,8291,72228,87,39223,https://research.com/u/l-hanzo,telecommunications/wireless communication/quantum_information_science/video_coding/video_networking,https://scholar.google.co.uk/citations?user=p0jnEW0AAAAJ&hl=en
36,L Hanzo,"Chair of Telecommunications, University of Southampton",112,8291,72228,87,39223,https://research.com/u/l-hanzo,telecommunications/wireless communication/quantum_information_science/video_coding/video_networking,https://scholar.google.co.uk/citations?user=p0jnEW0AAAAJ&hl=en
37,Robert Heath,"Lampe Distinguished Professor, North Carolina State University",139,7741,82898,93,44428,https://www.facebook.com/pages/category/Cargo---Freight-Company/Robert-Heath-Trucking-154874791214731/,wireless/MIMO/communications/signal processing/information theory,https://scholar.google.com/citations?user=17Ko8Q0AAAAJ&hl=en
38,Francisco Herrera,"Professor Computer Science and AI, Granada University, Spain",165,14437,118708,125,66437,http://www.herrerabox.com/,Artificial Intelligence/Computational Intelligence/Data mining/Evolutionary Algorithms/Big Data Analytics,https://scholar.google.com/citations?user=HULIk-QAAAAJ&hl=en
39,Enrique Herrera-Viedma,"Professor of Computer Science and Artificial Intelligence, Spain, University of Granada",111,5914,50327,92,28988,https://www.ae-info.org/ae/User/Herrera_Viedma_Enrique,Fuzzy sets/fuzzy decision making/computing with words/multiple criteria decision making/consensus,https://scholar.google.com/citations?user=g8ZXTuYAAAAJ&hl=en
40,Ekram Hossain,"Professor, University of Manitoba, Canada, IEEE Fellow",99,3262,37525,71,19941,https://www.facebook.com/md.ekramhossain.bd,Wireless communication networks/radio resource allocation/cognitive radio/multi-tier cellular networks,https://scholar.google.com/citations?user=Lb617EMAAAAJ&hl=en
41,Guang-Bin Huang,"Full Professor, Nanyang Technological University, Singapore",72,5629,55953,61,34239,https://scholar.google.com/scholar?q=Guang-Bin+Huang+homepage&hl=en&as_sdt=0&as_vis=1&oi=scholart,Machine Learning/Neural Networks/Neuroscience,https://scholar.google.com.sg/citations?user=LhSqQCIAAAAJ&hl=en
42,Kaibin Huang,"Professor, Dept. of EEE, The University of Hong Kong; IEEE Fellow; ISI Highly Cited Researcher",53,2895,15911,44,12565,https://ieeexplore.ieee.org/author/37290266200,Machine Learning/Mobile Edge Computing/Wireless Communications/Wireless Power Transfer/Stochastic Geometry,https://scholar.google.com/citations?user=HfuA3uIAAAAJ&hl=en
43,Thomas JR Hughes,"Peter O'Donnell Jr. Chair in Computational and Applied Mathematics, University of Texas at Austin",151,7044,130401,95,42784,https://imechanica.org/profile/profile_6/Thomas%20J.R.%20Hughes,Finite Element Methods/Solid Mechanics/Computational Fluid Dynamics/Partial Differential Equations/Isogeometric Analysis,https://scholar.google.com/citations?user=6tPdlYAAAAAJ&hl=en
44,Yaochu Jin,"A. v. Humboldt Professor for AI, Bielefeld University and Distinguished Chair, University of Surrey",92,5576,34376,74,22498,https://scholar.google.com/citations?user=B5WAkz4AAAAJ&hl=en,Evolutionary algorithms/Multiobjective optimization/Multiobjective learning/Trustworthy AI/Developmental AI,https://scholar.google.com/citations?user=B5WAkz4AAAAJ&hl=en
45,"Nei Kato(IEEE Fellow, IEICE Fellow)","Professor and Dean, Graduate School of Information Sciences, Tohoku University, Japan",76,3277,23150,61,15597,https://scholar.google.com/citations?user=LfLfZXEAAAAJ&hl=en,Wireless networking,https://scholar.google.com/citations?user=LfLfZXEAAAAJ&hl=en
46,"Dr. Neeraj Kumar, SMIEEE","Professor, CSED, Thapar Institute of Engineering and Technology, India",99,10001,32445,95,30500,https://www.mayoclinic.org/biographies/kumar-neeraj-m-d/bio-20054428,IoT and Machine Learning/Deep Learning/Blockchain Technology,https://scholar.google.co.in/citations?user=gL9gR-4AAAAJ&hl=en
47,"Dr.Arun Kumar Sangaiah, SM'IEEE (WoS-Highly Cited Researcher, Yushan Young Scholar)","National Yunlin University of Science & Technology, Taiwan & VIT University, India",73,4754,16914,73,16732,https://scholar.google.com.hk/citations?user=8yF6Xc4AAAAJ&hl=ja,Computational Intelligence/Internet of Things/Cognitive Computing,https://scholar.google.co.in/citations?user=8yF6Xc4AAAAJ&hl=en
48,Victor C. M. Leung,Shenzhen University / The University of British Columbia,106,6557,50685,87,33148,https://wix.academia.edu/VictorLeung/CurriculumVitae,communication systems/wireless networks/mobile systems,https://scholar.google.ca/citations?user=ajvCoo4AAAAJ&hl=en
49,Geoffrey Ye Li (李烨),"Chair Professor in Wireless Systems, Dept EEE, Imperial College London",111,5847,55640,80,27366,https://scholar.google.fi/citations?user=d0FzG8YAAAAJ&hl=fi,Signal Processing/and/Machine Learning/for/Wireless Communications,https://scholar.google.com/citations?user=d0FzG8YAAAAJ&hl=en
50,Hongyi Li,"Assistant Professor, University of Houston",34,919,4023,31,3426,https://scholar.google.com/scholar_url?url=https://www.researchgate.net/profile/Hongyi-Li-12/publication/248802637_Rayleigh_wave_tomography_of_China_and_adjacent_regions/links/5823603c08ae61258e3ca9ea/Rayleigh-wave-tomography-of-China-and-adjacent-regions.pdf&hl=en&sa=X&ei=FKgvY4CCPLaVy9YPkrCYqA4&scisig=AAGBfm0Y4zCXzSMGdI__PPkoJvo3llMMWw&oi=scholarr,watershed hydrology/earth system modeling/coupled human-nature system,https://scholar.google.com/citations?user=yWy-5icAAAAJ&hl=en
51,Jin Li  李进,Professor @Guangzhou University,61,1994,19599,55,13199,https://www.facebook.com/LI-JIN-ART-Atelier-749684642040678/videos/%E6%9D%8E%E8%BF%9B%E8%89%BA%E6%9C%AF%E5%B7%A5%E4%BD%9C%E5%AE%A4-%E8%AF%BE%E5%A0%82%E4%B9%A6%E7%94%BB%E6%95%99%E5%AD%A6-cours-de-peinture-et-calligraphe-chinoise/2248643622100004/,Trust and Security in Artificial Intelligence/Computating and Storage in Cloud Computing/Blockchain,https://scholar.google.com/citations?user=7GDV2vUAAAAJ&hl=en
52,Xuelong Li (Executive Councilor of AAAI),"Professor, Northwestern Polytechnical University, China",122,8527,57994,101,41472,https://sigai.acm.org/static/aimatters/3-3/AIMatters-3-3-08-Dong.pdf,artificial intelligence/optics and electronics,https://scholar.google.com/citations?user=ahUibskAAAAJ&hl=en
53,yongming li,"college of computer science, shaanxi normal university",37,403,5060,24,2546,https://ieeexplore.ieee.org/author/37405724900,fuzzy systems/quantume logic and quantum information/lattice/topology/model checking,https://scholar.google.com/citations?user=P3VERZ0AAAAJ&hl=en
54,Huchang Liao (廖虎昌),"IET Fellow, BCS Fellow; Business School, Sichuan University",65,3529,14224,63,13158,https://scholar.google.co.uk/citations?user=KlWnnbIAAAAJ&hl=en,Decision analysis/Fuzzy Systems/Multiple criteria decision making/Preference learning,https://scholar.google.co.uk/citations?user=KlWnnbIAAAAJ&hl=en
55,Chong Lin,Qingdao University,71,1916,17047,53,9732,https://bjdcollectasy.com/2021/01/09/chong-lin/,systems and control theory,https://scholar.google.com/citations?user=AQbRErEAAAAJ&hl=en
56,Yan-Jun Liu,Liaoning University of Technology,64,2277,15087,60,11650,https://eee.sustech.edu.cn/?view=%E5%88%98%E8%A8%80%E5%86%9B&jsid=18&lang=en,Adaptive control/fuzzy control/neural networks,https://scholar.google.com/citations?user=x_Wk1jAAAAAJ&hl=en
57,Yuanwei Liu,"Associate Professor in Queen Mary University of London, Web of Science Highly Cited Researcher",55,3434,13937,55,13673,https://vtsociety.org/contact/yuanwei-liu,NOMA/RIS/AI/6G/Integrated Sensing and Communications,https://scholar.google.com/citations?user=FxLf7ZAAAAAJ&hl=en
58,Wenjing Lou,"W. C. English Endowed Professor, IEEE Fellow, Virginia Tech, USA",83,2813,40454,60,19996,https://nvc.cs.vt.edu/faculty/Wenjing-Lou.html,Cyber Security/Wireless Networks/Wireless Security/Network Security/Cloud Computing,https://scholar.google.com/citations?user=hM8uAwoAAAAJ&hl=en
59,Majdi Mafarja,"Associate Professor of Computer Science, Birzeit University",36,2611,7778,35,7732,https://ieeexplore.ieee.org/author/37086290316,Feature Selection/Machine Learning/Artificial Intelligence/Bio-inspired Algorithms/Metaheuristics,https://scholar.google.com/citations?user=ftkD0MgAAAAJ&hl=en
60,Luis Martínez,"Professor of Computer Science, University of Jaén",67,2668,23742,53,13698,https://harris.uchicago.edu/directory/luis-martinez,Fuzzy decision making/Computing with words/Recommender Systems,https://scholar.google.com/citations?user=PG3D8UMAAAAJ&hl=en
61,Thomas Marzetta,"Distinguished Industry Professor, Department of Electrical and Computer Engineering, New York",61,4634,48606,46,29374,https://dblp.org/pid/84/6779,Beyond Massive MIMO,https://scholar.google.com/citations?user=tBLWIBoAAAAJ&hl=en
62,Seyedali Mirjalili,"Professor, Torrens University Australia, Adjunct Griffith University",79,16634,58776,79,56578,https://seyedalimirjalili.com/publications,Metaheuristics/Robust Optimization/Engineering Optimization/Evolutionary Algorithm/Swarm Intelligence,https://scholar.google.com/citations?user=TJHmrREAAAAJ&hl=en
63,Andreas F. Molisch,"Professor of Electrical Engineering, University of Southern California",104,5264,61239,72,29908,https://research.com/u/andreas-f-molisch,wireless propagation channels/multi-antenna systems/ultrawideband communications and positioning/cooperative communications,https://scholar.google.com/citations?user=W0wwrucAAAAJ&hl=en
64,Derrick Wing Kwan Ng,"Scientia  Associate Professor,  University of New South Wales",71,3950,21171,67,18517,https://nla.gov.au/nla.cat-vn7896055,Wireless Communications,https://scholar.google.com/citations?user=NUJSHxoAAAAJ&hl=en
65,H. Nguyen-Xuan,"CIRTech Institute, HUTECH University, Vietnam",70,2422,16620,61,11945,https://orcid.org/0000-0002-1746-8297,Computational Engineering/Large-scale Data/3D Printing/Renewable Energy,https://scholar.google.co.uk/citations?user=3iK9h-gAAAAJ&hl=en
66,Dusit (Tao) Niyato,Nanyang Technological University (NTU),106,8923,51843,91,37064,https://personal.ntu.edu.sg/dniyato/,ดุสิต นิยะโต - เต๋า,https://scholar.google.com/citations?user=T8sVhLMAAAAJ&hl=en
67,Kaoru Ota (太田　香),"MEXT Excellent Young Researcher (文部科学省　卓越研究員), Muroran Institute of Technology",52,2128,10552,49,9672,https://researchmap.jp/k-ota/published_papers/6446802?lang=en,,https://scholar.google.com/citations?user=8JVn8RsAAAAJ&hl=ja
68,Mugen Peng,"Beijing University of Posts & Telecommun., IEEE Fellow, Web of Science Highly Cited Researcher",54,2389,16441,48,11864,https://glose.com/author/mugen-peng,Fog Computing/Cloud Radio Access Networks/Integrated Satellite-Terrestrial Networks/6G,https://scholar.google.com/citations?user=85mAZVcAAAAJ&hl=en
69,HV Poor,"Michael Henry Strater University Professor, Princeton University",161,14332,128463,111,67031,https://scholar.google.com/citations?user=Dq93mOUAAAAJ&hl=en,Communication Systems/Wireless Communications/Communications/Statistical Signal Processing/Information Theory,https://scholar.google.com/citations?user=Dq93mOUAAAAJ&hl=en
70,Lianyong Qi(齐连永),"Professor, China University of Petroleum (East China)",47,1848,6786,46,6532,https://scholar.google.com/citations?user=pxNRRsAAAAAJ&hl=en,service computing/big data/recommender system,https://scholar.google.com/citations?user=pxNRRsAAAAAJ&hl=en
71,Timon Rabczuk,Bauhaus University Weimar,111,7343,44748,95,34286,https://www.journals.elsevier.com/computational-materials-science/editorial-board/timon-rabczuk,Computational Mechanics/Solid Mechanics,https://scholar.google.ca/citations?user=3CBuGosAAAAJ&hl=en
72,Kim-Kwang Raymond Choo,"Cloud Tech Endowed Professor, University of Texas at San Antonio; Highly Cited Researcher 2020, 2021",97,6685,27709,92,25224,https://dblp.org/pid/c/KimKwangRaymondChoo,Cloud Forensics/Cyber Forensics/Cyber Security/IoT Security/Blockchain,https://scholar.google.com/citations?user=rRBNI6AAAAAJ&hl=en
73,Kui Ren,"Professor, Zhejiang University, ACM Fellow, IEEE Fellow",86,3768,41410,71,23603,https://www.apam.columbia.edu/faculty/kui-ren,Data Security & Privacy/IoT Security/AI Security,https://scholar.google.com/citations?user=uuQA_rcAAAAJ&hl=en
74,Walid Saad,"Professor, Electrical and Computer Engineering",85,7508,35115,79,30105,https://healthcare.ascension.org/doctors/1164752499/walid-youssef-saad-murfreesboro-tn,6G/machine learning/semantic communications/security and cyber-physical systems/unmanned aerial vehicles,https://scholar.google.com/citations?user=kYDNA0UAAAAJ&hl=en
75,Robert Schober,Friedrich-Alexander-University Erlangen-Nuremberg,95,5366,44982,80,30022,https://scholar.google.com/scholar_url?url=http://publications.lib.chalmers.se/records/fulltext/224284/224284.pdf&hl=en&sa=X&ei=KKgvY_ecKaPcsQLs6JjYDA&scisig=AAGBfm2gxWUcVpDHf-H143qHaxLBGDlNPA&oi=scholarr,,https://scholar.google.com/citations?user=Uu0BpX8AAAAJ&hl=en
76,"Ling Shao, Fellow of IEEE/IAPR",Terminus Group,94,8243,36005,89,30939,https://en.wikipedia.org/wiki/Ling_Shao,Computer Vision/Deep Learning/Artificial Intelligence/Medical Imaging/Vision and Language,https://scholar.google.com/citations?user=z84rLjoAAAAJ&hl=en
77,Xuemin (Sherman) Shen,"University Professor, University of Waterloo",136,9306,77732,106,46240,https://scholar.google.com/scholar?q=Xuemin+(Sherman)+Shen+homepage&hl=en&as_sdt=0&as_vis=1&oi=scholart,Wireless networking/MAC/Network security/VANET,https://scholar.google.com/citations?user=Bjl3GwoAAAAJ&hl=cs
78,Peng Shi,"Professor, School of Electrical and Electronic Engineering, The University of Adelaide",152,8177,80615,116,48457,https://www.pengshi.com/,Systems and Control/Electrical and Electronic Engineering/Cybernetics/Human-Computer Interaction,https://scholar.google.com.hk/citations?user=EGx1iH0AAAAJ&hl=en
79,"R. Prof. P. N. Suganthan, FIEEE'2015, SCI Highly Cited Researcher 2015-2022, (Codes from my GitHub)","KINDI Center for Computing Research, Qatar University (Hon Doc: U of Maribor; BA/MA: Cambridge U, UK",110,7006,59775,91,35725,https://biochem2.com/newsentry/2021-11-16,Machine Learning(ML)/Swarm-Evolutionary Computation(SEC)/Neural Networks(ANN)/Applications of ML SEC ANN.,https://scholar.google.com/citations?user=yZNzBU0AAAAJ&hl=en
80,Xingming Sun,Nanjing University of Information Science and Technology,59,1692,16226,52,12952,http://www.sunlab-usf.com/,Digital Watermarking/Information Security,http://scholar.google.com/citations?user=epqnljMAAAAJ&hl=en
81,Tarik Taleb,University of Oulu,68,3670,20448,61,16037,https://www.6gworld.com/teams/tarik-taleb/,Network Function Virtualization/Network Softwarization/Software Defined Networking,https://scholar.google.com/citations?user=o1Ap0TEAAAAJ&hl=en
82,"jen hong, tan","Highly Cited Researcher in Computer Science, National University of Singapore",49,2340,10534,45,9644,https://sg.linkedin.com/in/jen-hong-tan-804b282b?trk=people-guest_people_search-card,image processing/computer vision/deep learning/infrared thermography/fundus image,https://scholar.google.com/citations?user=uJlD-A0AAAAJ&hl=en
