,Name,Affilation,H-index,Citations 2020,Total_citation,H-index_since_2016,Citation_since_2016,HomePage,Area of Research,Google_Scholar
0,"U Rajendra Acharya (SCI Highly Cited Researcher 2016-2021)  PhD, DEng, DSc","Ngee Ann,  Singapore University of Social Science,  University of Malaya, Malaysia",112,11440,48930,96,36373,https://umevent.um.edu.my/BIOMED2021=b59a51a3c0bf9c5228fde841714f523a,Artificial Intelligence/Medical Informatics,https://scholar.google.com.sg/citations?user=8FjY99sAAAAJ&hl=en
1,IAN  F.  AKYILDIZ,"Truva Inc. , USA",132,6216,132661,78,37426,https://ianakyildiz.com/publications/,Wireless Communication/5G/6G Wireless Systems/Intelligent Surfaces for Wireless Communication/Nano-scale and Molecular Commun,https://scholar.google.com/citations?user=rAGwv14AAAAJ&hl=en
2,Ibrahim Aljarah,"Associate Professor, University of Jordan",43,3313,7594,42,7419,https://en.everybodywiki.com/Ibrahim_Aljarah,Artificial  intelligence/Swarm Intelligence/Data Science/Machine Learning/Evolutionary Computation,https://scholar.google.com/citations?user=moOTIYEAAAAJ&hl=en
3,Jeffrey Andrews,"Cockrell Family Endowed Chair in Engineering, University of Texas at Austin",106,3590,65137,70,28529,https://www.jeffandrewsdesign.com/pressmain,Wireless Communications/Communication Theory/Machine Learning for Communications/Stochastic Geometry/Information Theory,https://scholar.google.com/citations?user=Hr9Gey0AAAAJ&hl=en
4,Bennis Mehdi,"Full Professor, IEEE Fellow, Head of ICON, University of Oulu",65,6564,23372,62,20761,https://comnet.ieee.tn/mehdi-bennis/,B5G/6G/machine learning/semantic communication,https://scholar.google.com/citations?user=RW4sJu8AAAAJ&hl=en
5,Emil Björnson,"Professor of Wireless Communication, KTH Royal Institute of Technology",61,4222,17089,58,14225,https://github.com/emilbjornson,Massive MIMO/Cell-free Massive MIMO/RIS/Signal processing/Wireless communication,https://scholar.google.se/citations?user=Maij4akAAAAJ&hl=en
6,Rajkumar Buyya,"CLOUDS Lab, School of Computing and Information Systems, The University of Melbourne, Australia",153,10845,121679,102,58172,https://www.freetechbooks.com/rajkumar-buyya-a3726.html,Computer Systems/Cloud Computing/Distributed Systems/Edge Computing/Internet of Things,https://scholar.google.com/citations?user=7xN6JqYAAAAJ&hl=en
7,Xing Cai,"Senior Research Scientist at Simula Research Laboratory, Professor at University of Oslo",19,141,2006,13,719,https://www.simula.no/people/xingca,Parallel programming/High-performance computing/numerical methods for PDEs,https://scholar.google.com/citations?user=IWQbrcK5CEwC&hl=en
8,Giuseppe Caire,"Professor, Technical University of Berlin, Germany, and Professor of Electrical Engineering (on",82,2689,38728,54,15275,https://www.humboldt-foundation.de/en/entdecken/newsroom/dossier-alexander-von-humboldt-professur/giuseppe-caire,Information Theory/Communications/Signal Processing/Statistics,https://scholar.google.com/citations?user=g66ErTcAAAAJ&hl=en
9,Jinde Cao,"Academician, RAE/AE/RAEN/LAS/AAS/EASA/PAS/IASCYS  & FIEEE/FAAIA/DFIETI; Southeast University",129,9101,67757,88,37987,https://www.peertechzpublications.com/editor-in-chief/jinde-cao,Complex networks/neural networks/multi-agent systems - engineering stability - dynamics and control - time-delay systems,https://scholar.google.com/citations?user=8_ffELYAAAAJ&hl=en
10,C. L. Philip Chen,"Chair Professor, South China University of Technology, Philip.Chen@ieee.org",92,7383,35695,81,26060,https://scholar.google.com/citations?user=Q5248zwAAAAJ&hl=en,Computational Intelligence/Intelligent Control/Cybernetics/Intelligent Transportation Systems/Data Science/Engineering,https://scholar.google.com/citations?user=Q5248zwAAAAJ&hl=en
11,Jinjun Chen,"Professor and Deputy Institute Director, Swinburne University of Technology",67,2370,12488,48,8250,https://scholar.google.com/citations?user=mQ9vJ24AAAAJ&hl=en,Cloud Computing/Scalable Architecture/Scalable Data Storage/Scalable Data Processing (Privacy),https://scholar.google.com/citations?user=mQ9vJ24AAAAJ&hl=en
12,Min Chen,"Professor, IEEE Fellow, Highly Cited Researcher, Huazhong University of Science and Technology",86,5741,32529,68,23437,https://faculty.washington.edu/minchen2/,Cognitive Computing and Big Data Analytics/IoT Sensing/5G Networks/Robotics/Edge Computing,https://scholar.google.com/citations?user=_HyHTrsAAAAJ&hl=en
13,Xiaofeng Chen,"Professor, Xidian University, China",56,1677,12730,48,9257,https://scholar.google.com/citations?user=-3WhJecAAAAJ&hl=en,Security/Cryptography/Cloud computing,https://scholar.google.com/citations?user=-3WhJecAAAAJ&hl=en
14,Francisco Chiclana,"Professor of Computational Intelligence and Decision Making, De Montfort University, UK",68,2553,19279,58,10876,https://www.researchgate.net/profile/Francisco-Chiclana/3,Decision making/computational intelligence/information fusion/consensus/sentiment analysis,https://scholar.google.com/citations?user=qDOxZIIAAAAJ&hl=en
15,zhihua cui,"Taiyuan University of Science and Technology, Taiyuan, Shanxi, China, 030024",43,1753,7692,33,5478,https://www.zhihuacui.com/contact,evolutionary computation,https://scholar.google.com/citations?user=BpDrULIAAAAJ&hl=en
16,Linglong Dai,"Associate Professor, Tsinghua University; IEEE Fellow",62,3123,15347,56,13697,https://www.ee.tsinghua.edu.cn/en/info/1059/1261.htm,Wireless Communications/RIS/Massive MIMO/Millimeter-Wave/Teraherz Communications/Non-Orthogonal Mutiple Access,https://scholar.google.com/citations?user=OTFnifoAAAAJ&hl=en
17,Merouane Debbah,"Centralesupelec, Technology Innovation Institute, MBZUAI, Lagrange Mathematics Center",98,8491,45993,82,31588,https://laneas.com/merouane-debbah,5G/6G/Machine Learning/Random Matrix Theory/Game Theory,https://scholar.google.com/citations?user=HU5I0X4AAAAJ&hl=en
18,Yong Deng,"School of Computer and Information Science, Southwest University",74,3609,19172,65,14456,https://scholar.google.com/citations?user=8voeILsAAAAJ&hl=en,Evidence Theory/Fuzzy Set Theory/Bio-inspired AI/Complex Networks,https://scholar.google.com/citations?user=8voeILsAAAAJ&hl=en
19,Zhiguo Ding,"University of Manchester, Fellow of IEEE, Web of Science Highly Cited Researcher",89,7720,35321,83,31032,https://scholar.google.co.uk/citations?user=V-nB8scAAAAJ&hl=en,Wireless communications/signal processing/and cross-layer optimization,https://scholar.google.co.uk/citations?user=V-nB8scAAAAJ&hl=en
20,"Mianxiong Dong, Foreign Fellow of EAJ","Vice President and Professor, Muroran Institute of Technology, Japan",53,2056,10198,47,8819,https://u.muroran-it.ac.jp/enes/~mxdong/,Cyber-Physical Systems/Internet of Things/Artificial Intelligence,https://scholar.google.co.jp/citations?user=TqyApAUAAAAJ&hl=en
21,Yucheng Dong,"Professor of Management and Systems Sciences, Sichuan University",57,2389,11097,53,8775,https://dl.acm.org/profile/82858716757,Decision Analysis/Human Dynamics/Social Network/Data Science,https://scholar.google.com/citations?user=tFVYDw4AAAAJ&hl=en
22,Maged Elkashlan,"Associate Professor, Queen Mary University of London",59,2555,14429,52,11970,http://eecs.qmul.ac.uk/profiles/elkashlanmaged.html,IRS/URLLC/UAV/PLS/NOMA,https://scholar.google.com/citations?user=mncnnOAAAAAJ&hl=en
23,Zubair Md. Fadlullah,"Associate Professor, Research Chair, Department of Computer Science, Lakehead University, TBRHRI",38,1223,7059,36,5360,https://dblp.org/pid/64/3988,Beyond 5G/Smart Health/UAV & Energy efficient Networks/QoS & Security/Deep Learning applications,https://scholar.google.com/citations?user=dZyfKpYAAAAJ&hl=en
24,Hossam Faris,"Professor, The University of Jordan, Al Hussein Technical University",45,4387,10046,44,9820,https://ieeexplore.ieee.org/author/38016215500,Data Science/Knowledge Systems/Data Mining/Evolutionary computation,https://scholar.google.com/citations?user=UEYd--YAAAAJ&hl=en
25,Giancarlo Fortino,"Full Prof. of Computer Engineering, University of Calabria, IEEE Fellow, Highly Cited Researcher",64,3572,14924,56,11890,https://ieeexplore.ieee.org/author/37273318600,Human-Machine Systems/Agent-based Computing/Internet of Things/Wearable Computing/Wireless/Body Area Networks,https://scholar.google.com/citations?user=ecImn1MAAAAJ&hl=it
26,Hamido Fujita,Iwate Prefectural University,64,4776,15317,64,14218,https://ieeexplore.ieee.org/author/37275244500,Machine Learning,https://scholar.google.com/citations?user=MxzV1nQAAAAJ&hl=en
27,Erik G. Larsson,"Professor, Dept. of Electrical Engineering (ISY), Linköping University, Sweden",84,5868,42861,64,26883,https://scholar.google.se/citations?user=79Lry6oAAAAJ&hl=en,Wireless communications/statistical signal processing/localization/massive MIMO/networks,https://scholar.google.se/citations?user=79Lry6oAAAAJ&hl=en
28,Amir H. Gandomi,"Professor, UTS",74,6904,26135,61,19511,https://www.linkedin.com/in/amir-h-gandomi-4225023b,Data Analytics/Genetic Programming/Engineering Optimization/Evolutionary Computation/Smart Cities,https://scholar.google.com/citations?user=VMf3wfMAAAAJ&hl=en
29,Xiaohua Ge,"Swinburne University of Technology, Melbourne, Australia",33,2020,6211,33,6023,https://orcid.org/0000-0003-0180-0897,Multi-agent systems/Networked control systems/Cyber-physical systems,https://scholar.google.com.au/citations?user=B37CYFoAAAAJ&hl=en
30,"Mohsen Guizani, FIEEE",Mohamed Bin Zayed University of Artificial Intelligence (MBZUAI),89,10117,41378,74,33295,https://vivo.nkn.uidaho.edu/vivo/display/n62284,Internet of Things/Applied AI/ML and Cybersecurity,https://scholar.google.com/citations?user=RigrYkcAAAAJ&hl=en
31,Song Guo,"FCAE, FIEEE, The Hong Kong Polytechnic University",69,4111,19868,63,15893,https://polyu.netlify.app/people/song-guo/,Big Data Computing/Edge AI/Mobile Computing/Distributed System,https://scholar.google.com/citations?user=Ib-sizwAAAAJ&hl=en
32,Harald Haas,The University of Edinburgh,93,5296,44211,75,27819,https://uk.linkedin.com/in/hhaas,Optical Wireless Communications/Interference Managment in Wireless Networks/Spatial Modulation,https://scholar.google.com/citations?user=XxIwRJQAAAAJ&hl=ja
33,Yuki Hagiwara,Fraunhofer IKS,29,1922,5977,29,5955,https://apps.apple.com/us/developer/yuki-hagiwara/id1076129199,Artificial Intelligence,https://scholar.google.com.sg/citations?user=P6WI2DQAAAAJ&hl=en
34,"Qing-Long Han, Pro Vice-Chancellor and Distinguished Professor, MAE, IEEE Fellow",Swinburne University of Technology,104,6326,35956,86,23818,https://scholar.google.com.au/citations?user=j0pyptAAAAAJ&hl=en,Networked control systems/time-delay systems/multi-agent systems/smart grids/unmanned surface vehicles,https://scholar.google.com.au/citations?user=j0pyptAAAAAJ&hl=en
35,Zhu Han,University of Houston,117,7906,54391,87,34940,https://www.researchgate.net/profile/Zhu-Han-2,Game Theory/Wireless Networking/Security/Data Science/Smart Grid,https://scholar.google.com/citations?user=ty7wIXoAAAAJ&hl=en
36,L Hanzo,"Chair of Telecommunications, University of Southampton",106,7789,64843,81,31594,https://www.amazon.com/Books-Lajos-Hanzo/s?rh=n%3A283155%2Cp_27%3ALajos+Hanzo,telecommunications/wireless communication/quantum_information_science/video_coding/video_networking,https://scholar.google.co.uk/citations?user=p0jnEW0AAAAJ&hl=en
37,L Hanzo,"Chair of Telecommunications, University of Southampton",106,7789,64843,81,31594,https://www.amazon.com/Books-Lajos-Hanzo/s?rh=n%3A283155%2Cp_27%3ALajos+Hanzo,telecommunications/wireless communication/quantum_information_science/video_coding/video_networking,https://scholar.google.co.uk/citations?user=p0jnEW0AAAAJ&hl=en
38,Robert Heath,"Lampe Distinguished Professor, North Carolina State University",135,7509,79489,88,40675,https://www2.ljworld.com/life-events/obituaries/2021/aug/19/robert-heath/,wireless/MIMO/communications/signal processing/information theory,https://scholar.google.com/citations?user=17Ko8Q0AAAAJ&hl=en
39,Francisco Herrera,"Professor Computer Science and AI, Granada University, Senior Research Advisor in DL&ML at Sherpa.ai",158,14641,108296,117,56020,http://www.herrerabox.com/#contact,Artificial Intelligence/Computational Intelligence/Data mining/Evolutionary Algorithms/Big Data Analytics,https://scholar.google.com/citations?user=HULIk-QAAAAJ&hl=en
40,Enrique Herrera-Viedma,"Professor of Computer Science and Artificial Intelligence, Spain, University of Granada",106,6067,45297,86,24311,https://www.researchgate.net/profile/Enrique-Herrera-Viedma,Fuzzy sets/fuzzy decision making/computing with words/multiple criteria decision making/consensus,https://scholar.google.com/citations?user=g8ZXTuYAAAAJ&hl=en
41,Ekram Hossain,"Professor, University of Manitoba, Canada, IEEE Fellow",98,3076,36276,68,17958,https://research.com/u/ekram-hossain,Wireless communication networks/radio resource allocation/cognitive radio/multi-tier cellular networks,https://scholar.google.com/citations?user=Lb617EMAAAAJ&hl=en
42,Guang-Bin Huang,"Full Professor, Nanyang Technological University, Singapore",69,5439,52774,60,30771,https://orcid.org/0000-0002-2480-4965,Machine Learning/Neural Networks/Neuroscience,https://scholar.google.com.sg/citations?user=LhSqQCIAAAAJ&hl=en
43,Kaibin Huang,"Associate Professor, Dept. of EEE, The University of Hong Kong; IEEE Fellow",51,2709,13740,40,10385,https://www.eee.hku.hk/~huangkb/,Machine Learning/Mobile Edge Computing/Wireless Communications/Wireless Power Transfer/Stochastic Geometry,https://scholar.google.com/citations?user=HfuA3uIAAAAJ&hl=en
44,Thomas JR Hughes,"Peter O'Donnell Jr. Chair in Computational and Applied Mathematics, University of Texas at Austin",159,7431,130094,93,39312,https://www.nae.edu/29165/Dr-Thomas-JR-Hughes,Finite Element Methods/Solid Mechanics/Computational Fluid Dynamics/Partial Differential Equations/Isogeometric Analysis,https://scholar.google.com/citations?user=6tPdlYAAAAAJ&hl=en
45,Yaochu Jin,"A. v. Humboldt Professor for AI, Bielefeld University and Distinguished Chair, University of Surrey",83,5532,29652,69,17734,http://users.jyu.fi/~yaojin/,Artificial Intelligence/Evolutionary Computation/Multiobjective Optimization/Federated Learning/Developmental AI,https://scholar.google.com/citations?user=B5WAkz4AAAAJ&hl=en
46,"Nei Kato(IEEE Fellow, IEICE Fellow)","Professor, Graduate School of Information Sciences, Tohoku University, Japan",72,2965,20768,57,13100,http://www.ic-wcsp.org/2013/show.asp?id=36,Wireless networking,https://scholar.google.com/citations?user=LfLfZXEAAAAJ&hl=en
47,"Dr. Neeraj Kumar, SMIEEE (Web of Science Highly Cited Researcher 2019, 2020,2021)","Professor, CSED, Thapar Institute of Engineering and Technology, India",86,9599,25337,81,23284,https://scholar.google.pt/citations?user=gL9gR-4AAAAJ&hl=pt-PT,IoT and Machine Learning/Deep Learning/Blockchain Technology,https://scholar.google.co.in/citations?user=gL9gR-4AAAAJ&hl=en
48,"Dr. Arun Kumar Sangaiah., Ph.D (SM'IEEE)","Professor, School of Computing Science and Engineering, VIT University, Vellore, India",66,4579,13458,66,13286,https://scholar.google.com.pk/citations?user=8yF6Xc4AAAAJ&hl=tr,Software Engineering/Computational Intelligence/Internet of Things,https://scholar.google.co.in/citations?user=8yF6Xc4AAAAJ&hl=en
49,Victor C. M. Leung,Shenzhen University / The University of British Columbia,100,6039,45951,80,28356,https://people.ece.ubc.ca/vleung/,communication systems/wireless networks/mobile systems,https://scholar.google.ca/citations?user=ajvCoo4AAAAJ&hl=en
50,Geoffrey Ye Li (李烨),"Chair Professor in Wireless Systems, Dept EEE, Imperial College London",104,5397,51007,77,22657,https://www.grmmuskogee.org/how-to-bcaf/e1eccc-geoffrey-ye-li,Signal Processing/and/Machine Learning/for/Wireless Communications,https://scholar.google.com/citations?user=d0FzG8YAAAAJ&hl=en
51,Hongyi Li,"Assistant Professor, University of Houston",32,929,3340,28,2749,https://scholars.duke.edu/person/hongyi.li,watershed hydrology/earth system modeling/coupled human-nature system,https://scholar.google.com/citations?user=yWy-5icAAAAJ&hl=en
52,Jin Li  李进,Professor @Guangzhou University,56,1895,18221,51,11791,https://idealliancechina.org/2021/07/09/mr-jin-li-%E6%9D%8E%E8%BF%9B/,Trust and Security in Artificial Intelligence/Computating and Storage in Cloud Computing/Blockchain,https://scholar.google.com/citations?user=7GDV2vUAAAAJ&hl=en
53,Xuelong Li (Executive Councilor of AAAI),"Professor, Northwestern Polytechnical University, China",115,8113,51440,93,34811,https://aaai.org/Organization/officers.php,artificial intelligence/optics and electronics,https://scholar.google.com/citations?user=ahUibskAAAAJ&hl=en
54,yongming li,"college of computer science, shaanxi normal university",36,422,4772,23,2255,https://dl.acm.org/profile/81452600296,fuzzy systems/quantume logic and quantum information/lattice/topology/model checking,https://scholar.google.com/citations?user=P3VERZ0AAAAJ&hl=en
55,Huchang Liao (廖虎昌),"IET Fellow, BCS Fellow; Business School, Sichuan University",60,3889,11909,56,10841,https://www.pubtexto.com/uploads/editorialboard/editor_cv/pubtexto_cv_90_23092019123728.pdf,Decision analysis/Fuzzy Systems/Multiple criteria decision making/Preference learning,https://scholar.google.co.uk/citations?user=KlWnnbIAAAAJ&hl=en
56,Chong Lin,Qingdao University,68,2066,15639,50,8444,https://dblp.org/pid/72/4213,systems and control theory,https://scholar.google.com/citations?user=AQbRErEAAAAJ&hl=en
57,Yan-Jun Liu,Liaoning University of Technology,58,2439,13416,55,9983,https://eee.sustech.edu.cn/?view=%E5%88%98%E8%A8%80%E5%86%9B&jsid=18&lang=en,Adaptive control/fuzzy control/neural networks,https://scholar.google.com/citations?user=x_Wk1jAAAAAJ&hl=en
58,Yuanwei Liu,"Associate Professor in Queen Mary University of London, Web of Science Highly Cited Researcher",47,3289,10536,46,10230,https://dblp.org/pid/93/8541,NOMA/RIS/UAV Communications/Artifical Intelligence/6G,https://scholar.google.com/citations?user=FxLf7ZAAAAAJ&hl=en
59,Wenjing Lou,"W. C. English Endowed Professor, IEEE Fellow, Virginia Tech, USA",80,2606,38615,58,18143,https://www.researchgate.net/profile/Wenjing-Lou,Cyber Security/Wireless Networks/Wireless Security/Network Security/Cloud Computing,https://scholar.google.com/citations?user=hM8uAwoAAAAJ&hl=en
60,Majdi Mafarja,"Associate Professor of Computer Science, Birzeit University",33,2715,5624,31,5573,https://ieeexplore.ieee.org/author/37086290316,Feature Selection/Machine Learning/Artificial Intelligence/Bio-inspired Algorithms/Metaheuristics,https://scholar.google.com/citations?user=ftkD0MgAAAAJ&hl=en
61,Luis Martínez,"Professor of Computer Science, University of Jaén",61,2889,21908,50,11833,https://scholar.google.com/citations?user=PG3D8UMAAAAJ&hl=en,Fuzzy decision making/Computing with words/Recommender Systems,https://scholar.google.com/citations?user=PG3D8UMAAAAJ&hl=en
62,Thomas Marzetta,"Distinguished Industry Professor, Department of Electrical and Computer Engineering, New York",58,4354,45902,44,26639,https://ieeexplore.ieee.org/author/37282754500,Beyond Massive MIMO,https://scholar.google.com/citations?user=tBLWIBoAAAAJ&hl=en
63,Seyedali Mirjalili,"Professor, Torrens University Australia, Adjunct Griffith University",70,17176,43254,70,41110,https://au.linkedin.com/in/alimirjalili,Metaheuristics/Robust Optimization/Engineering Optimization/Evolutionary Algorithm/Swarm Intelligence,https://scholar.google.com/citations?user=TJHmrREAAAAJ&hl=en
64,Andreas F. Molisch,"Professor of Electrical Engineering, University of Southern California",101,5028,58019,70,26350,https://ieeexplore.ieee.org/author/37279677800,wireless propagation channels/multi-antenna systems/ultrawideband communications and positioning/cooperative communications,https://scholar.google.com/citations?user=W0wwrucAAAAJ&hl=en
65,Derrick Wing Kwan Ng,"Scientia  Assoicate Professor,  University of New South Wales",65,3666,17637,61,14976,https://orcid.org/0000-0001-6400-712X,Wireless Communications,https://scholar.google.com/citations?user=NUJSHxoAAAAJ&hl=en
66,H. Nguyen-Xuan,"CIRTech Institute, Ho Chi Minh City University of Technology (HUTECH), Vietnam",67,2565,14955,56,10326,https://faculty.sites.iastate.edu/xhnguyen/,Computational Engineering/Large-scale data/3D Printing/Renewable Energy,https://scholar.google.co.uk/citations?user=3iK9h-gAAAAJ&hl=en
67,Dusit (Tao) Niyato,Nanyang Technological University (NTU),100,8142,44407,80,29458,https://scholar.google.com/citations?user=T8sVhLMAAAAJ&hl=en,ดุสิต นิยะโต - เต๋า,https://scholar.google.com/citations?user=T8sVhLMAAAAJ&hl=en
68,Kaoru Ota (太田　香),"MEXT Excellent Young Researcher (文部科学省　卓越研究員), Muroran Institute of Technology",49,1953,9043,47,8197,https://researchmap.jp/k-ota?lang=en,,https://scholar.google.com/citations?user=8JVn8RsAAAAJ&hl=ja
69,Mugen Peng,"Beijing University of Posts & Telecommun., IEEE Fellow, Web of Science Highly Cited Researcher",52,2194,14981,43,10090,https://dl.acm.org/profile/81339521539,Fog Radio Access Network/Heterogeneous Networks/Cloud Radio Access Networks/Network Coding/Radio Resource Allocation and Opt,https://scholar.google.com/citations?user=85mAZVcAAAAJ&hl=en
70,HV Poor,"Michael Henry Strater University Professor, Princeton University",154,13523,118216,102,55929,https://sites.google.com/view/nirshl,Information Theory/Statistical Signal Processing/Stochastic Analysis,https://scholar.google.com/citations?user=Dq93mOUAAAAJ&hl=en
71,Lianyong Qi(齐连永),"Professor, Qufu Normal University(青年教授，博士生导师，曲阜师范大学)",40,1777,4968,38,4719,https://faculty.nuist.edu.cn/xuxiaolong/zh_CN/index.htm,service computing/big data/recommender system,https://scholar.google.com/citations?user=pxNRRsAAAAAJ&hl=en
72,Timon Rabczuk,Bauhaus University Weimar,105,7595,39425,89,28994,https://comreslab.ut.ac.ir/member/dr-timon-rabczuk,Computational Mechanics/Solid Mechanics,https://scholar.google.ca/citations?user=3CBuGosAAAAJ&hl=en
73,Kim-Kwang Raymond Choo,"Cloud Tech Endowed Professor, University of Texas at San Antonio; Highly Cited Researcher 2020, 2021",89,6152,22635,82,20210,https://people.unisa.edu.au/raymond.choo,Cloud Forensics/Cyber Forensics/Cyber Security/IoT Security/Blockchain,https://scholar.google.com/citations?user=rRBNI6AAAAAJ&hl=en
74,Kui Ren,"Professor, Zhejiang University, ACM Fellow, IEEE Fellow",81,3519,38811,67,20986,https://ieeexplore.ieee.org/author/37288795500,Data Security & Privacy/IoT Security/AI Security,https://scholar.google.com/citations?user=uuQA_rcAAAAJ&hl=en
75,Walid Saad,"Professor, Electrical and Computer Engineering",79,6944,29507,70,24417,https://publons.com/a/C-7978-2018/,6G wireless systems/machine learning/security/cyber-physical systems/Unmanned aerial vehicles (UAVs),https://scholar.google.com/citations?user=kYDNA0UAAAAJ&hl=en
76,Robert Schober,Friedrich-Alexander-University Erlangen-Nuremberg,90,5064,40860,72,25869,https://www.comsoc.org/robert-schober,,https://scholar.google.com/citations?user=Uu0BpX8AAAAJ&hl=en
77,"Ling Shao, Fellow of IEEE/IAPR","CTO and Chief Scientist, National Center for Artificial Intelligence (NCAI), SDAIA, KSA",79,7994,28609,74,23523,https://scholar.google.com/citations?user=z84rLjoAAAAJ&hl=en,Computer Vision/Deep Learning/Artificial Intelligence/Medical Imaging/Vision and Language,https://scholar.google.com/citations?user=z84rLjoAAAAJ&hl=en
78,Xuemin (Sherman) Shen,"University Professor, University of Waterloo",127,8529,70601,97,39278,https://www.bookdepository.com/author/Xuemin-Sherman-Shen,Wireless networking/MAC/Network security/VANET,https://scholar.google.com/citations?user=Bjl3GwoAAAAJ&hl=cs
79,Peng Shi,"Professor, School of Electrical and Electronic Engineering, The University of Adelaide",148,8506,74706,109,42639,https://www.pengshi.com/,Systems and Control/Electrical and Electronic Engineering/Cybernetics/Human-Computer Interaction,https://scholar.google.com.hk/citations?user=EGx1iH0AAAAJ&hl=en
80,"Dr. P. N. Suganthan (SCI Highly Cited Researcher 2015-2021), FIEEE'2015","Some Codes available at GitHub, (Hon. Doctorate, U. of Maribor, 2020 ; BA & MA, U. of Cambridge, UK)",102,7042,54415,84,30355,https://scholar.google.cat/citations?user=J6lMBuEAAAAJ&hl=ca,Machine Learning(ML)/Swarm-Evolutionary Computation(SEC)/Neural Networks(ANN)/Applications of ML SEC ANN.,https://scholar.google.com/citations?user=yZNzBU0AAAAJ&hl=en
81,Xingming Sun,Nanjing University of Information Science and Technology,56,1634,15022,49,11746,https://dl.acm.org/profile/81100448221,Digital Watermarking/Information Security,http://scholar.google.com/citations?user=epqnljMAAAAJ&hl=en
82,Tarik Taleb,University of Oulu,65,3367,18023,58,13593,https://www.oulu.fi/cwc/personnel/taleb-tarik,Network Function Virtualization/Network Softwarization/Software Defined Networking,https://scholar.google.com/citations?user=o1Ap0TEAAAAJ&hl=en
83,"jen hong, tan","Highly Cited Researcher in Computer Science, National University of Singapore",46,2276,8938,43,8048,https://scholar.google.com/citations?user=uJlD-A0AAAAJ&hl=en,image processing/computer vision/deep learning/infrared thermography/fundus image,https://scholar.google.com/citations?user=uJlD-A0AAAAJ&hl=en
84,Dacheng Tao,The University of Sydney,137,13282,71758,111,50433,https://dl.acm.org/profile/81100159571,artificial intelligence/machine learning/computer vision/image processing/data mining,https://scholar.google.com/citations?user=RwlJNLcAAAAJ&hl=en
85,Athanasios Vasilakos,"PROF OF COMPLEX SYSTEMS, CYBERSECURITY, AI",122,7047,53984,102,37141,https://dblp.org/pid/40/4747,Cybersecurity/IoTs/Mobile Nets/Big Data Analytics/Cloud Computing/Artificial Intelligence/Machine Learning,https://scholar.google.com/citations?user=_yWPQWoAAAAJ&hl=en
86,Huanqing Wang,Michigan Technological University,3,7,30,3,30,https://www.artsy.net/artist/huanqing-wang,Electric vehicle/optimal control/model predictive control,https://scholar.google.com/citations?user=6XxgmPEAAAAJ&hl=en
