85,Huanqing Wang,Michigan Technological University,4,9,44,4,44,https://www.artsy.net/artist/huanqing-wang,Electric vehicle/optimal control/model predictive control,https://scholar.google.com/citations?user=6XxgmPEAAAAJ&hl=en
86,Ping Wang,"York University, IEEE Fellow, York Research Chair, IEEE VTS Distinguished Lecturer",71,3623,23312,61,17742,http://www.wangping.com/,wireless communications/Internet of Things/cloud computing/smart grid,https://scholar.google.com/citations?user=3sIHxrcAAAAJ&hl=en
87,Qingqing Wu (武庆庆),University of Macau,51,4935,16418,50,16306,https://scholar.google.com/citations?user=as1T8CMAAAAJ&hl=en,6G/IRS/Green communication and computing/UAV communications/Machine learning,https://scholar.google.com/citations?user=as1T8CMAAAAJ&hl=en
88,Zheng-Guang Wu,Zhejiang University,78,2536,17619,70,13417,https://ieeexplore.ieee.org/author/37404351000,Markov Jump Systems/Sampled-Data Control Systems/Neural Networks/Fuzzy Systems/Singular Systems,https://scholar.google.com/citations?user=vy6JCNgAAAAJ&hl=en
89,Yang Xiang,"IEEE Fellow, Professfor, Swinburne University of Technology",69,2814,17754,60,14148,https://sites.psu.edu/fpcrl/xiangyang/,Cybersecurity/Network Security/System Security/Software Vulnerability Detection/Blockchain,https://scholar.google.com/citations?user=7ymTWY4AAAAJ&hl=en
90,Xiaolong Xu (许小龙),"Professor, Highly Cited Researcher 2021, Nanjing University of Information Science and Technology",43,1444,5804,43,5748,https://faculty.nuist.edu.cn/xuxiaolong/zh_CN/index.htm,Edge computing/Cloud computing/Big data/Fog computing/Mobile computing,https://scholar.google.com/citations?user=Tyzef4sAAAAJ&hl=en
91,Zeshui Xu (徐泽水),"Member of AE,EASA,IASCYS; DFIETI,FIEEE,FIFSA,FIET,FRSA,FORS,FBCS,FIAAM,FAAIA... Sichuan University",141,8948,77380,112,46921,https://www.adscientificindex.com/scientist/zeshui-xu-/713557,Decision Making/Information Fusion/Fuzzy Sets/Computational Intelligence/Bibliometrics,https://scholar.google.co.uk/citations?user=kd9L_GUAAAAJ&hl=en
92,Xin-She Yang (DPhil),"Computational intelligence, swarm intelligence, optimization, metaheuristics, nature-inspired",93,10552,74915,85,52614,https://www.mdx.ac.uk/about-us/our-people/staff-directory/profile/yang-xin-she,swarm intelligence/optimization/metaheuristics/computational intelligence.,https://scholar.google.com/citations?user=fA6aTlAAAAAJ&hl=th
93,Fei Yu,University of Southern Denmark,10,69,314,9,252,https://www.biostat.ucla.edu/people/yu,Industry 4.0 technology and smart product development,https://scholar.google.com/citations?user=3OHgAmIAAAAJ&hl=en
94,Xiangxiang Zeng,"Deparment of Computer Science, Hunan University",51,1612,7638,42,6455,https://ieeexplore.ieee.org/author/37591081000,Computational Intelligence/Bio-inspired Intelligence,https://scholar.google.com/citations?user=B20HBMIAAAAJ&hl=en
95,Yong Zeng (曾勇）,"Southeast University, China; Purple Mountain Laboratories, China",53,4117,18337,52,17848,http://www.citmd.com/CIT/2021/program_view.php?sid=&c_id=100,UAV communications/Massive MIMO/Extremely-Large MIMO (XL-MIMO)/Integrated Sensing and Communication,https://scholar.google.com/citations?user=ENldmwIAAAAJ&hl=en
96,Jianming Zhan,Hubei University for Nationalities,45,1009,7704,39,5173,https://content.iospress.com/articles/journal-of-intelligent-and-fuzzy-systems/ifs707,logical algebras(BL-algebras/R0-algebras and MTL-algebras)/fuzzy algebras(semirings/hemirings and rings) and their hyperstuctures(hyperring/hypergroups,https://scholar.google.com/citations?user=XmJAmNIAAAAJ&hl=en
97,Rui Zhang,National University of Singapore,124,12320,69616,107,53965,https://people.eng.unimelb.edu.au/zr/,Wireless Communications/MIMO/Cognitive Radio/Wireless Power Transfer/UAV,https://scholar.google.com.sg/citations?user=yoJqPIkAAAAJ&hl=en
98,Xian-Ming Zhang,Swinburne University of Technology,48,2163,12523,44,10468,https://dblp.org/pid/29/3319.html,Networked Control Systems/Event-triggered Control/H-infinity Filtering/Time-delay Systems/Neural Networks,https://scholar.google.com/citations?user=aZcLkqgAAAAJ&hl=en
99,Xuyun Zhang,Macquarie University,44,1226,7059,42,5938,https://research.com/u/xuyun-zhang,big data mining/scalable machine learning/big data privacy and cybersecurity/cloud/edge computing/Internet of Things,https://scholar.google.com.au/citations?user=wbF6HL8AAAAJ&hl=en
100,Yan Zhang,"IEEE Fellow, Highly Cited Researcher, University of Oslo, Norway",96,6492,34156,83,26526,https://www.ischool.utexas.edu/~yanz/,wireless networks/smart grid/edge intelligence/blockchain/digital twin,https://scholar.google.no/citations?user=-gahn9AAAAAJ&hl=no
101,Quan Zou (邹权),University of Electronic Science and Technology of China,72,3197,16052,65,13597,https://xzenglab.github.io/xzeng/,Bioinformatics/data mining,https://scholar.google.com/citations?user=RcaUHs4AAAAJ&hl=en
