81,Tarik Taleb,University of Oulu,66,3566,18644,58,14221,https://ieeexplore.ieee.org/author/37088408078,Network Function Virtualization/Network Softwarization/Software Defined Networking,https://scholar.google.com/citations?user=o1Ap0TEAAAAJ&hl=en
82,"jen hong, tan","Highly Cited Researcher in Computer Science, National University of Singapore",48,2311,9304,43,8415,https://scholar.google.com/citations?user=uJlD-A0AAAAJ&hl=en,image processing/computer vision/deep learning/infrared thermography/fundus image,https://scholar.google.com/citations?user=uJlD-A0AAAAJ&hl=en
83,Dacheng Tao,The University of Sydney,138,13898,74650,112,53376,https://www.sydney.edu.au/engineering/about/our-people/academic-staff/dacheng-tao.html,artificial intelligence/machine learning/computer vision/image processing/data mining,https://scholar.google.com/citations?user=RwlJNLcAAAAJ&hl=en
84,Athanasios Vasilakos,"PROF OF COMPLEX SYSTEMS, CYBERSECURITY, AI",124,7356,55372,104,38510,https://cair.uia.no/people/athanasios-v-vasilakos/,Cybersecurity/IoTs/Mobile Nets/Big Data Analytics/Cloud Computing/Artificial Intelligence/Machine Learning,https://scholar.google.com/citations?user=_yWPQWoAAAAJ&hl=en
85,Huanqing Wang,Michigan Technological University,4,9,35,4,35,https://www.stat.ubc.ca/huanqing-wang,Electric vehicle/optimal control/model predictive control,https://scholar.google.com/citations?user=6XxgmPEAAAAJ&hl=en
86,Ping Wang,"York University, IEEE Fellow, York Research Chair, IEEE VTS Distinguished Lecturer",69,3522,21019,56,15436,https://sites.google.com/view/ping-wang-homepage,wireless communications/Internet of Things/cloud computing/smart grid,https://scholar.google.com/citations?user=3sIHxrcAAAAJ&hl=en
87,Qingqing Wu (武庆庆),"Assistant Professor, University of Macau",45,5123,11984,45,11860,https://www.get-phone.org/enabling-secure-wireless-communications-via-intelligent/,6G/IRS/UAV communications/Machine learning/MIMO transceiver design,https://scholar.google.com/citations?user=as1T8CMAAAAJ&hl=en
88,Zheng-Guang Wu,Zhejiang University,70,2587,15562,62,11395,https://research.com/u/zheng-guang-wu,Markov Jump Systems/Sampled-Data Control Systems/Neural Networks/Fuzzy Systems/Singular Systems,https://scholar.google.com/citations?user=vy6JCNgAAAAJ&hl=en
89,Yang Xiang,"IEEE Fellow, Professfor, Swinburne University of Technology",65,2743,15731,57,12113,https://www.linkedin.com/in/yangx88,Cybersecurity/Network Security/System Security/Software Vulnerability Detection/Blockchain,https://scholar.google.com/citations?user=7ymTWY4AAAAJ&hl=en
90,Xiaolong Xu (许小龙),"Professor, Highly Cited Researcher 2021, Nanjing University of Information Science and Technology",36,1454,4341,36,4287,https://sites.google.com/view/xiaolongxu/homepage,Edge computing/Cloud computing/Big data/Fog computing/Mobile computing,https://scholar.google.com/citations?user=Tyzef4sAAAAJ&hl=en
91,Zeshui Xu (徐泽水),"Academician of EASA,IASCYS; DFIETI,FIEEE,FIFSA,FIET,FRSA,FORS,FBCS,FIAAM,FAAIA... Sichuan University",137,9414,71401,106,41129,http://drdiaasharifclinic.com/d1phzrg/iet-fellow-list.html,Decision Making/Information Fusion/Fuzzy Sets/Computational Intelligence/Bibliometrics,https://scholar.google.co.uk/citations?user=kd9L_GUAAAAJ&hl=en
92,Xin-She Yang (DPhil),"Computational intelligence, swarm intelligence, optimization, metaheuristics, nature-inspired",90,10518,68344,80,46389,https://ieeexplore.ieee.org/author/38104337900,swarm intelligence/optimization/metaheuristics/computational intelligence.,https://scholar.google.com/citations?user=fA6aTlAAAAAJ&hl=th
93,Fei Yu,University of Southern Denmark,9,68,237,7,175,https://feiyu.web.unc.edu/,Industry 4.0 technology and smart product development,https://scholar.google.com/citations?user=3OHgAmIAAAAJ&hl=en
94,Xiangxiang Zeng,"Deparment of Computer Science, Hunan University",48,1607,6370,39,5191,https://scholar.google.com/scholar_url?url=https://www.ncbi.nlm.nih.gov/pmc/articles/pmc6036756/&hl=en&sa=X&ei=s_hEYrbEJcCP6rQP2ZOu6Ak&scisig=AAGBfm2d8xZonssiEu68sqOjuPUv54peMw&oi=scholarr,Computational Intelligence/Bio-inspired Intelligence,https://scholar.google.com/citations?user=B20HBMIAAAAJ&hl=en
95,Yong Zeng (曾勇）,"Southeast University, China; Purple Mountain Laboratories, China",45,3818,14733,45,14247,https://scholar.google.com.sg/citations?user=ENldmwIAAAAJ&hl=en,UAV communications/Massive MIMO/Extremely-Large MIMO (XL-MIMO)/Integrated Sensing and Communication,https://scholar.google.com/citations?user=ENldmwIAAAAJ&hl=en
96,Jianming Zhan,Hubei University for Nationalities,43,1036,6877,35,4330,https://scholar.google.com/citations?user=XmJAmNIAAAAJ&hl=en,logical algebras(BL-algebras/R0-algebras and MTL-algebras)/fuzzy algebras(semirings/hemirings and rings) and their hyperstuctures(hyperring/hypergroups,https://scholar.google.com/citations?user=XmJAmNIAAAAJ&hl=en
97,Haijun Zhang,"Professor, University of Science and Technology Beijing",44,1888,9848,43,8649,https://orcid.org/0000-0002-0236-6482,6G/AI enabled Wireless Communications/Resource Allocation/Mobility Management,https://scholar.google.ca/citations?user=B3oYgSIAAAAJ&hl=en
98,Rui Zhang,"Chair Professor, National University of Singapore",120,12493,60655,101,44942,https://rui-zhang.org/,Wireless Communications/MIMO/Cognitive Radio/Wireless Power Transfer/UAV,https://scholar.google.com.sg/citations?user=yoJqPIkAAAAJ&hl=en
99,Xian-Ming Zhang,Swinburne University of Technology,47,2231,10950,40,8891,https://scholar.google.com/scholar_url?url=https://www.researchgate.net/profile/Ming-Liang-Tong/publication/227560878_Hydroxylation_of_N-Heterocycle_Ligands_Observed_in_Two_Unusual_Mixed-Valence_CuICuII_Complexes/links/00b7d52c39d137be8d000000/Hydroxylation-of-N-Heterocycle-Ligands-Observed-in-Two-Unusual-Mixed-Valence-CuI-CuII-Complexes.pdf&hl=en&sa=X&ei=t_hEYsacNsCP6rQP2ZOu6Ak&scisig=AAGBfm0oUKshgbd2oo_fCJpR97FtdJX48g&oi=scholarr,Networked Control Systems/Event-triggered Control/H-infinity Filtering/Time-delay Systems/Neural Networks,https://scholar.google.com/citations?user=aZcLkqgAAAAJ&hl=en
100,Xuyun Zhang,Macquarie University,41,1198,5931,38,4823,https://sites.google.com/site/seanzhangcs/,big data mining/scalable machine learning/big data privacy and cybersecurity/cloud/edge computing/Internet of Things,https://scholar.google.com.au/citations?user=wbF6HL8AAAAJ&hl=en
101,Yan Zhang,"IEEE Fellow, Highly Cited Researcher, University of Oslo, Norway",92,6283,29474,76,21863,https://uweb.engr.arizona.edu/~yanzhang/,wireless networks/smart grid/edge intelligence/blockchain/digital twin,https://scholar.google.no/citations?user=-gahn9AAAAAJ&hl=no
102,Quan Zou (邹权),University of Electronic Science and Technology of China,67,3201,13889,60,11446,https://research.com/u/quan-zou,Bioinformatics/data mining,https://scholar.google.com/citations?user=RcaUHs4AAAAJ&hl=en
