80,"Dr. P. N. Suganthan (SCI Highly Cited Researcher 2015-2021), FIEEE'2015","Some Codes available at GitHub, (Hon. Doctorate, U. of Maribor, 2020 ; BA & MA, U. of Cambridge, UK)",100,6229,53201,84,33487,https://www.uni-kiel.de/en/details/news/252-highly-cited-researchers-2021,Machine Learning(ML)/Swarm-Evolutionary Computation(SEC)/Neural Networks(ANN)/Applications of ML SEC ANN.,https://scholar.google.com/citations?user=yZNzBU0AAAAJ&hl=en
81,Xingming Sun,Nanjing University of Information Science and Technology,57,1888,15822,51,13354,https://www.techscience.com/ndetail/editor-in-chief_named,Digital Watermarking/Information Security,http://scholar.google.com/citations?user=epqnljMAAAAJ&hl=en
82,Tarik Taleb,University of Oulu/Aalto University,62,3137,17391,58,14096,https://www.6gworld.com/teams/tarik-taleb/,Network Function Virtualization/Network Softwarization/Software Defined Networking,https://scholar.google.com/citations?user=o1Ap0TEAAAAJ&hl=en
83,"jen hong, tan","Highly Cited Researcher in Computer Science, National University of Singapore",46,2197,8553,44,7930,https://dblp.org/pid/234/1753,image processing/computer vision/deep learning/infrared thermography/fundus image,https://scholar.google.com/citations?user=uJlD-A0AAAAJ&hl=en
84,Dacheng Tao,The University of Sydney,136,11941,70444,116,54500,https://scholar.google.com/citations?user=RwlJNLcAAAAJ&hl=en,artificial intelligence/machine learning/computer vision/image processing/data mining,https://scholar.google.com/citations?user=RwlJNLcAAAAJ&hl=en
85,Athanasios Vasilakos,"PROF OF COMPLEX SYSTEMS, CYBERSECURITY, AI",122,7602,52745,109,42286,https://scholar.google.com/scholar?q=Athanasios+Vasilakos+homepage&hl=en&as_sdt=0&as_vis=1&oi=scholart,Cybersecurity/IoTs/Mobile Nets/Big Data Analytics/Cloud Computing/Artificial Intelligence/Machine Learning,https://scholar.google.com/citations?user=_yWPQWoAAAAJ&hl=en
86,Huanqing Wang,Michigan Technological University,2,14,27,2,27,https://dblp.org/pid/48/10582,Electric vehicle/optimal control/model predictive control,https://scholar.google.com/citations?user=6XxgmPEAAAAJ&hl=en
87,Ping Wang,York University,68,3508,19795,57,15872,https://wanglab.cfans.umn.edu/people/ping-wang,wireless communications/Internet of Things/cloud computing/smart grid,https://scholar.google.com/citations?user=3sIHxrcAAAAJ&hl=en
88,Qingqing Wu (武庆庆),"Assistant Professor, University of Macau",41,3056,9925,41,9880,https://scholar.google.com/citations?user=as1T8CMAAAAJ&hl=en,6G/IRS/UAV communications/Machine learning/MIMO transceiver design,https://scholar.google.com/citations?user=as1T8CMAAAAJ&hl=en
89,Zheng-Guang Wu,Zhejiang University,67,2354,14561,59,11523,https://scholar.google.com/scholar_url?url=https://pubs.acs.org/doi/abs/10.1021/jacs.0c08980&hl=en&sa=X&ei=YROoYZ3-L530yATnuoawAw&scisig=AAGBfm1oKsfcGb6xE9RCNDH8NPfPpPp2Aw&oi=scholarr,Markov Jump Systems/Sampled-Data Control Systems/Neural Networks/Fuzzy Systems/Singular Systems,https://scholar.google.com/citations?user=vy6JCNgAAAAJ&hl=en
90,Yang Xiang,"IEEE Fellow, Professfor, Swinburne University of Technology",63,2560,14757,57,12138,https://scholar.google.com/scholar_url?url=https://www.ncbi.nlm.nih.gov/pmc/articles/PMC3042954/&hl=en&sa=X&ei=YhOoYaGGNsqxywSNvpSoCA&scisig=AAGBfm3ONT6KOZVUpKzBvLM_ilXm7xOi9g&oi=scholarr,Cybersecurity/network and system security/deep learning/vulnerability detection/traffic classification,https://scholar.google.com/citations?user=7ymTWY4AAAAJ&hl=en
91,Xiaolong Xu (许小龙),"Professor, Nanjing University of Information Science and Technology",35,1484,3722,35,3705,https://scholar.google.com/scholar_url?url=http://www.nyxxb.cn/en/article/id/20060213&hl=zh-CN&sa=X&ei=YxOoYZbrOIbmyQSw5K_oDA&scisig=AAGBfm3v4-WGgkWDsIVGAd50za-zSwecZQ&oi=scholarr,Edge computing/Cloud computing/Big data/Fog computing/Mobile computing,https://scholar.google.com/citations?user=Tyzef4sAAAAJ&hl=en
92,Zeshui Xu (徐泽水),"Academician of EASA,IASCYS; Fellow of IEEE,IFSA,IET,RSA,ORS,BCS,VEBLEO,IAAM,AAIA; Sichuan University",135,7912,70253,107,43954,https://baike.baidu.com/item/%E5%BE%90%E6%B3%BD%E6%B0%B4/7518284,Decision Making/Information Fusion/Fuzzy Sets/Computational Intelligence/Bibliometrics,https://scholar.google.co.uk/citations?user=kd9L_GUAAAAJ&hl=en
93,Xin-She Yang (DPhil),"Computational intelligence, swarm intelligence, optimization, metaheuristics, nature-inspired",88,9328,64789,79,49308,https://scholar.google.com/citations?user=fA6aTlAAAAAJ&hl=fil,swarm intelligence/optimization/metaheuristics/computational intelligence.,https://scholar.google.com/citations?user=fA6aTlAAAAAJ&hl=th
94,Fei Yu,University of Southern Denmark,9,41,208,8,164,https://www.feiyu-tech.com/service.html,Industry 4.0 technology and smart product development,https://scholar.google.com/citations?user=3OHgAmIAAAAJ&hl=en
95,Xiangxiang Zeng,"Deparment of Computer Science, Hunan University",44,1154,5636,39,5024,https://loop.frontiersin.org/people/904991/overview,Computational Intelligence/Bio-inspired Intelligence,https://scholar.google.com/citations?user=B20HBMIAAAAJ&hl=en
96,Yong Zeng (曾勇）,"Southeast University, China; Purple Mountain Laboratories, China",43,3633,13234,43,13011,https://en.wikipedia.org/wiki/Zeng_Yong,UAV communications/Massive MIMO/Extremely-Large MIMO (XL-MIMO)/Integrated Sensing and Communication,https://scholar.google.com/citations?user=ENldmwIAAAAJ&hl=en
97,Jianming Zhan,Hubei University for Nationalities,41,797,6640,35,4370,https://content.iospress.com/articles/journal-of-intelligent-and-fuzzy-systems/ifs506,logical algebras(BL-algebras/R0-algebras and MTL-algebras)/fuzzy algebras(semirings/hemirings and rings) and their hyperstuctures(hyperring/hypergroups,https://scholar.google.com/citations?user=XmJAmNIAAAAJ&hl=en
98,Haijun Zhang,"Professor, University of Science and Technology Beijing",42,1931,8942,41,8346,https://ieeexplore.ieee.org/author/37406815600,Wireless Communications/Resource Allocation/Mobility Management,https://scholar.google.ca/citations?user=B3oYgSIAAAAJ&hl=en
99,Rui Zhang,"Chair Professor, National University of Singapore",117,10167,56160,103,44690,https://ruizhang-whut.github.io/,Wireless Communications/MIMO/Cognitive Radio/Wireless Power Transfer/UAV,https://scholar.google.com.sg/citations?user=yoJqPIkAAAAJ&hl=en
100,Xian-Ming Zhang,Swinburne University of Technology,46,2043,10075,41,8411,https://scholar.google.com/scholar_url?url=https://www.researchgate.net/profile/Ming-Liang-Tong/publication/227560878_Hydroxylation_of_N-Heterocycle_Ligands_Observed_in_Two_Unusual_Mixed-Valence_CuICuII_Complexes/links/00b7d52c39d137be8d000000/Hydroxylation-of-N-Heterocycle-Ligands-Observed-in-Two-Unusual-Mixed-Valence-CuI-CuII-Complexes.pdf&hl=en&sa=X&ei=bBOoYbyxPISaygSEoZSoDw&scisig=AAGBfm0oUKshgbd2oo_fCJpR97FtdJX48g&oi=scholarr,Networked Control Systems/Event-triggered Control/H-infinity Filtering/Time-delay Systems/Neural Networks,https://scholar.google.com/citations?user=aZcLkqgAAAAJ&hl=en
101,Xuyun Zhang,Macquarie University,41,1495,5602,38,4912,https://www.cikm2021.org/programme/workshops/PSTCI,big data mining/scalable machine learning/big data privacy and cybersecurity/cloud/edge computing/Internet of Things,https://scholar.google.com.au/citations?user=wbF6HL8AAAAJ&hl=en
102,Yan Zhang,"IEEE Fellow, Highly Cited Researcher, University of Oslo, Norway",88,5406,27119,77,21081,https://scholar.google.com/scholar?q=Yan+Zhang+homepage&hl=en&as_sdt=0&as_vis=1&oi=scholart,wireless networks/smart grid/edge intelligence/blockchain/digital twin,https://scholar.google.no/citations?user=-gahn9AAAAAJ&hl=no
103,Quan Zou (邹权),University of Electronic Science and Technology of China,64,2667,12651,60,11391,http://blog.sciencenet.cn/home.php?mod=space&uid=3334560&do=blog&id=1148960,Bioinformatics/data mining,https://scholar.google.com/citations?user=RcaUHs4AAAAJ&hl=en
