86,Huanqing Wang,Michigan Technological University,3,9,32,3,32,https://www.researchgate.net/profile/Huanqing-Wang,Electric vehicle/optimal control/model predictive control,https://scholar.google.com/citations?user=6XxgmPEAAAAJ&hl=en
87,Ping Wang,"York University, IEEE Fellow, York Research Chair, IEEE VTS Distinguished Lecturer",69,3497,20870,56,15276,https://faculty.stevens.edu/pwang44/,wireless communications/Internet of Things/cloud computing/smart grid,https://scholar.google.com/citations?user=3sIHxrcAAAAJ&hl=en
88,Qingqing Wu (武庆庆),"Assistant Professor, University of Macau",45,5111,11645,44,11521,https://sg.linkedin.com/in/qingqing-wu-63b30152,6G/IRS/UAV communications/Machine learning/MIMO transceiver design,https://scholar.google.com/citations?user=as1T8CMAAAAJ&hl=en
89,Zheng-Guang Wu,Zhejiang University,70,2593,15403,61,11236,https://person.zju.edu.cn/en/0011322,Markov Jump Systems/Sampled-Data Control Systems/Neural Networks/Fuzzy Systems/Singular Systems,https://scholar.google.com/citations?user=vy6JCNgAAAAJ&hl=en
90,Yang Xiang,"IEEE Fellow, Professfor, Swinburne University of Technology",64,2741,15579,57,11958,https://ieeexplore.ieee.org/author/37286573400,Cybersecurity/Network Security/System Security/Software Vulnerability Detection/Blockchain,https://scholar.google.com/citations?user=7ymTWY4AAAAJ&hl=en
91,Xiaolong Xu (许小龙),"Professor, Highly Cited Researcher 2021, Nanjing University of Information Science and Technology",36,1401,4172,36,4118,https://www.adscientificindex.com/scientist.php?id=679661,Edge computing/Cloud computing/Big data/Fog computing/Mobile computing,https://scholar.google.com/citations?user=Tyzef4sAAAAJ&hl=en
92,Zeshui Xu (徐泽水),"Academician of EASA,IASCYS; Fellow of IEEE,IFSA,IET,RSA,ORS,BCS,VEBLEO,IAAM,AAIA; Sichuan University",136,9470,70993,105,40728,https://www.adscientificindex.com/scientist.php?id=442478,Decision Making/Information Fusion/Fuzzy Sets/Computational Intelligence/Bibliometrics,https://scholar.google.co.uk/citations?user=kd9L_GUAAAAJ&hl=en
93,Xin-She Yang (DPhil),"Computational intelligence, swarm intelligence, optimization, metaheuristics, nature-inspired",90,10524,67805,80,45820,https://www.researchgate.net/profile/Xin-She-Yang,swarm intelligence/optimization/metaheuristics/computational intelligence.,https://scholar.google.com/citations?user=fA6aTlAAAAAJ&hl=th
94,Fei Yu,University of Southern Denmark,9,67,233,7,170,https://www.biostat.ucla.edu/people/yu,Industry 4.0 technology and smart product development,https://scholar.google.com/citations?user=3OHgAmIAAAAJ&hl=en
95,Xiangxiang Zeng,"Deparment of Computer Science, Hunan University",48,1610,6272,39,5094,https://ieeexplore.ieee.org/author/37087074633,Computational Intelligence/Bio-inspired Intelligence,https://scholar.google.com/citations?user=B20HBMIAAAAJ&hl=en
96,Yong Zeng (曾勇）,"Southeast University, China; Purple Mountain Laboratories, China",45,3802,14549,45,14067,http://scis.scichina.com/cfp/scis2020-wcuav.pdf,UAV communications/Massive MIMO/Extremely-Large MIMO (XL-MIMO)/Integrated Sensing and Communication,https://scholar.google.com/citations?user=ENldmwIAAAAJ&hl=en
97,Jianming Zhan,Hubei University for Nationalities,43,1038,6810,35,4264,https://www.aminer.org/profile/jianming-zhan/53f42ed7dabfaec22ba2ad74,logical algebras(BL-algebras/R0-algebras and MTL-algebras)/fuzzy algebras(semirings/hemirings and rings) and their hyperstuctures(hyperring/hypergroups,https://scholar.google.com/citations?user=XmJAmNIAAAAJ&hl=en
98,Haijun Zhang,"Professor, University of Science and Technology Beijing",44,1870,9736,43,8537,https://orcid.org/0000-0002-4313-3001,Wireless Communications/Resource Allocation/Mobility Management,https://scholar.google.ca/citations?user=B3oYgSIAAAAJ&hl=en
99,Rui Zhang,"Chair Professor, National University of Singapore",120,12447,59981,100,44280,https://biochem.wustl.edu/faculty/zhang,Wireless Communications/MIMO/Cognitive Radio/Wireless Power Transfer/UAV,https://scholar.google.com.sg/citations?user=yoJqPIkAAAAJ&hl=en
100,Xian-Ming Zhang,Swinburne University of Technology,46,2229,10813,40,8757,https://www.swinburne.edu.au/research/our-research/access-our-research/find-a-researcher-or-supervisor/researcher-profile/?id=xianmingzhang,Networked Control Systems/Event-triggered Control/H-infinity Filtering/Time-delay Systems/Neural Networks,https://scholar.google.com/citations?user=aZcLkqgAAAAJ&hl=en
101,Xuyun Zhang,Macquarie University,41,1183,5858,38,4750,https://ieeexplore.ieee.org/author/37089171155,big data mining/scalable machine learning/big data privacy and cybersecurity/cloud/edge computing/Internet of Things,https://scholar.google.com.au/citations?user=wbF6HL8AAAAJ&hl=en
102,Yan Zhang,"IEEE Fellow, Highly Cited Researcher, University of Oslo, Norway",91,6235,29144,76,21533,https://www.usf.edu/engineering/cse/people/zhang-yan.aspx,wireless networks/smart grid/edge intelligence/blockchain/digital twin,https://scholar.google.no/citations?user=-gahn9AAAAAJ&hl=no
103,Quan Zou (邹权),University of Electronic Science and Technology of China,67,3216,13760,60,11316,http://www.sdu-idea.cn/publication.php,Bioinformatics/data mining,https://scholar.google.com/citations?user=RcaUHs4AAAAJ&hl=en
