79,"Dr. P. N. Suganthan (SCI Highly Cited Researcher 2015-2021), FIEEE'2015","Some Codes available at GitHub, (Hon. Doctorate, U. of Maribor, 2020 ; BA & MA, U. of Cambridge, UK)",106,7059,57442,89,33281,https://scholar.google.com/citations?user=yZNzBU0AAAAJ&hl=en,Machine Learning(ML)/Swarm-Evolutionary Computation(SEC)/Neural Networks(ANN)/Applications of ML SEC ANN.,https://scholar.google.com/citations?user=yZNzBU0AAAAJ&hl=en
80,Xingming Sun,Nanjing University of Information Science and Technology,57,1677,15600,52,12372,http://scholar.google.com/citations?user=epqnljMAAAAJ&hl=en,Digital Watermarking/Information Security,http://scholar.google.com/citations?user=epqnljMAAAAJ&hl=en
81,Tarik Taleb,University of Oulu,68,3614,19329,59,14901,https://fi.linkedin.com/in/tariktaleb,Network Function Virtualization/Network Softwarization/Software Defined Networking,https://scholar.google.com/citations?user=o1Ap0TEAAAAJ&hl=en
82,"jen hong, tan","Highly Cited Researcher in Computer Science, National University of Singapore",48,2302,9775,44,8879,https://dblp.org/pid/234/1753,image processing/computer vision/deep learning/infrared thermography/fundus image,https://scholar.google.com/citations?user=uJlD-A0AAAAJ&hl=en
83,Dacheng Tao,The University of Sydney,140,13928,77528,116,56234,https://scholar.google.com/scholar_url?url=https://www.researchgate.net/profile/Shujian-Yu/publication/308772804_Kernel_Learning_for_Dynamic_Texture_Synthesis/links/5aa94130458515178818a7c7/Kernel-Learning-for-Dynamic-Texture-Synthesis.pdf&hl=en&sa=X&ei=cP6bYpXiK4WVy9YPguGT4Ag&scisig=AAGBfm2Rc1GLlseHR3caX22TauigZziedA&oi=scholarr,artificial intelligence/machine learning/computer vision/image processing/data mining,https://scholar.google.com/citations?user=RwlJNLcAAAAJ&hl=en
84,Athanasios Vasilakos,"PROF OF COMPLEX SYSTEMS, CYBERSECURITY, AI",126,7438,56808,106,39902,https://profiles.uts.edu.au/Athanasios.Vasilakos/grants,Cybersecurity/IoTs/Mobile Nets/Big Data Analytics/Cloud Computing/Artificial Intelligence/Machine Learning,https://scholar.google.com/citations?user=_yWPQWoAAAAJ&hl=en
85,Huanqing Wang,Michigan Technological University,4,9,38,4,38,https://www.researchgate.net/profile/Huanqing-Wang,Electric vehicle/optimal control/model predictive control,https://scholar.google.com/citations?user=6XxgmPEAAAAJ&hl=en
86,Ping Wang,"York University, IEEE Fellow, York Research Chair, IEEE VTS Distinguished Lecturer",70,3543,21697,56,16090,http://www.wangping.com/,wireless communications/Internet of Things/cloud computing/smart grid,https://scholar.google.com/citations?user=3sIHxrcAAAAJ&hl=en
87,Qingqing Wu (武庆庆),"Assistant Professor, University of Macau",46,5044,13157,45,13033,https://scholar.google.com/citations?user=as1T8CMAAAAJ&hl=en,6G/IRS/UAV communications/Machine learning/MIMO transceiver design,https://scholar.google.com/citations?user=as1T8CMAAAAJ&hl=en
88,Zheng-Guang Wu,Zhejiang University,72,2549,16119,65,11947,https://dl.acm.org/profile/81438592518,Markov Jump Systems/Sampled-Data Control Systems/Neural Networks/Fuzzy Systems/Singular Systems,https://scholar.google.com/citations?user=vy6JCNgAAAAJ&hl=en
89,Yang Xiang,"IEEE Fellow, Professfor, Swinburne University of Technology",66,2774,16390,58,12756,http://www.cis.uoguelph.ca/~yxiang/,Cybersecurity/Network Security/System Security/Software Vulnerability Detection/Blockchain,https://scholar.google.com/citations?user=7ymTWY4AAAAJ&hl=en
90,Xiaolong Xu (许小龙),"Professor, Highly Cited Researcher 2021, Nanjing University of Information Science and Technology",39,1467,4749,38,4693,https://www.transfermarkt.com/xiaolong-xu/profil/spieler/218025,Edge computing/Cloud computing/Big data/Fog computing/Mobile computing,https://scholar.google.com/citations?user=Tyzef4sAAAAJ&hl=en
91,Zeshui Xu (徐泽水),"Academician of EASA,IASCYS; DFIETI,FIEEE,FIFSA,FIET,FRSA,FORS,FBCS,FIAAM,FAAIA... Sichuan University",138,9203,73112,107,42769,https://www.sysengi.com/CN/10.12011/1000-6788-2019-0030-10,Decision Making/Information Fusion/Fuzzy Sets/Computational Intelligence/Bibliometrics,https://scholar.google.co.uk/citations?user=kd9L_GUAAAAJ&hl=en
92,Xin-She Yang (DPhil),"Computational intelligence, swarm intelligence, optimization, metaheuristics, nature-inspired",91,10479,70209,82,48134,https://en.wikipedia.org/wiki/Xin-She_Yang,swarm intelligence/optimization/metaheuristics/computational intelligence.,https://scholar.google.com/citations?user=fA6aTlAAAAAJ&hl=th
93,Fei Yu,University of Southern Denmark,9,72,263,8,201,https://people.wright.edu/fei.yu,Industry 4.0 technology and smart product development,https://scholar.google.com/citations?user=3OHgAmIAAAAJ&hl=en
94,Xiangxiang Zeng,"Deparment of Computer Science, Hunan University",49,1607,6687,40,5505,https://research.com/u/xiangxiang-zeng,Computational Intelligence/Bio-inspired Intelligence,https://scholar.google.com/citations?user=B20HBMIAAAAJ&hl=en
95,Yong Zeng (曾勇）,"Southeast University, China; Purple Mountain Laboratories, China",47,3830,15460,47,14971,http://gkcccc.org/openchurch/multimedia/podcasts/church%E2%80%99s-role-%0B-purify-assembly?page=19,UAV communications/Massive MIMO/Extremely-Large MIMO (XL-MIMO)/Integrated Sensing and Communication,https://scholar.google.com/citations?user=ENldmwIAAAAJ&hl=en
96,Jianming Zhan,Hubei University for Nationalities,43,1032,7091,36,4543,https://typeset.io/authors/jianming-zhan-3fih3rubut,logical algebras(BL-algebras/R0-algebras and MTL-algebras)/fuzzy algebras(semirings/hemirings and rings) and their hyperstuctures(hyperring/hypergroups,https://scholar.google.com/citations?user=XmJAmNIAAAAJ&hl=en
97,Haijun Zhang,"Professor, University of Science and Technology Beijing",45,1891,10216,43,9014,https://scholar.google.com/scholar_url?url=https://ieeexplore.ieee.org/abstract/document/8291835/&hl=en&sa=X&ei=fP6bYuHFJp6Ty9YPpIScuAE&scisig=AAGBfm3A7blVCFt0rIz4_d6Y5msLvgfZVQ&oi=scholarr,6G/AI enabled Wireless Communications/Resource Allocation/Mobility Management,https://scholar.google.ca/citations?user=B3oYgSIAAAAJ&hl=en
98,Rui Zhang,"Chair Professor, National University of Singapore",120,12404,63122,103,47409,https://scholar.google.com/scholar_url?url=https://arxiv.org/pdf/1508.04535&hl=en&sa=X&ei=ff6bYqPnIoWVy9YPguGT4Ag&scisig=AAGBfm1eu1GPcFAB9000__21MPtKoMmwpA&oi=scholarr,Wireless Communications/MIMO/Cognitive Radio/Wireless Power Transfer/UAV,https://scholar.google.com.sg/citations?user=yoJqPIkAAAAJ&hl=en
99,Xian-Ming Zhang,Swinburne University of Technology,47,2205,11374,41,9321,https://research.com/u/xian-ming-zhang,Networked Control Systems/Event-triggered Control/H-infinity Filtering/Time-delay Systems/Neural Networks,https://scholar.google.com/citations?user=aZcLkqgAAAAJ&hl=en
100,Xuyun Zhang,Macquarie University,42,1203,6176,39,5066,https://ieeexplore.ieee.org/author/37898426000,big data mining/scalable machine learning/big data privacy and cybersecurity/cloud/edge computing/Internet of Things,https://scholar.google.com.au/citations?user=wbF6HL8AAAAJ&hl=en
101,Yan Zhang,"IEEE Fellow, Highly Cited Researcher, University of Oslo, Norway",93,6298,30670,78,23043,https://scholar.google.com/scholar_url?url=https://www.sae.org/publications/technical-papers/content/2007-01-0199/&hl=en&sa=X&ei=f_6bYvf5LMLZmQGh5pWYBQ&scisig=AAGBfm19kaHew6yjDGSWxFAp88koRGNOsA&oi=scholarr,wireless networks/smart grid/edge intelligence/blockchain/digital twin,https://scholar.google.no/citations?user=-gahn9AAAAAJ&hl=no
102,Quan Zou (邹权),University of Electronic Science and Technology of China,69,3209,14552,62,12109,http://lab.malab.cn/,Bioinformatics/data mining,https://scholar.google.com/citations?user=RcaUHs4AAAAJ&hl=en
